index,url,valid,domain,title,description,image,published,archive,content,quote,language,keyword
https://www.dhnet.be/actu/monde/2026/05/01/quand-le-pape-provoque-donald-trump-leon-xiv-a-nomme-un-ancien-sans-papiers-eveque-aux-etats-unis-TZMUTBM2GBF2ZMHHOAWCQ2AWTI/,https://www.dhnet.be/actu/monde/2026/05/01/quand-le-pape-provoque-donald-trump-leon-xiv-a-nomme-un-ancien-sans-papiers-eveque-aux-etats-unis-TZMUTBM2GBF2ZMHHOAWCQ2AWTI/,0,www.dhnet.be,Quand le pape provoque Donald Trump: Leon XIV a nommé un ancien sans-papiers évêque aux États-Unis,"Le Vatican a annoncé dans un communiqué la nomination d'Evelio Menjivar-Ayala, 55 ans, actuellement évêque auxiliaire à Washington, évêque du diocèse de Wheeling-Charleston, en Virginie-Occidentale (est). ...",https://www.dhnet.be/resizer/v2/MA7YACK4H5AXBE44WQA5QKXCRI.jpg?auth=ab1e847110ea2e30b7c55a1ba5790add41e2c4f18349b62b31ee619b2fb06a01&width=1200&height=630&quality=85&focal=1516%2C1083,2026-05-01T18:52:34Z,,"Un SUV XXL au Vatican : le PDG de Ford offre un cadeau unique et personnalisé au Pape Leon XIVD'abord arrêté au Mexique alors qu'il tentait d'entrer aux Etats-Unis, il a dit dans une interview l'anné… [+2097 chars]",,fr,'Donald Trump'
https://www.franceinfo.fr/societe/religion/aux-etats-unis-le-pape-nomme-eveque-un-ancien-sans-papiers-apres-avoir-ete-critique-par-donald-trump_7977092.html,https://www.franceinfo.fr/societe/religion/aux-etats-unis-le-pape-nomme-eveque-un-ancien-sans-papiers-apres-avoir-ete-critique-par-donald-trump_7977092.html,0,www.franceinfo.fr,"Aux Etats-Unis, le pape nomme évêque un ancien sans-papiers, après avoir été critiqué par Donald Trump","Evelio Menjivar-Ayala a été nommé au diocèse de Wheeling-Charleston, en Virginie-Occidentale. Le pape a plusieurs fois critiqué la politique de Donald Trump en matière d'immigration.",https://www.franceinfo.fr/pictures/VP3VvO73sanhY2sAMmjLfQkmlsA/0x364:7040x4324/1500x843/2026/05/01/69f4f66cb22a5359571966.jpg,2026-05-01T18:57:37Z,,"Le pape Léon XIV a nommé un ancien immigré sans-papiers comme évêque d'un diocèse aux Etats-Unis, vendredi 1er mai, après avoir critiqué la guerre lancée contre l'Iran et la politique de Donald Trump… [+1739 chars]",,fr,'Donald Trump'
https://www.bfmtv.com/culture/cinema-series/tournages-toxiques-departs-d-acteurs-male-gaze-l-envers-du-decor-peu-reluisant-de-la-serie-euphoria_AN-202605020299.html,https://www.bfmtv.com/culture/cinema-series/tournages-toxiques-departs-d-acteurs-male-gaze-l-envers-du-decor-peu-reluisant-de-la-serie-euphoria_AN-202605020299.html,0,www.bfmtv.com,"Tournages ""toxiques"", départs d'acteurs, male gaze... L'envers du décor peu reluisant de la série ""Euphoria""","""Euphoria"" a fait son grand retour sur HBO en avril après quatre ans d'arrêt. Quatre ans pendant lesquels la série a accumulé les départs, les reports, les critiques - et les interrogations concernant la méthode Levinson.",https://images.bfmtv.com/pSWvE4HJOGGta-b4DARbkLlT3bI=/203x453:1643x1263/1440x0/images/Zendaya-Euphoria-2269407.jpg,2026-05-02T17:19:48Z,,"""Euphoria"" a fait son grand retour sur HBO en avril après quatre ans d'arrêt. Quatre ans pendant lesquels la série a accumulé les départs, les reports, les critiques - et les interrogations concernan… [+6347 chars]",,fr,'Jacob Elordi'
https://www.franceinfo.fr/replay-magazine/franceinfo/l-invite-politique/l-invite-politique-du-mercredi-06-mai-2026_7942355.html,https://www.franceinfo.fr/replay-magazine/franceinfo/l-invite-politique/l-invite-politique-du-mercredi-06-mai-2026_7942355.html,0,www.franceinfo.fr,"Carburants : Maud Bregeon, ministre de l'Énergie, confirme de nouvelles aides ""pour une partie des Français qui ne sont pas concernés par les mesures mises en place""","Voir ou revoir l'émission Carburants : Maud Bregeon, ministre de l'Énergie, confirme de nouvelles aides ""pour une partie des Français qui ne sont pas concernés par les mesures mises en place"". Interrogée sur la réponse du gouvernement à la hausse des prix du …",https://www.franceinfo.fr/pictures/Ga_JBvyLBZP4NR-UJngBzsQi4iE/8x0:1381x772/1500x843/2026/05/06/69fb14bb99997708490897.jpg,2026-05-06T10:16:24Z,,"Interrogée sur la réponse du gouvernement à la hausse des prix du carburant, après que le Premier ministre a déclaré vouloir ""changer d'ampleur et d'échelle"", la ministre et porte-parole de l'exécuti… [+5803 chars]",,fr,'Maud Bregeon'
https://www.bfmtv.com/politique/gouvernement/navire-cma-cgm-touche-dans-le-detroit-d-ormuz-emmanuel-macron-assure-que-ce-n-est-en-aucun-cas-la-france-qui-a-ete-visee_AD-202605060488.html,https://www.bfmtv.com/politique/gouvernement/navire-cma-cgm-touche-dans-le-detroit-d-ormuz-emmanuel-macron-assure-que-ce-n-est-en-aucun-cas-la-france-qui-a-ete-visee_AD-202605060488.html,0,www.bfmtv.com,"Navire CMA CGM touché dans le détroit d'Ormuz: Emmanuel Macron assure que ""ce n'est en aucun cas la France qui a été visée""","Un cargo appartenant à la compagnie française CMA CGM a été touché mardi 5 mai dans le détroit d'Ormuz dans une ""attaque"" lors de laquelle plusieurs membres d'équipage ont été blessés.",https://images.bfmtv.com/JLFcWgft5pag0sHh5__9ybS53c8=/0x106:2048x1258/2048x0/images/Emmanuel-Macron-s-adresse-aux-journalistes-a-son-arrivee-a-Nicosie-pour-une-reunion-informelle-du-Conseil-europeen-le-24-avril-2026-2275560.jpg,2026-05-06T10:54:55Z,,"Un cargo appartenant à la compagnie française CMA CGM a été touché mardi 5 mai dans le détroit d'Ormuz dans une ""attaque"" lors de laquelle plusieurs membres d'équipage ont été blessés.
La France n'a… [+1768 chars]",,fr,'Maud Bregeon'
https://www.franceinfo.fr/replay-magazine/franceinfo/l-invite-politique/l-invite-politique-du-jeudi-07-mai-2026_7944872.html,https://www.franceinfo.fr/replay-magazine/franceinfo/l-invite-politique/l-invite-politique-du-jeudi-07-mai-2026_7944872.html,0,www.franceinfo.fr,"Aides carburants : ""Le Premier ministre cherche à gagner du temps pour ne rien délivrer aux Français"", juge Sébastien Chenu, vice-président RN de l'Assemblée nationale","Voir ou revoir l'émission Aides carburants : ""Le Premier ministre cherche à gagner du temps pour ne rien délivrer aux Français"", juge Sébastien Chenu, vice-président RN de l'Assemblée nationale. Invité politique de franceinfo ce jeudi 7 mai, l'élu Rassembleme…",https://www.franceinfo.fr/pictures/QDhXE8y4jMRD4KZszWwZPJMufmI/18x0:1386x769/1500x843/2026/05/07/69fc708b1b492540035660.jpg,2026-05-07T10:09:40Z,,"Invité politique de franceinfo ce jeudi 7 mai, l'élu Rassemblement national du Nord déplore que les aides du gouvernement pour répondre à la crise des carburants ne soient ""ni calibrées, ni au niveau… [+7649 chars]",,fr,'Premier ministre'
