index,url,valid,domain,title,description,image,published,archive,content,quote,language,keyword
https://www.lalibre.be/international/moyen-orient/2026/03/05/comment-emmanuel-macron-tente-dempecher-que-le-liban-ne-soit-a-nouveau-entraine-dans-la-guerre-HJHEL5DLQFAG7LAZ7VP3Q532UQ/,https://www.lalibre.be/international/moyen-orient/2026/03/05/comment-emmanuel-macron-tente-dempecher-que-le-liban-ne-soit-a-nouveau-entraine-dans-la-guerre-HJHEL5DLQFAG7LAZ7VP3Q532UQ/,0,www.lalibre.be,"Comment Emmanuel Macron tente ""d'empêcher"" que le Liban ne soit ""à nouveau entraîné dans la guerre""",Emmanuel Macron dit travailler avec les autorités libanaises et les acteurs régionaux pour éviter une extension du conflit au Liban. La France annonce aussi une aide humanitaire pour les civils déplacés. ...,https://www.lalibre.be/resizer/v2/RFF3A4HZ5FEVXIKUHNRYA5IPMU.jpg?auth=a0484c695ea156f8d49369a541cf75f4e254a66ff42de9967ba4804be762e1e3&width=1200&height=630&quality=85&focal=1358%2C906,2026-03-05T18:49:09Z,,"La France prend position dans la crise au Moyen-Orient et fixe les limites de son intervention:""La France demeure une puissance qui protège les siens""Après des échanges mercredi avec Donald Trump et … [+2156 chars]",,fr,'Emmanuel Macron'
https://www.huffingtonpost.fr/international/article/un-ministre-israelien-menace-la-banlieue-sud-de-beyrouth-de-bientot-ressembler-a-gaza_261140.html,https://www.huffingtonpost.fr/international/article/un-ministre-israelien-menace-la-banlieue-sud-de-beyrouth-de-bientot-ressembler-a-gaza_261140.html,0,www.huffingtonpost.fr,Guerre au Moyen-Orient : Un ministre israélien menace la banlieue sud de Beyrouth de bientôt « ressembler » à Gaza,"Au sixième jour du conflit, l’armée israélienne a donné l’ordre d’évacuer la banlieue sud de la capitale libanaise. Emmanuel Macron a annoncé l’envoi d’aide humanitaire.",https://focus.huffingtonpost.fr/2026/03/05/96/0/1024/576/1820/1023/75/0/6ff175e_upload-1-8b8uxugkifnk-afp-20260305-aa-05032026-2682660-v1-midres-israelsattacksonbeirutsdahiehdistric.jpg,2026-03-05T19:13:32Z,,"La guerre au Moyen-Orient, qui dure depuis six jours, sest encore intensifiée ce jeudi 5 mars. Dans une déclaration virulente, le ministre israélien des Finances a menacé la banlieue sud de Beyrouth,… [+3250 chars]",,fr,'Emmanuel Macron'
https://www.slate.fr/monde/pedro-sanchez-nouvel-ennemi-donald-trump-europe-espagne-iran-israel-etats-unis-risque-embargo-sanctions,https://www.slate.fr/monde/pedro-sanchez-nouvel-ennemi-donald-trump-europe-espagne-iran-israel-etats-unis-risque-embargo-sanctions,0,www.slate.fr,"«Non à la guerre»: Pedro Sánchez, le nouvel ennemi juré de Donald Trump en Europe",Le Premier ministre espagnol Pedro Sánchez se distingue des autres dirigeants européens par son rejet en bloc de l'attaque israélo-américaine en Iran. Au point d'attirer des sanctions du président américain sur son pays?,https://cdn.slate.fr/uploads/store/story_272337/original_272337.jpg,2026-03-05T19:55:04Z,,Une attaque «illégale» qui risque de déclencher une spirale de violence. Le Premier ministre espagnol Pedro Sánchez a dénoncé les frappes israélo-américaines sur l'Iran comme aucun autre dirigeant eu… [+4575 chars],,fr,'Donald Trump'
https://www.lemonde.fr/international/live/2026/03/06/en-direct-guerre-au-moyen-orient-israel-dit-mener-une-vague-d-attaques-contre-l-infrastructure-du-regime-a-teheran-l-iran-annonce-lancer-des-missiles-et-des-drones-sur-tel-aviv_6668663_3210.html,https://www.lemonde.fr/international/live/2026/03/06/en-direct-guerre-au-moyen-orient-israel-dit-mener-une-vague-d-attaques-contre-l-infrastructure-du-regime-a-teheran-l-iran-annonce-lancer-des-missiles-et-des-drones-sur-tel-aviv_6668663_3210.html,0,www.lemonde.fr,"EN DIRECT, guerre au Moyen-Orient : Israël dit mener une vague d’attaques contre « l’infrastructure du régime » à Téhéran ; l’Iran annonce lancer des missiles et des drones sur Tel-Aviv","L’agence de presse libanaise officielle ANI a fait état de frappes israéliennes nocturnes sur six localités du sud du pays, sans évoquer de victimes à ce stade. De son côté, Emmanuel Macron a assuré que la France « ne va pas s’engager dans cette guerre ».",https://img.lemde.fr/2026/03/05/752/0/5471/2735/1440/720/60/0/b2c0567_ftp-1-bhwgmo55y3kr-ce366fd7b3184801b179e7e605cca150-0-0c539b73576b4c79b4d163318e920e2d.jpg,2026-03-06T04:43:39Z,,"Après le Sénat, mercredi, les élus de la Chambre des représentants américaine ont rejeté, jeudi, à 219 voix contre 212 un texte permettant de limiter les pouvoirs de Donald Trump dans la guerre contr… [+1946 chars]",,fr,'Emmanuel Macron'
https://www.franceinfo.fr/elections/municipales/je-suis-une-etiquette-a-moi-toute-seule-pourquoi-certains-candidats-aux-municipales-n-affichent-pas-leur-appartenance-politique_7815944.html,https://www.franceinfo.fr/elections/municipales/je-suis-une-etiquette-a-moi-toute-seule-pourquoi-certains-candidats-aux-municipales-n-affichent-pas-leur-appartenance-politique_7815944.html,0,www.franceinfo.fr,"""Je suis une étiquette à moi toute seule"" : pourquoi certains candidats aux municipales n'affichent pas leur appartenance politique","De nombreux candidats aux élections des 15 et 22 mars misent sur leur seul nom ou revendiquent des listes sans étiquette. Une pratique qui n'est pas inhabituelle pour un scrutin local, mais qui semble s'être accentuée.",https://www.franceinfo.fr/pictures/ikcA7M_EvwJyBVu2pEXpjazKdKE/0x0:3840x2160/1500x843/2026/03/04/candidats-sans-etiquette-02-69a8b48743eb3195553445.jpg,2026-03-06T05:03:09Z,,"De nombreux candidats aux élections des 15 et 22 mars misent sur leur seul nom ou revendiquent des listes sans étiquette. Une pratique qui n'est pas inhabituelle pour un scrutin local, mais qui sembl… [+9175 chars]",,fr,'Emmanuel Macron'
https://www.bfmtv.com/politique/elysee/six-points-de-gagnes-la-cote-de-confiance-d-emmanuel-macron-boostee-depuis-le-debut-de-la-guerre-en-iran-et-au-moyen-orient_AN-202603060101.html,https://www.bfmtv.com/politique/elysee/six-points-de-gagnes-la-cote-de-confiance-d-emmanuel-macron-boostee-depuis-le-debut-de-la-guerre-en-iran-et-au-moyen-orient_AN-202603060101.html,0,www.bfmtv.com,Six points de gagnés: la cote de confiance d'Emmanuel Macron boostée depuis le début de la guerre en Iran et au Moyen-Orient,Le baromètre Elabe pour Les Échos montre une hausse de la cote de confiance d'Emmanuel Macron après son discours de dissuasion nucléaire et dans un contexte de crise internationale avec le lancement de l'offensive israélo-américaine.,https://images.bfmtv.com/Bqod5xt0sKzj5J-0_ELM7gjic_M=/0x0:1920x1080/1920x0/images/Le-president-de-la-Republique-Emmanuel-Macron-le-3-mars-2026-2245718.jpg,2026-03-06T05:23:24Z,,Le baromètre Elabe pour Les Échos montre une hausse de la cote de confiance d'Emmanuel Macron après son discours de dissuasion nucléaire et dans un contexte de crise internationale avec le lancement … [+2008 chars],,fr,'Emmanuel Macron'
https://www.bfmtv.com/politique/elysee/la-france-ne-fait-pas-la-guerre-emmanuel-macron-repond-a-l-inquietude-d-une-internaute-sur-le-conflit-au-moyen-orient_AD-202603060104.html,https://www.bfmtv.com/politique/elysee/la-france-ne-fait-pas-la-guerre-emmanuel-macron-repond-a-l-inquietude-d-une-internaute-sur-le-conflit-au-moyen-orient_AD-202603060104.html,0,www.bfmtv.com,"""La France ne fait pas la guerre"": Emmanuel Macron répond à l'inquiétude d'une internaute sur le conflit au Moyen-Orient","Interrogé sur la guerre au Moyen-Orient par une jeune Française sur Instagram, Emmanuel Macron lui a répondu en envoyant un message vocal assurant que la France ne prendrait pas part au conflit.",https://images.bfmtv.com/dtQM6ZrqLJt4HUPs5QWtA7Sx2Bo=/7x111:2039x1254/2032x0/images/Emmanuel-Macron-2247370.jpg,2026-03-06T05:27:00Z,,"Interrogé sur la guerre au Moyen-Orient par une jeune Française sur Instagram, Emmanuel Macron lui a répondu en envoyant un message vocal assurant que la France ne prendrait pas part au conflit.
""On… [+1369 chars]",,fr,'Emmanuel Macron'
https://www.challenges.fr/monde/israel-frappe-teheran-macron-assure-que-paris-ne-fait-pas-la-guerre-au-moyen-orient-rapprochement-washingtoncaracas-ca-sest-passe-cette-nuit_641489,https://www.challenges.fr/monde/israel-frappe-teheran-macron-assure-que-paris-ne-fait-pas-la-guerre-au-moyen-orient-rapprochement-washingtoncaracas-ca-sest-passe-cette-nuit_641489,0,www.challenges.fr,"Israël frappe Téhéran, Macron assure que Paris « ne fait pas la guerre » au Moyen-Orient, rapprochement Washington/Caracas… Ça s’est passé cette nuit","L’armée israélienne mène des frappes « à grande échelle » sur Téhéran, Emmanuel Macron assure que la France « ne fait pas la guerre » au Moyen-Orient, les Etats-Unis et le Venezuela vont rétablir des relations diplomatiques.",https://www.challenges.fr/_ipx/f_jpg&enlarge_true&s_1200x630/cha/static/2026-03/50892.HR_0.jpg%3FVersionId=zkdb5kwUk3Plk.xn.WulYMv4LWN_Qpg2,2026-03-06T06:59:00Z,,"Larmée israélienne mène des frappes « à grande échelle » sur Téhéran
Larmée israélienne a entamé ce vendredi une série de frappes « à grande échelle » sur Téhéran, disant viser « linfrastructure du … [+1799 chars]",,fr,'Emmanuel Macron'
https://www.franceinfo.fr/monde/iran/guerre-entre-les-etats-unis-israel-et-l-iran/la-france-ne-fait-pas-la-guerre-au-moyen-orient-emmanuel-macron-repond-sur-istragram-a-une-jeune-fille-inquietee-par-le-conflit_7849397.html,https://www.franceinfo.fr/monde/iran/guerre-entre-les-etats-unis-israel-et-l-iran/la-france-ne-fait-pas-la-guerre-au-moyen-orient-emmanuel-macron-repond-sur-istragram-a-une-jeune-fille-inquietee-par-le-conflit_7849397.html,0,www.franceinfo.fr,"La France ""ne fait pas la guerre"" au Moyen-Orient : Emmanuel Macron répond sur Istragram à une jeune fille inquiétée par le conflit","Le chef de l'Etat a assuré jeudi soir sur Instagram que la France n'allait pas s'""engager"" dans la guerre, en réponse à une jeune internaute qui l'avait interpellée sur Instagram.",https://www.franceinfo.fr/pictures/SLSJoZurXwy6m4xGfOJ2yDO-v94/0x53:1024x629/1500x843/2026/03/06/000-99cr6x6-69aa7e890b3a4455984366.jpg,2026-03-06T07:13:40Z,,"Interpellé en message privé sur Instagram par une jeune internaute, qui s'inquiète d'une possible entrée de la France dans le conflit d'Israël et des Etats-Unis contre l'Iran, Emmanuel Macron a mis e… [+1340 chars]",,fr,'Emmanuel Macron'
https://www.challenges.fr/monde/israel-frappe-le-liban-et-teheran-macron-assure-que-la-france-ne-fait-pas-la-guerre-le-point-au-7e-jour-du-conflit-au-moyen-orient_641491,https://www.challenges.fr/monde/israel-frappe-le-liban-et-teheran-macron-assure-que-la-france-ne-fait-pas-la-guerre-le-point-au-7e-jour-du-conflit-au-moyen-orient_641491,0,www.challenges.fr,"Israël frappe le Liban et Téhéran, Macron assure que la France « ne fait pas la guerre »… : le point au 7e jour du conflit au Moyen-Orient","Israël mène des frappes au Liban et à Téhéran, Emmanuel Macron assure que la France ne « fait pas la guerre » au Moyen-Orient… Le point sur les dernières évolutions dans la région, au 7e jour du conflit.",https://www.challenges.fr/_ipx/f_jpg&enlarge_true&s_1200x630/cha/static/2026-03/50893.HR_0.jpg%3FVersionId=j6gBRXDgao_ENfJ4xZUNdCO_7BRBAeQk,2026-03-06T08:19:00Z,,"Alors que la guerre lancée par Israël et les Etats-Unis contre la République islamique dIran le 28 février embrase le Moyen-Orient et inquiète les acteurs économiques mondiaux, la durée du conflit, q… [+8343 chars]",,fr,'Emmanuel Macron'
https://www.courrierinternational.com/article/vu-du-royaume-uni-pourquoi-macron-ne-sera-pas-chirac-ii-dans-cette-nouvelle-guerre-du-golfe_241360,https://www.courrierinternational.com/article/vu-du-royaume-uni-pourquoi-macron-ne-sera-pas-chirac-ii-dans-cette-nouvelle-guerre-du-golfe_241360,0,www.courrierinternational.com,Pourquoi Macron ne sera pas “Chirac II” dans cette nouvelle guerre du Golfe,"Contrairement à Jacques Chirac, qui s’était opposé en 2003 à suivre les États-Unis dans leur guerre en Irak, Emmanuel Macron semble prêt à s’engager dans le conflit en Iran. S’il a dénoncé l’intervention américaine, le président français est contraint par la …",https://focus.courrierinternational.com/2026/03/02/0/0/5301/3534/1200/630/60/0/a20d790_ftp-1-5w5bvc8yktj6-afp-99lm7fg.jpg,2026-03-06T08:50:02Z,,"Il y a vingt-trois ans, la France a divisé lOccident.
Le président français, Jacques Chirac, a refusé de participer à linvasion de lIrak aux côtés des États-Unis et du Royaume-Uni. Aux Nations unies… [+1086 chars]",,fr,'Emmanuel Macron'
https://www.franceinfo.fr/elections/municipales-2026-pierre-yves-bournazel-candidat-a-la-mairie-de-paris-a-ete-la-cible-d-une-attaque-informationnelle-russe_7849616.html,https://www.franceinfo.fr/elections/municipales-2026-pierre-yves-bournazel-candidat-a-la-mairie-de-paris-a-ete-la-cible-d-une-attaque-informationnelle-russe_7849616.html,0,www.franceinfo.fr,"Municipales 2026 : Pierre-Yves Bournazel, candidat à la mairie de Paris, a été la cible d'une attaque informationnelle russe","Le candidat Horizons et Renaissance à la mairie de Paris a notamment ""fait l'objet de deepfakes"" et son ""site de campagne a été copié par des opérateurs russes"", selon l'Agence de vérification de Radio France, auprès de sources concordantes.",https://www.franceinfo.fr/pictures/egpROEzMH5LKn9vRN5gjm6D1KRs/2x0:1638x920/1500x843/2026/01/31/bournazel-2-697dc2d098bbe695270799.png,2026-03-06T10:44:30Z,,"Le candidat Horizons et Renaissance à la mairie de Paris, Pierre-Yves Bournazel, a été la cible d'une attaque informationnelle russe, a confirmé vendredi 6 mars l'Agence de vérification de Radio Fran… [+3205 chars]",,fr,'Emmanuel Macron'
https://www.diplomatie.gouv.fr/fr/les-ministres/jean-noel-barrot/presse-et-medias/article/entretien-de-jean-noel-barrot-ministre-de-l-europe-et-des-affaires-etrangeres-287772,https://www.diplomatie.gouv.fr/fr/les-ministres/jean-noel-barrot/presse-et-medias/article/entretien-de-jean-noel-barrot-ministre-de-l-europe-et-des-affaires-etrangeres-287772,0,www.diplomatie.gouv.fr,"Entretien de Jean-Noël Barrot, ministre de l’Europe et des affaires étrangères, avec « TF1 » (Paris, 05.03.26)","Q - Bonsoir Jean-Noël Barrot. 
R - Bonsoir. 
Q - Vous êtes ministre des affaires étrangères. On a vu aujourd'hui le président libanais demander instamment de l'aide à Emmanuel Macron, son homologue français. Que va faire la France d'un point de vue humanitair…",https://www.diplomatie.gouv.fr/local/cache-vignettes/L800xH400/visuel_defaut_une_fd-44916.jpg?1702480405,2026-03-06T10:53:20Z,,"Q - Bonsoir Jean-Noël Barrot.
R - Bonsoir.
Q - Vous êtes ministre des affaires étrangères. On a vu aujourd’hui le président libanais demander instamment de l’aide à Emmanuel Macron, son homologue f… [+6812 chars]",,fr,'Emmanuel Macron'
https://www.dhnet.be/actu/monde/2026/03/06/vous-avez-top-ouvert-votre-bouche-on-sera-raisonnables-emmanuel-macron-repond-a-linquietude-dune-jeune-fille-sur-le-conflit-au-moyen-orient-SXNVGTIWPFCHXE3UEYWGVKYB3M/,https://www.dhnet.be/actu/monde/2026/03/06/vous-avez-top-ouvert-votre-bouche-on-sera-raisonnables-emmanuel-macron-repond-a-linquietude-dune-jeune-fille-sur-le-conflit-au-moyen-orient-SXNVGTIWPFCHXE3UEYWGVKYB3M/,0,www.dhnet.be,"""Vous avez top ouvert votre bouche"", ""On sera raisonnables"" : Emmanuel Macron répond à l'inquiétude d'une jeune fille sur le conflit au Moyen-Orient","Fatima, une jeune française, a interpellé Emmanuel Macron à propos de la guerre au Moyen-Orient. Le président lui a répondu. ...",https://www.dhnet.be/resizer/v2/HXWM3375OJEEBG7LPCHBYJWS4Q.jpg?auth=c6421ca246fbb87c74d348e9815305e87174f393cd367f026d9ac8f736b64e38&width=1200&height=630&quality=85&focal=4128%2C2752,2026-03-06T11:32:22Z,,"""Je voulais être très clair, vous n'allez pas faire la guerre du tout, vous allez continuer de vivre (...) et de construire votre avenir dans notre beau pays"", précisa le président français.
Avant d… [+1109 chars]",,fr,'Emmanuel Macron'
https://www.lalibre.be/international/europe/2026/03/06/vous-avez-top-ouvert-votre-bouche-on-sera-raisonnables-emmanuel-macron-repond-a-une-jeune-fille-inquiete-sur-le-conflit-au-moyen-orient-CUJTQ3OGABHSPLCYD2R57MLDAY/,https://www.lalibre.be/international/europe/2026/03/06/vous-avez-top-ouvert-votre-bouche-on-sera-raisonnables-emmanuel-macron-repond-a-une-jeune-fille-inquiete-sur-le-conflit-au-moyen-orient-CUJTQ3OGABHSPLCYD2R57MLDAY/,0,www.lalibre.be,"""Vous avez top ouvert votre bouche"", ""On sera raisonnables"" : Emmanuel Macron répond à une jeune fille inquiète sur le conflit au Moyen-Orient","Fatima, une jeune française, a interpellé Emmanuel Macron à propos de la guerre au Moyen-Orient. Le président lui a répondu. ...",https://www.lalibre.be/resizer/v2/RFF3A4HZ5FEVXIKUHNRYA5IPMU.jpg?auth=a0484c695ea156f8d49369a541cf75f4e254a66ff42de9967ba4804be762e1e3&width=1200&height=630&quality=85&focal=1358%2C906,2026-03-06T11:40:35Z,,"""Je voulais être très clair, vous n'allez pas faire la guerre du tout, vous allez continuer de vivre (...) et de construire votre avenir dans notre beau pays"", précisa le président français.
Avant d… [+1136 chars]",,fr,'Emmanuel Macron'
https://www.franceinfo.fr/monde/iran/guerre-entre-les-etats-unis-israel-et-l-iran/sebastien-lecornu-va-recevoir-mercredi-les-forces-politiques-pour-un-briefing-sur-l-iran_7849817.html,https://www.franceinfo.fr/monde/iran/guerre-entre-les-etats-unis-israel-et-l-iran/sebastien-lecornu-va-recevoir-mercredi-les-forces-politiques-pour-un-briefing-sur-l-iran_7849817.html,0,www.franceinfo.fr,"Guerre au Moyen-Orient : Sébastien Lecornu va recevoir les forces politiques mercredi pour un point sur ""l'état de la menace"" et le ""positionnement de la France""","Les présidents de l'Assemblée nationale et du Sénat seront conviés à cette réunion, tout comme les présidents des commissions parlementaires concernées.",https://www.franceinfo.fr/pictures/u1adQl8jeYR0y3WiYny-Oz3tLKk/0x0:5472x3078/1500x843/2026/03/06/075-farzat-notitle260202-np1ey-69aac3c028667851022534.jpg,2026-03-06T12:36:44Z,,"""Dans le contexte de la guerre en cours en Iran et plus largement au Moyen-Orient, le Premier ministre réunira, mercredi 11 mars, les formations politiques afin de les briefer sur l'état de la menace… [+1969 chars]",,fr,'Emmanuel Macron'
