index,url,valid,domain,title,description,image,published,archive,content,quote,language,keyword
https://www.courrierinternational.com/article/russie-autour-de-poutine-le-pouvoir-se-fissure-et-la-peur-gagne-le-sommet_243772,https://www.courrierinternational.com/article/russie-autour-de-poutine-le-pouvoir-se-fissure-et-la-peur-gagne-le-sommet_243772,0,www.courrierinternational.com,"Autour de Poutine, le pouvoir se fissure et la peur gagne le sommet","DĂŠfiance, rivalitĂŠs internes et usure vis-Ă -vis de lâinvasion de lâUkraineÂ : ces jours-ci, la presse internationale dĂŠpeint, Ă  grand renfort de rĂŠvĂŠlations et dâanalyses, un Kremlin en crise. Sans annoncer de chute imminente, ces signaux disent beaucoup de lââŚ",https://focus.courrierinternational.com/2026/04/28/71/0/7744/5162/1200/630/60/0/8c64b71_ftp-1-x5ghuprgo0hc-2026-04-28t181203z-1074112026-rc2hyka4ojjo-rtrmadp-3-ukraine-crisis-putin-tuapse.JPG,2026-05-07T16:14:52Z,,"Ce nest pas encore une rĂŠbellion, mais plutĂ´t un changement de ton. Dans The Economist, un ancien haut responsable russe signe un texte au titre alarmisteÂ : Vladimir Poutine perd son emprise sur la RâŚ [+5445 chars]",,fr,'Vladimir Poutine'
https://www.20minutes.fr/monde/royaume-uni/4222544-20260507-royaume-uni-homme-arme-arrete-pres-residence-ex-prince-andrew,https://www.20minutes.fr/monde/royaume-uni/4222544-20260507-royaume-uni-homme-arme-arrete-pres-residence-ex-prince-andrew,0,www.20minutes.fr,Royaume-UniÂ : Un homme armĂŠ arrĂŞtĂŠ prĂ¨s de la rĂŠsidence de lâex-prince Andrew,"InterpellĂŠ pour comportement menaĂ§ant, le suspect aurait poursuivi lâex-prince lors dâune promenade selon des mĂŠdias britanniques",https://img.20mn.fr/Inr6WdiJSnWzGeFNoKIg2yk/1444x920_photographie-paul-marriott-credit-obligatoire-photo-de-paul-marriott-shutterstock-16802033j-les-travaux-d-installation-de-barrieres-de-securite-et-de-clotures-autour-de-marsh-farm-dans-le-domaine-de-sandringham-ou-andrew-mountbatten-windsor-demenagerait-au-printemps-sont-termines-il-sejourne-actuellement-a-wood-farm-dans-le-domaine-de-sandringham-mais-a-visite-sa-nouvelle-residence-marsh-farm-wolferton-sandringham-norfolk-le-26-mars-2026-marsh-farm-wolferton-sandringham-norfolk-le-26-mars-2026-angleterre-26-mars-2026-shutterstock-editorial-marsh-farm-wolferton-sandringh-16802033j-paul-marriott-photography-2603270842,2026-05-07T17:15:05Z,http://web.archive.org/web/20260507222220/https://www.20minutes.fr/monde/royaume-uni/4222544-20260507-royaume-uni-homme-arme-arrete-pres-residence-ex-prince-andrew,"Un homme a ĂŠtĂŠ arrĂŞtĂŠ mercredi 6Â mai en soirĂŠe Ă  proximitĂŠ du domicile dAndrew MountbattenWindsor Ă  Sandringham dans le village de Wolferton, en ÂŤÂ possession dune armeÂ Âť, selon la police britannique.âŚ [+1583 chars]",,fr,'Andrew Windsor'
https://www.lalibre.be/international/europe/guerre-ukraine-russie/2026/05/07/la-mise-en-garde-de-zelensky-aux-dirigeants-allies-a-la-russie-une-etrange-envie-par-les-temps-qui-courent-nous-ne-le-recommandons-pas-CGH5E2LU45BORP4SCSBALSIWXQ/,https://www.lalibre.be/international/europe/guerre-ukraine-russie/2026/05/07/la-mise-en-garde-de-zelensky-aux-dirigeants-allies-a-la-russie-une-etrange-envie-par-les-temps-qui-courent-nous-ne-le-recommandons-pas-CGH5E2LU45BORP4SCSBALSIWXQ/,0,www.lalibre.be,"La mise en garde de Zelensky aux dirigeants alliĂŠs Ă  la Russie: ""Une ĂŠtrange envie par les temps qui courent, nous ne le recommandons pas""",Volodymyr Zelensky a dĂŠconseillĂŠ jeudi aux reprĂŠsentants des pays alliĂŠs Ă  la Russie de se rendre aux cĂŠlĂŠbrations du 9 mai Ă  Moscou. ...,https://www.lalibre.be/resizer/v2/ZNNS74UJCZDB5ALAY2TDOR475M.jpg?auth=2b6199ea47a9240d9d4f676cd70a37b47b7dcc3108c5dfbe8f45c216ec264d57&width=1200&height=630&quality=85&focal=1296%2C864,2026-05-07T17:21:07Z,,"La Russie a de son cĂ´tĂŠ exhortĂŠ les habitants de Kiev Ă  quitter la ville face Ă  la menace d'une frappe le 9 mai.
L'Europe redoute une ""fenĂŞtre d'opportunitĂŠ"" pour Vladimir Poutine : ""Quelque chose pâŚ [+736 chars]",,fr,'Vladimir Poutine'
https://www.lexpress.fr/monde/russie-un-ancien-avocat-pro-kremlin-desormais-en-croisade-contre-poutine-SMVSF7QJ2JBW3FEIQ42WHWQX4Y/,https://www.lexpress.fr/monde/russie-un-ancien-avocat-pro-kremlin-desormais-en-croisade-contre-poutine-SMVSF7QJ2JBW3FEIQ42WHWQX4Y/,0,www.lexpress.fr,Russie : un ancien avocat pro-Kremlin dĂŠsormais en croisade contre Poutine,"Longtemps associĂŠ au camp pro-Kremlin et surtout connu pour ses attaques contre AlexeĂŻ Navalny, Ilya Remeslo a ĂŠtĂŠ admis dans un hĂ´pital psychiatrique aprĂ¨s avoir critiquĂŠ Vladimir Poutine.",https://www.lexpress.fr/resizer/v2/BSUD6HKXCRCEPNMZAMJD6HVUYY.JPG?auth=4ecf9712f23f9e79c8908dfe9c0349d1177d4aab6ff5d405d6bd3b8519d65286&width=1200&height=630&quality=85&smart=true,2026-05-07T17:22:54Z,,"En l'espace de quelques semaines, ses positions politiques se sont radicalement transformĂŠes. Au point de le conduire en hĂ´pital psychiatrique. Ă 42 ans, Ilya Remeslo, connu en Russie pour ĂŞtre un avâŚ [+4538 chars]",,fr,'Poutine'
https://www.franceinfo.fr/monde/russie/vladimir-poutine/vladimir-poutine-redouterait-une-tentative-d-assassinat_7990112.html,https://www.franceinfo.fr/monde/russie/vladimir-poutine/vladimir-poutine-redouterait-une-tentative-d-assassinat_7990112.html,0,www.franceinfo.fr,"DĂŠplacements limitĂŠs, bunker sĂŠcurisĂŠ... Vladimir Poutine redouterait une tentative d'assassinat","Vladimir Poutine limiterait ses dĂŠplacements par crainte pour sa vie, selon un rapport de renseignement europĂŠen. Le prĂŠsident russe redouterait une tentative d'assassinat ou un coup d'Ătat, se retranchant dĂŠsormais dans un bunker sĂŠcurisĂŠ.",https://www.franceinfo.fr/pictures/HblD1O8XIGMuZiC_gH16EyqpzI0/0x9:1402x798/1500x843/2026/05/07/69fcf33663890142965598.jpg,2026-05-07T20:26:57Z,,"Vladimir Poutine limiterait ses dĂŠplacements par crainte pour sa vie, selon un rapport de renseignement europĂŠen. Le prĂŠsident russe redouterait une tentative d'assassinat ou un coup d'Ătat, se retraâŚ [+2243 chars]",,fr,'Vladimir Poutine'
https://www.lalibre.be/international/europe/guerre-ukraine-russie/2026/05/08/des-drones-abattus-en-russie-en-pleine-treve-unilaterale-pour-les-commerations-du-9-mai-J3PIOBOB2FC43C2CIPW3BVUK7Q/,https://www.lalibre.be/international/europe/guerre-ukraine-russie/2026/05/08/des-drones-abattus-en-russie-en-pleine-treve-unilaterale-pour-les-commerations-du-9-mai-J3PIOBOB2FC43C2CIPW3BVUK7Q/,0,www.lalibre.be,Des drones abattus en Russie en pleine trĂŞve unilatĂŠrale pour les commĂŠrations du 9-Mai,"La Russie a annoncĂŠ vendredi matin avoir dĂŠtruit plus de 250 drones ukrainiens depuis l'entrĂŠe en vigueur Ă  minuit de sa trĂŞve unilatĂŠrale de deux jours pour les commĂŠmorations du 9-Mai, auxquelles le prĂŠsident ukrainien Volodymyr Zelensky dissuade les alliĂŠsâŚ",https://www.lalibre.be/resizer/v2/N2EI6DIFXJGNLNCXOKWJHIXGZA.jpg?auth=5c5b84da81b4ba2f4dfc4ed83a5ec73e34776794ec82b959017a985a450f2957&width=1200&height=630&quality=85&focal=2952%2C1962,2026-05-08T05:00:47Z,,"Les engins ont ĂŠtĂŠ abattus dans une dizaine de rĂŠgions, dont celle de la capitale russe, de mĂŞme source.
L'entrĂŠe en vigueur de la trĂŞve unilatĂŠrale russe avait commencĂŠ Ă  00H00 heure de Moscou.
LaâŚ [+4082 chars]",,fr,'Vladimir Poutine'
https://www.dhnet.be/actu/belgique/2026/05/08/rencontre-derdogan-visites-dentreprises-locales-reseautage-la-reine-mathilde-presidera-ce-dimanche-sa-premiere-mission-economique-en-turquie-SXS3EUOEUZC4NCUZ4NRAETSFQU/,https://www.dhnet.be/actu/belgique/2026/05/08/rencontre-derdogan-visites-dentreprises-locales-reseautage-la-reine-mathilde-presidera-ce-dimanche-sa-premiere-mission-economique-en-turquie-SXS3EUOEUZC4NCUZ4NRAETSFQU/,0,www.dhnet.be,"Rencontre d'Erdogan, visites d'entreprises locales et rĂŠseautage : La reine Mathilde prĂŠsidera ce dimanche sa premiĂ¨re mission ĂŠconomique en Turquie","La reine Mathilde prĂŠsidera dimanche sa premiĂ¨re mission ĂŠconomique belge, en Turquie. Elle emmĂ¨nera une vaste dĂŠlĂŠgation ministĂŠrielle et d'entreprises Ă  Istanbul et Ankara, dans le cadre d'une visite de cinq jours centrĂŠe notamment sur la transition ĂŠnergĂŠtâŚ",https://www.dhnet.be/resizer/v2/EX5J4O75XRCE7OGCWPOD35SQKI.jpg?auth=cd3992cab4938df70e956a2dac8d4e778161392f71c7d4d883064fb7933e6e2c&width=1200&height=630&quality=85&focal=256%2C188,2026-05-08T05:10:17Z,http://web.archive.org/web/20260509074435/https://www.dhnet.be/actu/belgique/2026/05/08/rencontre-derdogan-visites-dentreprises-locales-reseautage-la-reine-mathilde-presidera-ce-dimanche-sa-premiere-mission-economique-en-turquie-SXS3EUOEUZC4NCUZ4NRAETSFQU/,La reine Mathilde donnera son nom Ă  une nouvelle azalĂŠe gantoise lors des FloraliesL'objectif de cette mission est de renforcer les relations ĂŠconomiques avec un pays stratĂŠgiquement situĂŠ entre l'EuâŚ [+1210 chars],,fr,'reine Mathilde'
https://www.lavenir.net/actu/belgique/2026/05/08/la-reine-mathilde-presidera-dimanche-sa-premiere-mission-economique-en-turquie-elle-prend-le-relais-de-la-princesse-astrid-PJXSCXF3NNHY7J6RWAPRQ7XADE/,https://www.lavenir.net/actu/belgique/2026/05/08/la-reine-mathilde-presidera-dimanche-sa-premiere-mission-economique-en-turquie-elle-prend-le-relais-de-la-princesse-astrid-PJXSCXF3NNHY7J6RWAPRQ7XADE/,0,www.lavenir.net,La reine Mathilde prĂŠsidera dimanche sa premiĂ¨re mission ĂŠconomique en Turquie: elle prend le relais de la princesse Astrid,"La reine Mathilde prĂŠsidera dimanche sa premiĂ¨re mission ĂŠconomique belge, en Turquie. Elle emmĂ¨nera une vaste dĂŠlĂŠgation ministĂŠrielle et d'entreprises Ă  Istanbul et Ankara, dans le cadre d'une visite de cinq jours centrĂŠe sur la transition ĂŠnergĂŠtique, le tâŚ",https://www.lavenir.net/resizer/v2/L3N4VXXJGZFKTK5O6QX3P3SZ64.JPG?auth=1d6efa02fcf4bfb4d3ab6cfc044d15467b0e88435a5a1ae72f748f08b308f855&width=1200&height=630&quality=85&focal=1728%2C1152,2026-05-08T05:30:28Z,http://web.archive.org/web/20260509044107/https://www.lavenir.net/actu/belgique/2026/05/08/la-reine-mathilde-presidera-dimanche-sa-premiere-mission-economique-en-turquie-elle-prend-le-relais-de-la-princesse-astrid-PJXSCXF3NNHY7J6RWAPRQ7XADE/,"L'objectif de cette mission ĂŠconomique est de renforcer les relations ĂŠconomiques et de poursuivre un partenariat durable avec un pays stratĂŠgiquement situĂŠ entre l'Europe et l'Asie, dans une rĂŠgion âŚ [+1380 chars]",,fr,'reine Mathilde'
https://www.franceinfo.fr/monde/afrique/algerie/l-ambassadeur-de-france-en-algerie-retourne-sur-place-emmanuel-macron-veut-porter-une-attention-prioritaire-au-retour-de-christophe-gleizes-annonce-l-elysee_7991435.html,https://www.franceinfo.fr/monde/afrique/algerie/l-ambassadeur-de-france-en-algerie-retourne-sur-place-emmanuel-macron-veut-porter-une-attention-prioritaire-au-retour-de-christophe-gleizes-annonce-l-elysee_7991435.html,0,www.franceinfo.fr,"L'ambassadeur de France en AlgĂŠrie retourne sur place, Emmanuel Macron veut porter ""une attention prioritaire"" au retour de Christophe Gleizes, annonce l'ElysĂŠe",La ministre dĂŠlĂŠguĂŠe aux ArmĂŠes se rend ĂŠgalement vendredi en AlgĂŠrie pour commĂŠmorer la rĂŠpression franĂ§aise de SĂŠtif de 1945.,https://www.franceinfo.fr/pictures/H3Vehr7wvQ6cXKlL2_BakBxbFG0/0x247:4743x2915/1500x843/2026/05/08/69fd8dde773b8101976207.jpg,2026-05-08T07:20:09Z,http://web.archive.org/web/20260508084057/https://www.franceinfo.fr/monde/afrique/algerie/l-ambassadeur-de-france-en-algerie-retourne-sur-place-emmanuel-macron-veut-porter-une-attention-prioritaire-au-retour-de-christophe-gleizes-annonce-l-elysee_7991435.html,"La France veut rĂŠchauffer les relations avec l'AlgĂŠrie. L'ElysĂŠe, a annoncĂŠ, vendredi 8 mai, que l'ambassadeur de France en AlgĂŠrie allait retourner sur place et ""reprendr[ait] ses activitĂŠs"". StĂŠphaâŚ [+963 chars]",,fr,'Christophe Gleizes'
https://www.huffingtonpost.fr/international/article/l-ambassadeur-de-france-de-retour-en-algerie-macron-espere-un-degel-des-relations-avec-tebboune_263516.html,https://www.huffingtonpost.fr/international/article/l-ambassadeur-de-france-de-retour-en-algerie-macron-espere-un-degel-des-relations-avec-tebboune_263516.html,0,www.huffingtonpost.fr,"Lâambassadeur de France de retour en AlgĂŠrie, Macron espĂ¨re un dĂŠgel des relations avec Tebboune","Un an aprĂ¨s avoir ĂŠtĂŠ rappelĂŠ Ă  Paris, StĂŠphane Romatet va reprendre ses activitĂŠs. Le retour en France de Christophe Gleizes est lâune de ses prioritĂŠs.",https://focus.huffingtonpost.fr/2025/03/31/186/0/7844/4412/1820/1023/75/0/54d5ebd_sirius-fs-upload-1-rfnj2s6q1vpa-1743451953120-000-34wt4xj.jpg,2026-05-08T07:39:25Z,,"EN BREFStĂŠphane Romatet, ambassadeur de France, retourne en AlgĂŠrie pour reprendre ses fonctions un an aprĂ¨s avoir ĂŠtĂŠ rappelĂŠ Ă  Paris.Emmanuel Macron souhaite relancer la relation entre la France etâŚ [+2270 chars]",,fr,'Christophe Gleizes'
https://www.dhnet.be/actu/monde/2026/05/08/trump-utilise-lia-pour-afficher-joe-biden-barack-obama-et-hillary-clinton-ils-ont-cause-denormes-degats-photo-BN6A5SW4QREHPPRKRSRANRRE5U/,https://www.dhnet.be/actu/monde/2026/05/08/trump-utilise-lia-pour-afficher-joe-biden-barack-obama-et-hillary-clinton-ils-ont-cause-denormes-degats-photo-BN6A5SW4QREHPPRKRSRANRRE5U/,0,www.dhnet.be,"Trump utilise l'IA pour afficher Joe Biden, Barack Obama et Hillary Clinton : ""Ils ont causĂŠ d'ĂŠnormes dĂŠgats"" (PHOTO)",Donald Trump a publiĂŠ ce jeudi un clichĂŠ gĂŠnĂŠrĂŠ par lâintelligence artificielle sur son rĂŠseau social. Il le dĂŠcrit comme âun portrait extrĂŞmement frappant du gouvernement de Sleepy Joeâ. ...,https://www.dhnet.be/resizer/v2/3PHRZ6I6WZGX3CPCHWKWU26D4Q.jpg?auth=dce8395594f918db84f4b11ea24873141c5ee917f39a79e549f77c39248badf9&width=1200&height=630&quality=85&focal=1588%2C1059,2026-05-08T07:55:05Z,,"Comment le ""projet Freedom"" de Trump aurait capotĂŠ en IranTrump avait dĂŠjĂ  fait parler de lui en avril en publiant, puis supprimant, une photo de lui se penchant sur un homme malade pour lui apporterâŚ [+1204 chars]",,fr,'Donald Trump'
https://rmcsport.bfmtv.com/football/coupe-du-monde/zidane-messi-dembele-yamal-le-casting-xxl-de-la-pub-virale-d-adidas-pour-la-coupe-du-monde-2026_AN-202605080405.html,https://rmcsport.bfmtv.com/football/coupe-du-monde/zidane-messi-dembele-yamal-le-casting-xxl-de-la-pub-virale-d-adidas-pour-la-coupe-du-monde-2026_AN-202605080405.html,0,rmcsport.bfmtv.com,"Zidane, Messi, DembĂŠlĂŠ, YamalâŚ le casting XXL de la pub virale dâAdidas pour la Coupe du monde 2026","La marque Adidas a dĂŠvoilĂŠ un film publicitaire de plus de cinq minutes avec l'acteur de Hollywood TimothĂŠe Chalamet Ă  la baguette et un panel de stars du football mondial comme Lamine Yamal, Lionel Messi, ZinĂŠdine Zidane ou Ousmane DembĂŠlĂŠ.",https://images.bfmtv.com/kRuJj5sfsvXfvgIj7qGSue_I_Mk=/6x47:1622x956/images/Jude-Bellingham-et-Lamie-Yamal-dans-la-publicite-d-Adidas-avant-la-Coupe-du-monde-mai-2026-2282959.jpg,2026-05-08T10:20:54Z,,"La marque Adidas a dĂŠvoilĂŠ un film publicitaire de plus de cinq minutes avec l'acteur de Hollywood TimothĂŠe Chalamet Ă  la baguette et un panel de stars du football mondial comme Lamine Yamal, Lionel âŚ [+4121 chars]",,fr,'Lionel Messi'
https://www.lalibre.be/international/europe/guerre-ukraine-russie/2026/05/08/la-situation-nest-pas-terrible-pour-poutine-et-la-russie-qui-perdent-du-terrain-en-ukraine-trois-elements-expliquent-ce-revers-ICFVQOOIUVBMTMC7VLX43GIKUE/,https://www.lalibre.be/international/europe/guerre-ukraine-russie/2026/05/08/la-situation-nest-pas-terrible-pour-poutine-et-la-russie-qui-perdent-du-terrain-en-ukraine-trois-elements-expliquent-ce-revers-ICFVQOOIUVBMTMC7VLX43GIKUE/,0,www.lalibre.be,La situation nâest pas terrible pour Poutine et la Russie qui perdent du terrain en Ukraine: trois ĂŠlĂŠments expliquent ce revers,"Pour la premiĂ¨re fois depuis prĂ¨s de deux ans, les troupes russes ont perdu une surface nette sur le front ukrainien, le mois dernier. ...",https://www.lalibre.be/resizer/v2/BPS4JOD72NFM3DIZWWBFKIYWNE.jpg?auth=fd5b73e2cf9a3af3025caa66797f51a4d236369a691511a99c24948757659df5&width=1200&height=630&quality=85&focal=4320%2C2880,2026-05-08T10:55:43Z,http://web.archive.org/web/20260509013222/https://www.lalibre.be/international/europe/guerre-ukraine-russie/2026/05/08/la-situation-nest-pas-terrible-pour-poutine-et-la-russie-qui-perdent-du-terrain-en-ukraine-trois-elements-expliquent-ce-revers-ICFVQOOIUVBMTMC7VLX43GIKUE/,"En Russie, Vladimir Poutine entre pression et paranoĂŻa: ""Sous la stabilitĂŠ de surface se trouve un systĂ¨me politique fracturĂŠ""Trois ĂŠlĂŠments expliquent ce revers selon les analystes de l'ISW : les coâŚ [+3815 chars]",,fr,'Vladimir Poutine'
https://www.voltairenet.org/article224454.html,https://www.voltairenet.org/article224454.html,0,www.voltairenet.org,"L'ancien Premier ministre souverainiste Mossadegh avait ĂŠtĂŠ inspirĂŠ par le gĂŠnĂŠral LĂĄzaro CĂĄrdenas pour nationaliser le pĂŠtrole iranien, par Alfredo Jalife-Rahme","La mobilisation populaire en Iran, pour soutenir le pays face aux agresseurs israĂŠlo-ĂŠtats-uniens et Ă  leurs alliĂŠs, trouve son origine dans celle qui a accompagnĂŠ la nationalisation pĂŠtrole par Mohammad Mossadegh. Le souverainisme iranien est donc antĂŠrieur âŚ",https://www.voltairenet.org/IMG/logo/400_-_1_2_-380.jpg?1778246002,2026-05-08T13:23:00Z,,"La question du pillage de ÂŤÂ lâor noirÂ Âť de la Perse, de nouveau attaquĂŠ par le duo IsraĂŤl/Ătats-Unis, 75 ans aprĂ¨s la nationalisation du pĂŠtrole par le Premier ministre souverainiste iranien MohammadâŚ [+4674 chars]",,fr,'Premier ministre'
https://www.lalibre.be/international/amerique/2026/05/08/le-pentagone-publie-des-documents-sur-les-ovnis-il-est-temps-que-le-peuple-americain-puisse-y-avoir-directement-acces-TIB5PHVGC5ESPIXCR3PRL3646I/,https://www.lalibre.be/international/amerique/2026/05/08/le-pentagone-publie-des-documents-sur-les-ovnis-il-est-temps-que-le-peuple-americain-puisse-y-avoir-directement-acces-TIB5PHVGC5ESPIXCR3PRL3646I/,0,www.lalibre.be,"Le Pentagone publie des documents sur les ovnis: ""Il est temps que le peuple amĂŠricain puisse y avoir directement accĂ¨s""","Le ministĂ¨re amĂŠricain de la DĂŠfense a annoncĂŠ vendredi avoir rendu public un premier lot de documents, prĂŠcĂŠdemment tenus secrets, sur les objets volants non-identifiĂŠs, ou ovnis, un sujet qui fascine jusqu'Ă  Donald Trump, Ă  l'origine de cette publication. .âŚ",https://www.lalibre.be/resizer/v2/YTRNQL6GINCADA65UJXBGWNEAY.jpg?auth=0a780a4d3294f44eea14977f8bd8e409644efc1f611f134066dff48dc96a5cff&width=1200&height=630&quality=85&focal=901%2C512,2026-05-08T14:07:58Z,http://web.archive.org/web/20260509021615/https://www.lalibre.be/international/amerique/2026/05/08/le-pentagone-publie-des-documents-sur-les-ovnis-il-est-temps-que-le-peuple-americain-puisse-y-avoir-directement-acces-TIB5PHVGC5ESPIXCR3PRL3646I/,"Le ciel belge a ĂŠtĂŠ le thĂŠĂ˘tre d'un phĂŠnomĂ¨ne inexpliquĂŠ en 1989 qui a tenu le pays en haleine : ""Un objet ĂŠtrange""Donald Trump avait annoncĂŠ en fĂŠvrier qu'il comptait ordonner aux agences fĂŠdĂŠrales âŚ [+1586 chars]",,fr,'Donald Trump'
https://www.numerama.com/politique/2250137-trois-lueurs-au-dessus-du-relief-lunaire-les-usa-ouvrent-leurs-premiers-x-files-sur-les-ovni.html,https://www.numerama.com/politique/2250137-trois-lueurs-au-dessus-du-relief-lunaire-les-usa-ouvrent-leurs-premiers-x-files-sur-les-ovni.html,0,www.numerama.com,ÂŤ Trois lueurs au-dessus du relief lunaire Âť : les USA ouvrent leurs premiers X-Files sur les OVNI,"Ce qui nâĂŠtait quâune pique de Donald Trump contre Barack Obama en fĂŠvrier dernier vient de se transformer en sĂŠisme dâĂtat. Ce 8 mai 2026, le DĂŠpartement de la Guerre a lancĂŠ le portail War.gov/UFO, livrant au public les premiĂ¨res piĂ¨ces dâun puzzle de 161 aâŚ","https://c0.lestechnophiles.com/www.numerama.com/wp-content/uploads/2026/05/ufo-dod.jpg?resize=1600,900&key=0ef275aa&watermark",2026-05-08T14:46:24Z,,"Ce qui nâĂŠtait quâune pique de Donald Trump contre Barack Obama en fĂŠvrier dernier vient de se transformer en sĂŠisme dâĂtat. Ce 8 mai 2026, le DĂŠpartement de la Guerre a lancĂŠ le portail War.gov/UFO,âŚ [+5952 chars]",,fr,'Donald Trump'
https://www.franceinfo.fr/sciences/le-pentagone-publie-des-documents-precedemment-tenus-secrets-sur-les-ovnis_7991921.html,https://www.franceinfo.fr/sciences/le-pentagone-publie-des-documents-precedemment-tenus-secrets-sur-les-ovnis_7991921.html,0,www.franceinfo.fr,"Le Pentagone publie des documents, prĂŠcĂŠdemment tenus secrets, sur les ovnis","""Ces documents, cachĂŠs derriĂ¨re le secret-dĂŠfense, ont longtemps alimentĂŠ, de maniĂ¨re justifiĂŠe, les spĂŠculations, et il est temps que le peuple amĂŠricain puisse y avoir directement accĂ¨s"", a dĂŠclarĂŠ le ministre de la DĂŠfense, Pete Hegseth, dans un communiquĂŠ.",https://www.franceinfo.fr/pictures/Mgv9thKusPy0x2AM0SVn1ugIvH8/0x0:1024x576/1500x843/2026/05/08/69fdf916973f1639880373.jpg,2026-05-08T14:56:25Z,,"""Ces documents, cachĂŠs derriĂ¨re le secret-dĂŠfense, ont longtemps alimentĂŠ, de maniĂ¨re justifiĂŠe, les spĂŠculations, et il est temps que le peuple amĂŠricain puisse y avoir directement accĂ¨s"", a dĂŠclarĂŠâŚ [+2587 chars]",,fr,'Pete Hegseth'
https://www.presse-citron.net/apple-nvidia-boeing-quels-sont-les-rares-patrons-invites-par-trump-a-pekin/,https://www.presse-citron.net/apple-nvidia-boeing-quels-sont-les-rares-patrons-invites-par-trump-a-pekin/,0,www.presse-citron.net,"Apple, Nvidia, BoeingÂ : quels sont les rares patrons invitĂŠs par Trump Ă  PĂŠkinÂ ?","Le prĂŠsident amĂŠricain retourne en Chine rencontrer Xi Jinping, 9 ans aprĂ¨s sa derniĂ¨re visite en 2017. ComparĂŠ Ă  des dĂŠlĂŠgations comme celle du Premier ministre canadien ou du chancelier allemand, Donald Trump a fait une sĂŠlection trĂ¨s restreinte. Le signe dâŚ",https://www.presse-citron.net/app/uploads/2026/05/donald-trump-nvidia-jensen-huang-1600x900.jpg,2026-05-08T15:00:04Z,,"Donald Trump retourne en Chine les 15 et 16 mai prochains, aprĂ¨s plusieurs mois de retard sur le calendrier initial. 9 ans aprĂ¨s sa visite en novembre 2017, le prĂŠsident amĂŠricain fera sa premiĂ¨re reâŚ [+2959 chars]",,fr,'Donald Trump'
https://www.bfmtv.com/politique/parti-socialiste/boris-vallaud-quitte-la-direction-du-parti-socialiste_AN-202605080610.html,https://www.bfmtv.com/politique/parti-socialiste/boris-vallaud-quitte-la-direction-du-parti-socialiste_AN-202605080610.html,0,www.bfmtv.com,Boris Vallaud quitte la direction du Parti socialiste,"D'aprĂ¨s les informations de BFMTV, Boris Vallaud, prĂŠsident du groupe socialiste Ă  l'AssemblĂŠe nationale, a dĂŠcidĂŠ de quitter la direction du Parti socialiste. Son dĂŠpart illustre les tensions au sein du PS, notamment autour de la question de la primaire de lâŚ",https://images.bfmtv.com/K1-AesQbiiRvB_SBgSIfTATpuUU=/0x39:768x471/768x0/images/Le-president-du-groupe-parlementaire-Socialistes-et-apparentes-Boris-Vallaud-assiste-a-une-seance-de-questions-au-gouvernement-a-l-Assemblee-nationale-a-Paris-le-20-janvier-2026-2222627.jpg,2026-05-08T15:58:25Z,,"D'aprĂ¨s les informations de BFMTV, Boris Vallaud, prĂŠsident du groupe socialiste Ă  l'AssemblĂŠe nationale, a dĂŠcidĂŠ de quitter la direction du Parti socialiste. Son dĂŠpart illustre les tensions au seiâŚ [+768 chars]",,fr,'Boris Vallaud'
https://www.nouvelobs.com/monde/20260508.OBS114783/en-ukraine-poutine-n-avance-toujours-pas-voire-recule-incapable-de-profiter-de-la-guerre-au-moyen-orient.html,https://www.nouvelobs.com/monde/20260508.OBS114783/en-ukraine-poutine-n-avance-toujours-pas-voire-recule-incapable-de-profiter-de-la-guerre-au-moyen-orient.html,0,www.nouvelobs.com,"En Ukraine, Poutine nâavance toujours pasâŚ voire recule, incapable de profiter de la guerre au Moyen-Orient","DĂŠjouant encore les attentes, lâarmĂŠe de Kiev a repris lâinitiative sur certains secteurs de la ligne de front, tandis que lâimpatience gagne le premier cercle du pouvoir russe. Ce samedi 9Â mai, la parade militaire Ă  Moscou sâannonce bien terne.",https://focus.nouvelobs.com/2026/05/07/46/0/2575/1717/1200/800/0/0/e76bd28_upload-1-qowy30h5uf4s-000-a9gq2g3.jpg,2026-05-08T16:00:03Z,http://web.archive.org/web/20260508160243/https://www.nouvelobs.com/monde/20260508.OBS114783/en-ukraine-poutine-n-avance-toujours-pas-voire-recule-incapable-de-profiter-de-la-guerre-au-moyen-orient.html,"Le prĂŠsident russe Vladimir Poutine Ă  Moscou, le 30Â avril 2026.Â VIACHESLAV PROKOFIEV/AFP
Commenter LireÂ plusÂ tard 
Google ActualitĂŠs
Partager Sabonner pour lire 
Tous les astres semblaient pourtaâŚ [+1199 chars]",,fr,'Vladimir Poutine'
