index,url,valid,domain,title,description,image,published,archive,content,quote,language,keyword
https://www.franceinfo.fr/elections/presidentielle/coup-de-force-sabotage-chez-les-ecologistes-des-divisions-en-pagaille-avant-de-determiner-la-strategie-pour-la-presidentielle_8086850.html,https://www.franceinfo.fr/elections/presidentielle/coup-de-force-sabotage-chez-les-ecologistes-des-divisions-en-pagaille-avant-de-determiner-la-strategie-pour-la-presidentielle_8086850.html,0,www.franceinfo.fr,"""Coup de force"", ""sabotage""… Chez Les Ecologistes, des divisions en pagaille avant de déterminer la stratégie pour la présidentielle","Autour de Marine Tondelier, qui se prépare à une candidature autonome pour 2027, la direction du parti critique le conseil fédéral extraordinaire demandé par ses opposants pour réclamer une consultation des militants à la rentrée.",https://www.franceinfo.fr/pictures/BD06Xi0F8u8_eOzLiI7pzffA728/0x102:5472x3180/1500x843/2026/06/30/6a43d122d800c213782238.jpg,2026-07-01T03:50:28Z,http://web.archive.org/web/20260701074939/https://www.franceinfo.fr/elections/presidentielle/coup-de-force-sabotage-chez-les-ecologistes-des-divisions-en-pagaille-avant-de-determiner-la-strategie-pour-la-presidentielle_8086850.html,"""Le parti est à deux doigts d'exploser."" L'alerte de cette figure des Ecologistes, mi-juin, va peut-être connaître une traduction concrète au début de l'été, à neuf mois de l'élection présidentielle.… [+7498 chars]",,fr,'Marine Tondelier'
https://www.challenges.fr/monde/le-royaume-uni-tourne-la-page-starmer-quel-heritage-economique-pour-andy-burnham_644597,https://www.challenges.fr/monde/le-royaume-uni-tourne-la-page-starmer-quel-heritage-economique-pour-andy-burnham_644597,0,www.challenges.fr,Le Royaume-Uni tourne la page Starmer : quel héritage économique pour Andy Burnham ?,"La croissance, toujours convalescente outre-Manche, compromet la poursuite de la politique sociale affichée par Andy Burnham et la résorption du déficit.",https://www.challenges.fr/_ipx/f_jpg&enlarge_true&s_1200x630/cha/static/2026-06/58482.HR_0.jpg%3FVersionId=wuYFF8Fm9AafJvZRcCirAWQfMR24eUU5,2026-07-01T06:00:00Z,,Andy Burnham devrait prendre les rênes du Royaume-Uni mi-juillet. Son transfert de la mairie du Grand Manchester au 10 Downing Street sannonce donc rapide. Le Parlement fermant ses portes entre le 16… [+714 chars],,fr,'Andy Burnham'
https://www.franceinfo.fr/elections/presidentielle/ce-n-est-ni-a-l-ordre-du-jour-ni-dans-mon-horizon-assure-jean-castex-concernant-la-presidentielle-2027_8087960.html,https://www.franceinfo.fr/elections/presidentielle/ce-n-est-ni-a-l-ordre-du-jour-ni-dans-mon-horizon-assure-jean-castex-concernant-la-presidentielle-2027_8087960.html,0,www.franceinfo.fr,"""Ce n'est ni à l'ordre du jour, ni dans mon horizon"", assure Jean Castex concernant la présidentielle 2027","""Je me demande si aujourd'hui la distinction n'est pas de ne pas être candidat"", ironise l'ancien Premier ministre.",https://www.franceinfo.fr/pictures/f0J2GP2xFPYvP8Lqx3Lf9g6YtFI/41x0:1160x629/1500x843/2026/07/01/6a44b68f5815c968901348.jpeg,2026-07-01T06:41:26Z,http://web.archive.org/web/20260701073830/https://www.franceinfo.fr/elections/presidentielle/ce-n-est-ni-a-l-ordre-du-jour-ni-dans-mon-horizon-assure-jean-castex-concernant-la-presidentielle-2027_8087960.html,"Être candidat à l'élection présidentielle en 2027, ""ce n'est ni à l'ordre du jour, ni dans mon horizon"", assure mercredi 1er juillet sur France Inter Jean Castex, PDG de la SNCF et ancien Premier min… [+545 chars]",,fr,'Gabriel Attal'
https://www.huffingtonpost.fr/politique/article/le-pen-future-tutrice-de-bardella-cette-sortie-fait-le-bonheur-des-adversaires-du-rn_281459.html,https://www.huffingtonpost.fr/politique/article/le-pen-future-tutrice-de-bardella-cette-sortie-fait-le-bonheur-des-adversaires-du-rn_281459.html,0,www.huffingtonpost.fr,Le Pen future « tutrice » de Bardella ? Cette sortie fait le bonheur des adversaires du RN,"Le député RN Philippe Ballard a estimé que même en cas de condamnation de Marine Le Pen, « on ne peut pas gommer une personne comme ça ».",https://focus.huffingtonpost.fr/2026/07/01/53/0/1024/576/1820/1023/75/0/cdfaa0e_upload-1-br1qzd3jvpf8-afp-20260227-pinto-marinele260226-np1zy-v1-midres-marinelepenandjordanbardellav.jpg,2026-07-01T11:05:08Z,,Cest qui le patron ? Ou plutôt la patronne ? À une semaine de la décision de la Cour dappel de Paris dans le procès des assistants parlementaires du FN qui décidera de la candidature de Marine Le Pen… [+2757 chars],,fr,'Marine Le Pen'
https://www.huffingtonpost.fr/politique/article/chez-les-ecologistes-la-fronde-s-intensifie-avec-plusieurs-elus-qui-exigent-de-discuter-avec-lfi_281494.html,https://www.huffingtonpost.fr/politique/article/chez-les-ecologistes-la-fronde-s-intensifie-avec-plusieurs-elus-qui-exigent-de-discuter-avec-lfi_281494.html,0,www.huffingtonpost.fr,"Chez Les Écologistes, la fronde s’intensifie avec plusieurs élus qui exigent de discuter avec LFI","Treize parlementaires, dont la présidente du groupe à l’Assemblée, appellent à « sortir du tête-à-tête avec le PS » et à ouvrir des négociations avec Jean-Luc Mélenchon.",https://focus.huffingtonpost.fr/2026/07/01/209/0/6630/3729/1820/1023/75/0/5de9eef_upload-1-ozbojk6qmhb4-afp-20260311-a2uc237-v1-highres-franceiranusisraelwargovernmentparties.jpg,2026-07-01T13:31:04Z,,"Le casse-tête continue pour Marine Tondelier. Chez les Verts, de plus en plus délus et de cadres plaident pour louverture de discussions avec La France insoumise dans la perspective de lélection prés… [+4004 chars]",,fr,'Jean-Luc Mélenchon'
https://www.20minutes.fr/politique/4232270-20260701-presidentielle-2027-laurent-wauquiez-trouve-plein-qualites-edouard-philippe-invite-retailleau-retirer,https://www.20minutes.fr/politique/4232270-20260701-presidentielle-2027-laurent-wauquiez-trouve-plein-qualites-edouard-philippe-invite-retailleau-retirer,0,www.20minutes.fr,Présidentielle 2027 : Laurent Wauquiez trouve plein de qualités à Édouard Philippe et invite Retailleau à se retirer,"Le chef de file des députés de la Droite républicaine a, dans un entretien au « Figaro » ce mercredi, tendu la main à Édouard Philippe et estimé que Bruno Retailleau doit « savoir se retirer » si sa candidature ne décolle pas dans les sondages",https://img.20mn.fr/h1Ym_WcJQaeCZ5LDatAfTSk/1444x920_video-de-soutien-a-laurent-wauquiez-lors-du-meeting-de-campagne-pour-les-elections-municipales-de-2026-a-paris-de-rachida-dati-ancienne-ministre-de-la-culture-et-candidate-du-groupe-les-republicains-elysee-montmartre-paris-france-jeudi-12-mars-2026-01accorsinijeanne-dati-0087-credit-jeanne-accorsini-sipa-2603130025,2026-07-01T15:17:02Z,,Un pavé dans la mare du parti Les Républicains. Laurent Wauquiez a porté un coup mercredi aux ambitions élyséennes de Bruno Retailleau en l'appelant sans le nommer à « savoir se retirer » si sa candi… [+3617 chars],,fr,'Bruno Retailleau'
https://www.huffingtonpost.fr/divertissement/video/le-mariage-de-taylor-swift-au-madison-square-garden-ce-clin-d-il-de-zohran-mamdani-qui-semble-le-confirmer_281591.html,https://www.huffingtonpost.fr/divertissement/video/le-mariage-de-taylor-swift-au-madison-square-garden-ce-clin-d-il-de-zohran-mamdani-qui-semble-le-confirmer_281591.html,0,www.huffingtonpost.fr,Le mariage de Taylor Swift au Madison Square Garden ? Ce clin d’œil de Zohran Mamdani qui semble le confirmer,"Le mariage de Taylor Swift et Travis Kelce devrait bien avoir lieu à New York. La célèbre salle de concert est en pleins préparatifs et le maire n’a pas démenti la rumeur, au contraire.",https://focus.huffingtonpost.fr/2026/07/01/0/0/1920/1080/1820/1023/75/0/e33fcce_upload-1-m5avnj5wi9sy-mariage.jpg,2026-07-01T17:00:04Z,,"La lecture de ce contenu est susceptible dentraîner un dépôt de cookies de la part de lopérateur tiers qui lhéberge. Compte-tenu des choix que vous avez exprimés en matière de dépôt de cookies, nous … [+2759 chars]",,fr,'Zohran Mamdani'
https://www.ledauphine.com/societe/2026/07/02/deux-ceremonies-portables-interdits-ce-que-l-on-sait-du-mariage-de-taylor-swift-et-travis-kelce,https://www.ledauphine.com/societe/2026/07/02/deux-ceremonies-portables-interdits-ce-que-l-on-sait-du-mariage-de-taylor-swift-et-travis-kelce,0,www.ledauphine.com,"États-Unis. Deux cérémonies, portables interdits… ce que l’on sait du mariage de Taylor Swift et Travis Kelce","Selon plusieurs médias américains, la chanteuse Taylor Swift et le joueur de football américain Travis Kelce devraient se marier vendredi à New York, après s’être fiancés le 26 août dernier.",https://cdn-s-www.ledauphine.com/images/27431E4A-625B-4BC5-8410-B56B32CAFD06/FB1200/photo-1782918265.jpg,2026-07-02T07:30:00Z,,"Lunion supposée entre la chanteuse Taylor Swift et le joueur de football américain Travis Kelce, fiancés en août, aura lieu ce vendredi 3 juillet, selon plusieurs médias américains, qui décrivent un … [+6262 chars]",,fr,'Taylor Swift'
https://www.20minutes.fr/arts-stars/people/4232388-20260702-taylor-swift-travis-kelce-vont-vraiment-marier-madison-square-garden-pourquoi-quelques-doutes,https://www.20minutes.fr/arts-stars/people/4232388-20260702-taylor-swift-travis-kelce-vont-vraiment-marier-madison-square-garden-pourquoi-quelques-doutes,0,www.20minutes.fr,Taylor Swift et Travis Kelce vont-ils vraiment se marier au Madison Square Garden ? Pourquoi on a quelques doutes,La superstar Taylor Swift et le joueur de football américain Travis Kelce devraient se marier vendredi soir au Madison Square Garden,https://img.20mn.fr/ORtzlDl6TACoLKhqmZI0fyk/1444x920_taylor-swift-et-travis-kelce-vont-ils-vraiment-se-marier-dans-une-salle-de-sport-et-de-spectacle,2026-07-02T11:21:24Z,http://web.archive.org/web/20260702170952/https://www.20minutes.fr/arts-stars/people/4232388-20260702-taylor-swift-travis-kelce-vont-vraiment-marier-madison-square-garden-pourquoi-quelques-doutes,"On pensait avoir tout vu avec Taylor Swift. Les albums records, les stades en feu, les ruptures chantées comme des thérapies collectives Mais un mariage au Madison Square Garden ? Là on est un peu pe… [+3326 chars]",,fr,'Taylor Swift'
https://www.courrierinternational.com/article/celebrations-zohran-mamdani-fait-bande-a-part-pour-les-250-ans-de-l-independance-americaine_246200,https://www.courrierinternational.com/article/celebrations-zohran-mamdani-fait-bande-a-part-pour-les-250-ans-de-l-independance-americaine_246200,0,www.courrierinternational.com,Zohran Mamdani fait bande à part pour les 250 ans de l’indépendance américaine,"Alors que la Grosse Pomme va notamment être le théâtre d’un grand spectacle nautique pour fêter le 250e anniversaire des États-Unis, son maire a décidé de célébrer l’événement à contre-courant, en prononçant un discours à l’occasion d’une cérémonie de natural…",https://focus.courrierinternational.com/2026/06/18/47/0/1705/1136/1200/630/60/0/4c52a77_ftp-1-1k7xr9ixjhng-2026-06-18t155046z-194326532-up1em6i180le3-rtrmadp-3-basketball-nba-nyk-parade.JPG,2026-07-02T14:00:06Z,,"Le maire de New York, Zohran Mamdani, a décidé de célébrer le 250e anniversaire du pays à sa propre façon,souligne TheNew York Times.
Le 3 juillet, à la veille de lIndependence Day, la fête national… [+1708 chars]",,fr,'Zohran Mamdani'
https://www.frandroid.com/marques/sony/3166791_demain-vous-paierez-sans-jamais-rien-posseder-melenchon-veut-une-loi-pour-sauver-les-jeux-video-physiques,https://www.frandroid.com/marques/sony/3166791_demain-vous-paierez-sans-jamais-rien-posseder-melenchon-veut-une-loi-pour-sauver-les-jeux-video-physiques,0,www.frandroid.com,"« Demain, vous paierez sans jamais rien posséder » : Mélenchon veut une loi pour sauver les jeux vidéo physiques","Jean-Luc Mélenchon veut faire des jeux vidéo un bien culturel protégé par la loi, et promet un chantier législatif en 2027. Derrière la sortie, un vrai débat : à l'ère du tout-numérique, achète-t-on encore ce qu'on paie ?","https://c0.lestechnophiles.com/images.frandroid.com/wp-content/uploads/2026/07/image-21.jpg?resize=1600,900&key=00554280",2026-07-02T18:44:08Z,http://web.archive.org/web/20260702230022/https://www.frandroid.com/marques/sony/3166791_demain-vous-paierez-sans-jamais-rien-posseder-melenchon-veut-une-loi-pour-sauver-les-jeux-video-physiques,"Jean-Luc Mélenchon veut faire des jeux vidéo un bien culturel protégé par la loi, et promet un chantier législatif en 2027. Derrière la sortie, un vrai débat : à l’ère du tout-numérique, achète-t-on … [+4242 chars]",,fr,'Jean-Luc Mélenchon'
https://www.20minutes.fr/politique/assemblee_nationale/4232431-20260703-presidentielle-2027-seule-boussole-emmerder-retailleau-pourquoi-wauquiez-soutient-philippe,https://www.20minutes.fr/politique/assemblee_nationale/4232431-20260703-presidentielle-2027-seule-boussole-emmerder-retailleau-pourquoi-wauquiez-soutient-philippe,0,www.20minutes.fr,"Présidentielle 2027 : « Sa seule boussole, c’est d’emmerder Retailleau… » Pourquoi Wauquiez soutient Philippe ?","Le patron des députés LR, Laurent Wauquiez, a loué la candidature d’Edouard Philippe pour la présidentielle 2027, une manière d’affaiblir son rival et chef du parti Bruno Retailleau",https://img.20mn.fr/y9juV_dXR9uq1hzUJduvuSk/1444x920_le-president-du-groupe-parlementaire-de-droite-republicaine-laurent-wauquiez-lors-d-une-seance-de-questions-au-gouvernement-a-l-assemblee-nationale-la-chambre-basse-du-parlement-francais-a-paris-le-14-avril-2026-01accorsinijeanne-an-0048-credit-jeanne-accorsini-sipa-2604141820,2026-07-03T04:02:37Z,http://web.archive.org/web/20260703172325/https://www.20minutes.fr/politique/assemblee_nationale/4232431-20260703-presidentielle-2027-seule-boussole-emmerder-retailleau-pourquoi-wauquiez-soutient-philippe,Il faut reconnaître un certain talent à Laurent Wauquiez. Celui de pouvoir mettre le bazar comme personne au sein de sa famille politique. Le patron des Républicains à lAssemblée nationale a suscité … [+3691 chars],,fr,'Bruno Retailleau'
https://www.ledauphine.com/politique/2026/07/03/le-250e-anniversaire-de-l-independance-va-t-il-virer-au-fiasco-pour-donald-trump,https://www.ledauphine.com/politique/2026/07/03/le-250e-anniversaire-de-l-independance-va-t-il-virer-au-fiasco-pour-donald-trump,0,www.ledauphine.com,États-Unis. Le 250e anniversaire de l'indépendance va-t-il virer au fiasco pour Donald Trump ?,Les festivités du 250e anniversaire des États-Unis devraient connaître leur apogée ce week-end avec un méga feu d’artifice et un discours de Donald Trump. Le président américain a tellement politisé et confisqué cet événement qu’il contribue à mettre en évide…,https://cdn-s-www.ledauphine.com/images/3A30EB71-8B8B-4BB2-8792-92706C4EF9EA/FB1200/photo-1783012430.jpg,2026-07-03T05:30:00Z,http://web.archive.org/web/20260704020941/https://www.ledauphine.com/politique/2026/07/03/le-250e-anniversaire-de-l-independance-va-t-il-virer-au-fiasco-pour-donald-trump,Les États-Unis célèbrent leurs 250 ans mais le cur ny est pas. « LAmérique fête son 250e anniversaire en pleine division. Le pays est profondément polarisé et le climat politique y est plus agité que… [+2991 chars],,fr,'Donald Trump'
https://www.franceinfo.fr/societe/education/scolarite/financement-reussite-scolaire-le-bilan-tres-mitige-de-l-uniforme-a-l-ecole-dont-l-experimentation-prend-fin_8090873.html,https://www.franceinfo.fr/societe/education/scolarite/financement-reussite-scolaire-le-bilan-tres-mitige-de-l-uniforme-a-l-ecole-dont-l-experimentation-prend-fin_8090873.html,0,www.franceinfo.fr,"Financement, réussite scolaire... Le bilan très mitigé de l'uniforme à l'école, dont l'expérimentation prend fin","Gabriel Attal, alors ministre de l'Éducation nationale, avait lancé le projet à l'automne 2023 afin d'atteindre ""l'égalité sociale"" et d'améliorer le climat scolaire.",https://www.franceinfo.fr/pictures/opeSCh_PBzZ_ryin4KWFk4NeaGU/0x700:6720x4480/1500x843/2026/07/02/6a46c29463e32896051067.jpg,2026-07-03T06:18:41Z,,"Une expérimentation qui a fait couler beaucoup d'encre : celle de l'uniforme dans certains établissements scolaires. Après les lycéens et les collégiens, l'heure des grandes vacances a sonné pour les… [+4406 chars]",,fr,'Gabriel Attal'
https://www.lalibre.be/lifestyle/people/2026/07/03/a-new-york-le-mariage-de-taylor-swift-et-travis-kelce-est-lance-PQQK5JN7TVCVBBD3PCHPZW2FUQ/,https://www.lalibre.be/lifestyle/people/2026/07/03/a-new-york-le-mariage-de-taylor-swift-et-travis-kelce-est-lance-PQQK5JN7TVCVBBD3PCHPZW2FUQ/,0,www.lalibre.be,"A New York, le mariage de Taylor Swift et Travis Kelce est lancé","En plein centre de New York mais loin des regards du public, les célébrations du mariage de la popstar Taylor Swift et du footballeur américain Travis Kelce ont démarré jeudi, avant leur point d'orgue, la cérémonie, attendue vendredi. ...",https://www.lalibre.be/resizer/v2/F5HASWI52NHMJNKVFP5SZCW7PM.jpg?auth=f42c13bf374f5faf9abcd6d6a573f9ccdc4f8b308bd8ad497ad1d13f08feb6ec&width=1200&height=630&quality=85&focal=1500%2C1000,2026-07-03T06:54:20Z,,"Les très nombreux journalistes et les quelques ""Swifties"" (le nom donné aux fans de la musicienne) présents étaient maintenus à distance, aux deux extrémités d'une rue interdite aux piétons.
Alyssa … [+2698 chars]",,fr,'Travis Kelce'
https://www.journaldugeek.com/2026/07/03/gta-6-et-fin-des-jeux-physiques-jean-luc-melenchon-a-son-mot-a-dire/,https://www.journaldugeek.com/2026/07/03/gta-6-et-fin-des-jeux-physiques-jean-luc-melenchon-a-son-mot-a-dire/,0,www.journaldugeek.com,GTA 6 et fin des jeux physiques : Jean-Luc Mélenchon a son mot à dire,"Jean-Luc Mélenchon, candidat à la présidentielle pour 2027, s'empare du débat sur GTA et la fin des jeux physiques annoncée par PlayStation.",https://www.journaldugeek.com/app/uploads/2026/07/jeux-physiques-1600x900.jpg,2026-07-03T11:01:38Z,http://web.archive.org/web/20260703190113/https://www.journaldugeek.com/2026/07/03/gta-6-et-fin-des-jeux-physiques-jean-luc-melenchon-a-son-mot-a-dire/,"Le débat autour de la disparition progressive des jeux vidéo physiques vient de franchir une étape inattendue. Dans un message publié sur X, Jean-Luc Mélenchon sinquiète de la place laissée aux joueu… [+3979 chars]",,fr,'Jean-Luc Mélenchon'
https://www.presse-citron.net/jean-luc-melenchon-souhaite-contraindre-sony-a-vendre-des-jeux-ps5-en-physique-peut-il-reellement-le-faire/,https://www.presse-citron.net/jean-luc-melenchon-souhaite-contraindre-sony-a-vendre-des-jeux-ps5-en-physique-peut-il-reellement-le-faire/,0,www.presse-citron.net,"Jean-Luc Mélenchon souhaite contraindre Sony à vendre des jeux PS5 en physique, peut-il réellement le faire ?","Sony a décidé d’arrêter les jeux physiques et, face à l’émoi des joueurs, les politiques tentent déjà de récupérer l’affaire.",https://www.presse-citron.net/app/uploads/2026/03/sony-plainte-playstation-1600x900.jpg,2026-07-03T11:30:59Z,http://web.archive.org/web/20260703122015/https://www.presse-citron.net/jean-luc-melenchon-souhaite-contraindre-sony-a-vendre-des-jeux-ps5-en-physique-peut-il-reellement-le-faire/,"Le 1er juillet dernier, Sony a fait une annonce choc : à partir de janvier 2028, plus aucun nouveau jeu PS5 ne sera vendu sur disque. Tous seront proposés en version dématérialisée. Une décision maje… [+4192 chars]",,fr,'Jean-Luc Mélenchon'
https://www.huffingtonpost.fr/divertissement/article/mariage-de-taylor-swift-et-de-travis-kelce-les-medias-americains-a-la-recherche-du-moindre-indice_282482.html,https://www.huffingtonpost.fr/divertissement/article/mariage-de-taylor-swift-et-de-travis-kelce-les-medias-americains-a-la-recherche-du-moindre-indice_282482.html,0,www.huffingtonpost.fr,Mariage de Taylor Swift et de Travis Kelce : les médias américains à la recherche du moindre indice,"Alors que les spéculations sur le mariage de la chanteuse et de Travis Kelce (qui n’est toujours pas officiellement confirmé) vont bon train, des preuves de plus en plus tangibles sont mises à notre disposition.",https://focus.huffingtonpost.fr/2025/08/26/32/0/1080/607/1820/1023/75/0/6dd2195_upload-1-wdm2fedoic1b-539533158-18590984977054956-7093941098066659814-n.jpeg,2026-07-03T12:23:14Z,,"Le mariage de lannée est sur le point de débuter. Après des semaines de rumeurs, Taylor Swift et Travis Kelce devraient sunir au Madison Square Garden de New York ce vendredi 3 juillet, à la veille d… [+3046 chars]",,fr,'Paul McCartney'
https://www.lavenir.net/culture/2026/07/03/effervescence-a-new-york-pour-le-mariage-de-taylor-swift-avec-le-footballeur-americain-travis-kelce-les-prestigieux-invites-prives-de-portable-MUD5SXEV3NGC3LFIHAAH7QWEY4/,https://www.lavenir.net/culture/2026/07/03/effervescence-a-new-york-pour-le-mariage-de-taylor-swift-avec-le-footballeur-americain-travis-kelce-les-prestigieux-invites-prives-de-portable-MUD5SXEV3NGC3LFIHAAH7QWEY4/,0,www.lavenir.net,"Effervescence à New York pour le mariage de Taylor Swift avec le footballeur américain Travis Kelce, les prestigieux invités privés de portable",Les célébrations du mariage de la popstar Taylor Swift avec le footballeur américain Travis Kelce ont démarré ce jeudi 2 juillet 2026 au Madison Square Garden. ...,https://www.lavenir.net/resizer/v2/EFHNPILXARGYJHYQTWGR27BMEI.jpg?auth=acd18a5c3bbe4d107c35aaf0111d093315361da9668342df3993578075d77396&width=1200&height=630&quality=85&focal=972%2C636,2026-07-03T12:30:51Z,http://web.archive.org/web/20260704032858/https://www.lavenir.net/culture/2026/07/03/effervescence-a-new-york-pour-le-mariage-de-taylor-swift-avec-le-footballeur-americain-travis-kelce-les-prestigieux-invites-prives-de-portable-MUD5SXEV3NGC3LFIHAAH7QWEY4/,"Selon la presse américaine, qui feuilletonne depuis des semaines sur cet événement qui n'a jamais été confirmé officiellement, un premier dîner doit rassembler une centaine de personnes, avant d'autr… [+1424 chars]",,fr,'Travis Kelce'
https://www.courrierinternational.com/article/vu-de-teheran-l-iran-met-en-scene-les-plus-grandes-funerailles-du-siecle-pour-ali-khamenei_246496,https://www.courrierinternational.com/article/vu-de-teheran-l-iran-met-en-scene-les-plus-grandes-funerailles-du-siecle-pour-ali-khamenei_246496,0,www.courrierinternational.com,L’Iran met en scène les “plus grandes funérailles du siècle” pour Ali Khamenei,"Le cercueil de l’ancien guide suprême iranien, tué le 28 février par des frappes américano-israéliennes, est exposé depuis vendredi 3 juin à Téhéran avant d’être transporté dans les hauts lieux du chiisme, jusqu’en Irak. Le régime présente cet hommage nationa…",https://focus.courrierinternational.com/2026/07/03/0/0/5500/3666/1200/630/60/0/b80849b_ftp-1-k5sxughhnl9x-2026-07-03t035610z-1434491002-rc236ma3pq26-rtrmadp-3-iran-crisis-khamenei.JPG,2026-07-03T12:51:28Z,,"La République islamique dIran lance samedi 4 juillet les funérailles de lancien guide suprême, layatollah Ali Khamenei, tué le 28 février dernier au premier jour de la dernière guerre lancée par les … [+1083 chars]",,fr,'Ali Khamenei'
https://www.20minutes.fr/diaporama/diaporama-4232607-images-bad-bunny-david-beckham-kate-middleton-stars-assurent-show-tribunes-wimbledon,https://www.20minutes.fr/diaporama/diaporama-4232607-images-bad-bunny-david-beckham-kate-middleton-stars-assurent-show-tribunes-wimbledon,0,www.20minutes.fr,"EN IMAGES Bad Bunny, David Beckham, Kate Middleton… Les stars assurent le show en tribunes à Wimbledon","Djokovic, Sinner, et Gauff ont réussi leur entrée sur le gazon sacré de Wimbledon, pour le plus grand plaisir des stars venues en masse en tribunes",https://img.20mn.fr/VN1YHuxSQvqYnCNoYAjQVCk/1444x920_catherine-princesse-de-galles-est-apparue-radieuse-et-decontractee-a-wimbledon-au-cote-de-sir-andy-murray,2026-07-03T13:28:45Z,http://web.archive.org/web/20260704023848/https://www.20minutes.fr/diaporama/diaporama-4232607-images-bad-bunny-david-beckham-kate-middleton-stars-assurent-show-tribunes-wimbledon,"Christelle Pellissier
Publié le 03/07/2026 à 15h28
Quand il ny en a plus, il y en a encore. Après Roland-Garros et sa flopée de stars françaises (et pas que) venue applaudir les mastodontes du tenn… [+6073 chars]",,fr,'Bad Bunny'
https://www.20minutes.fr/monde/russie/4232710-20260703-guerre-iran-envoye-poutine-ex-president-russe-medvedev-recueille-devant-depouille-khamenei,https://www.20minutes.fr/monde/russie/4232710-20260703-guerre-iran-envoye-poutine-ex-president-russe-medvedev-recueille-devant-depouille-khamenei,0,www.20minutes.fr,"Guerre en Iran : Envoyé par Poutine, l’ex-président russe Medvedev se recueille devant la dépouille de Khamenei","L’ex-président russe Medvedev est présent en Iran pour les hommages à l’ayatollah Khamenei, tué par Israël et l’Etats-Unis au début de la guerre",https://img.20mn.fr/slHb303mS0-fq1OqBCcCqSk/1444x920_cette-photographie-fournie-par-le-bureau-du-guide-supreme-iranien-khamenei-ir-montre-le-chef-des-gardiens-de-la-revolution-iraniens-ahmad-vahidi-c-rendant-hommage-au-cercueil-du-guide-supreme-iranien-ali-khamenei-lors-d-une-ceremonie-precedant-ses-funerailles-a-teheran-le-3-juillet-2026-vahidi-a-rendu-hommage-a-teheran-devant-le-corps-d-ali-khamenei-sa-premiere-apparition-publique-depuis-le-debut-de-la-guerre-au-moyen-orient-selon-des-images-diffusees-le-3-juillet-par-les-medias-iraniens-photo-de-khamenei-ir-afp,2026-07-03T14:27:21Z,,"Lancien président russe Dimitri Medvedev, dont le pays entretient des liens étroits avec lIran, sest rendu vendredi à Téhéran devant le cercueil dAli Khamenei, selon des images de la télévision dEtat… [+945 chars]",,fr,'Ali Khamenei'
