index,url,valid,domain,title,description,image,published,archive,content,quote,language,keyword
https://www.courrierinternational.com/article/opinion-vladimir-poutine-a-un-probleme-le-mythe-du-bon-tsar-s-erode_243316,https://www.courrierinternational.com/article/opinion-vladimir-poutine-a-un-probleme-le-mythe-du-bon-tsar-s-erode_243316,0,www.courrierinternational.com,"Vladimir Poutine a un problĂ¨me, le mythe du âbon tsarâ sâĂŠrode","Internet restreint, inondations au Daghestan, troupeaux abattus en SibĂŠrieâŚ Dans une vidĂŠo adressĂŠe Ă  Vladimir Poutine, lâinfluenceuse Viktoria Bonya a surpris en ĂŠnumĂŠrant les motifs du mĂŠcontentement croissant dans le pays. Largement commentĂŠ, ce message ilâŚ",https://focus.courrierinternational.com/2026/04/23/0/0/2800/1866/1200/630/60/0/8635f94_upload-1-iwb0uglbq0zz-000-a8hx6f4.jpg,2026-05-01T03:00:10Z,http://web.archive.org/web/20260501152416/https://www.courrierinternational.com/article/opinion-vladimir-poutine-a-un-probleme-le-mythe-du-bon-tsar-s-erode_243316,"Pendant que les prises de bec entre les influenceurs russes et les propagandistes de la tĂŠlĂŠvision dĂtat retiennent lattention du public [dans le sillage de Viktoria Bonya, plusieurs personnalitĂŠs deâŚ [+5231 chars]",,fr,'Vladimir Poutine'
https://www.bfmtv.com/politique/1er-mai-manifestations-discours-politiques-securite-a-quoi-s-attendre-pour-cette-journee-de-mobilisation_AN-202605010112.html,https://www.bfmtv.com/politique/1er-mai-manifestations-discours-politiques-securite-a-quoi-s-attendre-pour-cette-journee-de-mobilisation_AN-202605010112.html,0,www.bfmtv.com,"1er-Mai: manifestations, discours politiques, sĂŠcuritĂŠ... Ă quoi s'attendre pour cette journĂŠe de mobilisation?","Le Rassemblement national en rĂŠgion, Olivier Faure du cĂ´tĂŠ d'Amiens, Jean-Luc MĂŠlenchon prĂŠsent Ă  la traditionnelle manifestation parisienne... Une nouvelle fois encore, la FĂŞte du Travail de ce vendredi 1er mai sera placĂŠe sous le signe du pouvoir d'achat, dâŚ",https://images.bfmtv.com/gQg8es1ANvtUYV0292ecUyX8TeM=/0x106:2048x1258/2048x0/images/La-manifestation-du-1er-Mai-a-Paris-pres-de-la-place-de-la-Republique-2075018.jpg,2026-05-01T04:16:48Z,,"Le Rassemblement national en rĂŠgion, Olivier Faure du cĂ´tĂŠ d'Amiens, Jean-Luc MĂŠlenchon prĂŠsent Ă  la traditionnelle manifestation parisienne... Une nouvelle fois encore, la FĂŞte du Travail de ce vendâŚ [+4675 chars]",,fr,'Olivier Faure'
https://atlantico.fr/article/decryptage/bardella-attal-le-syndrome-des-coucous-rassemblement-national-en-marche-renaissance-Macron-Le-Pen-dauphins-heritage-Jean-Yves-Camus,https://atlantico.fr/article/decryptage/bardella-attal-le-syndrome-des-coucous-rassemblement-national-en-marche-renaissance-Macron-Le-Pen-dauphins-heritage-Jean-Yves-Camus,0,atlantico.fr,Bardella / Attal : le syndrome des coucous ?,"AdoubĂŠs ou propulsĂŠs par leurs mentors, Jordan Bardella et Gabriel Attal incarnent une nouvelle gĂŠnĂŠration politique, entre dĂŠpendance fondatrice et volontĂŠ dâĂŠmancipation. DerriĂ¨re la mĂŠtaphore du ÂŤ coucou Âť, se dessinent des trajectoires contrastĂŠes, rĂŠvĂŠlaâŚ",https://atlantico.codexcdn.net/assets/asaKbuvINmK14YFD5.jpg?width=700&height=500&quality=75,2026-05-01T07:37:00Z,,"AdoubĂŠs ou propulsĂŠs par leurs mentors, Jordan Bardella et Gabriel Attal incarnent une nouvelle gĂŠnĂŠration politique, entre dĂŠpendance fondatrice et volontĂŠ dĂŠmancipation. DerriĂ¨re la mĂŠtaphore du ÂŤ âŚ [+194 chars]",,fr,'Jordan Bardella'
https://www.challenges.fr/politique/christine-lagarde-en-tete-des-femmes-pour-2027-manuel-valls-hesite-a-se-lancer-les-indiscretions-politiques-de-challenges_643101,https://www.challenges.fr/politique/christine-lagarde-en-tete-des-femmes-pour-2027-manuel-valls-hesite-a-se-lancer-les-indiscretions-politiques-de-challenges_643101,0,www.challenges.fr,"Christine Lagarde en tĂŞte des femmes pour 2027, Manuel Valls hĂŠsite Ă  se lancerâŚ les indiscrĂŠtions politiques de Challenges","Dans les indiscrĂŠtions politiques de Challenges cette semaineÂ : FranĂ§ois Ruffin, prĂŠsident payĂŠ au Smic ? Une idĂŠe qui fait sourire FranĂ§ois Hollande. Ou encore SĂŠbastien Lecornu qualifiĂŠ de ÂŤÂ scribeÂ Âť dâOlivier Faure sur le budget.",https://www.challenges.fr/_ipx/f_jpg&enlarge_true&s_1200x630/cha/static/2026-05/54533.HR_0.jpeg%3FVersionId=FaeAMza.zQw6grd3bQNyo_MPRv8vsdz4,2026-05-01T09:00:00Z,,"BardĂŠ de ses diplĂ´mes (HEC, Sciences-Po, ENA) et de son expĂŠrience de terrain dans sa circonscription de lEure, le dĂŠputĂŠ PS Philippe Brun est fort impatient. A un an de lĂŠlection prĂŠsidentielle, il âŚ [+3023 chars]",,fr,'Christine Lagarde'
https://www.20minutes.fr/monde/4221380-20260501-tirs-gala-washington-nouvelle-video-attaque-contre-donald-trump-devoilee,https://www.20minutes.fr/monde/4221380-20260501-tirs-gala-washington-nouvelle-video-attaque-contre-donald-trump-devoilee,0,www.20minutes.fr,Tirs au gala de WashingtonÂ : Une nouvelle vidĂŠo de lâattaque contre Donald Trump dĂŠvoilĂŠe,"La procureure fĂŠdĂŠrale de Washington a dĂŠvoilĂŠ jeudi sur X une vidĂŠo du suspect, armĂŠ dâun fusil de chasse, se ruant Ă  travers un portique de sĂŠcuritĂŠ Ă  lâhĂ´tel Hilton le soir de lâattaque contre le gala de la presse",https://img.20mn.fr/gr0-Xwg_Seidteeqpsn7GCk/1444x920_des-images-de-videosurveillance-diffusees-par-les-procureurs-montrent-que-le-tireur-cole-tomas-allen-a-fait-irruption-par-la-porte-de-l-hotel-washington-hilton-et-a-franchi-un-poste-de-controle-de-securite-en-seulement-quatre-secondes-alors-que-le-president-americain-donald-trump-assistait-a-un-gala-de-presse-le-samedi-25-avril-2026-photo-publiee-par-news-com-eye-press127192-epn-newscom-sipa-2605010904,2026-05-01T09:43:37Z,,"De nouveaux ĂŠlĂŠments dans lenquĂŞte sur lattaque du gala de la presse Ă  Washington, le 25Â avril dernier. Une nouvelle vidĂŠo a ĂŠtĂŠ dĂŠvoilĂŠe jeudi par la procureure fĂŠdĂŠrale de Washington, montrant lhomâŚ [+1606 chars]",,fr,'Donald Trump'
https://www.bfmtv.com/international/moyen-orient/guerre-au-moyen-orient-face-au-risque-extremement-eleve-d-escalade-jean-noel-barrot-appelle-a-ce-que-des-negociations-s-engagent_AV-202605010387.html,https://www.bfmtv.com/international/moyen-orient/guerre-au-moyen-orient-face-au-risque-extremement-eleve-d-escalade-jean-noel-barrot-appelle-a-ce-que-des-negociations-s-engagent_AV-202605010387.html,0,www.bfmtv.com,"Guerre au Moyen-Orient: face au risque ""extrĂŞmement ĂŠlevĂŠ"" d'escalade, Jean-NoĂŤl Barrot appelle Ă  ce que ""des nĂŠgociations s'engagent""","En dĂŠplacement aux Ămirats arabes unis ce vendredi 1er mai, Jean-NoĂŤl Barrot a appelĂŠ sur BFMTV Ă  ce que ""des nĂŠgociations s'engagent"" en vue d'une reprise du trafic dans le dĂŠtroit d'Ormuz et Ă  l'apaisement des tensions face au risque ""extrĂŞmement ĂŠlevĂŠ"" d'eâŚ",https://images.bfmtv.com/Eaft2_1isMCDYV3KqCa7xXSLqvE=/0x0:1920x1080/1920x0/images/Jean-Noel-Barrot-2279274.jpg,2026-05-01T10:55:23Z,,"En dĂŠplacement aux Ămirats arabes unis ce vendredi 1er mai, Jean-NoĂŤl Barrot a appelĂŠ sur BFMTV Ă  ce que ""des nĂŠgociations s'engagent"" en vue d'une reprise du trafic dans le dĂŠtroit d'Ormuz et Ă  l'apâŚ [+2300 chars]",,fr,'Donald Trump'
https://www.franceinfo.fr/politique/ps/1er-mai-olivier-faure-enfarine-lors-de-la-manifestation-a-amiens_7976603.html,https://www.franceinfo.fr/politique/ps/1er-mai-olivier-faure-enfarine-lors-de-la-manifestation-a-amiens_7976603.html,0,www.franceinfo.fr,1er-Mai : Olivier Faure enfarinĂŠ lors de la manifestation Ă  Amiens,"Le premier secrĂŠtaire du PS dĂŠfilait notamment aux cĂ´tĂŠs du nouveau maire socialiste d'Amiens, FrĂŠdĂŠric Fauvet.",https://www.franceinfo.fr/pictures/bmq52_6abppZ7mMcMbmfdYVICPs/0x6:1178x669/1500x843/2026/05/01/69f488203e98e631996880.jpg,2026-05-01T11:02:48Z,,"Le premier secrĂŠtaire du PS dĂŠfilait notamment aux cĂ´tĂŠs du nouveau maire socialiste d'Amiens, FrĂŠdĂŠric Fauvet.
lire plus tard
:
Fermer la fenĂŞtre de prĂŠsentation
commenter
Le patron du PS, OlivâŚ [+367 chars]",,fr,'Olivier Faure'
https://www.journaldugeek.com/2026/05/01/ou-est-ce-que-lhistoire-du-jeu-007-first-light-sinscrit-dans-lunivers-des-films-james-bond/,https://www.journaldugeek.com/2026/05/01/ou-est-ce-que-lhistoire-du-jeu-007-first-light-sinscrit-dans-lunivers-des-films-james-bond/,0,www.journaldugeek.com,OĂš est-ce que lâhistoire du jeu 007 First Light sâinscrit dans lâunivers des films James BondÂ ?,"Câest une question lĂŠgitime. CensĂŠ raconter les dĂŠbuts dâagent secret de James Bond, 007 First Light va ĂŠgalement sâappuyer sur les productions existantes, afin dâoffrir un jeu inĂŠdit oui mais dans un univers mondialement connu. Le jeu dâIO Interactive imposeâŚ",https://www.journaldugeek.com/app/uploads/2025/09/007-first-light-image-principale-1600x900.jpg,2026-05-01T11:11:00Z,,"Vingt-cinq films. Cela fait un sacrĂŠ marathon. Et mĂŞme si James Bond est un personnage unanimement connu et respectĂŠ dans lunivers de la pop culture, toutes ses aventures ne sont pas incroyables ni mâŚ [+3513 chars]",,fr,'Daniel Craig'
https://www.lavenir.net/actu/belgique/2026/05/01/frank-vandenbroucke-sen-prend-a-donald-trump-un-adversaire-de-leurope-SJC2XMZRTNGIPNKSOPTLEK5JBY/,https://www.lavenir.net/actu/belgique/2026/05/01/frank-vandenbroucke-sen-prend-a-donald-trump-un-adversaire-de-leurope-SJC2XMZRTNGIPNKSOPTLEK5JBY/,0,www.lavenir.net,"Frank Vandenbroucke s'en prend Ă  Donald Trump: ""Un adversaire de l'Europe""","Le ministre fĂŠdĂŠral de la SantĂŠ Frank Vandenbroucke (Vooruit) s'en est pris vendredi au prĂŠsident amĂŠricain Donald Trump qu'il a qualifiĂŠ d'""adversaire de l'Europe"". ...",https://www.lavenir.net/resizer/v2/VPQMUHEEWBGKDPMMIJW5NCTN74.jpg?auth=651a3128b6bae9bffa924055844c8c43c5b76bb45fe5f005278220f1877e74cf&width=1200&height=630&quality=85&focal=2000%2C1500,2026-05-01T12:04:45Z,,"Devant quelque 500 sympathisants rassemblĂŠs sur la place des Martyrs, Ă  Louvain pour le traditionnel dĂŠfilĂŠ du 1er mai, le ministre socialiste flamand est allĂŠ plus loin: ""Il n'est pas simplement un âŚ [+800 chars]",,fr,'Donald Trump'
https://www.lalibre.be/belgique/politique-belge/2026/05/01/frank-vandenbroucke-sen-prend-a-donald-trump-adversaire-de-leurope-YAFRBENWJZFETO4RFI6HD32IJE/,https://www.lalibre.be/belgique/politique-belge/2026/05/01/frank-vandenbroucke-sen-prend-a-donald-trump-adversaire-de-leurope-YAFRBENWJZFETO4RFI6HD32IJE/,0,www.lalibre.be,"Frank Vandenbroucke s'en prend Ă  Donald Trump, ""adversaire de l'Europe""","Le ministre fĂŠdĂŠral de la SantĂŠ Frank Vandenbroucke (Vooruit) s'en est pris vendredi au prĂŠsident amĂŠricain Donald Trump qu'il a qualifiĂŠ d'""adversaire de l'Europe"". ...",https://www.lalibre.be/resizer/v2/VPQMUHEEWBGKDPMMIJW5NCTN74.jpg?auth=651a3128b6bae9bffa924055844c8c43c5b76bb45fe5f005278220f1877e74cf&width=1200&height=630&quality=85&focal=2000%2C1500,2026-05-01T12:05:48Z,,"Devant quelque 500 sympathisants rassemblĂŠs sur la place des Martyrs, Ă  Louvain pour le traditionnel dĂŠfilĂŠ du 1er mai, le ministre socialiste flamand est allĂŠ plus loin: ""Il n'est pas simplement un âŚ [+800 chars]",,fr,'Donald Trump'
https://www.ledauphine.com/politique/2026/05/01/1-sup-er-sup-mai-sebastien-lecornu-et-gabriel-attal-achetent-leur-pain-en-boulangerie,https://www.ledauphine.com/politique/2026/05/01/1-sup-er-sup-mai-sebastien-lecornu-et-gabriel-attal-achetent-leur-pain-en-boulangerie,0,www.ledauphine.com,Politique. 1er-Mai : SĂŠbastien Lecornu et Gabriel Attal achĂ¨tent leur pain en boulangerie,"En plein dĂŠbat sur l'ouverture de commerces de proximitĂŠ le 1er-Mai, le Premier ministre et l'un de ses prĂŠdĂŠcesseurs ont chacun achetĂŠ leur baguette, ce vendredi, sous l'Ĺil des camĂŠras.",https://cdn-s-www.ledauphine.com/images/51C59903-2B64-492A-A845-3F1C1186A411/FB1200/photo-1777637383.jpg,2026-05-01T12:09:00Z,,"Le Premier ministre SĂŠbastien Lecornu a symboliquement achetĂŠ du pain ce vendredi dans une boulangerie de Saint-Julien-Chapteuil, en Haute-Loire. Ă l'invitation de Laurent Wauquiez, dĂŠputĂŠ du dĂŠparteâŚ [+3040 chars]",,fr,'SĂŠbastien Lecornu'
https://www.franceinfo.fr/monde/usa/presidentielle/donald-trump/donald-trump-n-a-pas-envie-d-avoir-l-air-de-peser-10-kilos-de-plus-avec-un-gilet-pare-balles_7976651.html,https://www.franceinfo.fr/monde/usa/presidentielle/donald-trump/donald-trump-n-a-pas-envie-d-avoir-l-air-de-peser-10-kilos-de-plus-avec-un-gilet-pare-balles_7976651.html,0,www.franceinfo.fr,"Donald Trump n'a ""pas envie d'avoir l'air de peser 10 kilos de plus"" avec un gilet pare-balles","Une journaliste l'interrogeait sur son souhait de porter ou non cette protection, cinq jours aprĂ¨s avoir ĂŠchappĂŠ Ă  une nouvelle tentative d'assassinat.",https://www.franceinfo.fr/pictures/rGRGe4wJo7NgmDpK0oJZ1qH-e6M/0x0:1024x576/1500x843/2026/05/01/69f49909becc8314073966.jpg,2026-05-01T12:14:55Z,,"Donald Trump n'est pas trĂ¨s partant pour porter un gilet pare-balles, qui risquerait de nuire Ă  sa silhouette, a confiĂŠ jeudi 30 avril le prĂŠsident amĂŠricain, cinq jours aprĂ¨s avoir ĂŠchappĂŠ Ă  une nouâŚ [+986 chars]",,fr,'Donald Trump'
https://www.dhnet.be/actu/belgique/2026/05/01/frank-vandenbroucke-sen-prend-a-donald-au-president-americain-ce-modele-doit-disparaitre-de-son-chemin-aux-yeux-du-gouvernement-trump-FMUXAEJ7M5FPRKUHSLKZ4SUPNE/,https://www.dhnet.be/actu/belgique/2026/05/01/frank-vandenbroucke-sen-prend-a-donald-au-president-americain-ce-modele-doit-disparaitre-de-son-chemin-aux-yeux-du-gouvernement-trump-FMUXAEJ7M5FPRKUHSLKZ4SUPNE/,0,www.dhnet.be,"Frank Vandenbroucke s'en prend Ă  Donald au prĂŠsident amĂŠricain: ""Ce modĂ¨le doit disparaĂŽtre de son chemin aux yeux du gouvernement Trump""","Le ministre fĂŠdĂŠral de la SantĂŠ Frank Vandenbroucke (Vooruit) s'en est pris vendredi au prĂŠsident amĂŠricain Donald Trump qu'il a qualifiĂŠ d'""adversaire de l'Europe"". ...",https://www.dhnet.be/resizer/v2/VPQMUHEEWBGKDPMMIJW5NCTN74.jpg?auth=651a3128b6bae9bffa924055844c8c43c5b76bb45fe5f005278220f1877e74cf&width=1200&height=630&quality=85&focal=2000%2C1500,2026-05-01T13:02:47Z,,"Devant quelque 500 sympathisants rassemblĂŠs sur la place des Martyrs, Ă  Louvain pour le traditionnel dĂŠfilĂŠ du 1er mai, le ministre socialiste flamand n'a pas mĂ˘chĂŠ ses mots envers Donald Trump. ""Il âŚ [+840 chars]",,fr,'Donald Trump'
https://iphoneaddict.fr/post/news-427931-remboursement-droits-douane-apple-reinjecter-largent-lindustrie-americaine,https://iphoneaddict.fr/post/news-427931-remboursement-droits-douane-apple-reinjecter-largent-lindustrie-americaine,0,iphoneaddict.fr,Remboursement des droits de douane : Apple va rĂŠinjecter lâargent dans lâindustrie amĂŠricaine,"Apple ne prĂŠsente pas les remboursements liĂŠs aux droits de douane de Donald Trump comme un simple allĂ¨gement de coĂťts. Tim Cook, le patron dâApple, affirme que toute somme rĂŠcupĂŠrĂŠe sera rĂŠinvestie dans lâinnovation et la fabrication avancĂŠe aux Ătats-Unis, âŚ",https://static.iphoneaddict.fr/wp-content/uploads/2026/03/Apple-Store-Logo.jpg,2026-05-01T13:11:01Z,,"Apple ne prĂŠsente pas les remboursements liĂŠs aux droits de douane de Donald Trump comme un simple allĂ¨gement de coĂťts. Tim Cook, le patron dâApple, affirme que toute somme rĂŠcupĂŠrĂŠe sera rĂŠinvestie âŚ [+2000 chars]",,fr,'Donald Trump'
https://www.bfmtv.com/politique/parti-socialiste/1er-mai-olivier-faure-enfarine-a-amiens-lors-de-la-manifestation_AN-202605010507.html,https://www.bfmtv.com/politique/parti-socialiste/1er-mai-olivier-faure-enfarine-a-amiens-lors-de-la-manifestation_AN-202605010507.html,0,www.bfmtv.com,1er-mai: Olivier Faure enfarinĂŠ Ă  Amiens lors de la manifestation,"Le premier secrĂŠtaire du Parti socialiste, Olivier Faure, a ĂŠtĂŠ enfarinĂŠ dans la manifestation du 1er-Mai Ă  Amiens ce vendredi. Il a continuĂŠ sa dĂŠambulation aprĂ¨s l'incident.",https://images.bfmtv.com/6vyMG2gBbKQi_1HyO-mcbkglUvE=/0x107:2048x1259/2048x0/images/Le-premier-secretaire-du-Parti-socialiste-Olivier-Faure-le-20-fevrier-2025-a-Paris-2085913.jpg,2026-05-01T13:31:37Z,http://web.archive.org/web/20260501171205/https://www.bfmtv.com/politique/parti-socialiste/1er-mai-olivier-faure-enfarine-a-amiens-lors-de-la-manifestation_AN-202605010507.html,"Le premier secrĂŠtaire du Parti socialiste, Olivier Faure, a ĂŠtĂŠ enfarinĂŠ dans la manifestation du 1er-Mai Ă  Amiens ce vendredi. Il a continuĂŠ sa dĂŠambulation aprĂ¨s l'incident.
Le premier secrĂŠtaire âŚ [+2516 chars]",,fr,'Olivier Faure'
https://www.nouvelobs.com/social/20260501.OBS114610/1er-mai-le-cortege-parisien-s-est-elance-attal-et-lecornu-a-la-boulangerie-marilyse-leon-denonce-la-politique-spectacle-le-point-sur-la-mobilisation.html,https://www.nouvelobs.com/social/20260501.OBS114610/1er-mai-le-cortege-parisien-s-est-elance-attal-et-lecornu-a-la-boulangerie-marilyse-leon-denonce-la-politique-spectacle-le-point-sur-la-mobilisation.html,0,www.nouvelobs.com,"1er-MaiÂ : le cortĂ¨ge parisien sâest ĂŠlancĂŠ, Attal et Lecornu Ă  la boulangerie, Marilyse LĂŠon dĂŠnonce la ÂŤÂ politique spectacleÂ ÂťâŚ Le point sur la mobilisation","Le cortĂ¨ge de la manifestation du 1er-Mai sâest ĂŠlancĂŠ Ă  Paris ce vendredi en dĂŠbut dâaprĂ¨s-midi. Un peu plus tĂ´t, SĂŠbastien Lecornu et Gabriel Attal se sont rendus dans des commerces plaidant une ouverture en ce jour historiquement fĂŠriĂŠ et chĂ´mĂŠ.",https://focus.nouvelobs.com/2026/05/01/20/0/7596/5064/1200/800/0/0/29e064a_upload-1-amhibelnxser-000-a9ka7q3.jpg,2026-05-01T13:34:23Z,,"Le cortĂ¨ge syndical parisien pour la journĂŠe internationale des droits des travailleurs, le 1er mai 2026.Â JULIE SEBADELHA / AFP
Commenter LireÂ plusÂ tard 
Google ActualitĂŠs
Partager Sabonner 
Le câŚ [+4391 chars]",,fr,'Olivier Faure'
https://www.huffingtonpost.fr/international/video/une-nouvelle-video-montre-comment-cole-allen-l-assaillant-du-gala-de-washington-a-force-la-securite_263294.html,https://www.huffingtonpost.fr/international/video/une-nouvelle-video-montre-comment-cole-allen-l-assaillant-du-gala-de-washington-a-force-la-securite_263294.html,0,www.huffingtonpost.fr,"Une nouvelle vidĂŠo montre comment Cole Allen, lâassaillant du gala de Washington, a forcĂŠ la sĂŠcuritĂŠ","La procureure fĂŠdĂŠrale de Washington a publiĂŠ sur X une vidĂŠo montrant lâhomme suspectĂŠ dâavoir ouvert le feu lors dâun gala avec Donald Trump, en train de courir Ă  travers la sĂŠcuritĂŠ.",https://focus.huffingtonpost.fr/2026/05/01/0/0/1920/1080/1820/1023/75/0/d42cb7d_upload-1-nekv5a9qslq5-2026-04-30t234647z-1-lwd709830042026rp1-rtrwnev-c-7098-usa-trump-dinner-shooting-mp4-00-05-02-09-still001.jpg,2026-05-01T14:21:52Z,,"La lecture de ce contenu est susceptible dentraĂŽner un dĂŠpĂ´t de cookies de la part de lopĂŠrateur tiers qui lhĂŠberge. Compte-tenu des choix que vous avez exprimĂŠs en matiĂ¨re de dĂŠpĂ´t de cookies, nous âŚ [+1612 chars]",,fr,'Donald Trump'
https://www.20minutes.fr/politique/4221401-20260501-fete-1er-mai-premier-secretaire-parti-socialiste-olivier-faure-enfarine-manifestation-amiens,https://www.20minutes.fr/politique/4221401-20260501-fete-1er-mai-premier-secretaire-parti-socialiste-olivier-faure-enfarine-manifestation-amiens,0,www.20minutes.fr,FĂŞte du 1er-maiÂ : Le Premier secrĂŠtaire du Parti socialiste Olivier Faure enfarinĂŠ Ă  la manifestation Ă  Amiens,Le leader du Parti socialiste a ĂŠtĂŠ pris Ă  partie par des militants dâextrĂŞme gauche Ă  la fin de la manifestation du 1er-Mai Ă  Amiens,https://img.20mn.fr/NcE4GJN4T3-NemWjJOwI-Sk/1444x920_le-premier-secretaire-du-parti-socialiste-francais-ps-et-depute-de-socialistes-et-apparentes-olivier-faure-c-s-entretient-avec-des-representants-syndicaux-lors-d-un-rassemblement-de-la-fete-du-travail-a-l-occasion-de-la-journee-internationale-des-travailleurs-a-amiens-dans-le-nord-de-la-france-le-1er-mai-2026-photo-de-francois-lo-presti-afp,2026-05-01T14:49:27Z,http://web.archive.org/web/20260501151524/https://www.20minutes.fr/politique/4221401-20260501-fete-1er-mai-premier-secretaire-parti-socialiste-olivier-faure-enfarine-manifestation-amiens,Il ne devait pas sattendre Ă  toucher le sujet du travail des boulangers le 1er-Mai de si prĂ¨s. PrĂŠsent Ă  Amiens (Somme) Ă  loccasion de la journĂŠe internationale des droits des travailleuses et travaiâŚ [+1389 chars],,fr,'Olivier Faure'
https://www.bfmtv.com/international/moyen-orient/iran/l-iran-fait-une-nouvelle-offre-aux-etats-unis-via-le-pakistan-pour-reprendre-les-negociations_AN-202605010544.html,https://www.bfmtv.com/international/moyen-orient/iran/l-iran-fait-une-nouvelle-offre-aux-etats-unis-via-le-pakistan-pour-reprendre-les-negociations_AN-202605010544.html,0,www.bfmtv.com,L'Iran fait une nouvelle offre aux Ătats-Unis via le Pakistan pour reprendre les nĂŠgociations,L'agence officielle iranienne Irna a annoncĂŠ ce vendredi que l'Iran a prĂŠsentĂŠ une nouvelle offre Ă  Donald Trump. Leur proposition a ĂŠtĂŠ transmise au Pakistan.,https://images.bfmtv.com/Qx4dV95aoewDytOA1QtiEhW8u2Y=/0x106:2048x1258/2048x0/images/Mojtaba-Khamenei-2267949.jpg,2026-05-01T15:06:29Z,,"L'agence officielle iranienne Irna a annoncĂŠ ce vendredi que l'Iran a prĂŠsentĂŠ une nouvelle offre Ă  Donald Trump. Leur proposition a ĂŠtĂŠ transmise au Pakistan.
L'Iran a prĂŠsentĂŠ une nouvelle offre eâŚ [+1607 chars]",,fr,'Donald Trump'
https://www.bfmtv.com/politique/marine-le-pen-gabriel-attal-jean-luc-melenchon-les-politiques-a-l-offensive-pour-le-1er-mai_AN-202605010545.html,https://www.bfmtv.com/politique/marine-le-pen-gabriel-attal-jean-luc-melenchon-les-politiques-a-l-offensive-pour-le-1er-mai_AN-202605010545.html,0,www.bfmtv.com,"Marine Le Pen, Gabriel Attal, Jean-Luc MĂŠlenchon... Les politiques Ă  l'offensive pour le 1er-Mai","En parallĂ¨le des manifestations aux quatre coins de l'Hexagone pour le 1er-Mai, les personnalitĂŠs politiques ont pris la parole. Entre deux discours, quelques passes d'armes ont ĂŠtĂŠ enregistrĂŠes.",https://images.bfmtv.com/dsCV4vmsEY0kstnZo71I-Dx0U5U=/112x0:1888x999/1776x0/images/Marine-Le-Pen-Gabriel-Attal-Jean-Luc-Melenchon-Les-politiques-a-l-offensive-pour-le-1er-Mai-2279411.jpg,2026-05-01T15:08:22Z,,"En parallĂ¨le des manifestations aux quatre coins de l'Hexagone pour le 1er-Mai, les personnalitĂŠs politiques ont pris la parole. Entre deux discours, quelques passes d'armes ont ĂŠtĂŠ enregistrĂŠes.
Ă âŚ [+2438 chars]",,fr,'Marine Le Pen'
https://www.lexpress.fr/monde/amerique/en-mer-la-guerre-secrete-de-donald-trump-contre-les-cartels-YZBFK7P5JNFMZFUQKQY4X53KDI/,https://www.lexpress.fr/monde/amerique/en-mer-la-guerre-secrete-de-donald-trump-contre-les-cartels-YZBFK7P5JNFMZFUQKQY4X53KDI/,0,www.lexpress.fr,"En mer, la guerre secrĂ¨te de Donald Trump contre les cartels","LâopĂŠration militaire amĂŠricaine sâintensifie depuis quelques semaines, visant des embarcations suspectĂŠes de trafic. Mais les contours exacts des cibles restent flous.",https://www.lexpress.fr/resizer/v2/TMDJ6G5HO5CWHKAJETLAYKJ6AA.JPG?auth=aa85ee649d639b49e4eb75284bb1ba04106d02556b95a2a9ded53c39b528cbb4&width=1200&height=630&quality=85&smart=true,2026-05-01T15:19:12Z,,Les vidĂŠos granuleuses diffusĂŠes par le Pentagone ne durent qu'une poignĂŠe de secondes. Certaines montrent des embarcations lancĂŠes Ă  pleine vitesse sur leau avant dĂŞtre englouties dans une boule de âŚ [+3718 chars],,fr,'Donald Trump'
https://www.nouvelobs.com/monde/20260501.OBS114615/trump-a-fracasse-la-pierre-angulaire-de-notre-monde-grand-entretien-de-pierre-haski-avec-thierry-breton.html,https://www.nouvelobs.com/monde/20260501.OBS114615/trump-a-fracasse-la-pierre-angulaire-de-notre-monde-grand-entretien-de-pierre-haski-avec-thierry-breton.html,0,www.nouvelobs.com,ÂŤÂ Trump a fracassĂŠ la pierre angulaire de notre mondeÂ Âť : grand entretien de Pierre Haski avec Thierry Breton,"Parce que cet ancien commissaire europĂŠen a contribuĂŠ Ă  rĂŠguler notre espace numĂŠrique, Thierry Breton est aujourdâhui interdit de sĂŠjour aux Etats-Unis. Pierre Haski le reĂ§oit pour une grande conversation sur sa chaĂŽne YouTube, en partenariat avec ÂŤÂ le NouveâŚ",https://focus.nouvelobs.com/2026/05/01/37/0/892/594/1200/800/0/0/0724a6b_upload-1-0lywae1v7ss9-capture-d-e-cran-2026-05-01-a-15-40-22.png,2026-05-01T16:00:02Z,,Le visionnage de cette vidĂŠo est susceptible d'entraĂŽner un dĂŠpĂ´t de cookies de la part de l'opĂŠrateur de la plate-forme vidĂŠo vers laquelle vous serez dirigĂŠ(e). Compte-tenu du refus du dĂŠpĂ´t de cooâŚ [+1610 chars],,fr,'Donald Trump'
