index,url,valid,domain,title,description,image,published,archive,content,quote,language,keyword
https://www.lemonde.fr/disparitions/article/2026/03/01/ali-khamenei-guide-supreme-iranien-et-symbole-du-durcissement-du-pouvoir-est-mort_6668734_3382.html,https://www.lemonde.fr/disparitions/article/2026/03/01/ali-khamenei-guide-supreme-iranien-et-symbole-du-durcissement-du-pouvoir-est-mort_6668734_3382.html,0,www.lemonde.fr,"Ali Khamenei, Guide suprême iranien et symbole du durcissement du pouvoir, est mort","Le successeur de l’ayatollah Khomeyni, en 1989, incarnait la République islamique, décidant de la ligne politique à l’intérieur comme à l’extérieur. Au cours de son règne, et face à l’isolement du pays, il a opté pour un durcissement du régime et la répressio…",https://img.lemde.fr/2026/02/28/443/0/1572/1048/1440/960/60/0/049c7cc_upload-1-dzsfsphpcsg3-rea11333721.jpg,2026-03-01T01:38:45Z,,"Le Guide suprême iranien, layatollah Ali Khamenei, à Téhéran, le 5 juillet 2025. BUREAU DU GUIDE SUPRÊME IRANIEN VIA ZUMA PRESS/REA
Dans le cur le plus secret du sérail iranien, layatollah Ali Khame… [+1263 chars]",,fr,'Ali Khamenei'
https://www.lemonde.fr/international/live/2026/03/01/en-direct-iran-la-mort-du-guide-supreme-ali-khamenei-est-confirmee-par-les-medias-d-etat-iraniens_6668663_3210.html,https://www.lemonde.fr/international/live/2026/03/01/en-direct-iran-la-mort-du-guide-supreme-ali-khamenei-est-confirmee-par-les-medias-d-etat-iraniens_6668663_3210.html,0,www.lemonde.fr,"EN DIRECT, Iran : la mort du Guide suprême, Ali Khamenei, est confirmée par les médias d’Etat iraniens",Le président américain a annoncé que les frappes en Iran continueront « sans interruption tout au long de la semaine ».,https://img.lemde.fr/2026/03/01/463/0/2952/1476/1440/720/60/0/7ec88dc_ftp-1-yx4uxppwhmad-2026-03-01t013845z-1614375372-rc2cvja276tf-rtrmadp-3-iran-crisis-khamenei.JPG,2026-03-01T01:43:16Z,,"Avec la mort annoncée par Donald Trump de layatollah Khamenei, « la République islamique a effectivement pris fin et sera bientôt renvoyée dans les poubelles de lHistoire », a écrit le fils du dernie… [+818 chars]",,fr,'Ali Khamenei'
https://www.lemonde.fr/international/article/2026/03/01/comment-voulez-vous-que-j-examine-mes-patients-dans-le-noir-a-cuba-la-penurie-de-carburant-commande-le-quotidien_6668747_3210.html,https://www.lemonde.fr/international/article/2026/03/01/comment-voulez-vous-que-j-examine-mes-patients-dans-le-noir-a-cuba-la-penurie-de-carburant-commande-le-quotidien_6668747_3210.html,0,www.lemonde.fr,"« Comment voulez-vous que j’examine mes patients dans le noir ? » A Cuba, la pénurie de carburant commande le quotidien","Soumise à un blocus pétrolier par les Etats-Unis et dépendante des importations d’énergie, l’île s’enfonce dans une crise qui touche désormais les services les plus élémentaires. Vendredi, Donald Trump a émis l’hypothèse d’une « prise de contrôle amicale de C…",https://img.lemde.fr/2026/02/27/380/0/5704/3802/1440/960/60/0/2cc9ae6_upload-1-dalyba0gtzhj-ll-cuba-la-havane-80.jpg,2026-03-01T04:45:11Z,,"Un habitant sarrête devant une « mipyme » (boutique privée) éclairée grâce à son générateur, lors dune coupure délectricité à La Havane, le 4 janvier 2026. LUCIEN LUNG/RIVA PRESS POUR « LE MONDE »
D… [+1228 chars]",,fr,'Donald Trump'
https://www.courrierinternational.com/article/moyen-orient-seisme-politique-en-iran-teheran-confirme-la-mort-d-ali-khamenei-dans-des-frappes-israelo-americaines_241161,https://www.courrierinternational.com/article/moyen-orient-seisme-politique-en-iran-teheran-confirme-la-mort-d-ali-khamenei-dans-des-frappes-israelo-americaines_241161,0,www.courrierinternational.com,“Séisme politique” en Iran : Téhéran confirme la mort d’Ali Khamenei dans des frappes israélo-américaines,"Les Gardiens de la Révolution ont promis dimanche “la plus féroce offensive de l’Histoire” contre les Etats-Unis et l’État hébreu, après le décès du guide suprême. Si sa disparition constitue un tournant historique pour le Moyen-Orient, elle ne signifie pas p…",https://focus.courrierinternational.com/2026/03/01/0/0/7936/5290/1200/630/60/0/ff11cbd_ftp-1-xgcf1qvth0nf-afp-99eb296.jpg,2026-03-01T04:49:57Z,,"Il était le visage de la République islamique pendant plus de trois décennies. Son architecte. Le père de lambiguïté nucléaire, des missiles, des milices et de la patience stratégique, soit tout ce q… [+3845 chars]",,fr,'nan Si'
https://www.bfmtv.com/international/moyen-orient/iran/l-iran-confirme-la-mort-du-guide-supreme-ali-khamenei-dans-l-operation-militaire-americano-israelienne_AV-202603010060.html,https://www.bfmtv.com/international/moyen-orient/iran/l-iran-confirme-la-mort-du-guide-supreme-ali-khamenei-dans-l-operation-militaire-americano-israelienne_AV-202603010060.html,0,www.bfmtv.com,L'Iran confirme la mort du guide suprême Ali Khamenei dans l'opération militaire américano-israélienne,"Après l’annonce faite samedi 28 février par Donald Trump, les médias iraniens ont confirmé ce dimanche 1er mars la mort d’Ali Khamenei dans les frappes américano-israéliennes.",https://images.bfmtv.com/3vK7mpT0HUrw0jx8ajuE00IOkFA=/0x212:2048x1364/2048x0/images/L-ayatollah-Khamenei-a-Teheran-le-19-mars-2024-1836446.jpg,2026-03-01T04:52:20Z,,"Après lannonce faite samedi 28 février par Donald Trump, les médias iraniens ont confirmé ce dimanche 1er mars la mort dAli Khamenei dans les frappes américano-israéliennes.
Les Gardiens de la révol… [+488 chars]",,fr,'Donald Trump'
https://www.bfmtv.com/international/moyen-orient/iran/direct-frappes-en-iran-les-gardiens-de-la-revolution-promettent-un-chatiment-severe-aux-meurtriers-du-guide-supreme_LN-202603010061.html,https://www.bfmtv.com/international/moyen-orient/iran/direct-frappes-en-iran-les-gardiens-de-la-revolution-promettent-un-chatiment-severe-aux-meurtriers-du-guide-supreme_LN-202603010061.html,0,www.bfmtv.com,"DIRECT. Frappes en Iran: les Gardiens de la révolution promettent un ""châtiment sévère"" aux ""meurtriers"" du guide suprême","Le guide suprême iranien Ali Khamenei a été tué, samedi 28 février, par des frappes menées dans le pays par les États-Unis et Israël. Téhéran a riposté par des tirs de missiles contre Israël et les États du Golfe. Donald Trump a assuré que les frappes continu…",https://images.bfmtv.com/XmFLKYKP2zJAXGk9aU0pqGZDJrU=/0x106:2048x1258/2048x0/images/Le-guide-supreme-iranien-l-ayatollah-Ali-Khamenei-a-Teheran-le-4-juin-2025-2098626.jpg,2026-03-01T04:59:30Z,,"La transition sera assurée par un triumvirat composé du président iranien, Masoud Pezeshkian, du chef du pouvoir judiciaire en Iran, Gholamhossein Mohseni Ejeï, ainsi que d'un membre du Conseil des g… [+281 chars]",,fr,'Donald Trump'
https://www.20minutes.fr/monde/etats-unis/4203917-20260301-frappes-iran-make-iran-great-again-diaspora-iranienne-los-angeles-fete-mort-khamenei,https://www.20minutes.fr/monde/etats-unis/4203917-20260301-frappes-iran-make-iran-great-again-diaspora-iranienne-los-angeles-fete-mort-khamenei,0,www.20minutes.fr,Frappes en Iran : « Make Iran Great Again »… La diaspora iranienne à Los Angeles fête la mort de Khamenei,Le guide suprême Ali Khamenei est mort dans les frappes menées par Israël et les Etats-Unis de Donald Trump en Iran,https://img.20mn.fr/E9btPEwjRdSAlvxbrwg6iSk/1444x920_los-angeles-february-28-signs-denouncing-iranian-leader-ayatollah-ali-khamenei-are-held-up-as-embers-of-the-iranian-community-and-supporters-celebrate-on-february-28-2026-in-los-angeles-california-president-donald-trump-announced-that-the-united-states-and-israel-had-launched-an-attack-on-iran-saturday-morning-mario-tama-getty-images-afp-photo-by-mario-tama-getty-images-north-america-getty-images-via-afp,2026-03-01T05:16:11Z,http://web.archive.org/web/20260301092509/https://www.20minutes.fr/monde/etats-unis/4203917-20260301-frappes-iran-make-iran-great-again-diaspora-iranienne-los-angeles-fete-mort-khamenei,"Sans surprise, une partie de la diaspora iranienne présente aux Etats-Unis a salué samedi la mort du guide suprême Ali Khamenei. Des danses de joie ont ainsi eu lieu à Los Angeles. Cette mégapole amé… [+2783 chars]",,fr,'Donald Trump'
https://www.bfmtv.com/international/amerique-nord/etats-unis/donald-trump-menace-l-iran-d-une-riposte-militaire-sans-precedent-en-cas-de-represailles-apres-l-attaque-americano-israelienne_AN-202603010078.html,https://www.bfmtv.com/international/amerique-nord/etats-unis/donald-trump-menace-l-iran-d-une-riposte-militaire-sans-precedent-en-cas-de-represailles-apres-l-attaque-americano-israelienne_AN-202603010078.html,0,www.bfmtv.com,"Donald Trump menace l'Iran d'une riposte militaire ""sans précédent"" en cas de représailles après l'attaque américano-israélienne",Le président des États-Unis a prévenu l'Iran ce dimanche 1er mars en cas de riposte à l'attaque américano-israélienne menée samedi et dans laquelle est mort le guide suprême iranien.,https://images.bfmtv.com/7cns3pWSHEDH-09THJcmWovE2gk=/0x0:2048x1152/2048x0/images/Donald-Trump-lors-du-premier-Conseil-de-Paix-a-Washington-le-19-fevrier-2026-2238746.jpg,2026-03-01T05:50:51Z,http://web.archive.org/web/20260301185154/https://www.bfmtv.com/international/amerique-nord/etats-unis/donald-trump-menace-l-iran-d-une-riposte-militaire-sans-precedent-en-cas-de-represailles-apres-l-attaque-americano-israelienne_AN-202603010078.html,"Le président des États-Unis a prévenu l'Iran ce dimanche 1er mars en cas de riposte à l'attaque américano-israélienne menée samedi et dans laquelle est mort le guide suprême iranien.
Le président am… [+565 chars]",,fr,'Donald Trump'
https://www.franceinfo.fr/monde/iran/guerre-entre-les-etats-unis-israel-et-l-iran/nucleaire-missiles-balistiques-repression-sanglante-les-principales-raisons-qui-ont-pousse-les-etats-unis-et-israel-a-attaquer-de-nouveau-l-iran_7836977.html,https://www.franceinfo.fr/monde/iran/guerre-entre-les-etats-unis-israel-et-l-iran/nucleaire-missiles-balistiques-repression-sanglante-les-principales-raisons-qui-ont-pousse-les-etats-unis-et-israel-a-attaquer-de-nouveau-l-iran_7836977.html,0,www.franceinfo.fr,"Nucléaire, missiles balistiques, répression sanglante... Les principales raisons qui ont poussé les Etats-Unis et Israël à attaquer de nouveau l'Iran","""Nous allons détruire leurs missiles et anéantir leur industrie balistique (...) Nous allons anéantir leur marine"", a promis samedi Donald Trump, dévoilant l'objectif de cette opération conjointe avec Israël : ""Eliminer la menace existentielle que fait peser …",https://www.franceinfo.fr/pictures/ilameSYIRraEhyA9kXJj1_6ZHM4/0x758:7290x4857/1500x843/2026/02/28/000-999y46h-69a333684424b951139792.jpg,2026-03-01T06:14:09Z,,"""La paix est à portée de main."" A quelques heures du lancement de l'opération conjointe des Etats-Unis et d'Israël contre l'Iran, le ministre des Affaires étrangères omanais, Badr al-Busaidi, chargé … [+7367 chars]",,fr,'Donald Trump'
https://www.courrierinternational.com/article/idees-la-petromelancolie-ca-suffit-pourquoi-avons-nous-tant-de-mal-a-renoncer-a-l-or-noir_240046,https://www.courrierinternational.com/article/idees-la-petromelancolie-ca-suffit-pourquoi-avons-nous-tant-de-mal-a-renoncer-a-l-or-noir_240046,0,www.courrierinternational.com,"La “pétromélancolie”, ça suffit : pourquoi avons-nous tant de mal à renoncer à l’or noir ?","Avec le retour de Donald Trump à la Maison-Blanche, le pétrole est redevenu un enjeu géopolitique de premier plan. Mais si l’or noir fait de la résistance, c’est aussi parce que les partisans de la transition énergétique ont sous-estimé le poids de l’imaginai…",https://focus.courrierinternational.com/2026/02/13/0/0/2850/1900/1200/630/60/0/6fd1ca3_upload-1-dwsgv6d2qodt-bartkus-slowhand.jpg,2026-03-01T06:15:49Z,,"Quand il a commencé à sen prendre au Venezuela, il parlait encore de drogue [lenlèvement de Nicolás Maduro, dans la nuit du 2 au 3 janvier, a dabord été justifié au nom du narcoterrorisme]. Donald Tr… [+1078 chars]",,fr,'Donald Trump'
https://www.franceinfo.fr/monde/iran/direct-guerre-au-moyen-orient-apres-la-mort-du-guide-ali-khamenei-donald-trump-menace-l-iran-d-une-riposte-sans-precedent-en-cas-de-represailles_7838399.html,https://www.franceinfo.fr/monde/iran/direct-guerre-au-moyen-orient-apres-la-mort-du-guide-ali-khamenei-donald-trump-menace-l-iran-d-une-riposte-sans-precedent-en-cas-de-represailles_7838399.html,0,www.franceinfo.fr,"Guerre au Moyen-Orient : après la mort du guide Ali Khamenei, Donald Trump menace l'Iran d’une riposte ""sans précédent"" en cas de représailles","Le guide suprême iranien Ali Khamenei est mort samedi, a confirmé Téhéran. Mais le conflit dans la région fait toujours rage et des frappes continuent de tomber en Iran et dans la région.",https://www.franceinfo.fr/pictures/6xUDco62QhSAHa8gcByXC1puTq8/0x53:1024x629/1500x843/2026/03/01/000-99eb296-69a3deb5631a9449113735.jpg,2026-03-01T06:37:42Z,,"Au lendemain de la mort du guide suprême iranien Ali Khamenei, tué dans l'attaque israélo-américaine lancée samedi sur l'Iran, le Moyen-Orient continue de s'embraser. Le président américain Donald Tr… [+1160 chars]",,fr,'Donald Trump'
https://www.franceinfo.fr/monde/iran/guerre-entre-les-etats-unis-israel-et-l-iran/apres-la-mort-du-guide-ali-khamenei-dans-les-frappes-israelo-americaines-le-processus-de-transition-en-iran-va-commencer-dimanche_7838420.html,https://www.franceinfo.fr/monde/iran/guerre-entre-les-etats-unis-israel-et-l-iran/apres-la-mort-du-guide-ali-khamenei-dans-les-frappes-israelo-americaines-le-processus-de-transition-en-iran-va-commencer-dimanche_7838420.html,0,www.franceinfo.fr,"Après la mort du guide Ali Khamenei dans les frappes israélo-américaines, le processus de transition en Iran va commencer dimanche","Le président, le chef du pouvoir judiciaire et un juriste du Conseil des gardiens assumeront la responsabilité jusqu'à l'élection du prochain dirigeant.",https://www.franceinfo.fr/pictures/vgaTyIrRNaUrUn_AxuYrPOvY8EY/0x53:1024x629/1500x843/2026/03/01/068-aa-01032026-2675970-69a3e368c2f0e969789422.jpg,2026-03-01T07:00:30Z,http://web.archive.org/web/20260302120950/https://www.franceinfo.fr/monde/iran/guerre-entre-les-etats-unis-israel-et-l-iran/apres-la-mort-du-guide-ali-khamenei-dans-les-frappes-israelo-americaines-le-processus-de-transition-en-iran-va-commencer-dimanche_7838420.html,"Le processus de transition en Iran après la mort du guide suprême Ali Khamenei, tué samedi dans l'attaque israélo-américaine lancée sur l'Iran, va démarrer dimanche 1er mars, a annoncé le principal r… [+1590 chars]",,fr,'Ali Khamenei'
https://www.futura-sciences.com/maison/actualites/architecture-voici-bibliotheques-plus-impressionnantes-jamais-construites-w2t8-131608/,https://www.futura-sciences.com/maison/actualites/architecture-voici-bibliotheques-plus-impressionnantes-jamais-construites-w2t8-131608/,0,www.futura-sciences.com,Voici les bibliothèques les plus impressionnantes jamais construites,"Si vous avez en tête l’image d’une bibliothèque poussiéreuse où les livres sont difficiles d’accès, chassez vite cette idée de votre esprit. Certains édifices sont de véritables bijoux d’architecture, voire d’art, et surtout des lieux uniques dont les murs ra…",https://cdn8.futura-sciences.com/a1280/images/bibliotheque-Chine.png,2026-03-01T07:01:02Z,,Les bibliothèques sont des lieux déjà existants dans l'Antiquité. Elles avaient alors pour objectif de sauvegarder la mémoire des ancêtres. Celle de Rome aurait été la première au monde à être constr… [+4170 chars],,fr,'François Mitterrand'
https://www.lemonde.fr/international/article/2026/03/01/les-etats-unis-et-israel-commettent-un-crime-d-agression-contre-l-iran-juge-matthew-duss-ancien-conseiller-de-bernie-sanders_6668800_3210.html,https://www.lemonde.fr/international/article/2026/03/01/les-etats-unis-et-israel-commettent-un-crime-d-agression-contre-l-iran-juge-matthew-duss-ancien-conseiller-de-bernie-sanders_6668800_3210.html,0,www.lemonde.fr,"Frappes en Iran : les Etats-Unis et Israël commettent « un crime d’agression », juge Matthew Duss, ancien conseiller de Bernie Sanders","Voix influente du camp progressiste, ancien conseiller du sénateur Bernie Sanders, Matthew Duss estime que la direction du Parti démocrate, en matière de politique étrangère, reste prisonnière de schémas anciens, hérités de l’après-guerre froide.",https://img.lemde.fr/2026/02/13/0/58/5380/3587/1440/960/60/0/430716b_ftp-1-forfelvus8sm-2026-02-13t163818z-1700405191-rc24ljazqesh-rtrmadp-3-security-munich.JPG,2026-03-01T07:03:29Z,http://web.archive.org/web/20260301102633/https://www.lemonde.fr/international/article/2026/03/01/les-etats-unis-et-israel-commettent-un-crime-d-agression-contre-l-iran-juge-matthew-duss-ancien-conseiller-de-bernie-sanders_6668800_3210.html,"Aux Etats-Unis, les démocrates sont focalisés sur les questions intérieures. Pourtant, la défaite électorale en 2024 et les embardées de Donald Trump dans le monde les obligent aussi à une réflexion … [+1753 chars]",,fr,'Donald Trump'
https://www.lexpress.fr/monde/proche-moyen-orient/attaque-en-iran-donald-trump-menace-de-frapper-teheran-avec-une-force-jamais-vue-WPG2RWIUOVC2FNRTQO6ONWP6XY/,https://www.lexpress.fr/monde/proche-moyen-orient/attaque-en-iran-donald-trump-menace-de-frapper-teheran-avec-une-force-jamais-vue-WPG2RWIUOVC2FNRTQO6ONWP6XY/,0,www.lexpress.fr,"EN DIRECT. Attaque en Iran : Donald Trump menace de frapper Téhéran ""avec une force jamais vue""","Après la mort du guide suprême Ali Khamenei samedi 28 février, le régime iranien a annoncé que le chef d’état-major de l’armée avait aussi été tué par les frappes israélo-américaines.",https://www.lexpress.fr/resizer/v2/JCPTCMYCE5BHTBTRT6UZBF45DI.JPG?auth=680f78440be96d4f6debde6c7b36c53020ed536be3499c8373dccd0c1744d239&width=1200&height=630&quality=85&focal=3027%2C1543,2026-03-01T07:06:07Z,http://web.archive.org/web/20260301110609/https://www.lexpress.fr/monde/proche-moyen-orient/attaque-en-iran-donald-trump-menace-de-frapper-teheran-avec-une-force-jamais-vue-WPG2RWIUOVC2FNRTQO6ONWP6XY/,"Les médias officiels iraniens ont confirmé ce dimanche 1er mars que l'ayatollah Ali Khamenei avait été tué dans les frappes menées par Israël et les Etats-Unis, tandis que l'armée israélienne a décla… [+2214 chars]",,fr,'Donald Trump'
https://www.mediapart.fr/journal/international/010326/l-iran-confirme-la-mort-de-khamenei-les-frappes-continuent-dans-la-region,https://www.mediapart.fr/journal/international/010326/l-iran-confirme-la-mort-de-khamenei-les-frappes-continuent-dans-la-region,0,www.mediapart.fr,"L’Iran confirme la mort de Khamenei, les frappes continuent dans la région","Téhéran a confirmé dimanche la mort de son Guide suprême Ali Khamenei, tué dans l’opération militaire lancée par les États-Unis et Israël contre l’Iran, lequel a riposté en visant Israël et plusieurs pays arabes. Malgré la joie qui s'exprime en Iran et au sei…",https://static.mediapart.fr/etmagine/og/journal/files/2026/03/01/000-99eb296-2.jpg,2026-03-01T07:09:51Z,,"Les cookies et technologies similaires que nous utilisons sur Mediapart sont de différentes natures et nous permettent de poursuivre différentes finalités. 
Certains sont nécessaires au fonctionneme… [+3291 chars]",,fr,'Ali Khamenei'
https://www.mediapart.fr/journal/international/010326/l-iran-confirme-la-mort-de-khamenei-dans-l-operation-israelo-americaine,https://www.mediapart.fr/journal/international/010326/l-iran-confirme-la-mort-de-khamenei-dans-l-operation-israelo-americaine,0,www.mediapart.fr,L’Iran confirme la mort de Khamenei dans l’opération israélo-américaine,"Téhéran a confirmé dimanche la mort de son guide suprême Ali Khamenei, tué dans l’opération militaire américano-israélienne contre l’Iran, lequel a riposté en visant Israël et plusieurs pays arabes.",https://static.mediapart.fr/etmagine/og/journal/files/2026/03/01/000-99eb296-2.jpg,2026-03-01T07:09:51Z,,"Les cookies et technologies similaires que nous utilisons sur Mediapart sont de différentes natures et nous permettent de poursuivre différentes finalités. 
Certains sont nécessaires au fonctionneme… [+3291 chars]",,fr,'Ali Khamenei'
https://www.bfmtv.com/politique/elections/municipales/nous-ne-partageons-pas-la-vision-de-lfi-sur-le-vivre-ensemble-sur-la-republique-sur-la-laicite-carole-delga-estime-que-toute-alliance-avec-lfi-aux-municipales-serait-un-deshonneur-pour-le-ps_AD-202603010134.html,https://www.bfmtv.com/politique/elections/municipales/nous-ne-partageons-pas-la-vision-de-lfi-sur-le-vivre-ensemble-sur-la-republique-sur-la-laicite-carole-delga-estime-que-toute-alliance-avec-lfi-aux-municipales-serait-un-deshonneur-pour-le-ps_AD-202603010134.html,0,www.bfmtv.com,"""Nous ne partageons pas leur vision sur le vivre-ensemble, sur la République, sur la laïcité..."": Carole Delga estime que toute alliance avec LFI aux municipales serait un ""déshonneur"" pour le PS","La présidente de la région Occitanie tacle le parti de Jean-Luc Mélenchon en assurant ""qu'il faut réparer les injustices en rassemblant, pas en déclamant ou en antagonisant davantage la société"".",https://images.bfmtv.com/3WIJguo7JM_bqz8gTqer7J-vkio=/0x106:2048x1258/2048x0/images/Carole-Delga-president-de-la-region-Occitanie-le-19-janvier-2026-2244028.jpg,2026-03-01T07:59:00Z,http://web.archive.org/web/20260302024604/https://www.bfmtv.com/politique/elections/municipales/nous-ne-partageons-pas-la-vision-de-lfi-sur-le-vivre-ensemble-sur-la-republique-sur-la-laicite-carole-delga-estime-que-toute-alliance-avec-lfi-aux-municipales-serait-un-deshonneur-pour-le-ps_AD-202603010134.html,"La présidente de la région Occitanie tacle le parti de Jean-Luc Mélenchon en assurant ""qu'il faut réparer les injustices en rassemblant, pas en déclamant ou en antagonisant davantage la société"".
La… [+2493 chars]",,fr,'Quentin Deranque'
https://www.sofoot.com/breves/lallemand-thomas-muller-demarre-bien-la-nouvelle-saison-de-mls,https://www.sofoot.com/breves/lallemand-thomas-muller-demarre-bien-la-nouvelle-saison-de-mls,0,www.sofoot.com,L’Allemand Thomas Müller démarre bien la nouvelle saison de MLS,"Nouvelle saison, même passion. La saison de MLS s’est ouverte, les retrouvailles avec les presque retraités aussi. Dans ce rayon,…",https://sofoot.s3.eu-central-1.amazonaws.com/wp-content/uploads/2026/03/01075419/ICONSPORT_360670_1109-1-1400x923.jpg,2026-03-01T08:12:52Z,http://web.archive.org/web/20260302113527/https://www.sofoot.com/breves/lallemand-thomas-muller-demarre-bien-la-nouvelle-saison-de-mls,"Nouvelle saison, même passion. La saison de MLS sest ouverte, les retrouvailles avec les presque retraités aussi. Dans ce rayon, Thomas Müller, qui démarre sa première année complète avec son nouveau… [+481 chars]",,fr,'Thomas Müller'
https://www.slate.fr/monde/affaire-epstein-ghislaine-maxwell-entremetteuses-bill-clinton,https://www.slate.fr/monde/affaire-epstein-ghislaine-maxwell-entremetteuses-bill-clinton,0,www.slate.fr,Comment Ghislaine Maxwell a joué les entremetteuses entre Bill Clinton et Jeffrey Epstein,"Au début des années 2000, l'ex-compagne de Jeffrey Epstein entretenait une relation ambiguë avec Doug Band, un ancien proche conseiller de Bill Clinton.",https://cdn.slate.fr/uploads/store/story_272297/original_272297.jpg,2026-03-01T08:55:02Z,,La récente publication de millions de documents relatifs à l'affaire Epstein par l'administration Trump a de nouveau éclaboussé la famille Clinton. Car si les liens entre l'ancien président des États… [+4330 chars],,fr,'Bill Clinton'
https://www.courrierinternational.com/long-format/dans-nos-archives-ali-khamenei-la-chute-du-maitre-absolu-de-l-iran_232162_2,https://www.courrierinternational.com/long-format/dans-nos-archives-ali-khamenei-la-chute-du-maitre-absolu-de-l-iran_232162_2,0,www.courrierinternational.com,"Ali Khamenei, la chute du maître absolu de l’Iran","Ali Khameini a été tué samedi 28 février par les frappes américano-israéliennes sur l’Iran. C’est la fin d’une ère : le guide suprême iranien, qui a succédé en 1989 à l’ayatollah Khomeyni, avait assis un pouvoir absolu à l’intérieur du pays et dominateur sur …",https://focus.courrierinternational.com/2025/06/18/0/0/3000/2000/1200/630/60/0/f1d266e_upload-1-d64murnuydyl-iran-elect-clerics-2.jpg,2026-03-01T09:01:52Z,,"Ali Khameini a été tué samedi 28 février par les frappes américano-israéliennes sur lIran. Cest la fin dune ère : le guide suprême iranien, qui a succédé en 1989 à layatollah Khomeyni, avait assis un… [+1544 chars]",,fr,'Ali Khamenei'
