index,url,valid,domain,title,description,image,published,archive,content,quote,language,keyword
https://www.franceinfo.fr/faits-divers/police/un-message-via-fr-alert-sera-bientot-envoye-sur-les-telephones-portables-en-cas-d-alerte-enlevement-annonce-gerald-darmanin_7863470.html,https://www.franceinfo.fr/faits-divers/police/un-message-via-fr-alert-sera-bientot-envoye-sur-les-telephones-portables-en-cas-d-alerte-enlevement-annonce-gerald-darmanin_7863470.html,0,www.franceinfo.fr,"Un message via FR-Alert sera bientôt envoyé sur les téléphones portables en cas d'alerte enlèvement, annonce Gérald Darmanin","Le dispositif alerte enlèvement vise à prévenir la population en cas d'enlèvement d'un enfant mineur afin de recueillir des témoignages. Un message est diffusé sur l’ensemble du territoire national dans les médias notamment, et bientôt sur les téléphones port…",https://www.franceinfo.fr/pictures/hhgLT28qM7IK7C_VFfXeB3RyDAU/0x2:1072x605/1500x843/2024/05/14/1200x680-sc-398342724-122157180290010089-8461578110734995035-n-6643083ab09ef649594775.jpg,2026-03-12T16:23:16Z,,"Le dispositif FR-Alert, qui envoie un message ainsi qu'une sonnerie sur les téléphones portables, sera bientôt utilisé à chaque déclenchement dune alerte enlèvement, annonce jeudi 12 mars le ministre… [+1351 chars]",,fr,'Gérald Darmanin'
https://www.courrierinternational.com/article/recapitulatif-guerre-au-moyen-orient-ce-qu-il-faut-retenir-de-la-journee-du-jeudi-12-mars_241697,https://www.courrierinternational.com/article/recapitulatif-guerre-au-moyen-orient-ce-qu-il-faut-retenir-de-la-journee-du-jeudi-12-mars_241697,0,www.courrierinternational.com,Guerre au Moyen-Orient : ce qu’il faut retenir de la journée du jeudi 12 mars,"Le treizième jour du conflit en cours au Moyen-Orient a notamment été marqué par la première déclaration officielle de Mojtaba Khamenei, le nouveau guide suprême de l’Iran. Mais au-delà de cet événement, les combats se poursuivent, et les problèmes liés à la …",https://focus.courrierinternational.com/2026/03/12/0/0/2791/1860/1200/630/60/0/d5bb8b1_ftp-1-rbxlgmfbtzhi-afp-a2zb8wr.jpg,2026-03-12T18:52:14Z,,"<ul><li>Le nouveau Guide suprême, Mojtaba Khamenei, sexprime pour la première fois
</li></ul>Cétait une prise de parole attendue, voire redoutée. Mojtaba Khamenei, le nouveau guide suprême iranien, … [+4165 chars]",,fr,'Mojtaba Khamenei'
https://www.lexpress.fr/monde/proche-moyen-orient/mojtaba-khamenei-son-empire-financier-secret-manoirs-londoniens-comptes-en-suisse-4WC57RJ2RRFINGNX6QLAYKDM4Q/,https://www.lexpress.fr/monde/proche-moyen-orient/mojtaba-khamenei-son-empire-financier-secret-manoirs-londoniens-comptes-en-suisse-4WC57RJ2RRFINGNX6QLAYKDM4Q/,0,www.lexpress.fr,"Mojtaba Khamenei, son empire financier secret : manoirs londoniens, comptes en Suisse...","Le nouveau Guide suprême iranien serait à la tête d'un vaste empire financier et immobilier, selon les révélations de Bloomberg. Une fortune qui contraste avec son image d'homme pieux.",https://www.lexpress.fr/resizer/v2/R6LTNDBIJVHVRLBIN3SIAFFAWA.JPG?auth=8a18b8fe00f6a14a7bb4e12abc9f10ad7c54d203e3547c6040004c8aa7a251a8&width=1200&height=630&quality=85&smart=true,2026-03-12T19:00:37Z,http://web.archive.org/web/20260312232227/https://www.lexpress.fr/monde/proche-moyen-orient/mojtaba-khamenei-son-empire-financier-secret-manoirs-londoniens-comptes-en-suisse-4WC57RJ2RRFINGNX6QLAYKDM4Q/,"L'avenue des millionnaires. C'est ainsi qu'est surnommée l'avenue Bishops, située dans le nord de Londres et desservant un ensemble de manoirs bordés d'arbres et protégés de portails blindés. La dern… [+2860 chars]",,fr,'Mojtaba Khamenei'
https://www.20minutes.fr/societe/4205972-20260312-alertes-enlevement-bientot-envoyees-directement-sms-population,https://www.20minutes.fr/societe/4205972-20260312-alertes-enlevement-bientot-envoyees-directement-sms-population,0,www.20minutes.fr,Les « alertes enlèvement » bientôt envoyées directement par SMS à la population,"Le dispositif Alerte enlèvement va intégrer FR-Alert afin d’envoyer des notifications immédiates sur les téléphones des Français en cas d’enlèvement d’un enfant, a annoncé jeudi Gérald Darmanin",https://img.20mn.fr/Sv3XYoh5QLi2nomZwWdD2ik/1444x920_illustration-du-dispositif-alerte-enlevement-07allilimages-all7638-credit-mourad-allili-sipa-2501211725,2026-03-12T20:21:42Z,http://web.archive.org/web/20260313002013/https://www.20minutes.fr/societe/4205972-20260312-alertes-enlevement-bientot-envoyees-directement-sms-population,"Le dispositif français Alerte enlèvement va évoluer pour diffuser plus rapidement les informations liées aux disparitions denfants. Jeudi, à loccasion du vingtième anniversaire du système, le ministr… [+1706 chars]",,fr,'Gérald Darmanin'
https://www.franceinfo.fr/monde/iran/guerre-entre-les-etats-unis-israel-et-l-iran/israel-dit-etre-en-train-d-ecraser-l-iran-et-le-hezbollah-mojtaba-khamenei-promet-la-vengeance-ce-qu-il-faut-retenir-du-treizieme-jour-du-conflit-au-moyen-orient_7863857.html,https://www.franceinfo.fr/monde/iran/guerre-entre-les-etats-unis-israel-et-l-iran/israel-dit-etre-en-train-d-ecraser-l-iran-et-le-hezbollah-mojtaba-khamenei-promet-la-vengeance-ce-qu-il-faut-retenir-du-treizieme-jour-du-conflit-au-moyen-orient_7863857.html,0,www.franceinfo.fr,"Israël dit être ""en train d'écraser l'Iran et le Hezbollah"", Mojtaba Khamenei promet la ""vengeance""... Ce qu'il faut retenir du treizième jour du conflit au Moyen-Orient","""Il faut aussi continuer à utiliser le levier du blocage du détroit d'Ormuz"", a déclaré le nouveau guide suprême iranien dans sa première déclaration depuis sa nomination, accélérant la flambée des cours du pétrole.",https://www.franceinfo.fr/pictures/A6ZaFkDRHM1nXBnhgGam7KL3x5A/0x510:4901x3267/1500x843/2026/03/11/sipa-ap23020794-000003-69b19983e0521120514104.jpg,2026-03-12T22:47:33Z,,"Au treizième jour de guerre au Moyen-Orient, le nouveau guide suprême iranien, Mojtaba Khamenei, a promis jeudi 12 mars de venger les attaques américaines et israéliennes et de maintenir la pression … [+6658 chars]",,fr,'Ali Larijani'
https://www.lesnumeriques.com/telephone-portable/alerte-enlevement-la-france-veut-mobiliser-75-des-smartphones-pour-retrouver-un-enfant-n252932.html,https://www.lesnumeriques.com/telephone-portable/alerte-enlevement-la-france-veut-mobiliser-75-des-smartphones-pour-retrouver-un-enfant-n252932.html,0,www.lesnumeriques.com,"Actualité : 38 enfants sauvés en 20 ans : et si le prochain témoin clé, c'était votre smartphone ?","Votre téléphone sait déjà vous alerter en cas de tempête ou de risque terroriste. Il saura bientôt le faire quand un enfant disparaît. Le garde des Sceaux Gérald Darmanin a annoncé l'intégration de FR-Alert au dispositif Alerte enlèvement, avec l'ambition de …",https://cdn.lesnumeriques.com/optim/news/25/252932/2bdb4101-alerte-enlevement-la-france-veut-mobiliser-75-des-smartphones-pour-retrouver-un-enfant__1200_678__609-702-5409-3222.jpg,2026-03-13T07:01:00Z,,"Le ministère de la Justice veut toucher 75 % des smartphones en cas d'enlèvement d'enfant grâce à FR-Alert.
© Vadzim Shubich
Le garde des Sceaux Gérald Darmanin a profité de la réunion des acteurs … [+2793 chars]",,fr,'Gérald Darmanin'
https://www.challenges.fr/politique/le-pape-snobe-la-france-les-factures-de-pierre-yves-bournazel-les-indiscretions-politiques-de-challenges_641630,https://www.challenges.fr/politique/le-pape-snobe-la-france-les-factures-de-pierre-yves-bournazel-les-indiscretions-politiques-de-challenges_641630,0,www.challenges.fr,"Le pape snobe la France, les factures de Pierre-Yves Bournazel… les indiscrétions politiques de Challenges","Dans les indiscrétions politiques de Challenges cette semaine, retrouvez aussi David Amiel (Comptes publics) qui entreprend de régulariser les héritages ou encore Raphaël Glucksmann au travail après avoir été mis en difficulté lors d’un débat avec Eric Zemmou…",https://www.challenges.fr/_ipx/f_jpg&enlarge_true&s_1200x630/cha/static/2026-03/51237.HR_0.jpeg%3FVersionId=tdiOTQ3SAl.zKAwoCVZSd0cryt_5Khf7,2026-03-13T09:00:00Z,http://web.archive.org/web/20260313103527/https://www.challenges.fr/politique/le-pape-snobe-la-france-les-factures-de-pierre-yves-bournazel-les-indiscretions-politiques-de-challenges_641630,Dernier espoir de ce proche de Rachida Dati pour voir Pierre-Yves Bournazel se retirer au second tour de lélection municipale parisienne : quEdouard Philippe (Horizons) lui coupe les vivres. « Cest q… [+2266 chars],,fr,'Yves Bournazel'
https://www.journaldugeek.com/2026/03/13/alerte-enlevement-votre-smartphone-va-bientot-sauver-des-vies/,https://www.journaldugeek.com/2026/03/13/alerte-enlevement-votre-smartphone-va-bientot-sauver-des-vies/,0,www.journaldugeek.com,Alerte enlèvement : votre smartphone va bientôt sauver des vies,"À l'occasion des 20 ans du dispositif Alerte enlèvement, le ministre de la Justice Gérald Darmanin a annoncé son intégration au système FR-Alert. Concrètement, votre téléphone va bientôt sonner en cas d'enlèvement dans votre région.",https://www.journaldugeek.com/app/uploads/2026/03/alerte-enlevement-1600x900.jpg,2026-03-13T10:01:06Z,http://web.archive.org/web/20260313132308/https://www.journaldugeek.com/2026/03/13/alerte-enlevement-votre-smartphone-va-bientot-sauver-des-vies/,"Vous connaissez peut-être déjà FR-Alert, ce système qui fait sonner les smartphones même en mode silencieux lors d’une catastrophe naturelle ou d’un attentat. Depuis le 12 mars 2026, le gouvernement … [+2915 chars]",,fr,'Gérald Darmanin'
https://www.franceinfo.fr/faits-divers/mort-de-quentin-militant-identitaire-agresse-a-lyon/je-soutiens-adolf-quentin-deranque-militant-identitaire-tue-a-lyon-affichait-sa-nostalgie-du-nazisme-sur-les-reseaux-sociaux-revele-mediapart_7865207.html,https://www.franceinfo.fr/faits-divers/mort-de-quentin-militant-identitaire-agresse-a-lyon/je-soutiens-adolf-quentin-deranque-militant-identitaire-tue-a-lyon-affichait-sa-nostalgie-du-nazisme-sur-les-reseaux-sociaux-revele-mediapart_7865207.html,0,www.franceinfo.fr,"""Je soutiens Adolf"" : Quentin Deranque, militant identitaire tué à Lyon, affichait sa nostalgie du nazisme sur les réseaux sociaux, révèle Mediapart","Le site d'investigation a exhumé de nombreux messages, publiés sous pseudonyme sur X mais attribués au jeune homme, qui témoignent de ""l'étendue de sa pensée raciste et antisémite"".",https://www.franceinfo.fr/pictures/p-xRZyD2aUiioogmCZYPGL7em0U/0x25:1024x601/1500x843/2026/03/13/080-hl-frosa-3070708-69b3e94be8502577550151.jpg,2026-03-13T11:30:11Z,,"Qui était Quentin Deranque ? Dans une enquête publiée jeudi 12 mars, Mediapart retrace le parcours militant du jeune identitaire de 23 ans, frappé mortellement lors d'une rixe avec des antifascistes … [+4231 chars]",,fr,'Quentin Deranque'
https://www.generation-nt.com/actualites/ormuz-ferme-petrole-explose-2072392,https://www.generation-nt.com/actualites/ormuz-ferme-petrole-explose-2072392,0,www.generation-nt.com,"Tension dans le détroit d'Ormuz : le baril de pétrole à plus de 100 dollars, c'est que le début !","Malgré la libération massive de 400 millions de barils de réserves stratégiques par l'AIE, le prix du pétrole a franchi la barre des 100 dollars. Cette flambée est la conséquence directe de la fermeture du détroit d'Ormuz par l'Iran, sous l'impulsion de son n…",https://img.generation-nt.com/pompe-station-essence_04B002A301686810.webp,2026-03-13T12:10:02Z,,"Suite au déclenchement d'une guerre au Moyen-Orient le 28 février, impliquant une coalition israélo-américaine contre l'Iran, le nouveau guide suprême iranien, Mojtaba Khamenei, a ordonné le blocage … [+4379 chars]",,fr,'Mojtaba Khamenei'
https://www.20minutes.fr/monde/etats-unis/4206081-20260313-guerre-iran-toujours-invisible-guide-supreme-mojtaba-khamenei-probablement-defigure-selon-pentagone,https://www.20minutes.fr/monde/etats-unis/4206081-20260313-guerre-iran-toujours-invisible-guide-supreme-mojtaba-khamenei-probablement-defigure-selon-pentagone,0,www.20minutes.fr,"Guerre en Iran : Toujours invisible, le guide suprême Mojtaba Khamenei est « probablement défiguré », selon le Pentagone","Selon le Pentagone, le nouveau guide suprême Mojtaba Khamenei est « blessé » et « probablement défiguré »",https://img.20mn.fr/M0bpa79rRv21PjLxkrcy2Ck/1444x920_un-musulman-chiite-marche-avec-un-immense-panneau-d-affichage-representant-le-guide-supreme-iranien-l-ayatollah-mojtaba-khamenei-lors-du-rassemblement-annuel-de-la-journee-d-al-qods-pour-montrer-l-importance-de-jerusalem-pour-les-musulmans-et-en-solidarite-avec-les-peuples-palestinien-et-iranien-a-islamabad-au-pakistan-le-vendredi-13-mars-2026-ap-photo-anum-naved-anj101-26072389170523-2603131200,2026-03-13T14:55:58Z,,"Il nest toujours pas apparu en public depuis sa nomination au rang de guide suprême iranien le 8 mars. Caché, Mojtaba Khamenei, qui a pris la succession de son père tué dans des frappes le 28 février… [+1132 chars]",,fr,'Mojtaba Khamenei'
https://www.bfmtv.com/international/amerique-nord/etats-unis/donald-trump/quel-honneur-donald-trump-se-felicite-de-tuer-les-dirigeants-iraniens_AD-202603130680.html,https://www.bfmtv.com/international/amerique-nord/etats-unis/donald-trump/quel-honneur-donald-trump-se-felicite-de-tuer-les-dirigeants-iraniens_AD-202603130680.html,0,www.bfmtv.com,"""Quel honneur!"": Donald Trump se félicite de ""tuer"" les dirigeants iraniens","Ce vendredi 13 mars, le président américain a affirmé, sur son réseau social Truth Social, que les États-Unis étaient en train de ""détruire totalement le régime terroriste iranien, militairement, économiquement et autrement"".",https://images.bfmtv.com/XgbtYLZ2SfXcOOPv98WvEhcO4EU=/0x106:2048x1258/2048x0/images/Donald-Trump-a-la-Maison-Blanche-le-11-mars-2026-2250845.jpg,2026-03-13T15:38:11Z,,"Ce vendredi 13 mars, le président américain a affirmé, sur son réseau social Truth Social, que les États-Unis étaient en train de ""détruire totalement le régime terroriste iranien, militairement, éco… [+1357 chars]",,fr,'Ali Larijani'
https://www.courrierinternational.com/article/vu-d-iran-dans-la-lignee-de-son-pere-mojtaba-khamenei-pret-a-embraser-la-region-pour-sauver-le-regime_241753,https://www.courrierinternational.com/article/vu-d-iran-dans-la-lignee-de-son-pere-mojtaba-khamenei-pret-a-embraser-la-region-pour-sauver-le-regime_241753,0,www.courrierinternational.com,"“Dans la lignée de son père”, Mojtaba Khamenei prêt à “embraser la région” pour sauver le régime","Pour sa première déclaration officielle, le nouveau guide suprême a exprimé sa détermination à poursuivre la guerre contre les États-Unis et Israël en maintenant la pression militaire et économique sur la région.",https://focus.courrierinternational.com/2026/03/13/0/0/3922/2615/1200/630/60/0/619af76_ftp-1-smy82ub4gaz3-afp-a3486fc.jpg,2026-03-13T16:46:42Z,,"Dans son premier message depuis son accession au rang de guide suprême iranien, publié le 12 mars, Mojtaba Khamenei a promis vengeance contre les États-Unis et Israël, salué laction du Hezbollah liba… [+1021 chars]",,fr,'Mojtaba Khamenei'
https://atlantico.fr/article/video/le-guide-supreme-iranien-mojtaba-khamenei-est-blesse-et-probablement-defigure-selon-le-pentagone,https://atlantico.fr/article/video/le-guide-supreme-iranien-mojtaba-khamenei-est-blesse-et-probablement-defigure-selon-le-pentagone,0,atlantico.fr,"Le guide suprême iranien Mojtaba Khamenei est « blessé et probablement défiguré », selon le Pentagone","« Nous savons que le nouveau soi-disant, pas si suprême, leader est blessé et probablement défiguré », a déclaré le secrétaire américain à la Défense Pete Hegseth lors d'un point de presse, en soulignant que le dirigeant iranien n'était pas apparu en personne…",https://atlantico.codexcdn.net/assets/asBP1E3VwoSiCzxxz.png?width=700&height=500&quality=75,2026-03-13T17:11:00Z,,"« Nous savons que le nouveau soi-disant, pas si suprême, leader est blessé et probablement défiguré », a déclaré le secrétaire américain à la Défense Pete Hegseth lors d'un point de presse, en soulig… [+130 chars]",,fr,'nan nan'
https://www.huffingtonpost.fr/international/video/mojtaba-khamenei-defigure-ce-que-l-on-sait-de-l-etat-de-sante-du-guide-supreme-iranien_261442.html,https://www.huffingtonpost.fr/international/video/mojtaba-khamenei-defigure-ce-que-l-on-sait-de-l-etat-de-sante-du-guide-supreme-iranien_261442.html,0,www.huffingtonpost.fr,Mojtaba Khamenei « défiguré » ? Ce que l’on sait de l’état de santé du guide suprême iranien,Le ministre des États-Unis de la défense Pete Hegseth s’est exprimé le 13 mars sur l’état de santé du leader iranien.,https://focus.huffingtonpost.fr/2026/03/13/0/0/1920/1080/1820/1023/75/0/f84ddbb_upload-1-ctsrooziram5-appel.jpg,2026-03-13T18:30:20Z,http://web.archive.org/web/20260315214143/https://www.huffingtonpost.fr/international/video/mojtaba-khamenei-defigure-ce-que-l-on-sait-de-l-etat-de-sante-du-guide-supreme-iranien_261442.html,"La lecture de ce contenu est susceptible dentraîner un dépôt de cookies de la part de lopérateur tiers qui lhéberge. Compte-tenu des choix que vous avez exprimés en matière de dépôt de cookies, nous … [+1936 chars]",,fr,'Mojtaba Khamenei'
https://www.nouvelobs.com/monde/20260313.OBS113168/la-strategie-de-l-iran-ne-vise-pas-a-gagner-la-guerre-mais-a-la-faire-perdre-en-empechant-les-etats-unis-d-atteindre-leurs-objectifs.html,https://www.nouvelobs.com/monde/20260313.OBS113168/la-strategie-de-l-iran-ne-vise-pas-a-gagner-la-guerre-mais-a-la-faire-perdre-en-empechant-les-etats-unis-d-atteindre-leurs-objectifs.html,0,www.nouvelobs.com,« La stratégie de l’Iran ne vise pas à gagner la guerre mais à la faire perdre en empêchant les Etats-Unis d’atteindre leurs objectifs »,"Le nouveau guide suprême iranien, Mojtaba Khamenei, a promis jeudi de venger les attaques américaines et israéliennes et de maintenir la pression sur le détroit d’Ormuz. Le chercheur Guillaume Lasconjarias fait le point sur les capacités militaires du régime …",https://focus.nouvelobs.com/2026/03/13/0/0/8640/5760/1200/800/0/0/bd8105e_upload-1-asccv0bknrqm-sipa-ap23021271-000008.jpg,2026-03-13T18:41:45Z,,"Des officiers du Commandement du Front intérieur israélien inspectent une maison détruite par une frappe de missile iranienne à Zarzir, dans le nord dIsraël, le vendredi 13 mars 2026. ARIEL SCHALIT/A… [+915 chars]",,fr,'Mojtaba Khamenei'
https://www.bfmtv.com/international/moyen-orient/iran/guerre-au-moyen-orient-ce-qu-il-faut-retenir-de-cette-quatorzieme-journee-de-conflit_AD-202603130860.html,https://www.bfmtv.com/international/moyen-orient/iran/guerre-au-moyen-orient-ce-qu-il-faut-retenir-de-cette-quatorzieme-journee-de-conflit_AD-202603130860.html,0,www.bfmtv.com,"Soldat français tué, Donald Trump veut frapper ""très fort"" l'Iran... Ce qu'il faut retenir de cette quatorzième journée de la guerre au Moyen-Orient","Quatorze jours après le début de l'offensive américano-israélienne sur l'Iran, la France et les États-Unis ont notamment annoncé la mort de sept de leurs soldats ou personnels en Irak, tandis que Donald Trump a déclaré les États-Unis frapperont l'Iran ""très f…",https://images.bfmtv.com/gmjypZcxNR2ZFtBqmpV20m9u8iw=/0x106:2048x1258/2048x0/images/Des-soldaits-francais-en-Irak-le-29-fevrier-2024-2251897.jpg,2026-03-13T19:24:14Z,http://web.archive.org/web/20260313233641/https://www.bfmtv.com/international/moyen-orient/iran/guerre-au-moyen-orient-ce-qu-il-faut-retenir-de-cette-quatorzieme-journee-de-conflit_AD-202603130860.html,"Quatorze jours après le début de l'offensive américano-israélienne sur l'Iran, la France et les États-Unis ont notamment annoncé la mort de sept de leurs soldats ou personnels en Irak, tandis que Don… [+3808 chars]",,fr,'Mojtaba Khamenei'
https://www.franceinfo.fr/monde/iran/guerre-entre-les-etats-unis-israel-et-l-iran/les-etats-unis-offrent-une-recompense-de-10-millions-de-dollars-pour-des-informations-sur-les-dirigeants-iraniens_7866203.html,https://www.franceinfo.fr/monde/iran/guerre-entre-les-etats-unis-israel-et-l-iran/les-etats-unis-offrent-une-recompense-de-10-millions-de-dollars-pour-des-informations-sur-les-dirigeants-iraniens_7866203.html,0,www.franceinfo.fr,Les Etats-Unis offrent une récompense de 10 millions de dollars pour des informations sur les dirigeants iraniens,"L'appel à renseignements vise dix personnes, dont le nouveau guide suprême, Mojtaba Khamenei.",https://www.franceinfo.fr/pictures/fYUO0qS9EKSqz9nTk0ARgQhPNhQ/0x0:1024x576/1500x843/2026/03/13/000-a36w8g3-69b4626297865729578611.jpg,2026-03-13T19:27:02Z,,"Les Etats-Unis ont annoncé, vendredi 13 mars, offrir une récompense de 10 millions de dollars pour des informations sur le sort des dirigeants iraniens. L'appel vise aussi bien Mojtaba Khamenei, le n… [+1167 chars]",,fr,'Mojtaba Khamenei'
https://www.franceinfo.fr/faits-divers/mort-de-quentin-militant-identitaire-agresse-a-lyon/yael-braun-pivet-choquee-apres-les-revelations-de-mediapart-sur-les-messages-racistes-attribues-a-quentin-deranque_7866245.html,https://www.franceinfo.fr/faits-divers/mort-de-quentin-militant-identitaire-agresse-a-lyon/yael-braun-pivet-choquee-apres-les-revelations-de-mediapart-sur-les-messages-racistes-attribues-a-quentin-deranque_7866245.html,0,www.franceinfo.fr,"Yaël Braun-Pivet ""choquée"" après les révélations de Mediapart sur les messages racistes attribués à Quentin Deranque","Une minute de silence avait été observée le 17 février à l'Assemblée nationale, cinq jours après l'agression mortelle du militant d'extrême droite lors d'une rixe avec des antifascistes.",https://www.franceinfo.fr/pictures/mZHDHhvJOxpeJzOgeygOmKA7VM4/0x53:1024x629/1500x843/2026/03/13/080-hl-acornu-3064697-69b47255813ae824712531.jpg,2026-03-13T20:25:08Z,,"Yaël Braun-Pivet est ""bien évidemment choquée"" après la révélation par Mediapart de messages racistes ou antisémites écrits par Quentin Deranque, a appris franceinfo vendredi 13 mars auprès de l'ento… [+1773 chars]",,fr,'Quentin Deranque'
https://www.20minutes.fr/monde/etats-unis/4205850-20260314-guerre-iran-course-vitesse-etats-unis-risque-embourber-operation,https://www.20minutes.fr/monde/etats-unis/4205850-20260314-guerre-iran-course-vitesse-etats-unis-risque-embourber-operation,0,www.20minutes.fr,"Guerre en Iran : « C’est une course de vitesse »… Pour les Etats-Unis, le risque de s’embourber dans cette opération","L’Iran est « proche de la défaite », assure Donald Trump. Mais le chaos que sème la guerre au Moyen-Orient pourrait coûter cher à son administration alors que les élections de mi-mandat se profilent",https://img.20mn.fr/mievNSiCTF63SBdeaoyNnSk/1444x920_le-president-americain-donald-j-trump-s-adresse-aux-membres-des-medias-sur-la-pelouse-sud-de-la-maison-blanche-a-washington-dc-etats-unis-avant-d-embarquer-a-bord-de-marine-one-en-route-pour-hebron-dans-le-kentucky-le-mercredi-11-mars-2026-credit-yuri-gripas-pool-via-cnp-581201588-yuri-gripas-pool-via-cnp-dpa-sipa-2603120506,2026-03-14T05:27:40Z,http://web.archive.org/web/20260315015157/https://www.20minutes.fr/monde/etats-unis/4205850-20260314-guerre-iran-course-vitesse-etats-unis-risque-embourber-operation,"«Nous devons finir le boulot, non ? ». Au treizième jour des opérations américano-israéliennes en Iran, Donald Trump multiplie les contradictions. Mercredi, lors dun meeting dans le Kentucky, il a fa… [+4243 chars]",,fr,'Mojtaba Khamenei'
https://www.ledauphine.com/defense-guerre-conflit/2026/03/14/donald-trump-cible-l-ile-de-kharg-teheran-menace-de-repliques,https://www.ledauphine.com/defense-guerre-conflit/2026/03/14/donald-trump-cible-l-ile-de-kharg-teheran-menace-de-repliques,0,www.ledauphine.com,"Guerre au Moyen-Orient. Donald Trump cible l'île de Kharg, Téhéran menace de répliques","Alors que le conflit au Moyen-Orient entre ce samedi dans sa deuxième semaine et que chacun des belligérants ne semble pas relâcher la pression, la France a déploré la perte de l'adjudant-chef Arnaud Frion, tué par une attaque de drones en Irak. Suivez notre …",https://cdn-s-www.ledauphine.com/images/21B9409A-EF17-46FA-A525-E3F4E6CD8947/FB1200/photo-1773442391.jpg,2026-03-14T06:00:00Z,,"Un soldat français mort au Kurdistan irakien. Au lendemain d’une attaque de drones qui a visé des soldats français dans une base en Irak, l’armée a dévoilé le nom de l’un d’eux, mort des suites de se… [+1062 chars]",,fr,'Mojtaba Khamenei'
https://www.lalibre.be/international/2026/03/14/les-americains-peuvent-se-retirer-diran-en-disant-on-arrete-on-a-gagne-mais-cest-peu-probable-3YAGREO4TRBLBFRYVB2PFQEWDA/,https://www.lalibre.be/international/2026/03/14/les-americains-peuvent-se-retirer-diran-en-disant-on-arrete-on-a-gagne-mais-cest-peu-probable-3YAGREO4TRBLBFRYVB2PFQEWDA/,0,www.lalibre.be,"""Les Américains peuvent se retirer d’Iran en disant 'on arrête, on a gagné' mais c’est peu probable""","Rencontre avec le colonel français Peer de Jong, qui revient sur le piège tendu par Téhéran à Washington et Tel Aviv, et les bénéfices colossaux que retire la Russie de cette guerre. ...",https://www.lalibre.be/resizer/v2/XK62RE63V5FMJLFMMMNCRDTA6Y.jpg?auth=490422a19ff91c66f556ec197e50579a70131af332dd9a363d437121bbc9ea34&width=1200&height=630&quality=85&focal=3621%2C2414,2026-03-14T06:01:39Z,,Poutine aide-t-il l'Iran? Donald Trump livre son point de vue lors d'une interviewNous avons rencontré cet expert en géopolitique en marge de la conférence qu'il donnera le jeudi 19 mars à Ellange (L… [+3993 chars],,fr,'Mojtaba Khamenei'
