index,url,valid,domain,title,description,image,published,archive,content,quote,language,keyword
https://www.20minutes.fr/politique/4232899-20260705-presidentielle-2027-vais-battre-paris-edouard-philippe-recherche-second-souffle-face-attal,https://www.20minutes.fr/politique/4232899-20260705-presidentielle-2027-vais-battre-paris-edouard-philippe-recherche-second-souffle-face-attal,0,www.20minutes.fr,"Présidentielle 2027 : « Je vais me battre »… A Paris, Edouard Philippe à la recherche du second souffle (face à Attal)","Concurrencé par Gabriel Attal au centre, le candidat Horizons tenait son premier grand meeting de campagne dimanche après-midi à l’Adidas Arena de Paris",https://img.20mn.fr/KhGkX0uoSM6y73hugMC0nik/1444x920_5-juillet-2026-paris-france-le-president-du-parti-de-droite-francais-horizons-ancien-premier-ministre-et-candidat-a-la-presidentielle-pour-2027-edouard-philippe-lors-de-son-rassemblement-de-campagne-a-l-adidas-arena-le-05-juillet-2026-a-paris-en-france-image-de-credit-matthieu-mirville-zuma-press-wire-20260705-zsp-m308-022-zeus-2607051830,2026-07-05T18:00:03Z,,"A lAdidas Arena de Paris,
On laurait presque oublié, mais Edouard Philippe est candidat à la présidentielle depuis presque deux ans déjà. Lancé très tôt dans la course à lElysée, dès septembre 2024,… [+4533 chars]",,fr,'Gabriel Attal'
https://www.huffingtonpost.fr/politique/article/raphael-glucksmann-n-a-pas-apprecie-que-marine-tondelier-mentionne-son-fils-pour-le-critiquer_284033.html,https://www.huffingtonpost.fr/politique/article/raphael-glucksmann-n-a-pas-apprecie-que-marine-tondelier-mentionne-son-fils-pour-le-critiquer_284033.html,0,www.huffingtonpost.fr,Raphaël Glucksmann n’a pas apprécié que Marine Tondelier mentionne son fils pour le critiquer,Nouvelle illustration ce week-end des tensions au sein de la gauche en vue de l’élection présidentielle de 2027.,https://focus.huffingtonpost.fr/2026/07/05/0/0/8256/4644/1820/1023/75/0/4451e47_upload-1-qpykkhbgj9kl-afp-20250927-76yb76g-v1-highres-francepoliticspartiesleft.jpg,2026-07-05T19:22:56Z,,"Lambiance est toujours loin dêtre au beau fixe à gauche, à lapproche de la présidentielle. Nouvelle illustration ce dimanche 5 juillet avec cette passe darmes entre Marine Tondelier et Raphaël Glucks… [+2313 chars]",,fr,'Jean-Luc Mélenchon'
https://www.bfmtv.com/international/moyen-orient/iran/guerre-en-iran-la-procession-funebre-du-guide-supreme-ali-khamenei-en-cours-a-teheran-suivie-par-une-foule-immense_AD-202607060231.html,https://www.bfmtv.com/international/moyen-orient/iran/guerre-en-iran-la-procession-funebre-du-guide-supreme-ali-khamenei-en-cours-a-teheran-suivie-par-une-foule-immense_AD-202607060231.html,0,www.bfmtv.com,Guerre en Iran: la procession funèbre du guide suprême Ali Khamenei en cours à Téhéran suivie par une foule immense,"Le cortège funèbre de l'ayatollah Ali Khamenei, le guide suprême iranien tué au début de la guerre contre les États-Unis et Israël est suivi ce lundi par une foule immense, selon la télévision d'État Irib.",https://images.bfmtv.com/NuH0-DAPfKBcGOHcNBgSB488Zck=/0x106:2048x1258/2048x0/images/Le-cortege-funebre-d-Ali-Khamenei-le-6-juillet-2026-2315635.jpg,2026-07-06T06:34:41Z,,"Le cortège funèbre de l'ayatollah Ali Khamenei, le guide suprême iranien tué au début de la guerre contre les États-Unis et Israël est suivi ce lundi par une foule immense, selon la télévision d'État… [+2348 chars]",,fr,'Ali Khamenei'
https://atlantico.fr/article/decryptage/edouard-philippe-lascension-par-la-face-lisse-anita-hausser,https://atlantico.fr/article/decryptage/edouard-philippe-lascension-par-la-face-lisse-anita-hausser,0,atlantico.fr,"Edouard Philippe, l’ascension par la face lisse","Edouard Philippe a tenu son premier grand meeting de campagne ce dimanche devant quelque cinq mille personnes réunies à l’Adidas Arena à Paris. Parmi elles, les personnalités ralliées à récemment à sa candidature, - des ministres proches de Gérald Darmanin, m…",https://atlantico.codexcdn.net/assets/asSBYb3Mnzu4lAKce.jpg?width=1600&height=900&quality=75,2026-07-06T08:11:00Z,http://web.archive.org/web/20260706215441/https://atlantico.fr/article/decryptage/edouard-philippe-lascension-par-la-face-lisse-anita-hausser,"Edouard Philippe a tenu son premier grand meeting de campagne ce dimanche devant quelque cinq mille personnes réunies à lAdidas Arena à Paris. Parmi elles, les personnalités ralliées à récemment à sa… [+591 chars]",,fr,'Gabriel Attal'
https://www.mediapart.fr/journal/international/060726/les-funerailles-en-rouge-et-noir-d-ali-khamenei,https://www.mediapart.fr/journal/international/060726/les-funerailles-en-rouge-et-noir-d-ali-khamenei,0,www.mediapart.fr,Les funérailles en rouge et noir d’Ali Khamenei,"Sur les drapeaux, la couleur du deuil et celle de la vengeance : Téhéran s’emploie à transformer les obsèques de l’ancien Guide suprême en acte politique. Mais lundi, au troisième des six jours de funérailles, son fils et successeur, Mojtaba Khamenei, ne s’y …",https://static.mediapart.fr/etmagine/og/journal/files/2026/07/06/260706-img-funerailles-khamenei.jpg,2026-07-06T09:37:07Z,http://web.archive.org/web/20260706124057/https://www.mediapart.fr/journal/international/060726/les-funerailles-en-rouge-et-noir-d-ali-khamenei,"Les cookies et technologies similaires que nous utilisons sur Mediapart sont de différentes natures et nous permettent de poursuivre différentes finalités. 
Certains sont nécessaires au fonctionneme… [+3291 chars]",,fr,'Mojtaba Khamenei'
https://www.dhnet.be/actu/monde/2026/07/06/laisse-mes-fils-en-dehors-ca-clash-entre-raphael-glucksmann-et-marine-tondelier-AD4SMGGIBRCZVCQAXMRDJDBJTA/,https://www.dhnet.be/actu/monde/2026/07/06/laisse-mes-fils-en-dehors-ca-clash-entre-raphael-glucksmann-et-marine-tondelier-AD4SMGGIBRCZVCQAXMRDJDBJTA/,0,www.dhnet.be,”Laisse mes fils en dehors ça” : clash entre Raphaël Glucksmann et Marine Tondelier,Plusieurs candidats de gauche essayent de se frayer un chemin dans le premier tour de l’élection présidentielle. ...,https://www.dhnet.be/resizer/v2/ODRI6FKGONBV3PC5APXWW2OGJQ.jpg?auth=62e848565dda227db8e03981da2647676f0f39e88725a799cb95489e31bce085&width=1200&height=630&quality=85&focal=4096%2C2731,2026-07-06T10:07:49Z,http://web.archive.org/web/20260706120240/https://www.dhnet.be/actu/monde/2026/07/06/laisse-mes-fils-en-dehors-ca-clash-entre-raphael-glucksmann-et-marine-tondelier-AD4SMGGIBRCZVCQAXMRDJDBJTA/,"Dernièrement, Glucksmann avait déclaré que son parti ne ferait pas alliance avec la France Insoumise. Intervenant au Festival des idées de La Charité-sur-Loire dans la Nièvre, la secrétaire nationale… [+1424 chars]",,fr,'Marine Tondelier'
https://www.lalibre.be/international/europe/elections-france/2026/07/06/clash-entre-raphael-glucksmann-et-marine-tondelier-laisse-mes-fils-en-dehors-de-tout-ca-VA6OYMKNLJCQZG2IBOBZZ56T5E/,https://www.lalibre.be/international/europe/elections-france/2026/07/06/clash-entre-raphael-glucksmann-et-marine-tondelier-laisse-mes-fils-en-dehors-de-tout-ca-VA6OYMKNLJCQZG2IBOBZZ56T5E/,0,www.lalibre.be,"Clash entre Raphaël Glucksmann et Marine Tondelier: ""Laisse mes fils en dehors de tout ça""","À gauche, Marine Tondelier et Raphaël Glucksmann affichent leurs désaccords sur les alliances à envisager avant 2027. ...",https://www.lalibre.be/resizer/v2/ARVMPTUJNJCZJMWQIFKU7NSENE.jpg?auth=480ac8ec59af06edfa22e3f014f3c35892f477888e663e4a2d9d06e13802cf6b&width=1200&height=630&quality=85&focal=3764%2C2509,2026-07-06T10:14:27Z,http://web.archive.org/web/20260706164923/https://www.lalibre.be/international/europe/elections-france/2026/07/06/clash-entre-raphael-glucksmann-et-marine-tondelier-laisse-mes-fils-en-dehors-de-tout-ca-VA6OYMKNLJCQZG2IBOBZZ56T5E/,"Dernièrement, Glucksmann avait déclaré que son parti ne ferait pas alliance avec la France Insoumise. Intervenant au Festival des idées de La Charité-sur-Loire dans la Nièvre, la secrétaire nationale… [+1499 chars]",,fr,'Marine Tondelier'
https://www.franceinfo.fr/monde/iran/reportage-cette-procession-va-briser-le-record-du-monde-d-affluence-a-teheran-des-millions-de-fideles-du-regime-defilent-pour-rendre-hommage-a-khamenei_8095739.html,https://www.franceinfo.fr/monde/iran/reportage-cette-procession-va-briser-le-record-du-monde-d-affluence-a-teheran-des-millions-de-fideles-du-regime-defilent-pour-rendre-hommage-a-khamenei_8095739.html,0,www.franceinfo.fr,"""Cette procession va briser le record du monde d'affluence"" : à Téhéran, des millions de fidèles du régime défilent pour rendre hommage à Khamenei","Quatre mois après la mort de l'ayatollah Ali Khamenei, ses funérailles rassemblent des millions de personnes à Téhéran. Des adeptes du pouvoir venus rendre hommage à l'ayatollah tué par une frappe américaine, et dire leur soutien à son son fils et successeur,…",https://www.franceinfo.fr/pictures/j7n00XNZ-rr7Y1DdmOO5GjhFp1U/0x0:4835x2719/1500x843/2026/07/06/6a4b5a13c65dc203241016.jpg,2026-07-06T11:22:14Z,,"Le recueillement continue devant le cercueil de l'ayatollah Ali Khamenei. Au troisième jour des cérémonies, lundi 6 juillet, organisées à Téhéran en Iran, dignitaires et anonymes se réunissent pour r… [+4690 chars]",,fr,'Ali Khamenei'
https://www.camer.be/93858/5:1/cameroun-jai-vraiment-besoin-de-dos-ngannou-repond-avec-humour-a-la-rumeur-sur-etoo-cameroon.html,https://www.camer.be/93858/5:1/cameroun-jai-vraiment-besoin-de-dos-ngannou-repond-avec-humour-a-la-rumeur-sur-etoo-cameroon.html,0,www.camer.be,:: « J'ai vraiment besoin de dos » : Ngannou répond avec humour à la rumeur sur Eto'o,"Alors qu&#039;une rumeur virale sur les réseaux sociaux prétendait que
Samuel Eto&#039;o serait redevable de 200 millions de FCFA envers Francis
Ngannou, le champion de M...",https://www.camer.be/storage/photos/24/F-nganou.jpg,2026-07-06T14:08:17Z,http://web.archive.org/web/20260706191928/https://www.camer.be/93858/5:1/cameroun-jai-vraiment-besoin-de-dos-ngannou-repond-avec-humour-a-la-rumeur-sur-etoo-cameroon.html,"Alors qu'une rumeur virale sur les réseaux sociaux prétendait que Samuel Eto'o serait redevable de 200 millions de FCFA envers Francis Ngannou, le champion de MMA a préféré répondre avec ironie, décl… [+5600 chars]",,fr,'Francis Ngannou'
https://www.courrierinternational.com/article/vu-d-iran-maree-humaine-a-teheran-en-hommage-a-ali-khamenei-le-monde-stupefie-par-l-amour-pour-le-guide_247141,https://www.courrierinternational.com/article/vu-d-iran-maree-humaine-a-teheran-en-hommage-a-ali-khamenei-le-monde-stupefie-par-l-amour-pour-le-guide_247141,0,www.courrierinternational.com,Marée humaine à Téhéran en hommage à Ali Khamenei : “Le monde stupéfié par l’amour pour le guide”,"Des centaines de milliers de personnes criant vengeance se sont rassemblées dans les rues de la capitale iranienne pour saluer le cortège funèbre du guide suprême, qui a commencé sa procession à travers les villes saintes chiites d’Iran et d’Irak.",https://focus.courrierinternational.com/2026/07/06/0/39/2256/1504/1200/630/60/0/1f9581f_ftp-1-idsf88mgu2q9-2026-07-06t063821z-943998114-rc268ma5xbi7-rtrmadp-3-iran-crisis-khamenei.JPG,2026-07-06T14:23:50Z,,"Les rues de Téhéran étaient noires de monde ce lundi pour saluer le cortège funèbre du guide suprême Ali Khamenei, tué le 28 février par des frappes menées par les États-Unis et Israël, au troisième … [+1061 chars]",,fr,'Ali Khamenei'
https://www.lexpress.fr/monde/proche-moyen-orient/iran-aux-funerailles-dali-khamenei-labsence-de-son-fils-et-successeur-mojtaba-pose-question-2MJJ6FONEJCMDI64RO7UMIEPKA/,https://www.lexpress.fr/monde/proche-moyen-orient/iran-aux-funerailles-dali-khamenei-labsence-de-son-fils-et-successeur-mojtaba-pose-question-2MJJ6FONEJCMDI64RO7UMIEPKA/,0,www.lexpress.fr,"Iran : aux funérailles d'Ali Khamenei, l'absence de son fils et successeur, Mojtaba, pose question","Le nouveau Guide suprême n'est pas réapparu en public depuis l'attaque dans laquelle a succombé son père, et dont il est lui-même ressorti blessé. De quoi laisser planer le doute sur sa capacité à réellement assurer le pouvoir.",https://www.lexpress.fr/resizer/v2/Q6ZFGQ57BNCYFDMGIHOCAWPK64.JPG?auth=6435d74a5f78c3e1c9b9330eebf6e36ba8737e57e83a38434ddec2f4546adbf5&width=1200&height=630&quality=85&focal=2769%2C1558,2026-07-06T14:32:04Z,,"C'est une absence scrutée de près. Tandis que les obsèques du Guide suprême iranien se poursuivent ce lundi 6 juillet à Téhéran, avec un cortège funéraire qui devrait rassembler des dizaines de milli… [+5345 chars]",,fr,'Mojtaba Khamenei'
https://www.courrierinternational.com/article/moyen-orient-au-yemen-les-houthistes-menacent-de-bloquer-le-detroit-de-bab-el-mandeb_247145,https://www.courrierinternational.com/article/moyen-orient-au-yemen-les-houthistes-menacent-de-bloquer-le-detroit-de-bab-el-mandeb_247145,0,www.courrierinternational.com,"Au Yémen, les Houthistes menacent de bloquer le détroit de Bab El-Mandeb","Tout est parti d’un avion qui s’est posé à Sanaa pour amener une délégation houthiste aux funérailles du Guide suprême iranien Ali Khamenei, samedi 4 juillet. Les Saoudiens auraient essayé d’intercepter cet avion, et depuis, les houthistes envoient message su…",https://focus.courrierinternational.com/2026/07/06/0/0/4993/3328/1200/630/60/0/cf62c1a_ftp-1-m1zunvutsvqu-afp-b9dd8nq.jpg,2026-07-06T15:33:19Z,,"Le groupe rebelle yéménite refait en effet parler de lui ces derniers jours. Samedi 4 juillet, ils ont lancé une offensive surprise contre larmée yéménite près de la ville portuaire de Hodeïdah, sur … [+1036 chars]",,fr,'Ali Khamenei'
https://www.courrierinternational.com/article/opinion-les-funerailles-d-ali-khamenei-un-spectacle-qui-revele-la-faiblesse-du-regime-iranien_246944,https://www.courrierinternational.com/article/opinion-les-funerailles-d-ali-khamenei-un-spectacle-qui-revele-la-faiblesse-du-regime-iranien_246944,0,www.courrierinternational.com,"Les funérailles d’Ali Khamenei, un “spectacle” qui révèle la faiblesse du régime iranien","En mettant en scène de vastes obsèques pour l’ancien guide suprême de la République islamique, érigé en martyr, le pouvoir iranien cherche à faire étalage de sa force et sa capacité à mobiliser les foules. Mais, en réalité, écrit une journaliste d’“Iran Inter…",https://focus.courrierinternational.com/2026/07/06/0/0/1828/1219/1200/630/60/0/6b740a4_ftp-1-cvdine0eqmau-2026-07-06t064456z-1721731474-rc268marm7ro-rtrmadp-3-iran-crisis-khamenei.JPG,2026-07-06T15:55:36Z,,Les funérailles dÉtat du guide suprême iranien Ali Khamenei ne sont pas simplement les obsèques dun dirigeant. Cest une volonté de restaurer limage écornée du pouvoir. Le dirigeant de la République i… [+1030 chars],,fr,'Ali Khamenei'
https://www.courrierinternational.com/article/politique-edouard-philippe-se-reve-candidat-utile-et-lance-une-attaque-cinglante-contre-le-rn_247146,https://www.courrierinternational.com/article/politique-edouard-philippe-se-reve-candidat-utile-et-lance-une-attaque-cinglante-contre-le-rn_247146,0,www.courrierinternational.com,Édouard Philippe se rêve “candidat utile” et lance une “attaque cinglante” contre le RN,"Le chef du parti Horizons a mené son premier meeting de campagne, dimanche 5 juillet. En “renvoyant dos à dos” le Rassemblement national et la France insoumise, Édouard Philippe s’est présenté comme seul candidat capable de les battre, observe la presse inter…",https://focus.courrierinternational.com/2026/07/05/0/0/5623/3748/1200/630/60/0/70ce8d2_ftp-1-mrrpcf7bb1pg-afp-b9b64at.jpg,2026-07-06T16:03:42Z,,"Ces jours-ci, les meetings présidentiels senchaînent plus vite que les canicules, constate le quotidien belge Le Soir. Dimanche 5 juillet, cétait au tour dÉdouard Philippe, ancien Premier ministre dE… [+1062 chars]",,fr,'Édouard Philippe'
https://www.nouvelobs.com/politique/20260706.OBS116456/comment-la-motion-de-censure-sur-la-canicule-a-tourne-au-desaveu-pour-olivier-faure-le-chef-devenu-frondeur-du-ps.html,https://www.nouvelobs.com/politique/20260706.OBS116456/comment-la-motion-de-censure-sur-la-canicule-a-tourne-au-desaveu-pour-olivier-faure-le-chef-devenu-frondeur-du-ps.html,0,www.nouvelobs.com,"Comment la motion de censure sur la canicule a tourné au désaveu pour Olivier Faure, le chef devenu frondeur du PS","Le patron des socialistes n’a pas obtenu le soutien de ses députés pour voter avec le reste de la gauche la censure du Premier ministre. Il a toutefois maintenu son vote, s’attirant les foudres de ses opposants internes.",https://focus.nouvelobs.com/2026/07/06/0/0/5616/3744/1200/800/0/0/57c9e19_upload-1-v3qaztn4hy4z-080-hl-xbouzas-3220920.jpg,2026-07-06T17:05:34Z,http://web.archive.org/web/20260710175131/https://www.nouvelobs.com/politique/20260706.OBS116456/comment-la-motion-de-censure-sur-la-canicule-a-tourne-au-desaveu-pour-olivier-faure-le-chef-devenu-frondeur-du-ps.html,"Le patron du Parti socialiste, Olivier Faure, à lAssemblée nationale, à Paris, le 6 juillet 2026. XOSE BOUZAS / HANS LUCAS VIA AFP
Chaque jour qui passe apporte son lot de règlement de compte entre … [+5251 chars]",,fr,'Premier ministre'
https://www.sofoot.com/breves/mondial-2026-paraguay-france-emmanuel-macron-defend-kylian-mbappe-apres-les-attaques-racistes,https://www.sofoot.com/breves/mondial-2026-paraguay-france-emmanuel-macron-defend-kylian-mbappe-apres-les-attaques-racistes,0,www.sofoot.com,Mondial 2026 – Paraguay-France : Emmanuel Macron défend Kylian Mbappé après les attaques racistes,"Après les insultes racistes de la sénatrice paraguayenne Celeste Amarilla à l’encontre de Kylian Mbappé, l’affaire prend une…",https://sofoot.s3.eu-central-1.amazonaws.com/wp-content/uploads/2026/07/06233850/ICONSPORT_168009_1546-1400x933.jpg,2026-07-06T21:56:27Z,http://web.archive.org/web/20260707214323/https://www.sofoot.com/breves/mondial-2026-paraguay-france-emmanuel-macron-defend-kylian-mbappe-apres-les-attaques-racistes,"Après les insultes racistes de la sénatrice paraguayenne Celeste Amarilla à lencontre de Kylian Mbappé, laffaire prend une tournure (géo)politique. Ce lundi soir, lÉlysée a publié un communiqué dans … [+1010 chars]",,fr,'Gabriel Attal'
https://www.20minutes.fr/monde/etats-unis/4233244-20260707-etats-unis-avant-midterms-novembre-trump-mise-peur-grand-mechant-communisme,https://www.20minutes.fr/monde/etats-unis/4233244-20260707-etats-unis-avant-midterms-novembre-trump-mise-peur-grand-mechant-communisme,0,www.20minutes.fr,"Etats-Unis : Avant les midterms de novembre, Trump mise sur la peur du grand méchant communisme","A l’approche des midterms de novembre aux Etats-Unis, Donald Trump remet le communisme au cœur de sa campagne pour attaquer le Parti démocrate. Une stratégie politique déjà utilisée en 2024",https://img.20mn.fr/jMddIBlZSOSx_I5oiIdwwyk/1444x920_le-president-americain-donald-j-trump-prononce-un-discours-sur-les-comptes-trump-lors-d-un-dejeuner-du-rose-garden-club-a-la-maison-blanche-a-washington-dc-etats-unis-le-6-juillet-2026-les-comptes-trump-accordent-aux-enfants-americains-eligibles-nes-entre-2026-et-2028-000-dollars-pour-financer-des-ira-de-demarrage-credit-cnp-ad-media-admedia-adm-070626-trump-accounts248-credit-cnp-ad-media-sipa-2607070012,2026-07-06T22:48:32Z,http://web.archive.org/web/20260706231946/https://www.20minutes.fr/monde/etats-unis/4233244-20260707-etats-unis-avant-midterms-novembre-trump-mise-peur-grand-mechant-communisme,"A quatre mois des élections de mi-mandat américaines de novembre (les midterms), Donald Trump a replacé le communisme au cur de son discours de campagne. Lors dune intervention prononcée vendredi au … [+2656 chars]",,fr,'Donald Trump'
https://basta.media/Presomption-de-legitime-defense-ou-permis-de-tuer-les-arguments-tres-contestables-des-initiateurs-de-la-loi,https://basta.media/Presomption-de-legitime-defense-ou-permis-de-tuer-les-arguments-tres-contestables-des-initiateurs-de-la-loi,0,basta.media,Présomption de légitime défense : les arguments très contestables des initiateurs de la loi,"Les députés débattent de la loi visant à instaurer une présomption de légitime défense. Ses partisans font valoir une supposée hausse des violences graves contre les forces de l'ordre et une « insécurité juridique » de celles-ci. Autant de faux arguments.

-
…",https://basta.media/local/cache-gd2/d9/094d9423b64c23ad9f6408e8e8c3a9.jpg,2026-07-07T08:00:00Z,http://web.archive.org/web/20260711211654/https://basta.media/Presomption-de-legitime-defense-ou-permis-de-tuer-les-arguments-tres-contestables-des-initiateurs-de-la-loi,"La proposition de loi visant à instaurer une « présomption de légitime défense » pour les forces de lordre a été adoptée ce 7 juillet avec le soutien du gouvernement, du RN (Marine Le Pen), dEnsemble… [+11246 chars]",,fr,'Marine Le Pen'
https://www.presse-citron.net/cest-acte-le-gouvernement-demande-a-des-millions-de-francais-de-retourner-en-teletravail-des-maintenant/,https://www.presse-citron.net/cest-acte-le-gouvernement-demande-a-des-millions-de-francais-de-retourner-en-teletravail-des-maintenant/,0,www.presse-citron.net,C’est acté : le gouvernement demande à des millions de Français de retourner en télétravail dès maintenant,Les autorités françaises ont publié une circulaire à ce sujet.,https://www.presse-citron.net/app/uploads/2024/09/pexels-olly-935743-1500x900.jpg,2026-07-07T08:49:33Z,http://web.archive.org/web/20260707132103/https://www.presse-citron.net/cest-acte-le-gouvernement-demande-a-des-millions-de-francais-de-retourner-en-teletravail-des-maintenant/,"Souvenez-vous, en mars 2020 des millions de salariés français sont soudainement passés en télétravail. Si certaines entreprises ont depuis opéré un retour en arrière, le travail à distance reste néan… [+2952 chars]",,fr,'David Amiel'
https://www.huffingtonpost.fr/international/article/midterms-le-democrate-progressiste-graham-platner-accule-apres-une-accusation-de-viol_284928.html,https://www.huffingtonpost.fr/international/article/midterms-le-democrate-progressiste-graham-platner-accule-apres-une-accusation-de-viol_284928.html,0,www.huffingtonpost.fr,Midterms : le démocrate progressiste Graham Platner acculé après une accusation de viol,L’ostréiculteur est candidat pour le Sénat et l’un des espoirs des démocrates pour renverser la majorité républicaine. Une de ses ex-compagnes l’accuse désormais de viol.,https://focus.huffingtonpost.fr/2026/07/07/312/0/6000/3375/1820/1023/75/0/eb659b1_upload-1-4akblkq677j5-afp-20260610-2280200274-v1-highres-mainesenatecandidategrahamplatnerholdshispri.jpg,2026-07-07T10:39:51Z,,À voir aussi sur Le HuffPost La lecture de ce contenu est susceptible dentraîner un dépôt de cookies de la part de lopérateur tiers qui lhéberge. Compte-tenu des choix que vous avez exprimés en matiè… [+6112 chars],,fr,'Graham Platner'
https://www.franceinfo.fr/economie/budget/le-gouvernement-annonce-3-milliards-d-euros-d-economies-supplementaires_8097836.html,https://www.franceinfo.fr/economie/budget/le-gouvernement-annonce-3-milliards-d-euros-d-economies-supplementaires_8097836.html,0,www.franceinfo.fr,Le gouvernement annonce 3 milliards d'euros d'économies supplémentaires,"Le ministre des Comptes publics David Amiel a précisé que ce montant est ""en grande partie lié aux mesures d'aide qui se sont déployées depuis avril dernier"".",https://www.franceinfo.fr/pictures/WMyTV2x2y5kjr-QRZBytWbl3Qh8/0x53:1024x629/1500x843/2026/07/07/6a4cf2d9b2a18003067952.jpg,2026-07-07T12:38:20Z,http://web.archive.org/web/20260707160755/https://www.franceinfo.fr/economie/budget/le-gouvernement-annonce-3-milliards-d-euros-d-economies-supplementaires_8097836.html,"Le gouvernement a annoncé, mardi 7 juillet, 3 milliards d'euros supplémentaires d'économies pour l'Etat et la Sécurité sociale lors du comité d'alerte des finances publiques, a déclaré le ministre de… [+941 chars]",,fr,'David Amiel'
https://www.ledauphine.com/economie/2026/07/07/le-gouvernement-annonce-3-milliards-d-euros-d-economies-supplementaires-pour-l-etat-et-la-secu,https://www.ledauphine.com/economie/2026/07/07/le-gouvernement-annonce-3-milliards-d-euros-d-economies-supplementaires-pour-l-etat-et-la-secu,0,www.ledauphine.com,Economie. Le gouvernement annonce 3 milliards d'euros d'économies supplémentaires pour l'Etat et la Sécu,"Ce total porte à 9 milliards le montant total d'économies annoncées par le gouvernement pour cette année, ou 11 milliards en prenant en compte les 2 milliards de risques identifiés pour les collectivités locales.",https://cdn-s-www.ledauphine.com/images/77998275-7FA0-49BF-B42C-1B114D199890/FB1200/photo-1783429501.jpg,2026-07-07T13:07:00Z,http://web.archive.org/web/20260708025912/https://www.ledauphine.com/economie/2026/07/07/le-gouvernement-annonce-3-milliards-d-euros-d-economies-supplementaires-pour-l-etat-et-la-secu,"Le gouvernement français a annoncé mardi 3 milliards d'euros d'économies supplémentaires pour lEtat et la Sécurité sociale, qui s'ajoutent aux 6 milliards d'euros de coupes déjà présentées en avril, … [+3031 chars]",,fr,'David Amiel'
