index,url,valid,domain,title,description,image,published,archive,content,quote,language,keyword
https://www.huffingtonpost.fr/politique/article/emmanuel-macron-remonte-un-peu-la-pente-de-son-impopularite_261177.html,https://www.huffingtonpost.fr/politique/article/emmanuel-macron-remonte-un-peu-la-pente-de-son-impopularite_261177.html,0,www.huffingtonpost.fr,Emmanuel Macron remonte (un peu) la pente de son impopularité,Le chef de l’État grimpe d’un petit point dans le dernier baromètre réalisé par YouGov pour Le HuffPost. C’est toujours ça de pris.,https://focus.huffingtonpost.fr/2026/03/06/116/0/3498/1967/1820/1023/75/0/8771755_upload-1-lj1x3av6s4bk-afp-20260303-99tg4we-v7-highres-franceiranusisraelpoliticswar.jpg,2026-03-06T17:41:18Z,,"Le tragique de lhistoire la contraint à revêtir ses habits de chef des Armées. Depuis la guerre déclenchée par Israël et les États-Unis contre lIran, Emmanuel Macron multiplie les initiatives pour mo… [+3519 chars]",,fr,'Emmanuel Macron'
https://www.lemonde.fr/societe/article/2026/03/06/mort-de-quentin-deranque-mise-en-examen-des-deux-hommes-interpelles-mercredi_6669818_3224.html,https://www.lemonde.fr/societe/article/2026/03/06/mort-de-quentin-deranque-mise-en-examen-des-deux-hommes-interpelles-mercredi_6669818_3224.html,0,www.lemonde.fr,Mort de Quentin Deranque : mise en examen des deux hommes interpellés mercredi,"Agés de 22 et 26 ans, ils avaient été arrêtés mercredi matin dans la région lyonnaise et dans l’Aube, deux semaines après une première vague de onze interpellations.",https://img.lemde.fr/2026/03/04/0/0/8256/5504/1440/960/60/0/71b8cd7_ftp-1-3xfqw2amargb-5360840-01-06.jpg,2026-03-06T17:44:26Z,,"Deux hommes ont été mis en examen et placés en détention provisoire, a annoncé, vendredi 6 mars, le parquet de Lyon, dans le cadre de lenquête portant sur la mort du militant dextrême droite, Quentin… [+1952 chars]",,fr,'Quentin Deranque'
https://www.20minutes.fr/justice/4204980-20260306-mort-quentin-deranque-deux-nouveaux-suspects-mis-examen-ecroues-lyon,https://www.20minutes.fr/justice/4204980-20260306-mort-quentin-deranque-deux-nouveaux-suspects-mis-examen-ecroues-lyon,0,www.20minutes.fr,Mort de Quentin Deranque : Deux nouveaux suspects mis en examen et écroués à Lyon,Deux nouveaux suspects ont été mis en examen et écroués le 6 mars dans l’enquête sur la mort du militant d’extrême droite,https://img.20mn.fr/KkOlRWjfSdWF0d-uB9fKfCk/1444x920_manifestation-a-la-memoire-de-quentin-deranque-tue-par-des-militants-de-gauche-a-lyon-rome-italie-21-fevrier-2026-agf-editorial-agf7706-credit-francesco-fotia-agf-sipa-2602231044,2026-03-06T18:11:45Z,,"Deux hommes de 22 et 26 ans ont été mis en examen et placés en détention provisoire ce vendredi 6 mars dans lenquête sur la mort de Quentin Deranque, décédé mi-février à Lyon après une violente agres… [+1821 chars]",,fr,'Quentin Deranque'
https://www.mediapart.fr/journal/france/060326/mort-du-militant-d-extreme-droite-quentin-deranque-deux-nouvelles-mises-en-examen,https://www.mediapart.fr/journal/france/060326/mort-du-militant-d-extreme-droite-quentin-deranque-deux-nouvelles-mises-en-examen,0,www.mediapart.fr,Mort du militant d’extrême droite Quentin Deranque: deux nouvelles mises en examen,"Deux hommes d’une vingtaine d’années ont à leur tour été mis en examen et incarcérés pour le meurtre du militant d’extrême droite Quentin Deranque. Au total, neuf personnes ont été placées en détention provisoire dans cette affaire.",https://static.mediapart.fr/etmagine/og/journal/files/2026/03/06/260306-img-mises-en-examen-quentin-deranque.jpg,2026-03-06T18:37:37Z,,"Les cookies et technologies similaires que nous utilisons sur Mediapart sont de différentes natures et nous permettent de poursuivre différentes finalités. 
Certains sont nécessaires au fonctionneme… [+3291 chars]",,fr,'Quentin Deranque'
https://www.bfmtv.com/international/amerique-nord/etats-unis/donald-trump/il-n-y-aura-pas-d-accord-donald-trump-veut-une-capitulation-sans-condition-de-l-iran_AD-202603060864.html,https://www.bfmtv.com/international/amerique-nord/etats-unis/donald-trump/il-n-y-aura-pas-d-accord-donald-trump-veut-une-capitulation-sans-condition-de-l-iran_AD-202603060864.html,0,www.bfmtv.com,"""Il n'y aura pas d'accord"": Donald Trump veut une ""capitulation sans condition"" de l'Iran","Dans un message publié sur son réseau Truth Social, le président américain a dit qu'il n'y aurait ""pas d'accord avec l'Iran"". Il réclame une ""capitulation sans condition"".",https://images.bfmtv.com/xs3zXbz0PpWaghkGc9xygxJkXG0=/0x106:2048x1258/2048x0/images/Donald-Trump-2247380.jpg,2026-03-06T18:38:15Z,http://web.archive.org/web/20260306235045/https://www.bfmtv.com/international/amerique-nord/etats-unis/donald-trump/il-n-y-aura-pas-d-accord-donald-trump-veut-une-capitulation-sans-condition-de-l-iran_AD-202603060864.html,"Dans un message publié sur son réseau Truth Social, le président américain a dit qu'il n'y aurait ""pas d'accord avec l'Iran"". Il réclame une ""capitulation sans condition"".
Donald Trump a exigé vendr… [+1433 chars]",,fr,'Ali Khamenei'
https://www.huffingtonpost.fr/france/article/deux-nouvelles-mises-en-examen-apres-la-mort-de-quentin-deranque-le-point-sur-l-affaire_261182.html,https://www.huffingtonpost.fr/france/article/deux-nouvelles-mises-en-examen-apres-la-mort-de-quentin-deranque-le-point-sur-l-affaire_261182.html,0,www.huffingtonpost.fr,"Deux nouvelles mises en examen après la mort de Quentin Deranque, le point sur l’affaire",Les deux hommes ont également été placés en détention provisoire. La police estime désormais avoir arrêté tous les auteurs des coups portés au militant d’ultradroite.,https://focus.huffingtonpost.fr/2026/02/20/205/0/4000/2250/1820/1023/75/0/5aa108a_upload-1-hoiruf0138oo-afp-20260219-hl-mdelaty-3066428-v1-highres-francefarrightfascismidentitariannat.jpg,2026-03-06T18:53:37Z,,"Deux nouvelles personnes ont été mises en examen, ce vendredi 6 mars, dans le cadre de lenquête sur le meurtre de Quentin Deranque. Ces deux hommes, âgés de 22 et 26 ans, ont été arrêtés mercredi mat… [+4122 chars]",,fr,'Raphaël Arnault'
https://www.lemonde.fr/societe/article/2026/03/06/a-lyon-deux-mises-en-examen-supplementaires-dans-l-affaire-quentin-deranque_6669832_3224.html,https://www.lemonde.fr/societe/article/2026/03/06/a-lyon-deux-mises-en-examen-supplementaires-dans-l-affaire-quentin-deranque_6669832_3224.html,0,www.lemonde.fr,"Mort de Quentin Deranque : à Lyon, deux mises en examen supplémentaires, neuf suspects écroués en tout","Agés de 22 et 26 ans, les participants présumés à la rixe après laquelle est mort le militant d'extrême droite ont été placés en détention provisoire.",https://img.lemde.fr/2026/02/25/0/0/7192/4795/1440/960/60/0/ce2877c_upload-1-pikppar2duin-dsc-6827.jpg,2026-03-06T19:39:28Z,,"Lors de la marche en hommage au militant dextrême droite Quentin Deranque, à Lyon, le 21 février 2026. BRUNO AMSELLEM/DIVERGENCE POUR « LE MONDE »
Interpellés mercredi 4 mars au matin en région lyon… [+1217 chars]",,fr,'Quentin Deranque'
https://www.lemonde.fr/idees/article/2026/03/07/la-disparition-probable-des-associations-socio-judiciaires-annonce-la-fin-de-l-espoir-d-une-justice-fonctionnelle-et-humaniste_6669843_3232.html,https://www.lemonde.fr/idees/article/2026/03/07/la-disparition-probable-des-associations-socio-judiciaires-annonce-la-fin-de-l-espoir-d-une-justice-fonctionnelle-et-humaniste_6669843_3232.html,0,www.lemonde.fr,« La disparition probable des associations socio-judiciaires annonce la fin de l’espoir d’une justice fonctionnelle et humaniste »,"L’annonce, par le garde des sceaux, de la reprise par le secteur public d’une partie des missions confiées aux associations socio-judiciaires condamne ces dernières à court terme, malgré leur rôle crucial dans l’accompagnement des auteurs et des victimes de v…",https://img.lemde.fr/2026/02/25/0/0/1500/1000/1440/960/60/0/7c79c9c_upload-1-rqkmynu9noh1-frame-1295.jpg,2026-03-07T04:00:16Z,,"Lors de la clôture des Etats généraux de linsertion et de la probation, le ministre de la justice, Gérald Darmanin, a fait des annonces dont la conséquence est, à terme, la disparition des associatio… [+1800 chars]",,fr,'Gérald Darmanin'
https://www.courrierinternational.com/article/vu-d-italie-lyon-de-capitale-de-la-resistance-francaise-a-capitale-de-la-violence-politique_241232,https://www.courrierinternational.com/article/vu-d-italie-lyon-de-capitale-de-la-resistance-francaise-a-capitale-de-la-violence-politique_241232,0,www.courrierinternational.com,"Lyon, de “capitale de la Résistance française” à “capitale de la violence politique”","La troisième ville de France est devenue le théâtre d’affrontements réguliers entre extrême droite et extrême gauche, comme celui ayant mené à la mort de Quentin Deranque à la mi-février. Une situation qui résulte de la transformation de Lyon ces dernières dé…",https://focus.courrierinternational.com/2022/02/04/0/0/4500/3000/1200/630/60/0/ded1a53_1644018035450-075-liponne-notitle190402-nprjr.jpg,2026-03-07T04:00:23Z,,"Depuis les rues escarpées du Vieux-Lyon, le quartier historique de la ville, on aperçoit la colline de la Croix-Rousse qui surplombe la Saône, lancien quartier ouvrier des travailleurs de la soie et … [+1048 chars]",,fr,'Quentin Deranque'
https://www.acrimed.org/Les-medias-dominants-veulent-dominer-sans,https://www.acrimed.org/Les-medias-dominants-veulent-dominer-sans,0,www.acrimed.org,Les médias dominants veulent dominer sans entraves,"À propos d'une conférence de presse de LFI.

-
Que sont les journalistes ? Où va le journalisme ?

/ 
La France insoumise, 
France Info (radio et télé)",https://www.acrimed.org/IMG/png/confmelenchon.png,2026-03-07T06:00:00Z,,Réserver une conférence de presse à des médias numériques alternatifs ? La presse traditionnelle est sous le choc et dénonce une atteinte à sa « liberté ». Davantage quune « simple » éruption corpora… [+24283 chars],,fr,'nan nan'
https://www.franceinfo.fr/elections/comment-la-france-insoumise-veut-multiplier-les-elus-aux-municipales-pour-renforcer-son-ancrage-local-avant-la-presidentielle_7826819.html,https://www.franceinfo.fr/elections/comment-la-france-insoumise-veut-multiplier-les-elus-aux-municipales-pour-renforcer-son-ancrage-local-avant-la-presidentielle_7826819.html,0,www.franceinfo.fr,"Comment La France insoumise veut ""multiplier les élus"" aux municipales pour renforcer son ancrage local avant la présidentielle","Avec plus de 500 listes présentées pour ce scrutin, le mouvement de Jean-Luc Mélenchon affiche des ambitions bien plus élevées qu'en 2020. Il mise sur ses députés et sur une stratégie largement autonome du reste de la gauche dans les grandes villes.",https://www.franceinfo.fr/pictures/C6KLDrPncjHS2gk7JLsQPVoo8E4/0x0:3840x2160/1500x843/2026/03/06/lfi-v1-69aaaffede01c540237886.jpg,2026-03-07T06:06:48Z,,"""Il n'y a pas de listes La France insoumise aux municipales"", répétait Jean-Luc Mélenchon à l'attention des journalistes fin 2019, les qualifiant au passage de ""petites cervelles"". En six ans, l'époq… [+7105 chars]",,fr,'Raphaël Arnault'
https://www.franceinfo.fr/monde/iran/guerre-entre-les-etats-unis-israel-et-l-iran/cartes-mort-d-ali-khamenei-ripostes-iraniennes-bombardements-au-liban-comment-le-moyen-orient-s-est-embrase-en-une-semaine_7847423.html,https://www.franceinfo.fr/monde/iran/guerre-entre-les-etats-unis-israel-et-l-iran/cartes-mort-d-ali-khamenei-ripostes-iraniennes-bombardements-au-liban-comment-le-moyen-orient-s-est-embrase-en-une-semaine_7847423.html,0,www.franceinfo.fr,"Mort d'Ali Khamenei, ripostes iraniennes, bombardements au Liban... Comment le Moyen-Orient s'est embrasé en une semaine","Les premières frappes israélo-américaines, le 28 février à Téhéran, ont provoqué une série de ripostes iraniennes à travers la région, entraînant de nombreux pays dans la guerre. Franceinfo revient sur ces sept jours de conflit.",https://www.franceinfo.fr/pictures/prfmsREi-dobVNUC_87lrcC_Z_I/0x106:1024x682/1500x843/2026/03/06/068-aa-01032026-2676260-69ab0b097b8c1456174016.jpg,2026-03-07T06:07:37Z,,"Les explosions, samedi matin à Téhéran, sont un premier aperçu de l'ampleur des opérations israélo-américaines. Celles-ci marquent une offensive inédite contre le pouvoir iranien. Après des semaines … [+9756 chars]",,fr,'nan nan'
https://www.lavenir.net/actu/monde/2026/03/07/israel-pilonne-teheran-apres-une-semaine-de-guerre-il-ny-aura-pas-daccord-NCZH6UTPKFG3JNHQ6ONTQY4ZRE/,https://www.lavenir.net/actu/monde/2026/03/07/israel-pilonne-teheran-apres-une-semaine-de-guerre-il-ny-aura-pas-daccord-NCZH6UTPKFG3JNHQ6ONTQY4ZRE/,0,www.lavenir.net,"Israël pilonne Téhéran après une semaine de guerre : ""Il n'y aura pas d'accord""","Israël bombarde ce samedi 7 mars 2026 la capitale iranienne Téhéran, en particulier un de ses aéroports, après que Donald Trump a dit vouloir la ""capitulation"" de l'Iran. ...",https://www.lavenir.net/resizer/v2/SVB23SIVVFFLVFTMJ7NRYIX4ZM.jpg?auth=e0ca33c3e81ba253fa2bb30708b46586d5d84247fc613d83df4d0272ab289abf&width=1200&height=630&quality=85&focal=1480%2C987,2026-03-07T06:28:50Z,,"L'armée israélienne avait promis plus tôt ""une vague de frappes de grande ampleur"" contre des cibles gouvernementales de Téhéran, où des foules se sont rassemblées vendredi pour le premier vendredi, … [+3209 chars]",,fr,'Ali Khamenei'
https://www.lexpress.fr/idees-et-debats/arash-azizi-je-reve-dun-pays-ou-lon-scande-vive-liran-plutot-que-mort-a-israel-ESCIJXDZEZF5RAPUSIFPI7AOIY/,https://www.lexpress.fr/idees-et-debats/arash-azizi-je-reve-dun-pays-ou-lon-scande-vive-liran-plutot-que-mort-a-israel-ESCIJXDZEZF5RAPUSIFPI7AOIY/,0,www.lexpress.fr,"Arash Azizi : ""Je rêve d'un pays où l'on scande 'Vive l'Iran' plutôt que 'mort à Israël'""","Pour cet historien irano-américain, quels que soient le successeur d’Ali Khamenei et l’avenir du régime, l’Iran pourrait être amené à privilégier la diplomatie et à remplacer le rejet d’Israël par une approche plus pragmatique.",https://www.lexpress.fr/resizer/v2/VXM5G45UORERJHZOXVNZWVAUGE.JPG?auth=52feb6253959def3be83c3759d6ad5e22fd1c7d6e04eb4d5041df0b010181037&width=1200&height=630&quality=85&smart=true,2026-03-07T06:43:00Z,,Arash Azizi est lun des plus fins connaisseurs de la société iranienne et de son mouvement dopposition au régime des mollahs. Il est aussi lune des voix les plus écoutées de la diaspora iranienne out… [+17482 chars],,fr,'Ali Khamenei'
https://atlantico.fr/article/rdv/de-la-jeune-garde-aux-saillies-antisemites-la-melenchonophobie-progresse-chez-les-electeurs-de-gauche,https://atlantico.fr/article/rdv/de-la-jeune-garde-aux-saillies-antisemites-la-melenchonophobie-progresse-chez-les-electeurs-de-gauche,0,atlantico.fr,De la Jeune garde aux saillies antisémites : la mélenchonophobie progresse chez les électeurs de gauche,"La multiplication des provocations du leader insoumis sur fond de meurtre de Quentin Deranque fait chuter sa cote de popularité auprès des électeurs de gauche, qui recule de 12 points à 31 % ce mois-ci.",https://atlantico.codexcdn.net/assets/asrjdTX3tlFgCICt3.jpg?width=700&height=500&quality=75,2026-03-07T07:27:24Z,http://web.archive.org/web/20260307215638/https://atlantico.fr/article/rdv/de-la-jeune-garde-aux-saillies-antisemites-la-melenchonophobie-progresse-chez-les-electeurs-de-gauche,"La multiplication des provocations du leader insoumis sur fond de meurtre de Quentin Deranque fait chuter sa cote de popularité auprès des électeurs de gauche, qui recule de 12 points à 31 % ce mois-… [+2 chars]",,fr,'Quentin Deranque'
https://www.meta-media.fr/2026/03/07/liens-vagabonds-informer-au-milieu-du-chaos-le-defi-du-journalisme-de-guerre.html,https://www.meta-media.fr/2026/03/07/liens-vagabonds-informer-au-milieu-du-chaos-le-defi-du-journalisme-de-guerre.html,0,www.meta-media.fr,"Liens vagabonds : Informer au milieu du chaos, le défi du journalisme de guerre","Avec l’escalade de la guerre au Proche et au Moyen-Orient, la demande d’informations fiables explose. Sur Google Trends, les requêtes se multiplient : « Pourquoi avons-nous bombardé l’Iran ? », « Sommes-nous en guerre maintenant ? ». Aux Etats-Unis, le mot-cl…",https://www.meta-media.fr/wp-content/uploads/sites/33/2026/03/couv-information-guerre-copy.jpg,2026-03-07T09:02:39Z,,"Avec lescalade de la guerre au Proche et au Moyen-Orient, la demande dinformations fiables explose. Sur Google Trends, les requêtes se multiplient : « Pourquoi avons-nous bombardé lIran ? », « Sommes… [+14200 chars]",,fr,'Ali Khamenei'
https://www.huffingtonpost.fr/politique/article/a-l-election-presidentielle-de-2027-philippe-poutou-se-dit-pret-a-soutenir-jean-luc-melenchon_261197.html,https://www.huffingtonpost.fr/politique/article/a-l-election-presidentielle-de-2027-philippe-poutou-se-dit-pret-a-soutenir-jean-luc-melenchon_261197.html,0,www.huffingtonpost.fr,"À l’élection présidentielle de 2027, Philippe Poutou se dit prêt à soutenir Jean-Luc Mélenchon",L’ancien porte-parole du NPA révèle qu’il est « probable » qu’il soutienne la candidature de La France insoumise l’an prochain.,https://focus.huffingtonpost.fr/2026/03/07/1/0/5550/3121/1820/1023/75/0/2eb8f9b_upload-1-vrdqywzer8tm-afp-20260226-992r8kb-v1-highres-franceelectionmunicipal2026.jpg,2026-03-07T13:00:07Z,,La gauche radicale partira-t-elle unie à lélection présidentielle ? Philippe Poutou a fait un geste douverture en se disant prêt à soutenir la candidature de Jean-Luc Mélenchon en 2027. Sur le platea… [+2719 chars],,fr,'Jean-Luc Mélenchon'
https://www.franceinfo.fr/elections/municipales/municipales-2026-je-ne-mettrai-jamais-de-bulletin-lfi-dans-l-urne-assure-la-porte-parole-du-gouvernement_7853678.html,https://www.franceinfo.fr/elections/municipales/municipales-2026-je-ne-mettrai-jamais-de-bulletin-lfi-dans-l-urne-assure-la-porte-parole-du-gouvernement_7853678.html,0,www.franceinfo.fr,"Municipales 2026 : ""Je ne mettrai jamais de bulletin LFI dans l'urne"", assure la porte-parole du gouvernement","Dénonçant les ""dérives antisémites"" et les ""discours communautaristes"" de La France insoumise, Maud Bregeon appelle à ""l’union du centre et de la droite pour construire une alternative solide"".",https://www.franceinfo.fr/pictures/7t4NDZ-DnixCEpnVUPS7TSnOC5g/0x53:1024x629/1500x843/2026/03/08/000-99vp6pj-69ad27563aea7970543797.jpg,2026-03-08T07:38:56Z,,"A une semaine du premier tour des élections municipales, la porte-parole du gouvernement a redit son opposition à La France insoumise. ""Jai toujours été claire : comme citoyenne, je ne mettrai jamais… [+621 chars]",,fr,'Maud Bregeon'
https://www.challenges.fr/monde/liran-toujours-pilonne-choisit-un-successeur-a-ali-khameni_641534,https://www.challenges.fr/monde/liran-toujours-pilonne-choisit-un-successeur-a-ali-khameni_641534,0,www.challenges.fr,"L’Iran, toujours pilonné, choisit un successeur à Ali Khameni","L’Iran a annoncé dimanche avoir choisi un successeur Ali Khamenei, tué au premier jour de l’offensive américano-israélienne le 28 février contre la République islamique.",https://www.challenges.fr/_ipx/f_jpg&enlarge_true&s_1200x630/cha/static/2026-03/50963.HR_1.jpg%3FVersionId=AkOSwew71N1cZykMSDetWwBkHfjOKNOa,2026-03-08T10:13:00Z,,"LAssemblée des experts, organe iranien chargé délire le haut dirigeant, a choisi ce dimanche un successeur à Ali Khamenei, qui était au pouvoir depuis 1989 et qui a tué le premier jour de loffensive … [+5390 chars]",,fr,'Ali Khamenei'
https://www.courrierinternational.com/article/succession-en-iran-le-nouveau-guide-supreme-aurait-ete-choisi-selon-des-clercs_241459,https://www.courrierinternational.com/article/succession-en-iran-le-nouveau-guide-supreme-aurait-ete-choisi-selon-des-clercs_241459,0,www.courrierinternational.com,"En Iran, le nouveau guide suprême aurait été choisi, selon des clercs","Un consensus se serait dégagé sur le successeur d’Ali Khamenei, dont le nom n’a pas été dévoilé pour l’heure. L’armée israélienne a déjà lancé un avertissement sur les réseaux sociaux, promettant d’en faire une cible.",https://focus.courrierinternational.com/2026/03/07/1/0/8192/5461/1200/630/60/0/7596738_ftp-1-sgbacgll3wbh-afp-a2bz443.jpg,2026-03-08T11:32:50Z,,"LAssemblée des experts a désigné le nouveau guide suprême iranien pour succéder à layatollah Ali Khamenei, ont affirmé dimanche 8 mars certains membres de cet organe composé de 88 hauts dignitaires r… [+1666 chars]",,fr,'Ali Khamenei'
https://www.lemonde.fr/culture/article/2026/03/08/a-aubusson-la-scene-nationale-prend-l-eau_6669993_3246.html,https://www.lemonde.fr/culture/article/2026/03/08/a-aubusson-la-scene-nationale-prend-l-eau_6669993_3246.html,0,www.lemonde.fr,"A Aubusson, la scène nationale prend l’eau","Le Théâtre Jean-Lurçat, dans cette petite ville de la Creuse, se dégrade en raison de problèmes d’infiltration, mais le département refuse de financer sa part des travaux. Une impasse qui pourrait aboutir à la fermeture du bâtiment.",https://img.lemde.fr/2026/03/05/813/0/2783/1855/1440/960/60/0/a5fb07e_upload-1-hqbbr1ssiimv-mfarcy-aubusson-027.jpeg,2026-03-08T13:00:09Z,,"Ce quon voit dabord, ce sont les seaux. Les bassines, les cuvettes, les poubelles de 100 litres, en métal et en plastique vert et noir. Posés çà et là dans une loge ou une salle de répétition, chargé… [+1905 chars]",,fr,'nan nan'
https://www.lexpress.fr/monde/proche-moyen-orient/en-direct-le-successeur-dali-khamenei-pourrait-etre-designe-dans-la-journee-PSQBOL63RVASHAIHI555RY4PQU/,https://www.lexpress.fr/monde/proche-moyen-orient/en-direct-le-successeur-dali-khamenei-pourrait-etre-designe-dans-la-journee-PSQBOL63RVASHAIHI555RY4PQU/,0,www.lexpress.fr,"Le successeur d'Ali Khamenei a été désigné, sans que son nom ne soit encore dévoilé",Donald Trump exclut toute négociation tandis que Téhéran s’apprête à désigner un successeur.,https://www.lexpress.fr/resizer/v2/7W3DNQPSPFD67IDUBGKZW3T6CU.jpg?auth=3567bb0fad1c3b9c22514d8f31e3611a3b13983d6fdb77a05760b2f134d0ab18&width=1200&height=630&quality=85&focal=2353%2C1253,2026-03-08T16:30:30Z,,"Interrogé samedi sur la possibilité d'envoyer des troupes au sol pour sécuriser les sites nucléaires, Donald Trump a déclaré que c'était quelque chose qu'ils pourraient faire ""plus tard"".
Les gouver… [+10394 chars]",,fr,'Ali Khamenei'
https://www.huffingtonpost.fr/france/article/prix-du-carburant-lecornu-annonce-des-controles-massifs-face-aux-pratiques-abusives-de-certaines-stations-service_261229.html,https://www.huffingtonpost.fr/france/article/prix-du-carburant-lecornu-annonce-des-controles-massifs-face-aux-pratiques-abusives-de-certaines-stations-service_261229.html,0,www.huffingtonpost.fr,Prix du carburant : Lecornu annonce des contrôles massifs face aux « pratiques abusives » de certaines stations-service,"Le Premier ministre a annoncé « un plan exceptionnel » pour contrôler les prix à la pompe, alors que la guerre au Moyen-Orient a des conséquences sur le cours du pétrole.",https://focus.huffingtonpost.fr/2026/03/08/53/0/1024/576/1820/1023/75/0/ddb2b23_upload-1-5jk4yylferco-afp-20230311-hl-mcohen-1993705-v1-midres-franceillustrationgasstation.jpg,2026-03-08T18:38:05Z,,Un début de semaine sous surveillance pour les stations-service. Le Premier ministre Sébastien Lecornu a annoncé ce dimanche 8 mars sur X « un plan exceptionnel de 500 contrôles » dans les stations-s… [+2570 chars],,fr,'Premier ministre'
https://www.lemonde.fr/international/live/2026/03/08/en-direct-guerre-au-moyen-orient-mojtaba-khamenei-nomme-nouveau-guide-supreme-iranien-annonce-l-assemblee-des-experts_6669855_3210.html,https://www.lemonde.fr/international/live/2026/03/08/en-direct-guerre-au-moyen-orient-mojtaba-khamenei-nomme-nouveau-guide-supreme-iranien-annonce-l-assemblee-des-experts_6669855_3210.html,0,www.lemonde.fr,"EN DIRECT, guerre au Moyen-Orient : Mojtaba Khamenei nommé nouveau guide suprême iranien, annonce l’Assemblée des experts","Ce religieux, âgé de 56 ans, est l’un des six enfants d’Ali Khamenei, tué dans les frappes aériennes américaines et israéliennes le 28 février. Il est considéré comme proche des conservateurs, en raison notamment de ses liens avec les gardiens de la révolutio…",https://img.lemde.fr/2026/03/08/120/0/3500/1750/1440/720/60/0/3a7f3dd_ftp-1-yrgj4puqhthp-5411186-01-06.jpg,2026-03-08T21:23:50Z,,"Mojtaba Khamenei, à Téhéran, le 3 octobre 2024. KHAMENEI.IR/AFP
Désigné pour prendre la tête de lIran en succédant aux fonctions de Guide suprême à son père, tué par les frappes américano-israélienn… [+3220 chars]",,fr,'Ali Khamenei'
