index,url,valid,domain,title,description,image,published,archive,content,quote,language,keyword
https://www.ledauphine.com/defense-guerre-conflit/2026/05/09/commemorations-du-9-mai-pourquoi-la-parade-sera-reduite-et-sous-haute-tension-cette-annee,https://www.ledauphine.com/defense-guerre-conflit/2026/05/09/commemorations-du-9-mai-pourquoi-la-parade-sera-reduite-et-sous-haute-tension-cette-annee,0,www.ledauphine.com,Russie. Commémorations du 9-Mai : pourquoi la parade sera réduite et sous haute tension cette année,"Devenue sous Vladimir Poutine un outil de propagande, la parade du 9-Mai commémorant la fin de la « Grande guerre patriotique » révèle désormais la fragilité du régime. Décryptage.",https://cdn-s-www.ledauphine.com/images/B1EDCF21-1D9F-42BC-A624-1F50FE3AFF29/FB1200/photo-1778267013.jpg,2026-05-09T05:30:00Z,,"Vladimir Poutine avait transformé la parade du 9-Mai, commémorant la victoire soviétique sur lAllemagne nazie, en vitrine de la puissance de la Russie. Depuis linvasion de lUkraine, elle est devenue … [+3340 chars]",,fr,'Vladimir Poutine'
https://www.mediapart.fr/journal/international/090526/vladimir-poutine-celebre-son-jour-de-la-victoire-en-mauvaise-posture,https://www.mediapart.fr/journal/international/090526/vladimir-poutine-celebre-son-jour-de-la-victoire-en-mauvaise-posture,0,www.mediapart.fr,Vladimir Poutine célèbre son jour de la Victoire en mauvaise posture,"La parade du 9-Mai, traditionnelle démonstration de puissance militaire russe, a été réduite cette année au strict minimum, indépendamment d’un cessez-le-feu de trois jours annoncé hier par Trump. Une absence de faste à l’image de la situation éprouvée par le…",https://static.mediapart.fr/etmagine/og/journal/files/2026/05/07/260507-img-vladimir-poutine-celebre-son-jour-de-la-victoire-en-mauvaise-posture.jpg,2026-05-09T06:54:42Z,,"Les cookies et technologies similaires que nous utilisons sur Mediapart sont de différentes natures et nous permettent de poursuivre différentes finalités. 
Certains sont nécessaires au fonctionneme… [+3291 chars]",,fr,'Vladimir Poutine'
https://www.courrierinternational.com/article/russie-a-moscou-une-parade-restreinte-qui-illustre-le-moment-de-vulnerabilite-de-poutine_243835,https://www.courrierinternational.com/article/russie-a-moscou-une-parade-restreinte-qui-illustre-le-moment-de-vulnerabilite-de-poutine_243835,0,www.courrierinternational.com,"À Moscou, une parade restreinte qui illustre le “moment de vulnérabilité” de Poutine","Ce 9 mai, comme chaque année, la Russie a célébré sa victoire contre l’Allemagne nazie à travers une parade à Moscou. Or, à cause des craintes liées à la sécurité, le défilé a été beaucoup plus modeste qu’à l’accoutumée. Un symptôme des difficultés actuelles …",https://focus.courrierinternational.com/2026/05/09/4/0/3542/2361/1200/630/60/0/b69ee33_ftp-1-amsoh8szvzwb-2026-05-09t134619z-1925252301-rc2p5lawhycj-rtrmadp-3-ww2-anniversary-russia-parade.JPG,2026-05-09T15:15:13Z,,"Un mini-défilé dans une sombre place rouge,observe depuis lItalie La Repubblica.Une parade restreinte,confirme le quotidien britannique The Guardian, tandis quaux États-Unis, le New York Times évoque… [+3466 chars]",,fr,'Vladimir Poutine'
https://atlantico.fr/article/decryptage/cette-faiblesse-que-vladimir-poutine-est-desormais-oblige-dassumer-a-ciel-ouvert-vladislav-avioutskii,https://atlantico.fr/article/decryptage/cette-faiblesse-que-vladimir-poutine-est-desormais-oblige-dassumer-a-ciel-ouvert-vladislav-avioutskii,0,atlantico.fr,Cette faiblesse que Vladimir Poutine est désormais obligé d’assumer à ciel ouvert,Quarante-cinq minutes montre en main et un dispositif sécuritaire drastique : le traditionnel défilé militaire russe du 9 mai commémorant la victoire sur l'envahisseur nazi s'est déroulé cette année dans une atmosphère fébrile à Moscou. Le signe d'une guerre …,https://atlantico.codexcdn.net/assets/as884LjWtdxvKbNXF.jpg?width=700&height=500&quality=75,2026-05-11T07:21:00Z,http://web.archive.org/web/20260512131743/https://atlantico.fr/article/decryptage/cette-faiblesse-que-vladimir-poutine-est-desormais-oblige-dassumer-a-ciel-ouvert-vladislav-avioutskii,Quarante-cinq minutes montre en main et un dispositif sécuritaire drastique : le traditionnel défilé militaire russe du 9 mai commémorant la victoire sur l'envahisseur nazi s'est déroulé cette année … [+117 chars],,fr,'Poutine'
https://www.numerama.com/pop-culture/2250917-les-meilleurs-films-netflix-a-voir-sur-la-plateforme-en-2026.html,https://www.numerama.com/pop-culture/2250917-les-meilleurs-films-netflix-a-voir-sur-la-plateforme-en-2026.html,0,www.numerama.com,Les meilleurs films Netflix à voir sur la plateforme en 2026,"Blockbusters explosifs, pépites d'animation oscarisées et thrillers psychologiques : l'année 2026 marque un tournant historique pour Netflix. Avec un catalogue qui aligne les noms les plus prestigieux d'Hollywood, de Guillermo del Toro à Ben Affleck, la plate…","https://c0.lestechnophiles.com/www.numerama.com/wp-content/uploads/2026/05/capture-decran-2026-05-11-a-171423-2.jpg?resize=1600,900&key=46f13493&watermark",2026-05-11T17:15:00Z,,"Blockbusters explosifs, pépites d’animation oscarisées et thrillers psychologiques : l’année 2026 marque un tournant historique pour Netflix. Avec un catalogue qui aligne les noms les plus prestigieu… [+16324 chars]",,fr,'Daniel Craig'
https://www.frandroid.com/marques/3095231_donald-trump-emmene-tim-cook-elon-musk-et-qualcomm-a-pekin-mais-oublie-nvidia,https://www.frandroid.com/marques/3095231_donald-trump-emmene-tim-cook-elon-musk-et-qualcomm-a-pekin-mais-oublie-nvidia,0,www.frandroid.com,"Donald Trump emmène Tim Cook, Elon Musk et Qualcomm à Pékin, mais oublie Nvidia","Tim Cook fait partie de la quinzaine de patrons américains qui accompagnent Donald Trump à Pékin cette semaine pour son sommet avec Xi Jinping. Apple, Tesla, Qualcomm et Micron sont du voyage ; Nvidia, Microsoft et AMD restent à Washington.","https://c0.lestechnophiles.com/images.frandroid.com/wp-content/uploads/2026/05/image-19-19.jpg?resize=1600,900&key=056041fb&watermark",2026-05-12T03:38:26Z,,"Tim Cook fait partie de la quinzaine de patrons américains qui accompagnent Donald Trump à Pékin cette semaine pour son sommet avec Xi Jinping. Apple, Tesla, Qualcomm et Micron sont du voyage ; Nvidi… [+1641 chars]",,fr,'Donald Trump'
https://www.courrierinternational.com/article/decryptage-le-temps-du-dialogue-entre-l-ue-et-moscou-est-il-arrive_243887,https://www.courrierinternational.com/article/decryptage-le-temps-du-dialogue-entre-l-ue-et-moscou-est-il-arrive_243887,0,www.courrierinternational.com,Le temps du dialogue entre l’UE et Moscou est-il arrivé ?,"Le 9 mai, lors des célébrations du “jour de la victoire”, Vladimir Poutine a déclaré que la guerre en Ukraine pourrait “toucher à sa fin” et a évoqué un dialogue avec l’Europe sur le sujet. Comment doivent réagir les États membres de l’UE ? Le chef du Kremlin…",https://focus.courrierinternational.com/2026/05/13/48/0/2400/1600/1200/630/60/0/8c0977d_upload-1-oec4ofe7jt2v-w-morales-izquierda-2025-05-10-0702.jpg,2026-05-14T07:00:10Z,,La question qui se pose est la suivante : Vladimir Poutine est-il suffisamment affaibli pour être convaincu que mettre un terme à la guerre en Ukraine est dans son intérêt ? LUnion européenne (UE) et… [+1088 chars],,fr,'Vladimir Poutine'
