index,url,valid,domain,title,description,image,published,archive,content,quote,language,keyword
https://www.bfmtv.com/international/moyen-orient/iran/donald-trump-ne-se-dit-pas-satisfait-de-la-nouvelle-offre-de-l-iran-pour-relancer-les-negociations-et-menace-de-pulveriser-le-pays_AN-202605010675.html,https://www.bfmtv.com/international/moyen-orient/iran/donald-trump-ne-se-dit-pas-satisfait-de-la-nouvelle-offre-de-l-iran-pour-relancer-les-negociations-et-menace-de-pulveriser-le-pays_AN-202605010675.html,0,www.bfmtv.com,"Donald Trump ne se dit ""pas satisfait"" de la nouvelle offre de l'Iran pour relancer les négociations et menace de ""pulvériser"" le pays","Le président américain a réagi ce vendredi à l'offre de Téhéran pour relancer les négociations. Il décrit les dirigeants iraniens comme ""désunis"" et incapables de s'accorder sur une stratégie pour sortir du conflit.",https://images.bfmtv.com/Rr9F0CQrYnwnI5R6iNb0o5kzxmU=/0x106:2048x1258/2048x0/images/DONALD-TRUMP-2278506.jpg,2026-05-01T18:38:48Z,,"Le président américain a réagi ce vendredi à l'offre de Téhéran pour relancer les négociations. Il décrit les dirigeants iraniens comme ""désunis"" et incapables de s'accorder sur une stratégie pour so… [+2422 chars]",,fr,'Donald Trump'
https://www.dhnet.be/actu/monde/2026/05/01/quand-le-pape-provoque-donald-trump-leon-xiv-a-nomme-un-ancien-sans-papiers-eveque-aux-etats-unis-TZMUTBM2GBF2ZMHHOAWCQ2AWTI/,https://www.dhnet.be/actu/monde/2026/05/01/quand-le-pape-provoque-donald-trump-leon-xiv-a-nomme-un-ancien-sans-papiers-eveque-aux-etats-unis-TZMUTBM2GBF2ZMHHOAWCQ2AWTI/,0,www.dhnet.be,Quand le pape provoque Donald Trump: Leon XIV a nommé un ancien sans-papiers évêque aux États-Unis,"Le Vatican a annoncé dans un communiqué la nomination d'Evelio Menjivar-Ayala, 55 ans, actuellement évêque auxiliaire à Washington, évêque du diocèse de Wheeling-Charleston, en Virginie-Occidentale (est). ...",https://www.dhnet.be/resizer/v2/MA7YACK4H5AXBE44WQA5QKXCRI.jpg?auth=ab1e847110ea2e30b7c55a1ba5790add41e2c4f18349b62b31ee619b2fb06a01&width=1200&height=630&quality=85&focal=1516%2C1083,2026-05-01T18:52:34Z,,"Un SUV XXL au Vatican : le PDG de Ford offre un cadeau unique et personnalisé au Pape Leon XIVD'abord arrêté au Mexique alors qu'il tentait d'entrer aux Etats-Unis, il a dit dans une interview l'anné… [+2097 chars]",,fr,'Donald Trump'
https://www.franceinfo.fr/societe/religion/aux-etats-unis-le-pape-nomme-eveque-un-ancien-sans-papiers-apres-avoir-ete-critique-par-donald-trump_7977092.html,https://www.franceinfo.fr/societe/religion/aux-etats-unis-le-pape-nomme-eveque-un-ancien-sans-papiers-apres-avoir-ete-critique-par-donald-trump_7977092.html,0,www.franceinfo.fr,"Aux Etats-Unis, le pape nomme évêque un ancien sans-papiers, après avoir été critiqué par Donald Trump","Evelio Menjivar-Ayala a été nommé au diocèse de Wheeling-Charleston, en Virginie-Occidentale. Le pape a plusieurs fois critiqué la politique de Donald Trump en matière d'immigration.",https://www.franceinfo.fr/pictures/VP3VvO73sanhY2sAMmjLfQkmlsA/0x364:7040x4324/1500x843/2026/05/01/69f4f66cb22a5359571966.jpg,2026-05-01T18:57:37Z,,"Le pape Léon XIV a nommé un ancien immigré sans-papiers comme évêque d'un diocèse aux Etats-Unis, vendredi 1er mai, après avoir critiqué la guerre lancée contre l'Iran et la politique de Donald Trump… [+1739 chars]",,fr,'Donald Trump'
https://www.challenges.fr/monde/berlin-prend-acte-du-retrait-de-5-000-soldats-americains_643122,https://www.challenges.fr/monde/berlin-prend-acte-du-retrait-de-5-000-soldats-americains_643122,0,www.challenges.fr,Berlin prend acte du retrait de 5 000 soldats américains,"Le Pentagone a annoncé le retrait de quelque 5 000 militaires américains d’Allemagne d'ici à un an, Berlin prenant acte samedi de la mesure et appelant l’Europe à renforcer sa sécurité.",https://www.challenges.fr/_ipx/f_jpg&enlarge_true&s_1200x630/cha/static/2026-05/54562.HR_0.jpg%3FVersionId=jbIS.R98Q2tNyz0evLKsewFDdlaMlqAJ,2026-05-02T10:11:00Z,,"« Que des troupes des Etats-Unis se retirent dEurope et aussi dAllemagne était attendu », a réagi le ministre allemand de la Défense, Boris Pistorius, dans un commentaire transmis à lAFP par son mini… [+3609 chars]",,fr,'nan nan'
https://www.telerama.fr/cinema/netflix-brise-le-tabou-de-la-sortie-en-salles-pour-le-narnia-de-greta-gerwig-7030890.php,https://www.telerama.fr/cinema/netflix-brise-le-tabou-de-la-sortie-en-salles-pour-le-narnia-de-greta-gerwig-7030890.php,0,www.telerama.fr,Netflix brise le tabou de la sortie en salles pour le “Narnia” de Greta Gerwig,"Pour la première fois, le géant du streaming accorde une fenêtre d’exploitation massive pour un film avant sa mise en ligne. Ce blockbuster à 200 millions de dollars pourrait bien marquer un tournant dans la stratégie du numéro un du streaming.",https://focus.telerama.fr/2022/02/23/380/462/1415/943/1200/800/60/0/7e32986_1645629844548-greta-gerwing01-0-rmiptc.jpg,2026-05-02T15:16:13Z,,"Pour la première fois, le géant du streaming accorde une fenêtre dexploitation massive pour un film avant sa mise en ligne. Ce blockbuster à 200 millions de dollars pourrait bien marquer un tournant … [+5061 chars]",,fr,'Greta Gerwig'
https://www.nouvelobs.com/teleobs/20260502.OBS114638/les-filles-du-docteur-march-greta-gerwig-revisite-un-classique-avec-audace.html,https://www.nouvelobs.com/teleobs/20260502.OBS114638/les-filles-du-docteur-march-greta-gerwig-revisite-un-classique-avec-audace.html,0,www.nouvelobs.com,« Les filles du docteur March » : Greta Gerwig revisite un classique avec audace,"Fidèle à l’esprit du roman, la réalisatrice oscille entre allégresse un peu forcée et émotion plus juste, portée par une distribution éclatante. Ce soir à 21h sur France 4 et disponible à la demande sur France.tv.",https://focus.nouvelobs.com/2026/05/01/0/76/3154/2103/1200/800/0/0/2b2187d_upload-1-xf35deche7ld-lesfillesdudocteurmarch.jpg,2026-05-02T15:45:05Z,,"Emma Watson, Saoirse Ronan, Eliza Scanlen et Florence Pugh dans « les Filles du docteur March » de Greta Gerwig SONY PICTURES/WILSON WEBB
Commenter Lire plus tard 
Google Actualités
Partager Sabon… [+1228 chars]",,fr,'Greta Gerwig'
https://www.bfmtv.com/culture/cinema-series/tournages-toxiques-departs-d-acteurs-male-gaze-l-envers-du-decor-peu-reluisant-de-la-serie-euphoria_AN-202605020299.html,https://www.bfmtv.com/culture/cinema-series/tournages-toxiques-departs-d-acteurs-male-gaze-l-envers-du-decor-peu-reluisant-de-la-serie-euphoria_AN-202605020299.html,0,www.bfmtv.com,"Tournages ""toxiques"", départs d'acteurs, male gaze... L'envers du décor peu reluisant de la série ""Euphoria""","""Euphoria"" a fait son grand retour sur HBO en avril après quatre ans d'arrêt. Quatre ans pendant lesquels la série a accumulé les départs, les reports, les critiques - et les interrogations concernant la méthode Levinson.",https://images.bfmtv.com/pSWvE4HJOGGta-b4DARbkLlT3bI=/203x453:1643x1263/1440x0/images/Zendaya-Euphoria-2269407.jpg,2026-05-02T17:19:48Z,,"""Euphoria"" a fait son grand retour sur HBO en avril après quatre ans d'arrêt. Quatre ans pendant lesquels la série a accumulé les départs, les reports, les critiques - et les interrogations concernan… [+6347 chars]",,fr,'Jacob Elordi'
https://www.bfmtv.com/international/moyen-orient/turquie/l-avion-du-premier-ministre-espagnol-pedro-sanchez-contraint-d-atterir-en-urgence-en-turquie-en-raison-d-un-imprevu-technique_AD-202605030370.html,https://www.bfmtv.com/international/moyen-orient/turquie/l-avion-du-premier-ministre-espagnol-pedro-sanchez-contraint-d-atterir-en-urgence-en-turquie-en-raison-d-un-imprevu-technique_AD-202605030370.html,0,www.bfmtv.com,"L'avion du Premier ministre espagnol Pedro Sánchez contraint d'atterir en urgence en Turquie en raison d'un ""imprévu technique""","En raison d'un ""imprévu technique"", l'avion qui transportait Pedro Sánchez vers l'Arménie pour assister au sommet de la Communauté politique européenne a dû atterrir à Ankara.",https://images.bfmtv.com/1MV4ROaYRMFSsAQZ3vppFHDdzZg=/0x108:2048x1260/2048x0/images/x-2266186.jpg,2026-05-03T21:48:16Z,,"En raison d'un ""imprévu technique"", l'avion qui transportait Pedro Sánchez vers l'Arménie pour assister au sommet de la Communauté politique européenne a dû atterrir à Ankara.
L'avion qui transporta… [+1244 chars]",,fr,'Mark Carney'
https://www.bfmtv.com/international/face-a-donald-trump-et-vladimir-poutine-les-europeens-et-le-canada-se-reunissent-en-armenie-dans-un-grand-rendez-vous-diplomatique_AD-202605040150.html,https://www.bfmtv.com/international/face-a-donald-trump-et-vladimir-poutine-les-europeens-et-le-canada-se-reunissent-en-armenie-dans-un-grand-rendez-vous-diplomatique_AD-202605040150.html,0,www.bfmtv.com,"Face à Donald Trump et Vladimir Poutine, les Européens et le Canada se réunissent en Arménie dans un grand rendez-vous diplomatique","Guerre en Ukraine, Donald Trump, lutte contre le narcotrafic... La communauté politique européenne se réunit ce lundi en Arménie dans une période de désordre géopolitique profond pour discuter de sujets variés et tenir de nombreuses rencontres bilatérales. Le…",https://images.bfmtv.com/aDQ9RWgXleG7-57_4ZMMKKP7hpo=/0x106:2048x1258/2048x0/images/Armenie-Communaute-politique-europeenne-2280119.jpg,2026-05-04T05:28:56Z,,"Guerre en Ukraine, Donald Trump, lutte contre le narcotrafic... La communauté politique européenne se réunit ce lundi en Arménie dans une période de désordre géopolitique profond pour discuter de suj… [+4529 chars]",,fr,'Poutine'
https://www.ledauphine.com/politique/2026/05/04/l-avion-du-premier-ministre-espagnol-contraint-d-atterrir-a-ankara-a-cause-d-un-imprevu-technique,https://www.ledauphine.com/politique/2026/05/04/l-avion-du-premier-ministre-espagnol-contraint-d-atterrir-a-ankara-a-cause-d-un-imprevu-technique,0,www.ledauphine.com,Turquie. L'avion du Premier ministre espagnol contraint d'atterrir à Ankara à cause d'un « imprévu technique »,"Pedro Sánchez, fervent soutien de la cause palestinienne et opposé à la guerre israélo-américaine en Iran, était en direction l'Arménie pour assister au sommet de la Communauté politique européenne.",https://cdn-s-www.ledauphine.com/images/404179D7-DBEB-462E-A909-F8B297BD3D8A/FB1200/photo-1777873824.jpg,2026-05-04T05:52:00Z,,L'avion qui transportait le Premier ministre espagnol Pedro Sánchez vers l'Arménie pour assister au sommet de la Communauté politique européenne a dû atterrir à Ankara (Turquie) dimanche soir en rais… [+1342 chars],,fr,'Pedro Sánchez'
https://www.lalibre.be/international/europe/2026/05/04/un-imprevu-technique-contraint-le-premier-ministre-espagnol-a-atterrir-a-ankara-UZGUSDA5Y5A7FO576XAKILNBMI/,https://www.lalibre.be/international/europe/2026/05/04/un-imprevu-technique-contraint-le-premier-ministre-espagnol-a-atterrir-a-ankara-UZGUSDA5Y5A7FO576XAKILNBMI/,0,www.lalibre.be,"Un ""imprévu technique"" contraint le Premier ministre espagnol à atterrir à Ankara","L'avion qui transportait le Premier ministre espagnol Pedro Sánchez vers l'Arménie en vue du sommet de la Communauté politique européenne a dû atterrir à Ankara (Turquie) dimanche soir en raison d'un ""imprévu technique"", ont annoncé les services du chef du go…",https://www.lalibre.be/resizer/v2/Q56QFQH2SRCIHDOMWWWJNQHNBE.jpg?auth=9fd6ffc4617b1784e9e816103d4f570524881bdbcde4a87cd368eaf77373b080&width=1200&height=630&quality=85&focal=2104%2C1400,2026-05-04T06:06:08Z,,"""La délégation espagnole passera la nuit à Ankara avant de reprendre demain son voyage vers l'Arménie"", a ajouté la même source, sans préciser la nature du problème rencontré.
Une source s'exprimant… [+726 chars]",,fr,'Premier ministre'
https://www.20minutes.fr/auto/byd/4220545-20260504-constructeurs-automobiles-chinois-gagnent-terrain-europe-jusqu,https://www.20minutes.fr/auto/byd/4220545-20260504-constructeurs-automobiles-chinois-gagnent-terrain-europe-jusqu,0,www.20minutes.fr,Les constructeurs automobiles chinois gagnent du terrain en Europe… jusqu’où ?,L’offensive en Europe des constructeurs chinois peut-elle changer le paysage auto sur le Vieux continent ? Pas sûr…,https://img.20mn.fr/wQUYADi7R1-7HXi7Y72vEik/1444x920_le-stand-du-constructeur-byd-au-salon-de-pekin-2026,2026-05-04T06:07:36Z,,"Lacteur Jean Reno qui part au bord de la mer avec sa Jaecco, dans une pub pour le groupe chinois Chery. Ou Daniel Craig au volant dune voiture chinoise aux faux airs dAston Martin pour servir sa maje… [+4269 chars]",,fr,'Daniel Craig'
https://www.bfmtv.com/culture/cinema-series/narnia-de-greta-gerwig-repousse-a-2027-mais-avec-une-diffusion-en-salles-exceptionnelle_AN-202605040479.html,https://www.bfmtv.com/culture/cinema-series/narnia-de-greta-gerwig-repousse-a-2027-mais-avec-une-diffusion-en-salles-exceptionnelle_AN-202605040479.html,0,www.bfmtv.com,"""Narnia"" de Greta Gerwig repoussé à 2027... mais avec une diffusion en salles exceptionnelle","Le film événement de Netflix, qui devait initialement sortir en novembre prochain sur la plateforme, se voit finalement attribué une sortie en salles mondiale relativement massive, mais à partir de février 2027.",https://images.bfmtv.com/Pix_6QxJCNPBLCnjLym037mnFbo=/0x45:768x477/768x0/images/La-realisatrice-et-actrice-americaine-Greta-Gerwig-arrive-au-Met-gala-le-6-mai-2024-a-New-York-1861700.jpg,2026-05-04T10:31:58Z,,"Le film événement de Netflix, qui devait initialement sortir en novembre prochain sur la plateforme, se voit finalement attribué une sortie en salles mondiale relativement massive, mais à partir de f… [+3905 chars]",,fr,'Daniel Craig'
https://www.lalibre.be/culture/cinema/2026/05/04/netflix-accorde-une-large-diffusion-en-salles-au-narnia-de-greta-gerwig-une-premiere-A4UJDZTATBFRTFFXA7LARLEROA/,https://www.lalibre.be/culture/cinema/2026/05/04/netflix-accorde-une-large-diffusion-en-salles-au-narnia-de-greta-gerwig-une-premiere-A4UJDZTATBFRTFFXA7LARLEROA/,0,www.lalibre.be,"Netflix accorde une large diffusion en salles au ""Narnia"" de Greta Gerwig : une première","Netflix va accorder une large diffusion en salles au ""Narnia"" de Greta Gerwig, en sortant le film près de deux mois avant de le rendre disponible en streaming - une première pour le géant du divertissement. ...",https://www.lalibre.be/resizer/v2/N3RDYZZBORF6PH2VFWOXCJRAUY.jpg?auth=b0e383d783c285e9d39c9bc846a908c0a662737b20cee2e857adb9e200b14f28&width=1200&height=630&quality=85&focal=1864%2C1181,2026-05-04T20:49:22Z,http://web.archive.org/web/20260505064021/https://www.lalibre.be/culture/cinema/2026/05/04/netflix-accorde-une-large-diffusion-en-salles-au-narnia-de-greta-gerwig-une-premiere-A4UJDZTATBFRTFFXA7LARLEROA/,"Lorsqu'il consent à sortir un film en salles, c'est en général sur un laps de temps très court, soit pour rendre le film éligible aux Oscars, soit pour réaliser un coup marketing.
La Belgique impose… [+1638 chars]",,fr,'Greta Gerwig'
https://atlantico.fr/article/decryptage/vladimir-poutine-sous-pression-ces-rumeurs-de-coup-de-detat-qui-agitent-le-monde-du-renseignement-europeen-et-le-president-russe-lui-meme-louis-duclos,https://atlantico.fr/article/decryptage/vladimir-poutine-sous-pression-ces-rumeurs-de-coup-de-detat-qui-agitent-le-monde-du-renseignement-europeen-et-le-president-russe-lui-meme-louis-duclos,0,atlantico.fr,Vladimir Poutine sous pression : ces rumeurs de coup de d’Etat qui agitent le monde du renseignement européen (et le président russe lui-même ?),"Un ex-ministre de la Défense marginalisé, un proche collaborateur arrêté, des purges militaires à répétition, près de mille gardes du corps pour un seul homme : les signaux qui s'accumulent autour de Poutine ressemblent moins à ceux d'un régime triomphant que…",https://atlantico.codexcdn.net/assets/as4FjzEep29KzmErC.jpg?width=700&height=500&quality=75,2026-05-05T06:59:00Z,http://web.archive.org/web/20260506020928/https://atlantico.fr/article/decryptage/vladimir-poutine-sous-pression-ces-rumeurs-de-coup-de-detat-qui-agitent-le-monde-du-renseignement-europeen-et-le-president-russe-lui-meme-louis-duclos,"Un ex-ministre de la Défense marginalisé, un proche collaborateur arrêté, des purges militaires à répétition, près de mille gardes du corps pour un seul homme : les signaux qui s'accumulent autour de… [+282 chars]",,fr,'Poutine'
https://www.presse-citron.net/un-palais-volant-qatari-pour-transporter-donald-trump-on-sait-quand-le-remplacant-temporaire-de-air-force-one-sera-operationnel/,https://www.presse-citron.net/un-palais-volant-qatari-pour-transporter-donald-trump-on-sait-quand-le-remplacant-temporaire-de-air-force-one-sera-operationnel/,0,www.presse-citron.net,Un « palais volant » qatari pour transporter Donald Trump : on sait quand le remplaçant temporaire de Air Force One sera opérationnel,"Le futur Boeing 747 présidentiel vient de terminer ses essais en vol. Cadeau diplomatique à 400 millions de dollars, de la part du Qatar, le quadriréacteur remplacera temporairement Air Force One, en attendant une livraison de Boeing. De quoi permettre à Dona…",https://www.presse-citron.net/app/uploads/2026/05/remplacant-air-force-one-boeing-747-qatari-1600x900.jpg,2026-05-05T09:30:42Z,,"Le ciel du Texas a vu voler un étranger quadriréacteurs ces dernières semaines : un Boeing 747-8 de la flotte royale qatarie. Malgré sa provenance, cet avion sera bientôt à la tête de la présidence a… [+2309 chars]",,fr,'Donald Trump'
https://www.journaldugeek.com/2026/05/05/narnia-netflix-cede-a-greta-gerwig-et-renie-ses-principes-fondateurs/,https://www.journaldugeek.com/2026/05/05/narnia-netflix-cede-a-greta-gerwig-et-renie-ses-principes-fondateurs/,0,www.journaldugeek.com,Narnia : Netflix cède à Greta Gerwig et renie ses principes fondateurs,"La réalisatrice de Barbie a obtenu gain de cause, son Narnia va profiter d'une sortie exclusive au cinéma partout dans le monde. Pourquoi c'est un jour à marquer d'une pierre blanche pour Netflix ?",https://www.journaldugeek.com/app/uploads/2026/05/narnia-netflix-sortie-cinema-1600x900.jpg,2026-05-05T11:34:48Z,,"Narnia : Le Neveu du Magicien accuse un important retard. Promise à une sortie en décembre sur Netflix, cette nouvelle adaptation des romans de C.S Lewis n’arrivera finalement pas avant le mois d’avr… [+3158 chars]",,fr,'Daniel Craig'
https://www.huffingtonpost.fr/divertissement/video/le-met-gala-2026-a-tout-d-un-grand-jeu-de-piste-entre-les-uvres-d-art-et-les-stars_263400.html,https://www.huffingtonpost.fr/divertissement/video/le-met-gala-2026-a-tout-d-un-grand-jeu-de-piste-entre-les-uvres-d-art-et-les-stars_263400.html,0,www.huffingtonpost.fr,"Le Met gala 2026 a tout d’un grand jeu de piste, entre les œuvres d’art et les stars","Saurez-vous reconnaître les peintures auxquelles Madonna, Hunter Schafer, Gracie Abrams et leurs consœurs ont fait référence dans leurs looks sur le tapis rouge ? On vous met au défi.",https://focus.huffingtonpost.fr/2026/05/05/0/0/1920/1080/1820/1023/75/0/174e99f_upload-1-mbhnqetlfeqy-met.jpg,2026-05-05T12:28:13Z,,"La lecture de ce contenu est susceptible dentraîner un dépôt de cookies de la part de lopérateur tiers qui lhéberge. Compte-tenu des choix que vous avez exprimés en matière de dépôt de cookies, nous … [+3084 chars]",,fr,'Hunter Schafer'
https://www.franceinfo.fr/culture/cinema/la-prochaine-production-netflix-de-greta-gerwig-narnia-le-neveu-du-magicien-beneficiera-d-une-large-diffusion-en-salles_7984883.html,https://www.franceinfo.fr/culture/cinema/la-prochaine-production-netflix-de-greta-gerwig-narnia-le-neveu-du-magicien-beneficiera-d-une-large-diffusion-en-salles_7984883.html,0,www.franceinfo.fr,"La prochaine production Netflix de Greta Gerwig, ""Narnia : Le neveu du Magicien"", bénéficiera d'une large diffusion en salles","Contrairement à ses précédentes productions, le géant américain du streaming ne publiera le film sur sa plateforme que deux mois après sa sortie en salles.",https://www.franceinfo.fr/pictures/mih5SqrbOhy2yR-olLGy1jgoZpc/0x84:7008x4026/1500x843/2026/05/05/69f9f4a8d3c3a839154586.jpg,2026-05-05T14:25:20Z,,"Netflix va accorder une large diffusion en salles au Narnia de Greta Gerwig, en sortant le film près de deux mois avant de le rendre disponible en streaming - une première pour le géant du divertisse… [+3003 chars]",,fr,'Daniel Craig'
https://www.journaldugeek.com/2026/05/05/james-bond-007-first-light-tout-ce-que-lon-sait-a-ce-jour-infos-annonces-date-de-sortie-lieux-personnages/,https://www.journaldugeek.com/2026/05/05/james-bond-007-first-light-tout-ce-que-lon-sait-a-ce-jour-infos-annonces-date-de-sortie-lieux-personnages/,0,www.journaldugeek.com,"James Bond : 007 First Light : tout ce que l’on sait à ce jour (infos, annonces, date de sortie, lieux, personnages…)",Découvrez dès maintenant toutes les informations que l'on sait sur le prochain jeu vidéo James Bond : 007 First Light.,https://www.journaldugeek.com/app/uploads/2025/10/Dossiers-JDG-007-First-Light-1600x900.jpg,2026-05-05T16:02:02Z,,"Annoncé depuis de nombreuses années, IO Interactive a enfin levé le voile sur son Project 007 avec l’annonce et la présentation de First Light, le prochain jeu James Bond qui arrivera en 2026 sur PC,… [+14702 chars]",,fr,'Daniel Craig'
https://www.presse-citron.net/immigration-donald-trump-recule-decision-lamentable-cree-penurie-medecins/,https://www.presse-citron.net/immigration-donald-trump-recule-decision-lamentable-cree-penurie-medecins/,0,www.presse-citron.net,Immigration : Donald Trump recule sur cette décision lamentable qui a créé une pénurie de médecins,"Après avoir gelé les visas de milliers de médecins étrangers au nom de la sécurité nationale, l'administration Trump vient de faire machine arrière. Un rétropédalage en urgence pour éviter un infarctus du système de santé américain, déjà bien assez amoché.",https://www.presse-citron.net/app/uploads/2026/05/Medecin-1600x900.jpg,2026-05-05T16:02:46Z,,"La politique migratoire de Donald Trump est à l’image de celle qu’il mène contre l’infrastructure scientifique du pays : polarisante, pour rester poli. Le gouvernement, visiblement, ne semble pas fai… [+3504 chars]",,fr,'Donald Trump'
https://www.lalibre.be/culture/cinema/films/2026/05/06/billie-eilish-titanesque-N76MYC62FREFHEJ2SZT6RCL3BM/,https://www.lalibre.be/culture/cinema/films/2026/05/06/billie-eilish-titanesque-N76MYC62FREFHEJ2SZT6RCL3BM/,0,www.lalibre.be,"Billie Eilish, titanesque","La star californienne de 24 ans touche désormais toutes les générations. Et fait même chavirer James Cameron, qui l’a suivie en tournée dans “Billie Eilish – Hit Me Hard and Soft : The Tour”, à voir en 3D dès ce mercredi sur grand écran. ...",https://www.lalibre.be/resizer/v2/Q7IQTE55MFDSZN3LDTFD2VOT64.jpg?auth=3e8301729e2c3c299cb34e5af85f9c5d7871b159e9140ed5c80a40d90430aa1b&width=1200&height=630&quality=85&focal=1836%2C1225,2026-05-06T07:43:31Z,,"Le titre inaugurait le succès prodige, quatre ans plus tard, de l'album When We All Fall Asleep, Where Do We Go ? (Quand on s'endort, où va-t-on ?), sorti en mars 2019 et lauréat d'une flopée de Gram… [+3230 chars]",,fr,'Billie Eilish'
https://www.franceinfo.fr/replay-magazine/franceinfo/l-invite-politique/l-invite-politique-du-mercredi-06-mai-2026_7942355.html,https://www.franceinfo.fr/replay-magazine/franceinfo/l-invite-politique/l-invite-politique-du-mercredi-06-mai-2026_7942355.html,0,www.franceinfo.fr,"Carburants : Maud Bregeon, ministre de l'Énergie, confirme de nouvelles aides ""pour une partie des Français qui ne sont pas concernés par les mesures mises en place""","Voir ou revoir l'émission Carburants : Maud Bregeon, ministre de l'Énergie, confirme de nouvelles aides ""pour une partie des Français qui ne sont pas concernés par les mesures mises en place"". Interrogée sur la réponse du gouvernement à la hausse des prix du …",https://www.franceinfo.fr/pictures/Ga_JBvyLBZP4NR-UJngBzsQi4iE/8x0:1381x772/1500x843/2026/05/06/69fb14bb99997708490897.jpg,2026-05-06T10:16:24Z,,"Interrogée sur la réponse du gouvernement à la hausse des prix du carburant, après que le Premier ministre a déclaré vouloir ""changer d'ampleur et d'échelle"", la ministre et porte-parole de l'exécuti… [+5803 chars]",,fr,'Maud Bregeon'
https://www.bfmtv.com/politique/gouvernement/navire-cma-cgm-touche-dans-le-detroit-d-ormuz-emmanuel-macron-assure-que-ce-n-est-en-aucun-cas-la-france-qui-a-ete-visee_AD-202605060488.html,https://www.bfmtv.com/politique/gouvernement/navire-cma-cgm-touche-dans-le-detroit-d-ormuz-emmanuel-macron-assure-que-ce-n-est-en-aucun-cas-la-france-qui-a-ete-visee_AD-202605060488.html,0,www.bfmtv.com,"Navire CMA CGM touché dans le détroit d'Ormuz: Emmanuel Macron assure que ""ce n'est en aucun cas la France qui a été visée""","Un cargo appartenant à la compagnie française CMA CGM a été touché mardi 5 mai dans le détroit d'Ormuz dans une ""attaque"" lors de laquelle plusieurs membres d'équipage ont été blessés.",https://images.bfmtv.com/JLFcWgft5pag0sHh5__9ybS53c8=/0x106:2048x1258/2048x0/images/Emmanuel-Macron-s-adresse-aux-journalistes-a-son-arrivee-a-Nicosie-pour-une-reunion-informelle-du-Conseil-europeen-le-24-avril-2026-2275560.jpg,2026-05-06T10:54:55Z,,"Un cargo appartenant à la compagnie française CMA CGM a été touché mardi 5 mai dans le détroit d'Ormuz dans une ""attaque"" lors de laquelle plusieurs membres d'équipage ont été blessés.
La France n'a… [+1768 chars]",,fr,'Maud Bregeon'
