index,url,valid,domain,title,description,image,published,archive,content,quote,language,keyword
https://www.bfmtv.com/culture/spectacles-expositions/la-beatlemania-vue-par-paul-mc-cartney-des-cliches-oublies-exposes-a-aix-en-provence_AD-202607030828.html,https://www.bfmtv.com/culture/spectacles-expositions/la-beatlemania-vue-par-paul-mc-cartney-des-cliches-oublies-exposes-a-aix-en-provence_AD-202607030828.html,0,www.bfmtv.com,"La ""Beatlemania"" vue par Paul McCartney: des clichés oubliés exposés à Aix-en-Provence","À partir du 4 juillet et jusqu'au 3 janvier 2027, environ 250 photos prises par le chanteur sont exposées au musée Granet d'Aix-en-Provence. Elles ont été prises entre octobre 1963 et février 1964.",https://images.bfmtv.com/FmV1ErUlvI5L_1cFG-DoiI-IcWA=/0x192:2048x1344/2048x0/images/Le-livre-de-photos-1964-Eyes-of-the-Storm-a-Londres-le-13-juin-2023-2314863.jpg,2026-07-03T17:27:31Z,http://web.archive.org/web/20260703185245/https://www.bfmtv.com/culture/spectacles-expositions/la-beatlemania-vue-par-paul-mc-cartney-des-cliches-oublies-exposes-a-aix-en-provence_AD-202607030828.html,"À partir du 4 juillet et jusqu'au 3 janvier 2027, environ 250 photos prises par le chanteur sont exposées au musée Granet d'Aix-en-Provence. Elles ont été prises entre octobre 1963 et février 1964.
… [+3784 chars]",,fr,'Paul McCartney'
https://www.20minutes.fr/monde/israel/4232782-20260703-guerre-iran-talibans-pakistanais-gardiens-revolution-deplace-funerailles-ali-khamenei,https://www.20minutes.fr/monde/israel/4232782-20260703-guerre-iran-talibans-pakistanais-gardiens-revolution-deplace-funerailles-ali-khamenei,0,www.20minutes.fr,"Guerre en Iran : Talibans, Pakistanais, gardiens de la révolution… Qui s’est déplacé pour les funérailles d’Ali Khamenei ?","Des responsables iraniens et étrangers se recueillent depuis vendredi devant le cercueil d’Ali Khamenei à Téhéran, avant des funérailles nationales qui s’annoncent comme les plus importantes de l’histoire de l’Iran",https://img.20mn.fr/Cbrm5T_aSiaJmDsGHahuvCk/1444x920_une-famille-iranienne-passe-devant-un-panneau-d-affichage-presentant-une-photo-du-guide-supreme-iranien-assassine-ali-khamenei-avant-ses-funerailles-a-la-grande-mosalla-de-teheran-le-3-juillet-2026-les-preparatifs-pour-les-funerailles-de-khamenei-battaient-leur-plein-le-3-juillet-les-autorites-s-attendant-a-ce-que-des-millions-de-personnes-et-une-coterie-de-dignitaires-etrangers-assistent-a-la-ceremonie-officielle-photo-d-atta-kenare-afp,2026-07-03T19:08:03Z,http://web.archive.org/web/20260703232248/https://www.20minutes.fr/monde/israel/4232782-20260703-guerre-iran-talibans-pakistanais-gardiens-revolution-deplace-funerailles-ali-khamenei,"Quatre mois après sa mort dans une frappe israélo-américaine, Ali Khamenei est au cur dun immense hommage national en Iran. Depuis vendredi, des responsables politiques, militaires et religieux défil… [+2519 chars]",,fr,'Ali Khamenei'
https://www.bfmtv.com/politique/elections/presidentielle/direct-presidentielle-2027-jordan-bardella-et-marine-le-pen-attendus-dans-le-pas-de-calais-fabien-roussel-a-lille_LN-202607040151.html,https://www.bfmtv.com/politique/elections/presidentielle/direct-presidentielle-2027-jordan-bardella-et-marine-le-pen-attendus-dans-le-pas-de-calais-fabien-roussel-a-lille_LN-202607040151.html,0,www.bfmtv.com,"DIRECT. Présidentielle 2027: Jordan Bardella et Marine Le Pen attendus dans le Pas-de-Calais, Fabien Roussel à Lille","En ordre de marche pour l'élection présidentielle de 2027, les partis politiques se mobilisent ce samedi 4 juillet. Pendant que le Rassemblement national convie ses adhérents dans le Pas-de-Calais, le Parti communiste se réunit à Lille. D'autres figures polit…",https://images.bfmtv.com/uOdVjOjPvngVcu3ckRTJWy83SMA=/0x2:1200x677/1200x0/images/Jordan-Bardella-et-Marine-Le-Pen-2203860.jpg,2026-07-04T04:15:00Z,http://web.archive.org/web/20260704210419/https://www.bfmtv.com/politique/elections/presidentielle/direct-presidentielle-2027-jordan-bardella-et-marine-le-pen-attendus-dans-le-pas-de-calais-fabien-roussel-a-lille_LN-202607040151.html,"Le Festival des idées, initiative citoyenne et pluraliste qui se revendique de gauche, organise une série de débats et de rencontres du 3 au 5 juillet à la Charité-sur-Loire, dans la Nièvre.
Pensé a… [+519 chars]",,fr,'Jordan Bardella'
https://atlantico.fr/article/rdv/quand-la-pression-des-melenchonistes-transforme-france-culture-en-fci-france-culture-insoumise,https://atlantico.fr/article/rdv/quand-la-pression-des-melenchonistes-transforme-france-culture-en-fci-france-culture-insoumise,0,atlantico.fr,Quand la pression des mélenchonistes transforme France culture en FCI (France Culture Insoumise),"Sous la pression des Insoumis et de la Société des Journalistes, qui demandent sa tête, l’animateur de la matinale est privé d’édito pour une mise en parallèle jugée ""fallacieuse"" de propos tenus par Jean-Marie Le Pen et Jean-Luc Mélenchon sur les juifs.",https://atlantico.codexcdn.net/assets/askTb6pOnbhCBzNbK.png?width=1600&height=900&quality=75,2026-07-04T05:40:39Z,http://web.archive.org/web/20260705035037/https://atlantico.fr/article/rdv/quand-la-pression-des-melenchonistes-transforme-france-culture-en-fci-france-culture-insoumise,"Sous la pression des Insoumis et de la Société des Journalistes, qui demandent sa tête, lanimateur de la matinale est privé dédito pour une mise en parallèle jugée ""fallacieuse"" de propos tenus par J… [+52 chars]",,fr,'Jean-Luc Mélenchon'
https://www.20minutes.fr/monde/4232413-20260704-iran-funerailles-ayatollah-khamenei-demonstration-force-regime,https://www.20minutes.fr/monde/4232413-20260704-iran-funerailles-ayatollah-khamenei-demonstration-force-regime,0,www.20minutes.fr,"Iran : Les funérailles de l’ayatollah Khamenei, une « démonstration de force » du régime","Les funérailles de l’ayatollah Ali Khamenei, tué fin février, se déroulent sur six jours en Iran, avec une escale en Irak",https://img.20mn.fr/7DFjjBZJROSheDdIOkVUqik/1444x920_des-filles-musulmanes-chiites-tiennent-des-photos-de-l-ayatollah-ali-khamenei-lors-d-une-procession-de-muharram-alors-que-les-personnes-en-deuil-commemorent-le-martyre-de-l-imam-hussein-et-observent-les-rituels-associes-au-mois-sacre-de-muharram-muharram-est-le-premier-mois-du-calendrier-islamique-et-l-un-des-mois-les-plus-sacres-du-calendrier-islamique-les-musulmans-chiites-observent-muharram-comme-une-periode-de-deuil-pour-commemorer-le-martyre-de-l-imam-hussein-petit-fils-du-prophete-mahomet-l-imam-hussein-a-ete-martyrise-le-10e-jour-de-muharram-lors-de-la-bataille-historique-de-karbala-en-680-de-notre-ere-sopa-images-idree-sabbas-23-juin-2026-10-credit-idrees-abbas-sopa-images-sipa-2606240859,2026-07-04T06:02:36Z,http://web.archive.org/web/20260704234631/https://www.20minutes.fr/monde/4232413-20260704-iran-funerailles-ayatollah-khamenei-demonstration-force-regime,"«Historiques et inédites. » LIran sapprête à vivre les funérailles XXL du guide suprême Ali Khamenei, tué par des frappes israélo-américaines fin février. Les cérémonies débutent ce week-end et durer… [+4556 chars]",,fr,'Ali Khamenei'
https://atlantico.fr/article/decryptage/attal-lisnard-le-match-des-propositions-affichees-comme-liberales,https://atlantico.fr/article/decryptage/attal-lisnard-le-match-des-propositions-affichees-comme-liberales,0,atlantico.fr,Attal / Lisnard : le match des propositions (affichées comme) libérales,"Gabriel Attal et David Lisnard revendiquent tous deux un discours libéral, mais ne défendent pas le même projet. L'un veut réformer un État qu'il juge perfectible, l'autre entend en réduire radicalement le périmètre. Au-delà des mesures, c'est une opposition …",https://atlantico.codexcdn.net/assets/aszfJOmxn3FD28rIu.png?width=1600&height=900&quality=75,2026-07-04T06:27:20Z,http://web.archive.org/web/20260704072112/https://atlantico.fr/article/decryptage/attal-lisnard-le-match-des-propositions-affichees-comme-liberales,"Gabriel Attal et David Lisnard revendiquent tous deux un discours libéral, mais ne défendent pas le même projet. L'un veut réformer un État qu'il juge perfectible, l'autre entend en réduire radicalem… [+120 chars]",,fr,'Gabriel Attal'
https://www.huffingtonpost.fr/international/article/en-iran-depuis-la-mort-d-ali-khamenei-qui-tient-vraiment-le-pouvoir_282227.html,https://www.huffingtonpost.fr/international/article/en-iran-depuis-la-mort-d-ali-khamenei-qui-tient-vraiment-le-pouvoir_282227.html,0,www.huffingtonpost.fr,"En Iran, depuis la mort d’Ali Khamenei, qui tient vraiment le pouvoir ?","Les funérailles du guide suprême Ali Khamenei débute à partir de ce samedi 4 juillet en Iran, alors que le régime a été bousculé par des mois de guerre.",https://focus.huffingtonpost.fr/2026/04/20/965/0/7025/3951/1820/1023/75/0/8135765_upload-1-7px40d6e5gjk-afp-20260401-nikoubazl-progover260401-npj4y-v1-highres-progovernmentdemonstrato.jpg,2026-07-04T07:10:06Z,http://web.archive.org/web/20260704111706/https://www.huffingtonpost.fr/international/article/en-iran-depuis-la-mort-d-ali-khamenei-qui-tient-vraiment-le-pouvoir_282227.html,"Mojtaba Khamenei assistera-t-il aux funérailles de son père ? Quatre mois après la mort dAli Khamenei, tué dans une frappe israélo-américaine le 28 février, des cérémonies massives débutent en Iran, … [+5329 chars]",,fr,'Ali Khamenei'
https://atlantico.fr/article/rdv/taylor-swift-a-reeduque-travis-kelce-avant-le-mariage-albert-and-charlene-de-monaco-fete-leur-15e-anniversaire-madonna-and-lourdes-se-battent-froid-pamela-anderson-se-beldochise-brad-pitt-and-angelina-jolie-repartent-en-guerre-kate-moss-devient-fleuriste,https://atlantico.fr/article/rdv/taylor-swift-a-reeduque-travis-kelce-avant-le-mariage-albert-and-charlene-de-monaco-fete-leur-15e-anniversaire-madonna-and-lourdes-se-battent-froid-pamela-anderson-se-beldochise-brad-pitt-and-angelina-jolie-repartent-en-guerre-kate-moss-devient-fleuriste,0,atlantico.fr,"Taylor Swift a rééduqué Travis Kelce avant le mariage, Albert & Charlène de Monaco fêté leur 15e anniversaire; Madonna & Lourdes se battent-froid, Pamela Anderson se beldochise; Brad Pitt & Angelina Jolie repartent en guerre; Kate Moss devient fleuriste","Royautés, Hollywood, romances, ruptures et mariages hors normes : cette semaine, la presse people passe des palais princiers aux tapis rouges, entre confidences intimes, grandes célébrations et rebondissements qui agitent les célébrités du monde entier.",https://atlantico.codexcdn.net/assets/asiyk6Pq6nC1GJw0G.png?width=1600&height=900&quality=75,2026-07-04T07:18:59Z,http://web.archive.org/web/20260704090040/https://atlantico.fr/article/rdv/taylor-swift-a-reeduque-travis-kelce-avant-le-mariage-albert-and-charlene-de-monaco-fete-leur-15e-anniversaire-madonna-and-lourdes-se-battent-froid-pamela-anderson-se-beldochise-brad-pitt-and-angelina-jolie-repartent-en-guerre-kate-moss-devient-fleuriste,"Royautés, Hollywood, romances, ruptures et mariages hors normes : cette semaine, la presse people passe des palais princiers aux tapis rouges, entre confidences intimes, grandes célébrations et rebon… [+53 chars]",,fr,'Brad Pitt'
https://www.courrierinternational.com/article/iran-a-teheran-les-funerailles-d-ali-khamenei-marquent-la-fin-d-une-epoque_246612,https://www.courrierinternational.com/article/iran-a-teheran-les-funerailles-d-ali-khamenei-marquent-la-fin-d-une-epoque_246612,0,www.courrierinternational.com,"À Téhéran, les funérailles d’Ali Khamenei marquent “la fin d’une époque”","Plusieurs dizaines de milliers de personnes se sont rassemblées à Téhéran, samedi 4 juillet, à l’occasion du début des cérémonies de funérailles de l’ayatollah Ali Khamenei. Parmi les manifestants, beaucoup appellent à venger la mort de l’ancien guide suprême…",https://focus.courrierinternational.com/2026/07/04/1/0/5500/3666/1200/630/60/0/ba3eb53_ftp-1-nkr3n7j4bnog-2026-07-04t085719z-2068490953-rc2v6mabocfr-rtrmadp-3-iran-crisis-khamenei.JPG,2026-07-04T09:45:27Z,http://web.archive.org/web/20260704113606/https://www.courrierinternational.com/article/iran-a-teheran-les-funerailles-d-ali-khamenei-marquent-la-fin-d-une-epoque_246612,"La foule a commencé à se rassembler à Téhéran, samedi 4 juillet, à loccasion du début des funérailles publiques dAli Khamenei, lancien guide suprême de la république islamique dIran, tué le 28 févrie… [+1056 chars]",,fr,'Ali Khamenei'
https://www.huffingtonpost.fr/international/article/iran-lors-des-funerailles-d-ali-khamenei-ces-fideles-voulaient-envoyer-un-message-a-donald-trump_282911.html,https://www.huffingtonpost.fr/international/article/iran-lors-des-funerailles-d-ali-khamenei-ces-fideles-voulaient-envoyer-un-message-a-donald-trump_282911.html,0,www.huffingtonpost.fr,"Iran : lors des funérailles d’Ali Khamenei, ces fidèles voulaient envoyer un message à Donald Trump","La cérémonie d’hommage au guide suprême, tué fin février lors des frappes israélo-américaines, a été marquée par des appels à « venger » le « martyr » Khamenei.",https://focus.huffingtonpost.fr/2026/07/04/125/0/1200/675/1820/1023/75/0/160d585_upload-1-b7jzld1j7rsy-afp-20260704-b9946we-v1-midres-iranusisraelwarfuneral.jpg,2026-07-04T10:40:12Z,http://web.archive.org/web/20260704114835/https://www.huffingtonpost.fr/international/article/iran-lors-des-funerailles-d-ali-khamenei-ces-fideles-voulaient-envoyer-un-message-a-donald-trump_282911.html,À voir aussi sur Le HuffPost La lecture de ce contenu est susceptible dentraîner un dépôt de cookies de la part de lopérateur tiers qui lhéberge. Compte-tenu des choix que vous avez exprimés en matiè… [+4640 chars],,fr,'Donald Trump'
https://www.camer.be/93839/5:1/cameroun-francis-ngannou-inaugure-venice-hall-un-empire-a-yaounde-cameroon.html,https://www.camer.be/93839/5:1/cameroun-francis-ngannou-inaugure-venice-hall-un-empire-a-yaounde-cameroon.html,0,www.camer.be,:: Francis Ngannou inaugure Venice Hall : un empire à Yaoundé,"Le 3 juillet 2026, Francis Ngannou, le « Predator » camerounais, a
officiellement inauguré « Venice Hall », un complexe événementiel
ultramoderne situé en plein...",https://www.camer.be/storage/photos/shares/Cameroun2/Venice-Hall040726500.webp,2026-07-04T13:52:11Z,http://web.archive.org/web/20260705021456/https://www.camer.be/93839/5:1/cameroun-francis-ngannou-inaugure-venice-hall-un-empire-a-yaounde-cameroon.html,"Le 3 juillet 2026, Francis Ngannou, le « Predator » camerounais, a officiellement inauguré « Venice Hall », un complexe événementiel ultramoderne situé en plein cœur de Yaoundé, affirmant sa place de… [+3011 chars]",,fr,'Francis Ngannou'
https://www.gamekult.com/actualite/face-a-la-fin-du-support-physique-jean-luc-melenchon-prend-position-contre-rockstar-et-sony-3050871098.html,https://www.gamekult.com/actualite/face-a-la-fin-du-support-physique-jean-luc-melenchon-prend-position-contre-rockstar-et-sony-3050871098.html,0,www.gamekult.com,"Face à la fin du support physique, Jean-Luc Mélenchon prend position contre Rockstar et Sony","Alors que Rockstar Games et Sony menacent sérieusement les droits des joueurs en annonçant la disparition prochaine du support physique, Jean-Luc Mélenchon est l'un des rares politiques à s'être exprimé sur le sujet. Dans un récent post publié sur X, le leade…",https://cdn.gamekult.com/optim/images/news/30/3050871098/face-a-la-disparition-du-support-physique-jean-luc-melenchon-prend-position-contre-rockstar-et-sony-e49ea418__w1920.jpg,2026-07-04T16:35:00Z,http://web.archive.org/web/20260705102604/https://www.gamekult.com/actualite/face-a-la-fin-du-support-physique-jean-luc-melenchon-prend-position-contre-rockstar-et-sony-3050871098.html,"Le 100% dématérialisé, un cauchemar qui devient réalité
L'ouverture des précommandes de Grand Theft Auto VI a vite tourné à la désillusion lorsque Rockstar a dévoilé que les boîtes ne contiendraient… [+2209 chars]",,fr,'Jean-Luc Mélenchon'
https://www.lalibre.be/international/moyen-orient/iran/2026/07/04/funerailles-dali-khamenei-des-millions-diraniens-attendus-a-teheran-pour-un-dernier-adieu-au-guide-supreme-MGXOLMAQKZAMXOHMDN25J6CHKY/,https://www.lalibre.be/international/moyen-orient/iran/2026/07/04/funerailles-dali-khamenei-des-millions-diraniens-attendus-a-teheran-pour-un-dernier-adieu-au-guide-supreme-MGXOLMAQKZAMXOHMDN25J6CHKY/,0,www.lalibre.be,Funérailles d’Ali Khamenei : des millions d’Iraniens attendus à Téhéran pour un dernier adieu au guide suprême,"Le cercueil d’Ali Khamenei est exposé à Téhéran avant six jours de cérémonies, sous haute sécurité et en présence de délégations alliées de l’Iran. ...",https://www.lalibre.be/resizer/v2/YBXDQLVBRFBH5EKY2YEQ44G3GU.jpg?auth=dff0d4789bed736ac0756f574b844d55e84befa4e7ad4fbbbe08c4189cd82d97&width=1200&height=630&quality=85&focal=3000%2C2000,2026-07-04T18:06:53Z,http://web.archive.org/web/20260704220657/https://www.lalibre.be/international/moyen-orient/iran/2026/07/04/funerailles-dali-khamenei-des-millions-diraniens-attendus-a-teheran-pour-un-dernier-adieu-au-guide-supreme-MGXOLMAQKZAMXOHMDN25J6CHKY/,"Pour la plupart vêtus de noir, des partisans y ont afflué samedi dès l'aube, avant même que la télévision d'Etat n'annonce vers 06H00 (02H30 GMT) le début de l'hommage public.
De nombreux participan… [+4237 chars]",,fr,'Ali Khamenei'
https://www.huffingtonpost.fr/politique/article/marine-le-pen-et-jordan-bardella-jouent-la-proximite-a-fond-pour-leur-derniere-sortie-avant-le-jugement_283307.html,https://www.huffingtonpost.fr/politique/article/marine-le-pen-et-jordan-bardella-jouent-la-proximite-a-fond-pour-leur-derniere-sortie-avant-le-jugement_283307.html,0,www.huffingtonpost.fr,Marine Le Pen et Jordan Bardella jouent la proximité à fond pour leur dernière sortie avant le jugement,Les deux leaders du Rassemblement national étaient réunis lors d’un « banquet champêtre » à Liévin dans le Pas-de-Calais ce samedi.,https://focus.huffingtonpost.fr/2026/07/04/122/0/3168/1782/1820/1023/75/0/5be2c64_upload-1-trr0go4ofy9b-afp-20260704-b9a38d9-v1-highres-francepoliticspartiesrn.jpg,2026-07-04T20:11:00Z,,La carte de lunité totale avant lune des décisions de justice les plus importantes dans lhistoire du Rassemblement national. Marine Le Pen et Jordan Bardella ont affiché ce samedi 4 juillet leur prox… [+2948 chars],,fr,'Jean-Luc Mélenchon'
https://www.huffingtonpost.fr/france/article/bernard-arnault-rattrape-par-un-redressement-fiscal-a-plus-de-20-millions-d-euros_283340.html,https://www.huffingtonpost.fr/france/article/bernard-arnault-rattrape-par-un-redressement-fiscal-a-plus-de-20-millions-d-euros_283340.html,0,www.huffingtonpost.fr,Bernard Arnault rattrapé par un redressement fiscal à plus de 20 millions d’euros,"Ce jugement s’apparente à un nouveau chapitre d’une longue saga financière, judiciaire et politique concernant l’homme le plus riche de France.",https://focus.huffingtonpost.fr/2026/07/04/0/0/3817/2147/1820/1023/75/0/550eedd_upload-1-zjx1mzvvikqw-afp-20260617-b7cx3db-v1-highres-francetechnologyindustrysciencefairvivatech.jpg,2026-07-04T20:54:24Z,,"Le patron du géant mondial du luxe LVMH Bernard Arnault rattrapé par le fisc. Lhomme derrière la première fortune de France sest vu infliger un redressement fiscal de près de 22,5 millions deuros, da… [+3146 chars]",,fr,'David Amiel'
https://www.challenges.fr/politique/nous-ne-pratiquons-pas-la-chaise-vide-malgre-les-pressions-insoumises-fabien-roussel-fait-un-pas-de-plus-vers-la-presidentielle_644704,https://www.challenges.fr/politique/nous-ne-pratiquons-pas-la-chaise-vide-malgre-les-pressions-insoumises-fabien-roussel-fait-un-pas-de-plus-vers-la-presidentielle_644704,0,www.challenges.fr,"« Nous ne pratiquons pas la chaise vide » : malgré les pressions insoumises, Fabien Roussel fait un pas de plus vers la présidentielle","Au congrès du PCF à Lille, Fabien Roussel a confirmé sa volonté de briguer l’Élysée malgré les critiques de LFI, qui l'accuse d'être responsable de l'élimination de Mélenchon en 2022.",https://www.challenges.fr/_ipx/f_jpg&enlarge_true&s_1200x630/cha/static/2026-07/58658.HR_3.jpg%3FVersionId=SKOsnVj7xjFXdpvVbyPVq9mul9JmvjWv,2026-07-05T07:45:00Z,,"Au congrès du Parti communiste, Fabien Roussel fait un pas de plus vers une nouvelle candidature à la présidentielle, au grand dam de certains élus de son parti et de La France insoumise, qui lui rep… [+3970 chars]",,fr,'Fabien Roussel'
https://www.huffingtonpost.fr/politique/article/radio-france-denonce-des-pressions-apres-l-appel-de-melenchon-a-eviter-france-culture_283472.html,https://www.huffingtonpost.fr/politique/article/radio-france-denonce-des-pressions-apres-l-appel-de-melenchon-a-eviter-france-culture_283472.html,0,www.huffingtonpost.fr,Radio France dénonce « des pressions » après l’appel de Mélenchon à éviter France Culture,"Jean-Luc Mélenchon a jugé insuffisantes les excuses et sanctions prises par la radio, après la diffusion d’un montage trompeur laissant entendre qu’il avait tenu des propos antisémites.",https://focus.huffingtonpost.fr/2026/07/05/53/0/1024/576/1820/1023/75/0/84edaae_upload-1-hxyzc8cvr31p-afp-20260619-pinto-jeanlucm260619-npiqp-v1-midres-jeanlucmelenchonvisitstheviva.jpg,2026-07-05T08:21:34Z,,"De la friture sur les ondes entre Jean-Luc Mélenchon et Radio France. Après la diffusion sur France Culture dun montage fallacieux le rapprochant de Jean-Marie Le Pen, le candidat LFI à la prochaine … [+3116 chars]",,fr,'Jean-Luc Mélenchon'
https://www.20minutes.fr/politique/4232905-20260705-presidentielle-2027-melenchon-persuade-eliminer-candidat-rn-peut-etre-premier-tour,https://www.20minutes.fr/politique/4232905-20260705-presidentielle-2027-melenchon-persuade-eliminer-candidat-rn-peut-etre-premier-tour,0,www.20minutes.fr,"Présidentielle 2027 : Mélenchon est persuadé « d’éliminer » le candidat RN, « peut-être » même dès le premier tour","Malgré des sondages très pessimistes sur son cas, Jean-Luc Mélenchon se croit capable de déjouer les pronostics et d’éliminer le Rassemblement national",https://img.20mn.fr/0jggaN_OS1KgQp3o5cqGgyk/1444x920_exclusif-le-fondateur-du-parti-de-gauche-francais-la-france-insoumise-lfi-et-candidat-a-la-presidentielle-jean-luc-melenchon-prononce-un-discours-lors-d-une-conference-de-presse-au-siege-du-lfi-a-paris-le-2-juillet-2026-stephane-le-mouton-sipa-lemouton-stephane-260702a031-credit-stephane-lemouton-sipa-2607021444,2026-07-05T11:42:56Z,,Insoumis et confiant. Le leader de La France insoumise Jean-Luc Mélenchon sest dit ce dimanche persuadé d'« éliminer » le candidat du Rassemblement national à la présidentielle quil sagisse de Marine… [+1095 chars],,fr,'Jean-Luc Mélenchon'
https://www.huffingtonpost.fr/international/article/iran-il-y-avait-bien-des-enfants-d-ali-khamenei-aux-obseques-du-guide-supreme-mais-pas-son-successeur_283934.html,https://www.huffingtonpost.fr/international/article/iran-il-y-avait-bien-des-enfants-d-ali-khamenei-aux-obseques-du-guide-supreme-mais-pas-son-successeur_283934.html,0,www.huffingtonpost.fr,"Iran : il y avait bien des enfants d’Ali Khamenei aux obsèques du guide suprême, mais pas son successeur","Mojtaba, qui a succédé à son père après sa mort, reste toujours invisible en public dans son pays.",https://focus.huffingtonpost.fr/2026/07/05/133/0/2550/1434/1820/1023/75/0/06ba8a1_upload-1-hohrhxkxj0sl-afp-20260705-b9ar4mn-v1-highres-iranusisraelwarfuneral.jpg,2026-07-05T15:31:33Z,,La deuxième journée des obsèques nationales de layatollah Ali Khamenei avait lieu ce dimanche 5 juillet à Téhéran. Si la plupart des hauts responsables iraniens étaient réunis pour la grande prière o… [+2695 chars],,fr,'Ali Khamenei'
https://www.franceinfo.fr/politique/edouard-philippe/reportage-je-vais-me-battre-encore-et-encore-edouard-philippe-fixe-le-cap-de-sa-campagne-presidentielle-lors-de-son-premier-meeting-a-paris_8092415.html,https://www.franceinfo.fr/politique/edouard-philippe/reportage-je-vais-me-battre-encore-et-encore-edouard-philippe-fixe-le-cap-de-sa-campagne-presidentielle-lors-de-son-premier-meeting-a-paris_8092415.html,0,www.franceinfo.fr,"""Je vais me battre encore et encore"" : Edouard Philippe fixe le cap de sa campagne présidentielle lors de son premier meeting à Paris","Le favori du bloc central pour la présidentielle 2027, qui a réuni plus de 5 000 personnes dimanche, est au défi de conserver, voire accentuer, l'avance qu'il a dans les sondages face à ses concurrents Gabriel Attal et Bruno Retailleau.",https://www.franceinfo.fr/pictures/pEoac6tXzFB8Egqtwfklh-36hSs/0x0:1024x576/1500x843/2026/07/05/6a4a77a21a66f908005568.jpg,2026-07-05T17:00:57Z,,"""On est ici pour montrer qu'il est soutenu. On espère qu'il va créer une union avec Gabriel Attal et Bruno Retailleau pour créer une vraie force contre les extrêmes"", lâche Andréa Lambert, 28 ans. Co… [+7127 chars]",,fr,'Edouard Philippe'
