index,url,valid,domain,title,description,image,published,archive,content,quote,language,keyword
https://www.huffingtonpost.fr/international/video/lors-de-son-audition-au-congres-sur-l-affaire-epstein-bill-clinton-contraint-de-s-expliquer-sur-une-photo-de-lui-dans-un-jacuzzi_261071.html,https://www.huffingtonpost.fr/international/video/lors-de-son-audition-au-congres-sur-l-affaire-epstein-bill-clinton-contraint-de-s-expliquer-sur-une-photo-de-lui-dans-un-jacuzzi_261071.html,0,www.huffingtonpost.fr,"Lors de son audition sur l’affaire Epstein, Bill Clinton s’explique sur une photo de lui dans un jacuzzi","Entendu pendant plus de quatre heures par une commission parlementaire, l’ancien président a répondu aux questions sur des clichés publiés.",https://focus.huffingtonpost.fr/2026/03/03/10/0/627/352/1820/1023/75/0/044bf6a_upload-1-aw6inqq3lhzo-afp-20260302-99nh6we-v3-highres-usjusticepoliticsepsteinclinton.jpg,2026-03-04T05:46:37Z,,"Une image légèrement pixélisée, un jacuzzi, un visage masqué par un carré noir. Et un ancien président des États-Unis obligé de commenter la scène, sous serment dans le cadre de laffaire Epstein.
Ve… [+2808 chars]",,fr,'Ghislaine Maxwell'
https://www.ledauphine.com/faits-divers-justice/2026/03/04/mort-de-quentin-deranque-deux-nouveaux-suspects-interpelles,https://www.ledauphine.com/faits-divers-justice/2026/03/04/mort-de-quentin-deranque-deux-nouveaux-suspects-interpelles,0,www.ledauphine.com,Rhône. Mort de Quentin Deranque : deux nouveaux suspects interpellés,De nouvelles interpellations dans le cadre de l'enquête sur la mort de Quentin Deranque ont eu lieu ce mercredi. Deux personnes ont été arrêtées.,https://cdn-s-www.ledauphine.com/images/77421AB9-A82A-4E87-8CB4-B123A8237425/FB1200/photo-1772610776.jpg,2026-03-04T07:53:00Z,http://web.archive.org/web/20260305151032/https://www.ledauphine.com/faits-divers-justice/2026/03/04/mort-de-quentin-deranque-deux-nouveaux-suspects-interpelles,"Deux hommes soupçonnés d'avoir participé aux violences contre le militant d'extrême droite radicale Quentin Deranque à Lyon ont été arrêtés mercredi matin, deux semaines après une première vague d'in… [+1242 chars]",,fr,'Quentin Deranque'
https://www.lemonde.fr/societe/article/2026/03/04/mort-de-quentin-deranque-deux-nouveaux-suspects-interpelles-a-lyon_6669466_3224.html,https://www.lemonde.fr/societe/article/2026/03/04/mort-de-quentin-deranque-deux-nouveaux-suspects-interpelles-a-lyon_6669466_3224.html,0,www.lemonde.fr,Mort de Quentin Deranque : deux nouveaux suspects interpellés à Lyon,"Sept personnes ont déjà été mises en examen pour homicide involontaire et complicité. Le procureur de la République de Lyon avait prévenu, le 20 février, qu’il restait « plusieurs personnes à identifier ».",https://img.lemde.fr/2026/02/23/0/0/8256/5504/1440/960/60/0/eaa5bd1_upload-1-qyzhk5ee8vdd-dsc-6638.jpg,2026-03-04T07:55:28Z,,"A lendroit où Quentin Deranque a été battu à mort, à Lyon (Rhône), le 21 février 2026. BRUNO AMSELLEM/DIVERGENCE POUR « LE MONDE »
Deux nouvelles arrestations ont eu lieu mercredi 4 mars dans lenquê… [+2953 chars]",,fr,'Quentin Deranque'
https://www.franceinfo.fr/faits-divers/mort-de-quentin-militant-identitaire-agresse-a-lyon/mort-de-quentin-deranque-deux-nouvelles-interpellations-dans-le-rhone-et-l-aube_7844594.html,https://www.franceinfo.fr/faits-divers/mort-de-quentin-militant-identitaire-agresse-a-lyon/mort-de-quentin-deranque-deux-nouvelles-interpellations-dans-le-rhone-et-l-aube_7844594.html,0,www.franceinfo.fr,Mort de Quentin Deranque : deux nouveaux suspects interpellés dans le Rhône et l'Aube,"Le militant identitaire de 23 ans avait été frappé le 12 février par plusieurs personnes cagoulées, en marge d'une conférence de l'eurodéputée LFI Rima Hassan à Sciences Po Lyon.",https://www.franceinfo.fr/pictures/BAptVcy_hRlr_rpqYP8-g0WwJPk/0x260:5000x3073/1500x843/2026/02/20/080-hl-agesquiere-3066009-69989d620648f039211284.jpg,2026-03-04T08:04:59Z,http://web.archive.org/web/20260304145341/https://www.franceinfo.fr/faits-divers/mort-de-quentin-militant-identitaire-agresse-a-lyon/mort-de-quentin-deranque-deux-nouvelles-interpellations-dans-le-rhone-et-l-aube_7844594.html,"Deux personnes ont été interpellées dans le Rhône et dans l'Aube, mercredi 4 mars, dans le cadre de l'enquête sur la mort de Quentin Deranque, deux semaines après une première vague d'interpellations… [+1425 chars]",,fr,'Quentin Deranque'
https://www.20minutes.fr/justice/4204444-20260304-mort-quentin-deranque-deux-suspects-supplementaires-arretes-pres-lyon,https://www.20minutes.fr/justice/4204444-20260304-mort-quentin-deranque-deux-suspects-supplementaires-arretes-pres-lyon,0,www.20minutes.fr,Mort de Quentin Deranque : Deux suspects supplémentaires arrêtés près de Lyon,"Avec ces deux arrestations, la police pense avoir interpellé tous les participants à la rixe qui a conduit à la mort du militant d’ultradroite",https://img.20mn.fr/Iyv8q6TmQEG9Xl_thu8KtSk/1444x920_des-personnes-defilent-avec-des-drapeaux-en-hommage-au-militant-d-extreme-droite-quentin-deranque-a-lyon-en-france-le-21-fevrier-2026-le-militant-d-extreme-droite-quentin-deranque-est-decede-le-14-fevrier-des-suites-de-blessures-subies-lors-d-un-affrontement-entre-des-partisans-d-extreme-droite-et-d-extreme-gauche-devant-sciences-po-lyon-middle-east-images-mei-fra-as-lmfqd-20260221-033-credit-abolfazl-salmanzadeh-mei-sipa-2602231255,2026-03-04T08:24:42Z,,"«On pense désormais avoir tous ceux qui ont participé directement aux coups portés à Quentin Deranque », indique une source policière. Ce mercredi matin, deux hommes soupçonnés davoir participé aux v… [+1358 chars]",,fr,'Quentin Deranque'
https://www.huffingtonpost.fr/france/article/mort-de-quentin-deranque-deux-nouveaux-suspects-interpelles-pour-le-meurtre-du-militant-d-extreme-droite_261078.html,https://www.huffingtonpost.fr/france/article/mort-de-quentin-deranque-deux-nouveaux-suspects-interpelles-pour-le-meurtre-du-militant-d-extreme-droite_261078.html,0,www.huffingtonpost.fr,Mort de Quentin Deranque : deux nouveaux suspects interpellés pour le meurtre du militant d’extrême droite,"Deux hommes ont été arrêtés dans la région lyonnaise et dans l’Aube, deux semaines après une première vague d’interpellations.",https://focus.huffingtonpost.fr/2026/02/20/205/0/4000/2250/1820/1023/75/0/5aa108a_upload-1-hoiruf0138oo-afp-20260219-hl-mdelaty-3066428-v1-highres-francefarrightfascismidentitariannat.jpg,2026-03-04T08:27:09Z,,Les investigations se poursuivent après le meurtre du militant dextrême droite Quentin Deranque. Deux hommes soupçonnés davoir participé aux violences contre lhomme de 23 ans à Lyon ont été arrêtés c… [+2024 chars],,fr,'Raphaël Arnault'
https://www.presse-citron.net/donald-trump-sattaque-a-la-protection-des-baleines-noires-il-nen-reste-que-380/,https://www.presse-citron.net/donald-trump-sattaque-a-la-protection-des-baleines-noires-il-nen-reste-que-380/,0,www.presse-citron.net,Donald Trump s’attaque à la protection des baleines noires : il n’en reste que 380,Une nouvelle menace majeure pour la biodiversité.,https://www.presse-citron.net/app/uploads/2025/09/donald-trump-eolien-1600x900.jpg,2026-03-04T08:46:08Z,,Donald Trump na jamais fait mystère de son peu dintérêt pour la protection de lenvironnement et cette trajectoire se confirme une nouvelle fois avec cette décision portée par son gouvernement ce mard… [+2538 chars],,fr,'Donald Trump'
https://www.courrierinternational.com/article/a-la-une-du-magazine-iran-une-guerre-a-haut-risque_241300,https://www.courrierinternational.com/article/a-la-une-du-magazine-iran-une-guerre-a-haut-risque_241300,0,www.courrierinternational.com,Iran : une guerre à haut risque,"Chaque semaine, “Courrier international” explique ses choix éditoriaux. Dans le numéro en kiosque le 5 mars, nous consacrons notre Une à la guerre en Iran et à ses conséquences après la mort du guide suprême, Ali Khamenei, tué au premier jour des frappes isra…",https://focus.courrierinternational.com/2026/03/03/0/100/1080/720/1200/630/60/0/cd17cd9_upload-1-f6lw0eqaqoue-1844-une-web.jpg,2026-03-04T08:51:15Z,,"Mort dune canaille (Maariv, quotidien de droite israélien), La plus grande guerre de Trump (Blick, en Suisse), Troisième guerre du Golfe (le quotidien koweïtien Al-Rai), Khamenei mort, le droit inter… [+5891 chars]",,fr,'Ali Khamenei'
https://france3-regions.franceinfo.fr/auvergne-rhone-alpes/rhone/lyon/meurtre-de-quentin-deranque-a-lyon-deux-nouveaux-suspects-interpelles-3308985.html,https://france3-regions.franceinfo.fr/auvergne-rhone-alpes/rhone/lyon/meurtre-de-quentin-deranque-a-lyon-deux-nouveaux-suspects-interpelles-3308985.html,0,france3-regions.franceinfo.fr,Meurtre de Quentin Deranque à Lyon : deux nouveaux suspects interpellés,"Âgés de 22 et 26 ans, deux hommes ont été arrêtés ce mercredi 4 mars dans la région lyonnaise et dans le département de l'Aube. Ils sont soupçonnés d'avoir participé au lynchage du jeune militant nationaliste le 12 février dernier.",https://france3-regions.franceinfo.fr/image/078tboGjQxlSj9lsH_l4hEm9AkI/930x620/regions/2026/03/04/maxnewsworldseven003073-69a7ecb852214247314213.jpg,2026-03-04T08:53:57Z,,"Âgés de 22 et 26 ans, deux hommes ont été arrêtés ce mercredi 4 mars dans la région lyonnaise et dans le département de l'Aube. Ils sont soupçonnés d'avoir participé au lynchage du jeune militant nat… [+1707 chars]",,fr,'Raphaël Arnault'
https://www.challenges.fr/monde/un-signe-que-le-camp-beaucoup-plus-radical-gouverne-desormais-liran-mojtaba-khamenei-fils-du-guide-supreme-tue-favori-pour-lui-succeder_641400,https://www.challenges.fr/monde/un-signe-que-le-camp-beaucoup-plus-radical-gouverne-desormais-liran-mojtaba-khamenei-fils-du-guide-supreme-tue-favori-pour-lui-succeder_641400,0,www.challenges.fr,"Un signe que « le camp beaucoup plus radical » gouverne désormais l’Iran : Mojtaba Khamenei, fils du guide suprême tué, favori pour lui succéder","Après la mort de l’ayatollah Ali Khamenei, l’assemblée religieuse chargée d’élire le prochain guide suprême en Iran devrait choisir son fils, Mojtaba Khamenei, selon des sources du New York Times. La nomination de ce proche des Gardiens de la Révolution pourr…",https://www.challenges.fr/_ipx/f_jpg&enlarge_true&s_1200x630/cha/static/2026-03/50685.HR_0.jpg%3FVersionId=mRJjXPn_ZB2CJWpbnbXF9ey1Ua.vCbgG,2026-03-04T09:54:00Z,,"Les hauts dignitaires religieux chargés de choisir le prochain guide suprême de lIran se sont réunis mardi pour délibérer, et le fils du guide assassiné, layatollah Ali Khamenei, sest imposé comme le… [+445 chars]",,fr,'Mojtaba Khamenei'
https://www.nouvelobs.com/justice/20260304.OBS112879/mort-de-quentin-deranque-deux-nouvelles-arrestations.html,https://www.nouvelobs.com/justice/20260304.OBS112879/mort-de-quentin-deranque-deux-nouvelles-arrestations.html,0,www.nouvelobs.com,Mort de Quentin Deranque : deux nouvelles arrestations,"Ce mercredi, deux hommes soupçonnés d’avoir eu un rôle dans les violences ayant entraîné la mort du militant d’extrême droite radicale Quentin Deranque ont été arrêtés.",https://focus.nouvelobs.com/2026/03/04/0/0/5616/3744/1200/800/0/0/3d87a65_upload-1-unkcfuihudsc-sipa-01255564-000018.jpg,2026-03-04T10:29:24Z,,"Marche à Lyon le 21 février 2026 en hommage à Quentin Deranque, activiste dextrême-droite tué par des militants dextrême-gauche le 12 février 2026. ABOLFAZL SALMANZADEH/MEI/SIPA
Commenter
 Lire plu… [+1597 chars]",,fr,'Quentin Deranque'
https://www.courrierinternational.com/article/scandale-epstein-en-colombie-l-ex-president-conservateur-andres-pastrana-eclabousse-par-l-affaire_241301,https://www.courrierinternational.com/article/scandale-epstein-en-colombie-l-ex-president-conservateur-andres-pastrana-eclabousse-par-l-affaire_241301,0,www.courrierinternational.com,"Epstein : en Colombie, l’ex-président conservateur Andrés Pastrana éclaboussé par l’affaire","Cité 57 fois dans les archives déclassifiées par le ministère de la Justice américain, l’ancien président conservateur Andrés Pastrana est au cœur d’un scandale qui mélange vols sur le “Lolita Express”, photos en uniforme aux côtés de Ghislaine Maxwell et acc…",https://focus.courrierinternational.com/2026/03/04/3/0/6004/4002/1200/630/60/0/7a7d739_upload-1-f9tqcwo404z5-andres-prastana-epstein-maxwell-courrierinternational.jpg,2026-03-04T10:40:58Z,,"En Colombie, lex-président conservateur Andrés Pastrana (1998-2002) est dans la tourmente. En cause : la révélation dune série de documents parmi lesquels se trouve une photo où on le voit poser avec… [+1085 chars]",,fr,'Ghislaine Maxwell'
https://www.lemonde.fr/societe/article/2026/03/04/le-groupe-d-ultradroite-bloc-montpellierain-dissous-en-conseil-des-ministres_6669499_3224.html,https://www.lemonde.fr/societe/article/2026/03/04/le-groupe-d-ultradroite-bloc-montpellierain-dissous-en-conseil-des-ministres_6669499_3224.html,0,www.lemonde.fr,Le groupe d’ultradroite Bloc montpelliérain dissous en conseil des ministres,"Le groupe d’ultradroite de Montpellier a été dissous en raison d’« appels à la violence, à la haine et à la discrimination », a annoncé la porte-parole du gouvernement, Maud Bregeon, à l’issue du conseil des ministres.",https://img.lemde.fr/2026/03/04/0/0/4509/3006/1440/960/60/0/3320179_ftp-1-m1ycfiu7oubz-5362066-01-06.jpg,2026-03-04T11:25:20Z,,"Le ministre de lintérieur, Laurent Nuñez, quitte le palais de lElysée, à lissue du conseil des ministres, à Paris, le 4 mars 2026. THOMAS SAMSON/AFP
Un groupe dultradroite de Montpellier, Bloc montp… [+1518 chars]",,fr,'Raphaël Arnault'
https://www.ledauphine.com/politique/2026/03/04/le-groupe-d-ultra-droite-bloc-montpellierain-dissous-en-conseil-des-ministres,https://www.ledauphine.com/politique/2026/03/04/le-groupe-d-ultra-droite-bloc-montpellierain-dissous-en-conseil-des-ministres,0,www.ledauphine.com,Politique. Le groupe d'ultra-droite « Bloc montpelliérain » dissous en Conseil des ministres,"« Trois autres dissolutions de groupuscules violents d’ultragauche comme d’ultradroite feront suite », a indiqué la porte-parole du gouvernement Maud Bregeon.",https://cdn-s-www.ledauphine.com/images/AD21B611-C6A5-41A2-9087-E2B85B0992B3/FB1200/photo-1772621102.jpg,2026-03-04T11:27:00Z,,"Un groupe d'ultra droite de Montpellier, dénommé « Bloc montpelliérain », a été dissous mercredi en raison « d'appels à la violence, à la haine et à la discrimination », a annoncé la porte-parole du … [+1455 chars]",,fr,'Maud Bregeon'
https://www.courrierinternational.com/video/video-a-washington-un-jeffrey-epstein-walk-of-shame_241319,https://www.courrierinternational.com/video/video-a-washington-un-jeffrey-epstein-walk-of-shame_241319,0,www.courrierinternational.com,"À Washington, un “Jeffrey Epstein Walk of Shame”","À seulement quelques mètres de la Maison-Blanche, des autocollants imitant les étoiles des vedettes de Hollywood Boulevard affichent les noms des personnes citées dans les dossiers Epstein.",https://focus.courrierinternational.com/2026/03/01/0/0/6000/4000/1200/630/60/0/c63eb7f_ftp-1-03on7qedidnm-afp-99gu6c4.jpg,2026-03-04T11:51:02Z,,"Il y a le Walk of Fame, ce célèbre trottoir de Hollywood Boulevard, à Los Angeles, où sont incrustées des étoiles aux noms des plus grandes stars de lindustrie du spectacle.
Et depuis ce 1er mars, à… [+1322 chars]",,fr,'Jeffrey Epstein'
https://www.courrierinternational.com/article/succession-mojtaba-fils-de-l-ayatollah-khamenei-sera-t-il-le-prochain-guide-supreme-iranien_241314,https://www.courrierinternational.com/article/succession-mojtaba-fils-de-l-ayatollah-khamenei-sera-t-il-le-prochain-guide-supreme-iranien_241314,0,www.courrierinternational.com,"Mojtaba, fils de l’ayatollah Khamenei, sera-t-il le prochain guide suprême iranien ?","L’éventuelle désignation du fils de l’ayatollah Ali Khamenei, réputé proche des Gardiens de la révolution islamique, risque de susciter des remous en Iran et l’ire des États-Unis, estiment certains médias. Le message envoyé serait que l’Iran n’est prêt à aucu…",https://focus.courrierinternational.com/2026/03/04/0/0/4386/2924/1200/630/60/0/5128915_upload-1-t0ei1n8ldg3q-089-mei-irn-rf-imksl-20190531-003.jpg,2026-03-04T14:36:37Z,,"Qui sera le prochain guide suprême iranien et aurait-il déjà été désigné officieusement ? sinterroge ce matin la presse étrangère. Selon The New York Times, le fils de layatollah Ali Khamenei tué sam… [+1058 chars]",,fr,'Mojtaba Khamenei'
https://www.huffingtonpost.fr/france/video/guerre-en-iran-a-quoi-va-servir-le-deploiement-du-porte-avions-charles-de-gaulle-en-mediterranee_261093.html,https://www.huffingtonpost.fr/france/video/guerre-en-iran-a-quoi-va-servir-le-deploiement-du-porte-avions-charles-de-gaulle-en-mediterranee_261093.html,0,www.huffingtonpost.fr,Guerre en Iran : à quoi va servir le déploiement du porte-avions Charles de Gaulle en Méditerranée ?,"Face à l’embrasement au Moyen-Orient, Emmanuel Macron a annoncé l’envoi dans la région de l’unique porte-avions français.",https://focus.huffingtonpost.fr/2026/03/04/0/0/1920/1080/1820/1023/75/0/9a64b58_upload-1-2fnfybgaouki-vignette-00-01-59-07-still001.jpg,2026-03-04T14:40:14Z,,"La lecture de ce contenu est susceptible dentraîner un dépôt de cookies de la part de lopérateur tiers qui lhéberge. Compte-tenu des choix que vous avez exprimés en matière de dépôt de cookies, nous … [+2365 chars]",,fr,'Emmanuel Macron'
https://www.bfmtv.com/international/moyen-orient/iran/l-iran-estime-que-donald-trump-avec-les-pitreries-de-benjamin-netanyahu-a-entraine-le-peuple-americain-dans-une-guerre-injuste_AD-202603040695.html,https://www.bfmtv.com/international/moyen-orient/iran/l-iran-estime-que-donald-trump-avec-les-pitreries-de-benjamin-netanyahu-a-entraine-le-peuple-americain-dans-une-guerre-injuste_AD-202603040695.html,0,www.bfmtv.com,"L'Iran estime que Donald Trump, ""avec les pitreries"" de Benjamin Netanyahu, a entraîné ""le peuple américain dans une guerre injuste""","Ali Larijani, chef du plus haut organe de sécurité iranien, a affirmé sur X que ""Monsieur Trump, avec les pitreries (du Premier ministre israélien Benjamin) Netanyahu, a entraîné le peuple américain dans une guerre injuste contre l'Iran"".",https://images.bfmtv.com/1mol47uqjSlXmUSmjdcilRuWgiQ=/0x106:2048x1258/2048x0/images/Le-chef-du-Conseil-de-securite-iranien-evoque-des-progres-en-vue-de-negociations-avec-les-Etats-Unis-2227050.jpg,2026-03-04T16:16:30Z,http://web.archive.org/web/20260305002204/https://www.bfmtv.com/international/moyen-orient/iran/l-iran-estime-que-donald-trump-avec-les-pitreries-de-benjamin-netanyahu-a-entraine-le-peuple-americain-dans-une-guerre-injuste_AD-202603040695.html,"Ali Larijani, chef du plus haut organe de sécurité iranien, a affirmé sur X que ""Monsieur Trump, avec les pitreries (du Premier ministre israélien Benjamin) Netanyahu, a entraîné le peuple américain … [+577 chars]",,fr,'Ali Larijani'
https://www.huffingtonpost.fr/politique/article/aux-municipales-le-bruit-de-jean-luc-melenchon-peut-il-provoquer-la-fureur-dans-les-urnes_261090.html,https://www.huffingtonpost.fr/politique/article/aux-municipales-le-bruit-de-jean-luc-melenchon-peut-il-provoquer-la-fureur-dans-les-urnes_261090.html,0,www.huffingtonpost.fr,"Aux municipales, le bruit de Jean-Luc Mélenchon peut-il provoquer la fureur dans les urnes ?","Très actif pendant la campagne, le patron de La France insoumise mise sur la conflictualité pour faire venir aux urnes les abstentionnistes.",https://focus.huffingtonpost.fr/2026/03/04/0/0/8256/4644/1820/1023/75/0/170e3cc_upload-1-skedjwds3ead-afp-20260109-928v878-v1-highres-francepoliticspartieslfinewyear.jpg,2026-03-05T05:00:16Z,,"EN BREFJean-Luc Mélenchon utilise la conflictualité pour mobiliser les abstentionnistes, malgré les critiques sur sa stratégie et ses polémiques.Les sondages montrent une progression des candidats LF… [+5887 chars]",,fr,'Jean-Luc Mélenchon'
https://www.franceinfo.fr/elections/pour-rester-la-force-politique-principale-lr-tiraille-entre-ses-alliances-avec-le-centre-et-la-tentation-de-l-extreme-droite_7826504.html,https://www.franceinfo.fr/elections/pour-rester-la-force-politique-principale-lr-tiraille-entre-ses-alliances-avec-le-centre-et-la-tentation-de-l-extreme-droite_7826504.html,0,www.franceinfo.fr,"Pour ""rester la force politique principale"", LR tiraillé entre ses alliances avec le centre et la tentation de l'extrême droite","Bien installée dans de nombreuses communes, la droite doit absolument se maintenir si elle veut continuer de peser au Sénat. A un an de la présidentielle, le patron du parti, Bruno Retailleau, espère aussi quelques victoires symboliques pour doper sa candidat…",https://www.franceinfo.fr/pictures/-Psef1eJMasmYw4uL_z_y_jvbLw/0x0:3840x2160/1500x843/2026/02/24/da-municipales-enjeux-lr-02-699de18800d8f621651526.jpg,2026-03-05T05:09:37Z,http://web.archive.org/web/20260305080754/https://www.franceinfo.fr/elections/pour-rester-la-force-politique-principale-lr-tiraille-entre-ses-alliances-avec-le-centre-et-la-tentation-de-l-extreme-droite_7826504.html,"Au QG des Républicains, on aborde les élections municipales avec le calme d'un parti à l'ancrage local solide. ""Il y a 1 000 communes de plus de 9 000 habitants, et 519 sont dirigées par la droite"", … [+10020 chars]",,fr,'Quentin Deranque'
https://www.franceinfo.fr/monde/iran/guerre-entre-les-etats-unis-israel-et-l-iran/guerre-au-moyen-orient-la-stabilite-financiere-n-est-pas-en-risque-affirme-le-gouverneur-de-la-banque-de-france_7846991.html,https://www.franceinfo.fr/monde/iran/guerre-entre-les-etats-unis-israel-et-l-iran/guerre-au-moyen-orient-la-stabilite-financiere-n-est-pas-en-risque-affirme-le-gouverneur-de-la-banque-de-france_7846991.html,0,www.franceinfo.fr,"Guerre au Moyen-Orient : ""La stabilité financière n'est pas en risque"", affirme le gouverneur de la Banque de France","François Villeroy de Galhau reconnaît que l'économie mondiale fait face à ""une accumulation de chocs qui crée une très grande incertitude et une très grande imprévisibilité"". Une situation, qui selon lui, dépendra de la durée du conflit.",https://www.franceinfo.fr/pictures/dy6pTzAl8u9uIG7Gs-xGLEcjc3M/0x53:1024x629/1500x843/2026/03/05/000-94xl4gm-69a9337def4af821858700.jpg,2026-03-05T08:48:29Z,http://web.archive.org/web/20260305103750/https://www.franceinfo.fr/monde/iran/guerre-entre-les-etats-unis-israel-et-l-iran/guerre-au-moyen-orient-la-stabilite-financiere-n-est-pas-en-risque-affirme-le-gouverneur-de-la-banque-de-france_7846991.html,"""Nous suivons d'extrêmement près la situation parce qu'elle est sérieuse, mais il est trop tôt pour en tirer des prévisions économiques"", déclare François Villeroy de Galhau, gouverneur de la Banque … [+3406 chars]",,fr,'Maud Bregeon'
https://www.20minutes.fr/monde/etats-unis/4204634-20260305-guerre-iran-proche-guide-supreme-possible-choix-trump-negociations-ali-larijani,https://www.20minutes.fr/monde/etats-unis/4204634-20260305-guerre-iran-proche-guide-supreme-possible-choix-trump-negociations-ali-larijani,0,www.20minutes.fr,Guerre en Iran : Proche du guide suprême et possible choix de Trump pour les négociations… Qui est Ali Larijani ?,"Secrétaire du Conseil suprême de sécurité nationale, Ali Larijani est considéré comme l’un des hommes les plus influents du régime depuis la mort de l’ayatollah Ali Khamenei",https://img.20mn.fr/w0omXVTgSPugB-WIqwkFSCk/1444x920_cette-combinaison-montre-le-president-donald-trump-a-mar-a-lago-le-lundi-29-decembre-2025-a-palm-beach-en-floride-et-le-secretaire-iranien-du-conseil-supreme-de-securite-nationale-ali-larijani-a-beyrouth-au-liban-le-mercredi-13-aout-2025-ap-photo-alex-brandon-bilal-hussein-lgk303-26002355356956-photo-d-archive-2601021100,2026-03-05T09:58:08Z,,"Il est peut-être celui que Donald Trump va choisir pour discuter dune transition en Iran. Ministre, président du parlement, candidat à la présidentielle mais surtout très proche conseil du guide supr… [+3019 chars]",,fr,'Ali Khamenei'
https://www.lemonde.fr/international/article/2026/03/05/iran-les-moudjahidin-du-peuple-comptent-participer-a-la-chute-du-regime_6669633_3210.html,https://www.lemonde.fr/international/article/2026/03/05/iran-les-moudjahidin-du-peuple-comptent-participer-a-la-chute-du-regime_6669633_3210.html,0,www.lemonde.fr,Iran : Les Moudjahidin du peuple comptent participer à la chute du régime,"Retirés de la liste des organisations terroristes de l’Union européenne en 2009, les Moudjahidin du peuple affirment avoir attaqué le Guide suprême avant la frappe américano-israélienne qui a tué Ali Khamenei.",https://img.lemde.fr/2026/03/04/0/0/4999/3333/1440/960/60/0/768a74a_upload-1-cwzurdip02ux-000-98me8t3.jpg,2026-03-05T11:30:14Z,,"Le portrait de Maryam Radjavi, dirigeante de lOrganisation des moudjahidin du peuple iranien, brandi par une manifestante, devant les bureaux des Nations unies, à Genève (Suisse), le 23 février 2026.… [+1290 chars]",,fr,'Ali Khamenei'
