index,url,valid,domain,title,description,image,published,archive,content,quote,language,keyword
https://www.bfmtv.com/politique/europe-ecologie-les-verts/marine-tondelier-prend-acte-que-les-adherents-du-ps-ont-enterre-la-primaire-unitaire-de-la-gauche_AN-202607100418.html,https://www.bfmtv.com/politique/europe-ecologie-les-verts/marine-tondelier-prend-acte-que-les-adherents-du-ps-ont-enterre-la-primaire-unitaire-de-la-gauche_AN-202607100418.html,0,www.bfmtv.com,"Marine Tondelier prend acte que ""les adhérents du PS ont enterré la primaire"" unitaire de la gauche",La patronne des Écologistes entend désormais discuter avec son parti de la stratégie à adopter pour la campagne présidentielle.,https://images.bfmtv.com/KFFcqgAW3feXEsmifOp04ZLPdsc=/0x0:2048x1152/2048x0/images/Marine-Tondelier-a-l-hotel-de-Matignon-le-12-juin-2026-a-Paris-2318329.jpg,2026-07-10T09:22:17Z,http://web.archive.org/web/20260710172454/https://www.bfmtv.com/politique/europe-ecologie-les-verts/marine-tondelier-prend-acte-que-les-adherents-du-ps-ont-enterre-la-primaire-unitaire-de-la-gauche_AN-202607100418.html,"La patronne des Écologistes entend désormais discuter avec son parti de la stratégie à adopter pour la campagne présidentielle.
La secrétaire nationale des Écologistes Marine Tondelier a reconnu ven… [+1673 chars]",,fr,'Marine Tondelier'
https://www.challenges.fr/politique/le-duel-lfi-rn-fait-les-affaires-dedouard-philippe-lheritage-de-pierre-moscovici-les-indiscretions-politiques-de-challenges_644802,https://www.challenges.fr/politique/le-duel-lfi-rn-fait-les-affaires-dedouard-philippe-lheritage-de-pierre-moscovici-les-indiscretions-politiques-de-challenges_644802,0,www.challenges.fr,"Le duel LFI-RN fait les affaires d’Edouard Philippe, l’héritage de Pierre Moscovici… les indiscrétions politiques de Challenges","Dans les indiscrétions politiques de Challenges cette semaine, retrouvez aussi Agnès Pannier-Runacher et Jean-Christophe Cambadélis qui esquissent un rassemblement des modérés contre l’extrême droite, ou encore Jean-Luc Mélenchon qui a trouvé sa banque pour f…",https://www.challenges.fr/_ipx/f_jpg&enlarge_true&s_1200x630/cha/static/2026-07/58880.HR_0.jpg%3FVersionId=CdKdLJrPeFk.l_T9BcrOUhXmvChAah4r,2026-07-10T10:00:00Z,http://web.archive.org/web/20260710110813/https://www.challenges.fr/politique/le-duel-lfi-rn-fait-les-affaires-dedouard-philippe-lheritage-de-pierre-moscovici-les-indiscretions-politiques-de-challenges_644802,"Contre les extrêmes, le rassemblement républicain des modérés, de gauche comme de droite, sesquisse. Cest ce quont initié à lAssemblée nationale deux personnalités qui sont, en principe, de deux bord… [+2753 chars]",,fr,'Jean-Luc Mélenchon'
https://www.huffingtonpost.fr/politique/article/la-primaire-de-la-gauche-en-vue-de-la-presidentielle-2027-est-bel-et-bien-enterree-avec-ce-vote-du-ps_286388.html,https://www.huffingtonpost.fr/politique/article/la-primaire-de-la-gauche-en-vue-de-la-presidentielle-2027-est-bel-et-bien-enterree-avec-ce-vote-du-ps_286388.html,0,www.huffingtonpost.fr,La primaire de la gauche en vue de la présidentielle 2027 est bel et bien enterrée avec ce vote du PS,"Les militants socialistes ont choisi d’organiser un scrutin interne pour désigner leur candidat, loin de la primaire plus large voulue par Olivier Faure et Marine Tondelier.",https://focus.huffingtonpost.fr/2026/07/10/0/0/5529/3110/1820/1023/75/0/f709aa3_upload-1-dt7wum0eyrkl-afp-20250821-726l7q6-v2-highres-francepoliticspartiesecologists.jpg,2026-07-10T11:16:10Z,,"Dure semaine pour Olivier Faure. Mis en minorité sur la motion de censure, quil a décidé de voter avec dix-neuf de ses collègues malgré lavis majoritairement exprimé par son groupe à lAssemblée, le p… [+3778 chars]",,fr,'Olivier Faure'
https://www.courrierinternational.com/article/moyen-orient-l-iran-chercherait-a-assassiner-donald-trump-selon-israel_248147,https://www.courrierinternational.com/article/moyen-orient-l-iran-chercherait-a-assassiner-donald-trump-selon-israel_248147,0,www.courrierinternational.com,"L’Iran chercherait à assassiner Donald Trump, selon Israël","D’après un rapport des renseignements israéliens, le pouvoir iranien aurait mis en place un plan visant à tuer Donald Trump pour venger l’assassinat de plusieurs hauts responsables iraniens, dont l’ayatollah Ali Khamenei.",https://focus.courrierinternational.com/2026/07/09/1/0/5500/3666/1200/630/60/0/6e2e94c_ftp-1-k3s1cq6awfvs-2026-07-09t134207z-1879919058-rc2damaazi16-rtrmadp-3-iran-crisis-khamenei.JPG,2026-07-10T11:50:18Z,,"Selon un rapport des renseignements israéliens fourni aux États-Unis, lIran aurait mis au point un plan visant à assassiner le président américain, Donald Trump, rapportent ce vendredi 10 juillet plu… [+1873 chars]",,fr,'Ali Khamenei'
https://www.courrierinternational.com/article/vu-d-iran-les-funerailles-d-ali-khamenei-plebiscite-pour-le-regime-ou-mascarade_248152,https://www.courrierinternational.com/article/vu-d-iran-les-funerailles-d-ali-khamenei-plebiscite-pour-le-regime-ou-mascarade_248152,0,www.courrierinternational.com,"Les funérailles d’Ali Khamenei, “plébiscite” pour le régime ou “mascarade” ?","Selon la presse locale, les obsèques du guide suprême iranien tué au premier jour de la guerre américano-israélienne contre l’Iran ont rassemblé plusieurs dizaines de millions de personnes. Mais pour les médias d’opposition, ces cérémonies organisées durant p…",https://focus.courrierinternational.com/2026/07/09/0/0/5500/3666/1200/630/60/0/21ff922_ftp-1-xjv6axevva6z-2026-07-09t162321z-1099852977-rc2camam2b78-rtrmadp-3-iran-crisis-khamenei.JPG,2026-07-10T13:13:42Z,,"Les longues funérailles de lancien guide suprême de la République islamique Ali Khamenei, qui se sont déroulées cette semaine en Iran et en Irak, ont rassemblé des dizaines de millions de personnes, … [+1037 chars]",,fr,'Ali Khamenei'
https://www.lesinrocks.com/musique/the-rolling-stones-jack-white-kelela-voici-les-5-albums-de-la-semaine-699364-10-07-2026/,https://www.lesinrocks.com/musique/the-rolling-stones-jack-white-kelela-voici-les-5-albums-de-la-semaine-699364-10-07-2026/,0,www.lesinrocks.com,"The Rolling Stones, Jack White, Kelela… Voici les 5 albums de la semaine !","Ce vendredi 10 juillet, on retrouve aussi dans les bacs les disques de Panda Bear & Sonic Boom ainsi que de Ellen Allien.",https://www.lesinrocks.com/wp-content/thumbnails/uploads/2026/07/highcompress_Screenshot-2026-07-10-at-16.58.10-t-1022x682.jpg,2026-07-10T15:29:31Z,http://web.archive.org/web/20260711032252/https://www.lesinrocks.com/musique/the-rolling-stones-jack-white-kelela-voici-les-5-albums-de-la-semaine-699364-10-07-2026/,"Ce vendredi 10 juillet, on retrouve aussi dans les bacs les disques de Panda Bear &amp; Sonic Boom ainsi que de Ellen Allien. 
Licône electro berlinoise livre un splendide nouvel album, dense et vib… [+3038 chars]",,fr,'Jack White'
https://www.ledauphine.com/societe/2026/07/10/c-est-en-vanoise-que-je-suis-devenue-ecologiste-marine-tondelier-en-campagne-a-tignes,https://www.ledauphine.com/societe/2026/07/10/c-est-en-vanoise-que-je-suis-devenue-ecologiste-marine-tondelier-en-campagne-a-tignes,0,www.ledauphine.com,Politique. « C’est en Vanoise que je suis devenue écologiste » : Marine Tondelier en campagne à Tignes,"La primaire à gauche enterrée, la patronne des Verts poursuit son tour de France en van électrique et présentait vendredi son livret dédié aux territoires d’altitude dans la station savoyarde, naguère bête noire des écolos, mais qui a renoncé à son slogan du …",https://cdn-s-www.ledauphine.com/images/23D5261E-5244-4FC8-9717-2C3C841A5834/FB1200/photo-1783698358.jpg,2026-07-10T15:42:00Z,http://web.archive.org/web/20260711173647/https://www.ledauphine.com/societe/2026/07/10/c-est-en-vanoise-que-je-suis-devenue-ecologiste-marine-tondelier-en-campagne-a-tignes,"Le Dauphiné Libéré, en tant que responsable de traitement, recueille dans ce formulaire des informations qui sont enregistrées dans un fichier informatisé par son Service Relations Clients, la finali… [+854 chars]",,fr,'Marine Tondelier'
https://www.ledauphine.com/defense-guerre-conflit/2026/07/10/trump-maintient-que-le-cessez-le-feu-est-termine-sans-fermer-la-porte-a-l-iran,https://www.ledauphine.com/defense-guerre-conflit/2026/07/10/trump-maintient-que-le-cessez-le-feu-est-termine-sans-fermer-la-porte-a-l-iran,0,www.ledauphine.com,Guerre au Moyen-Orient. Trump maintient que le cessez-le-feu est « terminé »... sans fermer la porte à l'Iran,"Donald Trump a déclaré ce vendredi avoir accepté de continuer les discussions avec l'Iran, mais a réaffirmé que le cessez-le-feu en vigueur depuis avril était bel et bien « terminé »",https://cdn-s-www.ledauphine.com/images/E038DAE9-F5EF-4008-A1A8-452609B2F1FE/FB1200/photo-1783700912.jpg,2026-07-10T16:39:00Z,,"Donald Trump a déclaré ce vendredi avoir accepté de continuer les discussions avec l'Iran, mais a réaffirmé que le cessez-le-feu en vigueur depuis avril était bel et bien « terminé » après la reprise… [+3011 chars]",,fr,'Mojtaba Khamenei'
https://www.20minutes.fr/monde/etats-unis/4234054-20260711-guerre-moyen-orient-renseignement-israelien-assure-iran-chercherait-assassiner-donald-trump,https://www.20minutes.fr/monde/etats-unis/4234054-20260711-guerre-moyen-orient-renseignement-israelien-assure-iran-chercherait-assassiner-donald-trump,0,www.20minutes.fr,Guerre au Moyen-Orient : Le renseignement israélien assure que l’Iran chercherait à assassiner Donald Trump,"Israël a alerté les États-Unis sur un présumé nouveau complot iranien visant Donald Trump, selon plusieurs médias américains",https://img.20mn.fr/5DfvSqMCS3K1d6x7Xr3rLCk/1444x920_mashhad-iran-9-juillet-2026-des-participants-ont-ete-vus-tenant-une-banderole-portant-le-message-en-anglais-nous-allons-tuer-trump-des-milliers-de-personnes-se-rassemblent-sur-le-boulevard-imam-reza-pour-un-dernier-adieu-a-l-ayatollah-khamenei-alors-que-son-cercueil-est-transporte-vers-le-sanctuaire-de-l-imam-reza-de-nombreuses-personnes-en-deuil-brandissent-des-drapeaux-rouges-qui-selon-les-participants-symbolisent-un-appel-a-la-vengeance-contre-les-responsables-de-sa-mort-aux-cotes-d-autres-drapeaux-religieux-associes-a-la-communaute-chiite-la-procession-attire-une-foule-nombreuse-le-long-de-la-route-menant-au-sanctuaire-farnood-sipa-12814-credit-farnood-sipa-2607101612,2026-07-10T23:18:24Z,http://web.archive.org/web/20260710235207/https://www.20minutes.fr/monde/etats-unis/4234054-20260711-guerre-moyen-orient-renseignement-israelien-assure-iran-chercherait-assassiner-donald-trump,"Plusieurs médias américains ont rapporté, jeudi, quIsraël avait transmis à Washington des renseignements selon lesquels lIran préparerait un nouveau projet visant à assassiner le président américain … [+1981 chars]",,fr,'Donald Trump'
https://www.lalibre.be/international/moyen-orient/iran/2026/07/11/trump-maintient-que-le-cessez-le-feu-est-termine-mais-accepte-de-parler-avec-liran-O4OVTTXQCRDU7M3STFMSWQHM3M/,https://www.lalibre.be/international/moyen-orient/iran/2026/07/11/trump-maintient-que-le-cessez-le-feu-est-termine-mais-accepte-de-parler-avec-liran-O4OVTTXQCRDU7M3STFMSWQHM3M/,0,www.lalibre.be,"Trump maintient que le cessez-le-feu est ""terminé"" mais accepte de parler avec l'Iran","Donald Trump a déclaré vendredi avoir accepté de continuer à discuter avec l'Iran, mais a réaffirmé que le cessez-le-feu en vigueur depuis avril était bel et bien ""terminé"" après la reprise des hostilités cette semaine. ...",https://www.lalibre.be/resizer/v2/SK4VXZTO3FHJ3L5W76C7J3DMTM.jpg?auth=79415504ccb6c3e1c6f12b28f2ff4bdaa57b7b936fe8c0750449ea42904996c2&width=1200&height=630&quality=85&focal=1904%2C1269,2026-07-11T05:46:29Z,http://web.archive.org/web/20260712032352/https://www.lalibre.be/international/moyen-orient/iran/2026/07/11/trump-maintient-que-le-cessez-le-feu-est-termine-mais-accepte-de-parler-avec-liran-O4OVTTXQCRDU7M3STFMSWQHM3M/,"""La République islamique d'Iran nous a demandé de continuer +les discussions+. Nous avons accepté de le faire, mais les Etats-Unis leur ont signifié, en des termes sans équivoque, que le cessez-le-fe… [+3087 chars]",,fr,'Mojtaba Khamenei'
https://www.bfmtv.com/international/moyen-orient/iran/guerre-au-moyen-orient-le-guide-supreme-iranien-affirme-dans-un-message-que-la-vengeance-doit-s-accomplir-inevitablement_AN-202607110237.html,https://www.bfmtv.com/international/moyen-orient/iran/guerre-au-moyen-orient-le-guide-supreme-iranien-affirme-dans-un-message-que-la-vengeance-doit-s-accomplir-inevitablement_AN-202607110237.html,0,www.bfmtv.com,"Guerre au Moyen-Orient: le guide suprême iranien affirme dans un message que ""la vengeance doit s'accomplir inévitablement""","""La vengeance doit s'accomplir inévitablement"", menace le guide suprême iranien Mojtaba Khamenei, dans un message rendu public ce samedi 11 juillet.",https://images.bfmtv.com/QyfZFQlxdIvkrMMNsFJXGk9Zbl4=/0x77:2032x1220/2032x0/images/Mojtaba-Khamenei-fils-d-Ali-Khamenei-le-31-mai-2019-a-Teheran-en-Iran-2248736.jpg,2026-07-11T11:18:25Z,,"""La vengeance doit s'accomplir inévitablement"", menace le guide suprême iranien Mojtaba Khamenei, dans un message rendu public ce samedi 11 juillet.
Le guide suprême iranien Mojtaba Khamenei affirme… [+412 chars]",,fr,'Mojtaba Khamenei'
https://www.franceinfo.fr/monde/iran/guerre-entre-les-etats-unis-israel-et-l-iran/le-guide-supreme-iranien-affirme-que-la-vengeance-doit-s-accomplir-inevitablement-apres-la-mort-d-ali-khamenei_8104028.html,https://www.franceinfo.fr/monde/iran/guerre-entre-les-etats-unis-israel-et-l-iran/le-guide-supreme-iranien-affirme-que-la-vengeance-doit-s-accomplir-inevitablement-apres-la-mort-d-ali-khamenei_8104028.html,0,www.franceinfo.fr,"Le guide suprême iranien affirme que ""la vengeance doit s'accomplir inévitablement"" après la mort d'Ali Khamenei",L'ancien guide suprême a été tué fin février dans des frappes israélo-américaines.,https://www.franceinfo.fr/pictures/xI6pAT5DV_V75wn3h0UNO0IkgcI/0x574:5524x3682/1500x843/2026/07/11/6a522d647aebe179963712.jpg,2026-07-11T11:52:04Z,http://web.archive.org/web/20260711142222/https://www.franceinfo.fr/monde/iran/guerre-entre-les-etats-unis-israel-et-l-iran/le-guide-supreme-iranien-affirme-que-la-vengeance-doit-s-accomplir-inevitablement-apres-la-mort-d-ali-khamenei_8104028.html,"Le guide suprême iranien a juré de venger la mort de son père. Dans un message écrit diffusé samedi 11 juillet, Mojtaba Khamenei affirme que cette vengeance devait ""s'accomplir, inévitablement"", aprè… [+773 chars]",,fr,'Mojtaba Khamenei'
https://www.bfmtv.com/politique/europe-ecologie-les-verts/climatisation-dans-les-trains-marine-tondelier-et-laurent-wauquiez-s-envoient-une-nouvelle-fois-des-tacles-sur-les-reseaux-sociaux_AN-202607110253.html,https://www.bfmtv.com/politique/europe-ecologie-les-verts/climatisation-dans-les-trains-marine-tondelier-et-laurent-wauquiez-s-envoient-une-nouvelle-fois-des-tacles-sur-les-reseaux-sociaux_AN-202607110253.html,0,www.bfmtv.com,Climatisation dans les trains: Marine Tondelier et Laurent Wauquiez s'envoient une nouvelle fois des tacles sur les réseaux sociaux,"Le vendredi 10 juillet, Marine Tondelier, patronne des Écologistes, a publié sur X une pique à Laurent Wauquiez, ancien président de la région Auvergne-Rhône-Alpes, sur les trains de la région. Ce à quoi l'ancien élu s'est empressé de répondre.",https://images.bfmtv.com/KFFcqgAW3feXEsmifOp04ZLPdsc=/0x0:2048x1152/2048x0/images/Marine-Tondelier-a-l-hotel-de-Matignon-le-12-juin-2026-a-Paris-2318329.jpg,2026-07-11T12:23:42Z,http://web.archive.org/web/20260711202343/https://www.bfmtv.com/politique/europe-ecologie-les-verts/climatisation-dans-les-trains-marine-tondelier-et-laurent-wauquiez-s-envoient-une-nouvelle-fois-des-tacles-sur-les-reseaux-sociaux_AN-202607110253.html,"Le vendredi 10 juillet, Marine Tondelier, patronne des Écologistes, a publié sur X une pique à Laurent Wauquiez, ancien président de la région Auvergne-Rhône-Alpes, sur les trains de la région. Ce à … [+3155 chars]",,fr,'Marine Tondelier'
https://www.nouvelobs.com/monde/20260711.OBS116595/entre-teheran-et-washington-les-mediateurs-reprennent-leurs-efforts-apres-les-frappes.html,https://www.nouvelobs.com/monde/20260711.OBS116595/entre-teheran-et-washington-les-mediateurs-reprennent-leurs-efforts-apres-les-frappes.html,0,www.nouvelobs.com,"Entre Téhéran et Washington, les médiateurs reprennent leurs efforts après les frappes","Les frappes échangées cette semaine ont été les plus importantes depuis la signature, le 17 juin, d’un texte visant à mettre fin de façon durable à la guerre. Si le calme est revenu sur le terrain, Donald Trump a de nouveau affirmé que le cessez-le-feu était …",https://focus.nouvelobs.com/2026/07/11/0/0/6000/4000/1200/800/0/0/283a027_upload-1-koea3pzy1g77-075-nikoubazl-statefun260703-nprc0.jpg,2026-07-11T12:44:08Z,,"Des hommes passent devant le cercueil dAli Khamenei à Téhéran, le 3 juillet 2026.  MORTEZA NIKOUBAZL / NURPHOTO VIA AFP
Les médiateurs entre lIran et les Etats-Unis tentent ce samedi 11 juillet de r… [+5161 chars]",,fr,'Donald Trump'
https://www.huffingtonpost.fr/politique/article/autain-se-retire-de-la-primaire-et-esquisse-un-rassemblement-derriere-un-autre-candidat_286972.html,https://www.huffingtonpost.fr/politique/article/autain-se-retire-de-la-primaire-et-esquisse-un-rassemblement-derriere-un-autre-candidat_286972.html,0,www.huffingtonpost.fr,"Autain se retire de la primaire, et esquisse un rassemblement derrière un autre candidat","Candidate désignée par L’Après (le mouvement des anciens insoumis), Clémentine Autain imagine un rassemblement avec Jean-Luc Mélenchon, mais pas Raphaël Glucksmann.",https://focus.huffingtonpost.fr/2023/02/03/359/0/6894/3877/1820/1023/75/0/8ede8e4_1675429649541-000-338e9wx.jpg,2026-07-11T13:12:14Z,,"La députée écologiste Clémentine Autain a pris acte ce samedi 11 juillet du « clou dans le cercueil » de la primaire unitaire, planté par le choix des socialistes dorganiser une primaire fermée, et a… [+2472 chars]",,fr,'Jean-Luc Mélenchon'
https://www.20minutes.fr/monde/4234091-20260711-guerre-iran-guide-supreme-iranien-vengeance-pere-inevitable,https://www.20minutes.fr/monde/4234091-20260711-guerre-iran-guide-supreme-iranien-vengeance-pere-inevitable,0,www.20minutes.fr,"Guerre en Iran : Pour le nouveau guide suprême iranien, la « vengeance » pour son père est « inévitable »","Mojtaba Khamenei s’est exprimé pour la première fois depuis les funérailles de son père et prédécesseur, Ali Khamenei, tué par des bombardements israélo-américains au premier jour de la guerre",https://img.20mn.fr/ogjMiLqQRbG2LS0sBtK3OSk/1444x920_beyrouth-liban-8-juillet-2026-des-portraits-des-chefs-religieux-iraniens-l-ayatollah-ruhollah-khomeini-l-ayatollah-ali-khamenei-et-mojtaba-khamenei-sont-exposes-lors-d-une-ceremonie-funebre-organisee-par-le-hezbollah-dans-la-banlieue-sud-de-beyrouth-en-l-honneur-du-guide-supreme-iranien-assassine-l-ayatollah-ali-khamenei-photo-de-nicholas-frakes-jna-press-photo-de-nicholas-frakes-jna-press-via-nexpher-images-sipa-usa-71640322-2607090309,2026-07-11T13:37:34Z,http://web.archive.org/web/20260712084401/https://www.20minutes.fr/monde/4234091-20260711-guerre-iran-guide-supreme-iranien-vengeance-pere-inevitable,"La « vengeance » est « inévitable ». Cest ce qua affirmé ce samedi le guide suprême iranien Mojtaba Khamenei après la mort de son père, tué dans des bombardements israélo-américains au premier jour d… [+2717 chars]",,fr,'Mojtaba Khamenei'
https://www.lexpress.fr/monde/proche-moyen-orient/iran-le-guide-supreme-mojtaba-khamenei-appelle-a-venger-son-pere-EH3UY2E6Y5ECRGHHZOGMRK6CY4/,https://www.lexpress.fr/monde/proche-moyen-orient/iran-le-guide-supreme-mojtaba-khamenei-appelle-a-venger-son-pere-EH3UY2E6Y5ECRGHHZOGMRK6CY4/,0,www.lexpress.fr,Iran : le guide suprême Mojtaba Khamenei appelle à venger son père,"Une semaine après les funérailles d’Ali Khamenei, son successeur Mojtaba rompt le silence. Dans un message diffusé samedi, le Guide suprême iranien promet une vengeance après la frappe américano-israélienne.",https://www.lexpress.fr/resizer/v2/HCD5KUIZ4FEKNNAJGJYKKB7BTE.JPG?auth=3e31e929d2f569cb05c3054436342f69897af835acf533b0a475f520ba8c7df3&width=1200&height=630&quality=85&focal=2164%2C1278,2026-07-11T14:27:40Z,http://web.archive.org/web/20260712034927/https://www.lexpress.fr/monde/proche-moyen-orient/iran-le-guide-supreme-mojtaba-khamenei-appelle-a-venger-son-pere-EH3UY2E6Y5ECRGHHZOGMRK6CY4/,"Dans une déclaration écrite publiée samedi, le Guide suprême iranien, layatollah Mojtaba Khamenei, est sorti du silence et a menacé de vengeance après la mort de son prédécesseur et père, tout en pré… [+1978 chars]",,fr,'Mojtaba Khamenei'
https://www.ledauphine.com/faits-divers-justice/2026/07/11/feu-au-planay-mon-fils-est-bloque-a-pralognan-la-patronne-des-ecologistes-marine-tondelier-n-a-pas-pu-le-recuperer,https://www.ledauphine.com/faits-divers-justice/2026/07/11/feu-au-planay-mon-fils-est-bloque-a-pralognan-la-patronne-des-ecologistes-marine-tondelier-n-a-pas-pu-le-recuperer,0,www.ledauphine.com,"Savoie. Feu au Planay : « Mon fils est bloqué à Pralognan », la patronne des Ecologistes Marine Tondelier n'a pas pu le récupérer","De passage en Savoie pour son tour de France en vue de la présidentielle en 2027 , Marine Tondelier, la patronne des Écologistes, devait récupérer son fils Joseph, 7 ans.",https://cdn-s-www.ledauphine.com/images/EABA7769-BEE5-452E-BFC7-9BE27F726859/FB1200/photo-1783789951.jpg,2026-07-11T17:00:00Z,http://web.archive.org/web/20260711173626/https://www.ledauphine.com/faits-divers-justice/2026/07/11/feu-au-planay-mon-fils-est-bloque-a-pralognan-la-patronne-des-ecologistes-marine-tondelier-n-a-pas-pu-le-recuperer,"Le Dauphiné Libéré, en tant que responsable de traitement, recueille dans ce formulaire des informations qui sont enregistrées dans un fichier informatisé par son Service Relations Clients, la finali… [+854 chars]",,fr,'Marine Tondelier'
https://www.bfmtv.com/politique/sondage-bfmtv-presidentielle-2027-jean-luc-melenchon-candidat-le-mieux-place-a-gauche-quel-que-soit-le-scenario_AN-202607110290.html,https://www.bfmtv.com/politique/sondage-bfmtv-presidentielle-2027-jean-luc-melenchon-candidat-le-mieux-place-a-gauche-quel-que-soit-le-scenario_AN-202607110290.html,0,www.bfmtv.com,SONDAGE BFMTV. Présidentielle 2027: Jean-Luc Mélenchon candidat le mieux placé à gauche quel que soit le scénario,"D'après les résultats du sondage ELABE pour BFMTV et La Tribune Dimanche, le candidat LFI récolterait le plus de voix au premier tour de la présidentielle 2027. Il surpasserait dans tous les scénarios Nathalie Arthaud, Fabien Roussel, Marine Tondelier et Raph…",https://images.bfmtv.com/kTg-GAylFRZ6Usy2pFx79Ax7oz0=/0x0:1920x1080/1920x0/images/SONDAGE-BFMTV-Presidentielle-2027-Jean-Luc-Melenchon-candidat-le-mieux-place-a-gauche-quel-que-soit-le-scenario-2318811.jpg,2026-07-11T18:30:11Z,http://web.archive.org/web/20260711202340/https://www.bfmtv.com/politique/sondage-bfmtv-presidentielle-2027-jean-luc-melenchon-candidat-le-mieux-place-a-gauche-quel-que-soit-le-scenario_AN-202607110290.html,"D'après les résultats du sondage ELABE pour BFMTV et La Tribune Dimanche, le candidat LFI récolterait le plus de voix au premier tour de la présidentielle 2027. Il surpasserait dans tous les scénario… [+2255 chars]",,fr,'Marine Tondelier'
https://www.ledauphine.com/politique/2026/07/11/presidentielle-2027-le-pen-balaie-la-menace-judiciaire-et-domine-les-sondages,https://www.ledauphine.com/politique/2026/07/11/presidentielle-2027-le-pen-balaie-la-menace-judiciaire-et-domine-les-sondages,0,www.ledauphine.com,Politique. Présidentielle 2027 : Le Pen balaie la menace judiciaire et domine les sondages,"Dans un entretien au Journal du dimanche, Marine Le Pen juge « irréaliste » que la justice puisse encore contrarier sa candidature à la présidentielle. Une assurance que confortent les enquêtes d'opinion, où la candidate du Rassemblement national reste largem…",https://cdn-s-www.ledauphine.com/images/B4C65913-5818-4F40-A443-0BCFE4418D9F/FB1200/photo-1783798192.jpg,2026-07-11T19:29:00Z,http://web.archive.org/web/20260711231423/https://www.ledauphine.com/politique/2026/07/11/presidentielle-2027-le-pen-balaie-la-menace-judiciaire-et-domine-les-sondages,"Marine Le Pen ne veut plus entendre parler d'« incertitude judiciaire ». Interrogée par le JDD sur la possibilité que la cour de cassation rejette son pourvoi avant le premier tour, prévu le 18 avril… [+2220 chars]",,fr,'Marine Le Pen'
https://www.franceinfo.fr/monde/usa/presidentielle/donald-trump/face-aux-menaces-de-mort-donald-trump-renforce-sa-securite_8104388.html,https://www.franceinfo.fr/monde/usa/presidentielle/donald-trump/face-aux-menaces-de-mort-donald-trump-renforce-sa-securite_8104388.html,0,www.franceinfo.fr,"Face aux menaces de mort, Donald Trump renforce sa sécurité","Face aux menaces de l'Iran, Donald Trump annonce que ""1 000 missiles"" sont parés à frapper en cas d'attaque. Visé par plusieurs tentatives d'assassinat en 2 ans, le président voit sa sécurité drastiquement renforcée à la Maison Blanche, désormais protégée par…",https://www.franceinfo.fr/pictures/7WGc-5Ed80AcVEqH7MaJ4lCI3Ng/54x0:1486x805/1500x843/2026/07/11/6a5292a5d02a9248981395.jpg,2026-07-11T21:25:52Z,,"Face aux menaces de l'Iran, Donald Trump annonce que ""1 000 missiles"" sont parés à frapper en cas d'attaque. Visé par plusieurs tentatives d'assassinat en 2 ans, le président voit sa sécurité drastiq… [+2066 chars]",,fr,'Donald Trump'
