index,url,valid,domain,title,description,image,published,archive,content,quote,language,keyword
https://www.20minutes.fr/monde/4221380-20260501-tirs-gala-washington-nouvelle-video-attaque-contre-donald-trump-devoilee,https://www.20minutes.fr/monde/4221380-20260501-tirs-gala-washington-nouvelle-video-attaque-contre-donald-trump-devoilee,0,www.20minutes.fr,Tirs au gala de Washington : Une nouvelle vidéo de l’attaque contre Donald Trump dévoilée,"La procureure fédérale de Washington a dévoilé jeudi sur X une vidéo du suspect, armé d’un fusil de chasse, se ruant à travers un portique de sécurité à l’hôtel Hilton le soir de l’attaque contre le gala de la presse",https://img.20mn.fr/gr0-Xwg_Seidteeqpsn7GCk/1444x920_des-images-de-videosurveillance-diffusees-par-les-procureurs-montrent-que-le-tireur-cole-tomas-allen-a-fait-irruption-par-la-porte-de-l-hotel-washington-hilton-et-a-franchi-un-poste-de-controle-de-securite-en-seulement-quatre-secondes-alors-que-le-president-americain-donald-trump-assistait-a-un-gala-de-presse-le-samedi-25-avril-2026-photo-publiee-par-news-com-eye-press127192-epn-newscom-sipa-2605010904,2026-05-01T09:43:37Z,,"De nouveaux éléments dans lenquête sur lattaque du gala de la presse à Washington, le 25 avril dernier. Une nouvelle vidéo a été dévoilée jeudi par la procureure fédérale de Washington, montrant lhom… [+1606 chars]",,fr,'Donald Trump'
https://www.bfmtv.com/international/moyen-orient/guerre-au-moyen-orient-face-au-risque-extremement-eleve-d-escalade-jean-noel-barrot-appelle-a-ce-que-des-negociations-s-engagent_AV-202605010387.html,https://www.bfmtv.com/international/moyen-orient/guerre-au-moyen-orient-face-au-risque-extremement-eleve-d-escalade-jean-noel-barrot-appelle-a-ce-que-des-negociations-s-engagent_AV-202605010387.html,0,www.bfmtv.com,"Guerre au Moyen-Orient: face au risque ""extrêmement élevé"" d'escalade, Jean-Noël Barrot appelle à ce que ""des négociations s'engagent""","En déplacement aux Émirats arabes unis ce vendredi 1er mai, Jean-Noël Barrot a appelé sur BFMTV à ce que ""des négociations s'engagent"" en vue d'une reprise du trafic dans le détroit d'Ormuz et à l'apaisement des tensions face au risque ""extrêmement élevé"" d'e…",https://images.bfmtv.com/Eaft2_1isMCDYV3KqCa7xXSLqvE=/0x0:1920x1080/1920x0/images/Jean-Noel-Barrot-2279274.jpg,2026-05-01T10:55:23Z,,"En déplacement aux Émirats arabes unis ce vendredi 1er mai, Jean-Noël Barrot a appelé sur BFMTV à ce que ""des négociations s'engagent"" en vue d'une reprise du trafic dans le détroit d'Ormuz et à l'ap… [+2300 chars]",,fr,'Donald Trump'
https://www.journaldugeek.com/2026/05/01/ou-est-ce-que-lhistoire-du-jeu-007-first-light-sinscrit-dans-lunivers-des-films-james-bond/,https://www.journaldugeek.com/2026/05/01/ou-est-ce-que-lhistoire-du-jeu-007-first-light-sinscrit-dans-lunivers-des-films-james-bond/,0,www.journaldugeek.com,Où est-ce que l’histoire du jeu 007 First Light s’inscrit dans l’univers des films James Bond ?,"C’est une question légitime. Censé raconter les débuts d’agent secret de James Bond, 007 First Light va également s’appuyer sur les productions existantes, afin d’offrir un jeu inédit oui mais dans un univers mondialement connu. Le jeu d’IO Interactive impose…",https://www.journaldugeek.com/app/uploads/2025/09/007-first-light-image-principale-1600x900.jpg,2026-05-01T11:11:00Z,,"Vingt-cinq films. Cela fait un sacré marathon. Et même si James Bond est un personnage unanimement connu et respecté dans lunivers de la pop culture, toutes ses aventures ne sont pas incroyables ni m… [+3513 chars]",,fr,'Daniel Craig'
https://www.lavenir.net/actu/belgique/2026/05/01/frank-vandenbroucke-sen-prend-a-donald-trump-un-adversaire-de-leurope-SJC2XMZRTNGIPNKSOPTLEK5JBY/,https://www.lavenir.net/actu/belgique/2026/05/01/frank-vandenbroucke-sen-prend-a-donald-trump-un-adversaire-de-leurope-SJC2XMZRTNGIPNKSOPTLEK5JBY/,0,www.lavenir.net,"Frank Vandenbroucke s'en prend à Donald Trump: ""Un adversaire de l'Europe""","Le ministre fédéral de la Santé Frank Vandenbroucke (Vooruit) s'en est pris vendredi au président américain Donald Trump qu'il a qualifié d'""adversaire de l'Europe"". ...",https://www.lavenir.net/resizer/v2/VPQMUHEEWBGKDPMMIJW5NCTN74.jpg?auth=651a3128b6bae9bffa924055844c8c43c5b76bb45fe5f005278220f1877e74cf&width=1200&height=630&quality=85&focal=2000%2C1500,2026-05-01T12:04:45Z,,"Devant quelque 500 sympathisants rassemblés sur la place des Martyrs, à Louvain pour le traditionnel défilé du 1er mai, le ministre socialiste flamand est allé plus loin: ""Il n'est pas simplement un … [+800 chars]",,fr,'Donald Trump'
https://www.lalibre.be/belgique/politique-belge/2026/05/01/frank-vandenbroucke-sen-prend-a-donald-trump-adversaire-de-leurope-YAFRBENWJZFETO4RFI6HD32IJE/,https://www.lalibre.be/belgique/politique-belge/2026/05/01/frank-vandenbroucke-sen-prend-a-donald-trump-adversaire-de-leurope-YAFRBENWJZFETO4RFI6HD32IJE/,0,www.lalibre.be,"Frank Vandenbroucke s'en prend à Donald Trump, ""adversaire de l'Europe""","Le ministre fédéral de la Santé Frank Vandenbroucke (Vooruit) s'en est pris vendredi au président américain Donald Trump qu'il a qualifié d'""adversaire de l'Europe"". ...",https://www.lalibre.be/resizer/v2/VPQMUHEEWBGKDPMMIJW5NCTN74.jpg?auth=651a3128b6bae9bffa924055844c8c43c5b76bb45fe5f005278220f1877e74cf&width=1200&height=630&quality=85&focal=2000%2C1500,2026-05-01T12:05:48Z,,"Devant quelque 500 sympathisants rassemblés sur la place des Martyrs, à Louvain pour le traditionnel défilé du 1er mai, le ministre socialiste flamand est allé plus loin: ""Il n'est pas simplement un … [+800 chars]",,fr,'Donald Trump'
https://www.franceinfo.fr/monde/usa/presidentielle/donald-trump/donald-trump-n-a-pas-envie-d-avoir-l-air-de-peser-10-kilos-de-plus-avec-un-gilet-pare-balles_7976651.html,https://www.franceinfo.fr/monde/usa/presidentielle/donald-trump/donald-trump-n-a-pas-envie-d-avoir-l-air-de-peser-10-kilos-de-plus-avec-un-gilet-pare-balles_7976651.html,0,www.franceinfo.fr,"Donald Trump n'a ""pas envie d'avoir l'air de peser 10 kilos de plus"" avec un gilet pare-balles","Une journaliste l'interrogeait sur son souhait de porter ou non cette protection, cinq jours après avoir échappé à une nouvelle tentative d'assassinat.",https://www.franceinfo.fr/pictures/rGRGe4wJo7NgmDpK0oJZ1qH-e6M/0x0:1024x576/1500x843/2026/05/01/69f49909becc8314073966.jpg,2026-05-01T12:14:55Z,,"Donald Trump n'est pas très partant pour porter un gilet pare-balles, qui risquerait de nuire à sa silhouette, a confié jeudi 30 avril le président américain, cinq jours après avoir échappé à une nou… [+986 chars]",,fr,'Donald Trump'
https://www.dhnet.be/actu/belgique/2026/05/01/frank-vandenbroucke-sen-prend-a-donald-au-president-americain-ce-modele-doit-disparaitre-de-son-chemin-aux-yeux-du-gouvernement-trump-FMUXAEJ7M5FPRKUHSLKZ4SUPNE/,https://www.dhnet.be/actu/belgique/2026/05/01/frank-vandenbroucke-sen-prend-a-donald-au-president-americain-ce-modele-doit-disparaitre-de-son-chemin-aux-yeux-du-gouvernement-trump-FMUXAEJ7M5FPRKUHSLKZ4SUPNE/,0,www.dhnet.be,"Frank Vandenbroucke s'en prend à Donald au président américain: ""Ce modèle doit disparaître de son chemin aux yeux du gouvernement Trump""","Le ministre fédéral de la Santé Frank Vandenbroucke (Vooruit) s'en est pris vendredi au président américain Donald Trump qu'il a qualifié d'""adversaire de l'Europe"". ...",https://www.dhnet.be/resizer/v2/VPQMUHEEWBGKDPMMIJW5NCTN74.jpg?auth=651a3128b6bae9bffa924055844c8c43c5b76bb45fe5f005278220f1877e74cf&width=1200&height=630&quality=85&focal=2000%2C1500,2026-05-01T13:02:47Z,,"Devant quelque 500 sympathisants rassemblés sur la place des Martyrs, à Louvain pour le traditionnel défilé du 1er mai, le ministre socialiste flamand n'a pas mâché ses mots envers Donald Trump. ""Il … [+840 chars]",,fr,'Donald Trump'
https://iphoneaddict.fr/post/news-427931-remboursement-droits-douane-apple-reinjecter-largent-lindustrie-americaine,https://iphoneaddict.fr/post/news-427931-remboursement-droits-douane-apple-reinjecter-largent-lindustrie-americaine,0,iphoneaddict.fr,Remboursement des droits de douane : Apple va réinjecter l’argent dans l’industrie américaine,"Apple ne présente pas les remboursements liés aux droits de douane de Donald Trump comme un simple allègement de coûts. Tim Cook, le patron d’Apple, affirme que toute somme récupérée sera réinvestie dans l’innovation et la fabrication avancée aux États-Unis, …",https://static.iphoneaddict.fr/wp-content/uploads/2026/03/Apple-Store-Logo.jpg,2026-05-01T13:11:01Z,,"Apple ne présente pas les remboursements liés aux droits de douane de Donald Trump comme un simple allègement de coûts. Tim Cook, le patron d’Apple, affirme que toute somme récupérée sera réinvestie … [+2000 chars]",,fr,'Donald Trump'
https://www.huffingtonpost.fr/international/video/une-nouvelle-video-montre-comment-cole-allen-l-assaillant-du-gala-de-washington-a-force-la-securite_263294.html,https://www.huffingtonpost.fr/international/video/une-nouvelle-video-montre-comment-cole-allen-l-assaillant-du-gala-de-washington-a-force-la-securite_263294.html,0,www.huffingtonpost.fr,"Une nouvelle vidéo montre comment Cole Allen, l’assaillant du gala de Washington, a forcé la sécurité","La procureure fédérale de Washington a publié sur X une vidéo montrant l’homme suspecté d’avoir ouvert le feu lors d’un gala avec Donald Trump, en train de courir à travers la sécurité.",https://focus.huffingtonpost.fr/2026/05/01/0/0/1920/1080/1820/1023/75/0/d42cb7d_upload-1-nekv5a9qslq5-2026-04-30t234647z-1-lwd709830042026rp1-rtrwnev-c-7098-usa-trump-dinner-shooting-mp4-00-05-02-09-still001.jpg,2026-05-01T14:21:52Z,,"La lecture de ce contenu est susceptible dentraîner un dépôt de cookies de la part de lopérateur tiers qui lhéberge. Compte-tenu des choix que vous avez exprimés en matière de dépôt de cookies, nous … [+1612 chars]",,fr,'Donald Trump'
https://www.bfmtv.com/international/moyen-orient/iran/l-iran-fait-une-nouvelle-offre-aux-etats-unis-via-le-pakistan-pour-reprendre-les-negociations_AN-202605010544.html,https://www.bfmtv.com/international/moyen-orient/iran/l-iran-fait-une-nouvelle-offre-aux-etats-unis-via-le-pakistan-pour-reprendre-les-negociations_AN-202605010544.html,0,www.bfmtv.com,L'Iran fait une nouvelle offre aux États-Unis via le Pakistan pour reprendre les négociations,L'agence officielle iranienne Irna a annoncé ce vendredi que l'Iran a présenté une nouvelle offre à Donald Trump. Leur proposition a été transmise au Pakistan.,https://images.bfmtv.com/Qx4dV95aoewDytOA1QtiEhW8u2Y=/0x106:2048x1258/2048x0/images/Mojtaba-Khamenei-2267949.jpg,2026-05-01T15:06:29Z,,"L'agence officielle iranienne Irna a annoncé ce vendredi que l'Iran a présenté une nouvelle offre à Donald Trump. Leur proposition a été transmise au Pakistan.
L'Iran a présenté une nouvelle offre e… [+1607 chars]",,fr,'Donald Trump'
https://www.lexpress.fr/monde/amerique/en-mer-la-guerre-secrete-de-donald-trump-contre-les-cartels-YZBFK7P5JNFMZFUQKQY4X53KDI/,https://www.lexpress.fr/monde/amerique/en-mer-la-guerre-secrete-de-donald-trump-contre-les-cartels-YZBFK7P5JNFMZFUQKQY4X53KDI/,0,www.lexpress.fr,"En mer, la guerre secrète de Donald Trump contre les cartels","L’opération militaire américaine s’intensifie depuis quelques semaines, visant des embarcations suspectées de trafic. Mais les contours exacts des cibles restent flous.",https://www.lexpress.fr/resizer/v2/TMDJ6G5HO5CWHKAJETLAYKJ6AA.JPG?auth=aa85ee649d639b49e4eb75284bb1ba04106d02556b95a2a9ded53c39b528cbb4&width=1200&height=630&quality=85&smart=true,2026-05-01T15:19:12Z,,Les vidéos granuleuses diffusées par le Pentagone ne durent qu'une poignée de secondes. Certaines montrent des embarcations lancées à pleine vitesse sur leau avant dêtre englouties dans une boule de … [+3718 chars],,fr,'Donald Trump'
https://www.nouvelobs.com/monde/20260501.OBS114615/trump-a-fracasse-la-pierre-angulaire-de-notre-monde-grand-entretien-de-pierre-haski-avec-thierry-breton.html,https://www.nouvelobs.com/monde/20260501.OBS114615/trump-a-fracasse-la-pierre-angulaire-de-notre-monde-grand-entretien-de-pierre-haski-avec-thierry-breton.html,0,www.nouvelobs.com,« Trump a fracassé la pierre angulaire de notre monde » : grand entretien de Pierre Haski avec Thierry Breton,"Parce que cet ancien commissaire européen a contribué à réguler notre espace numérique, Thierry Breton est aujourd’hui interdit de séjour aux Etats-Unis. Pierre Haski le reçoit pour une grande conversation sur sa chaîne YouTube, en partenariat avec « le Nouve…",https://focus.nouvelobs.com/2026/05/01/37/0/892/594/1200/800/0/0/0724a6b_upload-1-0lywae1v7ss9-capture-d-e-cran-2026-05-01-a-15-40-22.png,2026-05-01T16:00:02Z,,Le visionnage de cette vidéo est susceptible d'entraîner un dépôt de cookies de la part de l'opérateur de la plate-forme vidéo vers laquelle vous serez dirigé(e). Compte-tenu du refus du dépôt de coo… [+1610 chars],,fr,'Donald Trump'
https://www.lalibre.be/economie/conjoncture/2026/05/01/trump-annonce-vouloir-relever-la-semaine-prochaine-les-droits-de-douane-sur-les-vehicules-europeens-IYLYHCEWLJGAHOJQDYWVF3YF2E/,https://www.lalibre.be/economie/conjoncture/2026/05/01/trump-annonce-vouloir-relever-la-semaine-prochaine-les-droits-de-douane-sur-les-vehicules-europeens-IYLYHCEWLJGAHOJQDYWVF3YF2E/,0,www.lalibre.be,"Trump annonce vouloir relever ""la semaine prochaine"" les droits de douane sur les véhicules européens",Donald Trump a annoncé qu'il augmenterait les droits de douanes sur sur les voitures et les camions en provenance de l'UE à 25 %. ...,https://www.lalibre.be/resizer/v2/MNKUL4DUYZBKBB6OVVT6U2RHBA.jpg?auth=92b4963eeedcd20a5fa73b425282ab442d551a86ab59cebe66852ca68df6bc43&width=1200&height=630&quality=85&focal=1931%2C1287,2026-05-01T16:07:11Z,,"""J'ai le plaisir d'annoncer que, compte tenu du non-respect par l'Union européenne de notre accord commercial pleinement conclu, j'augmenterai la semaine prochaine les droits de douane appliqués aux … [+394 chars]",,fr,'Donald Trump'
https://www.ledauphine.com/economie/2026/05/01/vehicules-europeens-trump-annonce-25-de-droit-de-douane-la-semaine-prochaine,https://www.ledauphine.com/economie/2026/05/01/vehicules-europeens-trump-annonce-25-de-droit-de-douane-la-semaine-prochaine,0,www.ledauphine.com,Economie. Véhicules européens : Trump annonce 25% de droit de douane « la semaine prochaine »,"Quelques jours après une brouille avec le chancelier Allemand, Donald Trump s'est dit « ravi », ce vendredi, de rehausser les droits de douane sur les véhicules venant d'Europe à hauteur de 25%.",https://cdn-s-www.ledauphine.com/images/A89BC973-6EF5-4288-B450-87460B459EFB/FB1200/photo-1777652402.jpg,2026-05-01T16:13:00Z,,"Donald Trump a dit vendredi vouloir relever à 25% les droits de douane sur les véhicules importés aux Etats-Unis depuis l'UE, reprochant au bloc européen de pas respecter leur accord commercial.
Le … [+1187 chars]",,fr,'Donald Trump'
https://www.huffingtonpost.fr/international/article/donald-trump-annonce-vouloir-relever-les-droits-de-douane-sur-les-vehicules-europeens_263300.html,https://www.huffingtonpost.fr/international/article/donald-trump-annonce-vouloir-relever-les-droits-de-douane-sur-les-vehicules-europeens_263300.html,0,www.huffingtonpost.fr,Donald Trump annonce vouloir relever les droits de douane sur les véhicules européens,Le président américain se dit « ravi » d’annoncer cette nouvelle mesure de défiance à l’égard d’un de ses principaux partenaires commerciaux.,https://focus.huffingtonpost.fr/2026/05/01/102/0/6400/3600/1820/1023/75/0/6081e9b_upload-1-s8qkmflpbwk7-afp-20260430-a9hw964-v1-highres-ustrumppolitics.jpg,2026-05-01T16:13:18Z,,A voir aussi sur Le HuffPost La lecture de ce contenu est susceptible dentraîner un dépôt de cookies de la part de lopérateur tiers qui lhéberge. Compte-tenu des choix que vous avez exprimés en matiè… [+1646 chars],,fr,'Donald Trump'
https://www.franceinfo.fr/monde/usa/droits-de-douane/donald-trump-annonce-un-relevement-des-droits-de-douane-de-25-sur-les-vehicules-importes-depuis-l-union-europeenne_7976969.html,https://www.franceinfo.fr/monde/usa/droits-de-douane/donald-trump-annonce-un-relevement-des-droits-de-douane-de-25-sur-les-vehicules-importes-depuis-l-union-europeenne_7976969.html,0,www.franceinfo.fr,Donald Trump annonce un relèvement des droits de douane à 25% sur les véhicules importés depuis l'Union européenne,"Cette mesure entrera en vigueur la semaine prochaine, annonce le président américain dans un message posté sur les réseaux sociaux. Il accuse l'UE de ne pas respecter l'accord commercial qui avait été conclu avec Washington.",https://www.franceinfo.fr/pictures/BnTT4GZJFEVqMk0UTbGHTl0d418/0x292:5616x3451/1500x843/2026/05/01/69f4d047cf704727313463.jpg,2026-05-01T16:15:32Z,,"Donald Trump a annoncé vouloir relever ""la semaine prochaine"" les droits de douane sur les véhicules européens, dans un message posté sur le réseau social TruthSocial, vendredi 1er mai. Le président … [+849 chars]",,fr,'Donald Trump'
https://www.lavenir.net/actu/monde/2026/05/01/droits-de-douane-trump-veut-relever-a-25-les-droits-de-douane-sur-les-vehicules-europeens-2XTVBKRMHNGRTGXHUUU5GHICRU/,https://www.lavenir.net/actu/monde/2026/05/01/droits-de-douane-trump-veut-relever-a-25-les-droits-de-douane-sur-les-vehicules-europeens-2XTVBKRMHNGRTGXHUUU5GHICRU/,0,www.lavenir.net,Droits de douane: Trump veut relever à 25% les droits de douane sur les véhicules européens,"Le président des États-Unis Donald Trump a affirmé vendredi sur son réseau social Truth Social vouloir relever à 25% les droits de douane sur les véhicules importés aux États-Unis depuis l'Union européenne (UE), reprochant au bloc européen de pas respecter l'…",https://www.lavenir.net/resizer/v2/JQZU6ZP5VFDFTMD2ZXGPEBCWRM.jpg?auth=c6de0f76c5e1f8d1c327fc95bb410cb89d331cfe2bb829c26ddbc94ff15c352c&width=1200&height=630&quality=85&focal=3200%2C2136,2026-05-01T16:42:32Z,,"Le dirigeant républicain se dit ""ravi"" d'annoncer cette nouvelle mesure de défiance à l'égard d'un de ses principaux partenaires commerciaux, dans ce message publié quelques jours après une dispute a… [+297 chars]",,fr,'Donald Trump'
https://www.challenges.fr/monde/ladministration-trump-est-a-la-peine-pour-augmenter-la-production-darmes_643119,https://www.challenges.fr/monde/ladministration-trump-est-a-la-peine-pour-augmenter-la-production-darmes_643119,0,www.challenges.fr,L’administration Trump est à la peine pour augmenter la production d’armes,"Le secrétaire à la Guerre Pete Hegseth pousse l’industrie de l’armement à augmenter sa production d’armes face à la Russie et la Chine, mais se heurte à un manque de financement. Et aux trous dans les réserves créés par la guerre contre l’Iran.",https://www.challenges.fr/_ipx/f_jpg&enlarge_true&s_1200x630/cha/static/2026-05/54559.HR_1.jpg%3FVersionId=fXZriCJroW9Nv.xW0bmOJx4TBP3X.Yfd,2026-05-01T16:45:00Z,,"Depuis des mois, le président Donald Trump et le secrétaire à la Guerre Pete Hegseth se félicitent davoir conclu des accords de principe avec des entreprises du secteur de la défense visant à accroît… [+6521 chars]",,fr,'Donald Trump'
https://www.sofoot.com/articles/donald-trump-gianni-infantino-un-consensus-sur-la-participation-de-liran-a-la-coupe-du-monde-2026-qui-interroge-et-une-bromance-qui-continue,https://www.sofoot.com/articles/donald-trump-gianni-infantino-un-consensus-sur-la-participation-de-liran-a-la-coupe-du-monde-2026-qui-interroge-et-une-bromance-qui-continue,0,www.sofoot.com,Donald Trump-Gianni Infantino : un consensus sur la participation de l’Iran à la Coupe du monde 2026 qui interroge et une bromance qui continue,Les deux dirigeants ont appris à se couvrir mutuellement.,https://sofoot.s3.eu-central-1.amazonaws.com/wp-content/uploads/2026/05/01165113/11755776-1400x1007.jpg,2026-05-01T17:00:14Z,,"À quoi jouent vraiment Donald Trump et Gianni Infantino ? Si le rapprochement entre le président des États-Unis et le boss de la FIFA nest plus à expliquer, leurs soutiens respectifs sur les probléma… [+4681 chars]",,fr,'Donald Trump'
https://www.20minutes.fr/monde/etats-unis/4221415-20260501-etats-unis-trump-va-relever-25-droits-douane-vehicules-europeens-semaine-prochaine,https://www.20minutes.fr/monde/etats-unis/4221415-20260501-etats-unis-trump-va-relever-25-droits-douane-vehicules-europeens-semaine-prochaine,0,www.20minutes.fr,Etats-Unis : Trump va relever de 25 % les droits de douane sur les véhicules européens « la semaine prochaine »,"Donald Trump a annoncé, vendredi 1er mai, vouloir porter à 25 % les droits de douane sur les voitures importées de l’Union européenne, remettant en cause l’accord commercial conclu en 2025",https://img.20mn.fr/UtVI_N1TTzCTJvL0OgRRYSk/1444x920_le-president-donald-trump-s-adresse-a-des-journalistes-dans-le-bureau-ovale-de-la-maison-blanche-le-jeudi-30-avril-2026-a-washington-ap-photo-alex-brandon-dcje451-26120706339999-2604302140,2026-05-01T17:02:19Z,,"Donald Trump a brandi une nouvelle menace à lencontre des pays européens. Le président des Etats-Unis a annoncé, vendredi 1er mai, vouloir relever à 25 % les droits de douane sur les véhicules import… [+1627 chars]",,fr,'Donald Trump'
https://www.journaldugeek.com/2026/05/01/007-first-light-des-liens-etroits-entre-le-jeu-casino-royale-et-skyfall/,https://www.journaldugeek.com/2026/05/01/007-first-light-des-liens-etroits-entre-le-jeu-casino-royale-et-skyfall/,0,www.journaldugeek.com,"007 First Light : des liens étroits entre le jeu, Casino Royale et Skyfall","Attendu pour le 27 mai prochain, 007 First Light ne va pas seulement redéfinir les débuts d’agent secret de James Bond. Le jeu développé par le studio IO Interactive a bien l’intention de nous embarquer dans une aventure proche d’une production cinématographi…",https://www.journaldugeek.com/app/uploads/2025/08/james-bond-amazon-mgm-scenariste-1600x900.jpg,2026-05-01T17:07:57Z,,"Des échanges de coups de poing. Des combos savamment travaillés, jusquà débloquer une feature spéciale et mettre KO son adversaire. Des mâchoires fracassées contre les éléments du décor, comme une ta… [+4709 chars]",,fr,'Daniel Craig'
https://www.20minutes.fr/monde/etats-unis/4221419-20260501-vatican-ancien-papiers-nomme-eveque-etats-unis-pape-leon-xiv,https://www.20minutes.fr/monde/etats-unis/4221419-20260501-vatican-ancien-papiers-nomme-eveque-etats-unis-pape-leon-xiv,0,www.20minutes.fr,Vatican : Un ancien sans-papiers nommé évêque aux Etats-Unis par le pape Léon XIV,"Le pape Léon XIV a nommé, vendredi 1er mai, Evelio Menjivar-Ayala, un ancien migrant sans papiers, évêque en Virginie-Occidentale",https://img.20mn.fr/kNTdCZeiS2ajBIAnDxgZ1ik/1444x920_usage-editorial-uniquement-credit-obligatoire-photo-de-maria-grazia-picciarella-shutterstock-16852806b-le-pape-leon-xiv-fait-signe-a-son-arrivee-pour-son-audience-generale-hebdomadaire-sur-la-place-saint-pierre-au-vatican-audience-generale-hebdomadaire-du-pape-leon-xiv-cite-du-vatican-vatican-29-avril-2026-shutterstock-editorial-pope-leo-xiv-s-weekly-general-16852806b-usage-editorial-uniquement-2604301024,2026-05-01T17:39:16Z,,"Faut-il y voir un nouveau tacle en direction de Donald Trump ? Le pape Léon XIV a nommé, vendredi 1er mai, évêque du diocèse de Wheeling-Charleston, en Virginie-Occidentale, Evelio Menjivar-Ayala, un… [+1275 chars]",,fr,'Léon XIV'
https://www.20minutes.fr/monde/etats-unis/4221423-20260501-guerre-moyen-orient-trump-affirme-passera-feu-vert-congres-defiant-constitution,https://www.20minutes.fr/monde/etats-unis/4221423-20260501-guerre-moyen-orient-trump-affirme-passera-feu-vert-congres-defiant-constitution,0,www.20minutes.fr,"Guerre au Moyen-Orient : Trump affirme qu’il se passera d’un feu vert du Congrès, défiant la Constitution","A l’échéance des 60 jours prévue par la loi, ce vendredi 1er mai, Donald Trump refuse de solliciter le Congrès pour l’intervention contre l’Iran",https://img.20mn.fr/OLJHp0gwRjigTWHi3jnJSSk/1444x920_le-president-americain-donald-trump-s-adresse-a-des-journalistes-alors-qu-il-quitte-la-maison-blanche-pour-la-floride-a-washington-dc-etats-unis-le-1er-mai-2026-trump-a-parle-de-l-iran-ainsi-que-de-spirit-airlines-affirmant-que-son-administration-avait-presente-a-la-compagnie-aerienne-une-proposition-de-sauvetage-finale-credit-jim-los-calzo-pool-via-cnp-cnp-photos333700-cnp-news-com-sipa-2605011941,2026-05-01T18:10:34Z,,"Donald Trump a choisi, vendredi 1er mai, de passer outre la pression du Congrès. A de la date limite fixée par la loi, soit 60 jours, pour encadrer lengagement militaire contre lIran, le président am… [+1565 chars]",,fr,'Donald Trump'
https://www.huffingtonpost.fr/international/article/donald-trump-rejette-la-nouvelle-proposition-d-accord-de-l-iran_263301.html,https://www.huffingtonpost.fr/international/article/donald-trump-rejette-la-nouvelle-proposition-d-accord-de-l-iran_263301.html,0,www.huffingtonpost.fr,Donald Trump rejette la nouvelle proposition d’accord de l’Iran,"« À l’heure qu’il est, je ne suis pas satisfait par ce qu’ils offrent », a commenté le président américain ce vendredi à Washington.",https://focus.huffingtonpost.fr/2026/05/01/303/0/5820/3273/1820/1023/75/0/c87cefa_upload-1-ctrmiffmxxjx-afp-20260501-2274039720-v1-highres-presidenttrumpdepartswashingtonforweekendinf.jpg,2026-05-01T18:27:34Z,,A voir aussi sur Le HuffPost La lecture de ce contenu est susceptible dentraîner un dépôt de cookies de la part de lopérateur tiers qui lhéberge. Compte-tenu des choix que vous avez exprimés en matiè… [+3264 chars],,fr,'Donald Trump'
