index,url,valid,domain,title,description,image,published,archive,content,quote,language,keyword
https://www.lexpress.fr/secret-defense/vodka-faux-papiers-et-explosifs-les-secrets-de-lattaque-de-nord-stream-lukraine-voulait-frapper-la-XD4I6IZL6BB33GDVIZKMBCPVP4/,https://www.lexpress.fr/secret-defense/vodka-faux-papiers-et-explosifs-les-secrets-de-lattaque-de-nord-stream-lukraine-voulait-frapper-la-XD4I6IZL6BB33GDVIZKMBCPVP4/,0,www.lexpress.fr,"Vodka, faux papiers et explosifs, les secrets de l'attaque de Nord Stream : ""L'Ukraine voulait frapper la machine de guerre de Poutine""","Dans un livre d'enquĂŞte, Bojan Pancevski, correspondant politique en chef pour l'Europe au Wall Street Journal, dĂŠvoile les tĂŠmoignages d'anciens agents et plongeurs du renseignement ukrainien, responsables de l'attaque contre le gazoduc en 2022.",https://www.lexpress.fr/resizer/v2/E5PBY5VKPNAUBKMVN4JAXRWYF4.jpg?auth=6a038cba0cfc270707f503e312ddac872a65668d7ba76786cf488080dd63d990&width=1200&height=630&quality=85&focal=1865%2C1059,2026-05-12T16:00:00Z,http://web.archive.org/web/20260513015744/https://www.lexpress.fr/secret-defense/vodka-faux-papiers-et-explosifs-les-secrets-de-lattaque-de-nord-stream-lukraine-voulait-frapper-la-XD4I6IZL6BB33GDVIZKMBCPVP4/,"Le 26 septembre 2022, des explosions sous-marines troublent la surface de la mer Baltique. Le gazoduc Nord Stream vient d'exploser en deux endroits. L'infrastructure, destinĂŠe Ă  acheminer du gaz russâŚ [+1699 chars]",,fr,'Vladimir Poutine'
https://www.courrierinternational.com/article/analyse-elon-musk-contre-sam-altman-le-proces-des-grands-fauves-de-la-tech_243863,https://www.courrierinternational.com/article/analyse-elon-musk-contre-sam-altman-le-proces-des-grands-fauves-de-la-tech_243863,0,www.courrierinternational.com,"Elon Musk contre Sam Altman, le procĂ¨s des grands fauves de la tech",Lâissue du duel judiciaire opposant lâex-actionnaire de la start-up OpenAI Ă  son cofondateur est incertaine. Lâenjeu nâest pas vraiment de savoir si la start-up a eu tort de renoncer Ă  sa mission dâintĂŠrĂŞt public pour endosser le statut dâentreprise Ă  but lucâŚ,https://focus.courrierinternational.com/2026/05/07/0/0/4518/3012/1200/630/60/0/42dec45_ftp-1-5z1p2bdrhixf-2026-05-07t104132z-1327599886-rc2u3lav4ysp-rtrmadp-3-musk-openai-court.JPG,2026-05-12T16:07:23Z,,"Ă la veille dun procĂ¨s qui dĂŠcidera de lavenir dOpenAI, Elon Musk a promis de faire de son directeur gĂŠnĂŠral, Sam Altman, et de son prĂŠsident, Greg Brockman, les hommes les plus dĂŠtestĂŠs dAmĂŠrique.
âŚ [+1060 chars]",,fr,'Sam Altman'
https://www.huffingtonpost.fr/culture/article/au-festival-de-cannes-2026-demi-moore-et-le-jury-prennent-position-dans-ce-debat-qui-agite-le-cinema_263644.html,https://www.huffingtonpost.fr/culture/article/au-festival-de-cannes-2026-demi-moore-et-le-jury-prennent-position-dans-ce-debat-qui-agite-le-cinema_263644.html,0,www.huffingtonpost.fr,"Au Festival de Cannes 2026, Demi Moore et le jury prennent position dans ce dĂŠbat qui agite le cinĂŠma","Juste avant lâouverture officielle de la 79e ĂŠdition du Festival de Cannes, le jury cannois a ĂŠtĂŠ invitĂŠ Ă  se positionner sur la prĂŠsence de messages politiques dans lâart.",https://focus.huffingtonpost.fr/2026/05/12/238/0/6000/3375/1820/1023/75/0/9d4872f_upload-1-mtigng0dlc6c-afp-20260512-b2lt8fx-v1-highres-francefilmfestivalcannes2026.jpg,2026-05-12T16:19:21Z,,A voir aussi sur Le HuffPost La lecture de ce contenu est susceptible dentraĂŽner un dĂŠpĂ´t de cookies de la part de lopĂŠrateur tiers qui lhĂŠberge. Compte-tenu des choix que vous avez exprimĂŠs en matiĂ¨âŚ [+5366 chars],,fr,'Demi Moore'
https://www.mediapart.fr/journal/politique/120526/emmanuel-moulin-la-banque-de-france-la-pression-monte-sur-le-candidat-de-macron,https://www.mediapart.fr/journal/politique/120526/emmanuel-moulin-la-banque-de-france-la-pression-monte-sur-le-candidat-de-macron,0,www.mediapart.fr,Emmanuel Moulin Ă  la Banque de France: la pression monte sur le candidat de Macron,"AprĂ¨s les rĂŠvĂŠlations de ÂŤÂ MediapartÂ Âť, le dĂŠputĂŠ socialiste Philippe Brun, chargĂŠ dâorchestrer lâaudition du candidat au poste de gouverneur de la Banque de France, a interrogĂŠ lâactuel patron de lâinstitution sur lâaide que ses services ont fournie pour prĂŠâŚ",https://static.mediapart.fr/etmagine/og/journal/files/2026/05/12/260512-img-emmanuel-moulin-la-banque-de-france-la-pression-monte-sur-le-candidat-de-macron.jpg,2026-05-12T17:55:53Z,http://web.archive.org/web/20260513160956/https://www.mediapart.fr/journal/politique/120526/emmanuel-moulin-la-banque-de-france-la-pression-monte-sur-le-candidat-de-macron,"Les cookies et technologies similaires que nous utilisons sur Mediapart sont de diffĂŠrentes natures et nous permettent de poursuivre diffĂŠrentes finalitĂŠs. 
Certains sont nĂŠcessaires au fonctionnemeâŚ [+3291 chars]",,fr,'Emmanuel Moulin'
https://www.franceinfo.fr/politique/gabriel-attal/presidentielle-2027-gabriel-attal-se-rapproche-d-une-candidature-apres-un-vote-interne-de-soutien_8000732.html,https://www.franceinfo.fr/politique/gabriel-attal/presidentielle-2027-gabriel-attal-se-rapproche-d-une-candidature-apres-un-vote-interne-de-soutien_8000732.html,0,www.franceinfo.fr,PrĂŠsidentielle 2027Â : Gabriel Attal se rapproche d'une candidature aprĂ¨s un vote interne de soutien,L'immense majoritĂŠ des 303 membres du Conseil national du parti Renaissance ont adoptĂŠ mardi soir une motion favorable Ă  une candidature de l'ancien Premier ministre.,https://www.franceinfo.fr/pictures/vXULcUvy0JKenfwTTvOk4SPSZDs/0x0:1024x576/1500x843/2026/05/13/6a03a4f3d60fc805227639.jpg,2026-05-12T22:09:26Z,http://web.archive.org/web/20260513053913/https://www.franceinfo.fr/politique/gabriel-attal/presidentielle-2027-gabriel-attal-se-rapproche-d-une-candidature-apres-un-vote-interne-de-soutien_8000732.html,"Il a franchi une nouvelle ĂŠtape vers une candidature ĂŠlysĂŠenne. RĂŠuni mardi 12 mai au soir, le Conseil national de Renaissance a trĂ¨s largement adoptĂŠ une motion qui ""appelle le secrĂŠtaire gĂŠnĂŠral duâŚ [+996 chars]",,fr,'Gabriel Attal'
https://www.20minutes.fr/monde/ukraine/4223299-20260513-guerre-ukraine-cheffe-diplomatie-ue-juge-poutine-position-force,https://www.20minutes.fr/monde/ukraine/4223299-20260513-guerre-ukraine-cheffe-diplomatie-ue-juge-poutine-position-force,0,www.20minutes.fr,Guerre en UkraineÂ : La cheffe de la diplomatie de lâUE juge que Poutine nâest ÂŤÂ pas en position de forceÂ Âť,"La cheffe de la diplomatie de lâUE estime quâil faut utiliser les faiblesses actuelles, selon elle, de la Russie pour obtenir la paix en Ukraine",https://img.20mn.fr/MDAAZnsFS6akbW5kz9YiTCk/1444x920_9-mai-2026-moscou-russie-le-president-russe-vladimir-poutine-assiste-a-un-defile-militaire-sur-la-place-rouge-le-jour-de-la-victoire-pour-marquer-le-81e-anniversaire-de-la-victoire-de-l-union-sovietique-sur-l-allemagne-nazie-lors-de-la-grande-guerre-patriotique-sur-le-front-de-l-est-de-la-seconde-guerre-mondiale-image-de-credit-alexander-shcherbak-tass-via-zuma-press-20260509-zaa-t113-543-ruaridh-stewart-2605112352,2026-05-13T02:47:08Z,,"Dans le cadre de la guerre en Ukraine, Bruxelles a pointĂŠ mardi les faiblesses du Kremlin. La cheffe de la diplomatie de lUE a fait cela afin, selon elle, de sen servir dans les nĂŠgociations pour obtâŚ [+1595 chars]",,fr,'Poutine'
https://www.bfmtv.com/international/amerique-nord/etats-unis/donald-trump-publie-un-dessin-montrant-le-venezuela-comme-51e-etat-americain_AN-202605130112.html,https://www.bfmtv.com/international/amerique-nord/etats-unis/donald-trump-publie-un-dessin-montrant-le-venezuela-comme-51e-etat-americain_AN-202605130112.html,0,www.bfmtv.com,"Donald Trump publie un dessin montrant le Venezuela comme ""51e Etat"" amĂŠricain","Le prĂŠsident amĂŠricain a publiĂŠ le dessin ce mardi sur sa plateforme Truth Social. En rĂŠaction, la prĂŠsidente par intĂŠrim du Venezuela, Delcy Rodriguez, a dĂŠclarĂŠ que son pays n'avait ""jamais envisagĂŠ"" de devenir amĂŠricain.",https://images.bfmtv.com/btCFohsYWXegvhfltf6l_92CuIg=/0x106:2048x1258/2048x0/images/President-Donald-Trump-2281850.jpg,2026-05-13T04:36:53Z,http://web.archive.org/web/20260514030230/https://www.bfmtv.com/international/amerique-nord/etats-unis/donald-trump-publie-un-dessin-montrant-le-venezuela-comme-51e-etat-americain_AN-202605130112.html,"Le prĂŠsident amĂŠricain a publiĂŠ le dessin ce mardi sur sa plateforme Truth Social. En rĂŠaction, la prĂŠsidente par intĂŠrim du Venezuela, Delcy Rodriguez, a dĂŠclarĂŠ que son pays n'avait ""jamais envisagâŚ [+1301 chars]",,fr,'Donald Trump'
https://www.slate.fr/politique/rejete-lfi-menace-ps-bloc-central-raphael-glucksmann-candidat-defi-election-presidentielle-2027-france-gauche-place-publique-social-democratie,https://www.slate.fr/politique/rejete-lfi-menace-ps-bloc-central-raphael-glucksmann-candidat-defi-election-presidentielle-2027-france-gauche-place-publique-social-democratie,0,www.slate.fr,"PrĂŠsidentielle 2027: RaphaĂŤl Glucksmann peut-il survivre entre LFI, le PS et Gabriel Attal?","Pris en ĂŠtau entre la gauche radicale, un Parti socialiste revigorĂŠ et le bloc central macroniste, le dĂŠputĂŠ europĂŠen de Place publique rĂŠussira-t-il Ă  incarner la synthĂ¨se entre social-dĂŠmocratie et pragmatisme politique?",https://cdn.slate.fr/uploads/store/story_272772/original_272772.jpg,2026-05-13T04:55:03Z,,"Le 9 juin 2024 devait ĂŞtre sa victoire. RaphaĂŤl Glucksmann venait de ressusciter ce que l'on pensait ĂŞtre un astre mort. Sous son ĂŠgide, le Parti socialiste (PS), alliĂŠ Ă  sa formation politique PlaceâŚ [+12793 chars]",,fr,'Gabriel Attal'
https://www.franceinfo.fr/replay-radio/l-edito-politique/edito-gabriel-attal-rejoint-edouard-philippe-et-bruno-retailleau-dans-la-bataille-du-socle-commun-pour-la-presidentielle_7971383.html,https://www.franceinfo.fr/replay-radio/l-edito-politique/edito-gabriel-attal-rejoint-edouard-philippe-et-bruno-retailleau-dans-la-bataille-du-socle-commun-pour-la-presidentielle_7971383.html,0,www.franceinfo.fr,Ădito. Gabriel Attal rejoint Ădouard Philippe et Bruno Retailleau dans la bataille du socle commun pour la prĂŠsidentielle,"DĂŠsignĂŠ par Renaissance sans vĂŠritable opposition, Gabriel Attal entre officiellement dans la course Ă  lâĂlysĂŠe. Avec Ădouard Philippe et Bruno Retailleau, ces trois prĂŠtendants se livrent dĂŠsormais une primaire officieuseâŚ par sondages interposĂŠs.",https://www.franceinfo.fr/pictures/dEI2LnuMexqH1s0_0FpxFIxeb7I/0x53:1024x629/1500x843/2026/05/13/6a04096419805617397600.jpg,2026-05-13T05:55:01Z,,"DĂŠsignĂŠ par Renaissance sans vĂŠritable opposition, Gabriel Attal entre officiellement dans la course Ă  lĂlysĂŠe. Avec Ădouard Philippe et Bruno Retailleau, ces trois prĂŠtendants se livrent dĂŠsormais uâŚ [+2804 chars]",,fr,'Bruno Retailleau'
https://www.dhnet.be/actu/monde/2026/05/13/le-comportement-de-trump-sur-les-reseaux-sociaux-suscitent-linquietude-au-sujet-de-son-etat-de-sante-4DN4XY2HGRGJFKWIHC4E3NWIJY/,https://www.dhnet.be/actu/monde/2026/05/13/le-comportement-de-trump-sur-les-reseaux-sociaux-suscitent-linquietude-au-sujet-de-son-etat-de-sante-4DN4XY2HGRGJFKWIHC4E3NWIJY/,0,www.dhnet.be,Le comportement de Trump sur les rĂŠseaux sociaux suscite lâinquiĂŠtude au sujet de son ĂŠtat de santĂŠ,Le prĂŠsident Donald Trump a eu un comportement intrigant sur son rĂŠseau social Truth Social ce lundi. De quoi raviver les questions au sujet de son ĂŠtat de santĂŠ. ...,https://www.dhnet.be/resizer/v2/L76RCQ6ERFB7FLB7P4UFITJIUM.jpg?auth=91b9ae2fc72a2f9c8d0a7366217dffd881d44d5e59818dbf884f488c9a64635d&width=1200&height=630&quality=85&focal=771%2C514,2026-05-13T06:46:50Z,http://web.archive.org/web/20260513170430/https://www.dhnet.be/actu/monde/2026/05/13/le-comportement-de-trump-sur-les-reseaux-sociaux-suscitent-linquietude-au-sujet-de-son-etat-de-sante-4DN4XY2HGRGJFKWIHC4E3NWIJY/,"Rien que lundi soir, le compte de Donald Trump sur Truth Social a diffusĂŠ une cinquantaine de messages dont quelques doublons, toujours des partages de vidĂŠos ou des captures d'ĂŠcran, et non des publâŚ [+3170 chars]",,fr,'Donald Trump'
https://www.huffingtonpost.fr/france/article/sur-l-uniforme-a-l-ecole-cette-premiere-evaluation-ne-va-pas-convaincre-les-opposants-a-la-tenue-unique_263667.html,https://www.huffingtonpost.fr/france/article/sur-l-uniforme-a-l-ecole-cette-premiere-evaluation-ne-va-pas-convaincre-les-opposants-a-la-tenue-unique_263667.html,0,www.huffingtonpost.fr,"Sur lâuniforme Ă  lâĂŠcole, cette premiĂ¨re ĂŠvaluation ne va pas convaincre les opposants Ă  la ÂŤÂ tenue uniqueÂ Âť","ExpĂŠrimentĂŠ depuis un an et demi, lâuniforme Ă  lâĂŠcole visait, selon Gabriel Attal, son initiateur, Ă  amĂŠliorer lâĂŠgalitĂŠ entre ĂŠlĂ¨ves et le climat scolaire.",https://focus.huffingtonpost.fr/2026/05/13/0/0/1800/1012/1820/1023/75/0/2dc8f3e_upload-1-ecgb9dpifxvu-afp-20240902-36fd8pa-v1-midres-rentreescolaireetdistributiondesuniformesdanslec.jpg,2026-05-13T07:27:43Z,,A voir aussi sur Le HuffPost La lecture de ce contenu est susceptible dentraĂŽner un dĂŠpĂ´t de cookies de la part de lopĂŠrateur tiers qui lhĂŠberge. Compte-tenu des choix que vous avez exprimĂŠs en matiĂ¨âŚ [+3782 chars],,fr,'Gabriel Attal'
https://www.presse-citron.net/il-a-saute-dans-lavion-de-donald-trump-en-alaska-le-pdg-de-nvidia-a-rejoint-in-extremis-la-delegation-presidentielle-pour-la-chine-va-t-il-reussir-a-vendre-ses-puces-a-pekin/,https://www.presse-citron.net/il-a-saute-dans-lavion-de-donald-trump-en-alaska-le-pdg-de-nvidia-a-rejoint-in-extremis-la-delegation-presidentielle-pour-la-chine-va-t-il-reussir-a-vendre-ses-puces-a-pekin/,0,www.presse-citron.net,"Il a sautĂŠ dans lâavion de Donald TrumpÂ : en Alaska, le PDG de Nvidia a rejoint in extrĂŠmis la dĂŠlĂŠgation prĂŠsidentielle pour la Chine. Va-t-il rĂŠussir Ă  vendre ses puces Ă  PĂŠkinÂ ?",Jensen Huang vient de rejoindre la dĂŠlĂŠgation du prĂŠsident amĂŠricain.,https://www.presse-citron.net/app/uploads/2025/05/Jensen-Huang-Nvidia-1600x900.jpg,2026-05-13T07:52:27Z,,"On sinterrogeait sur sa prĂŠsence, elle est dĂŠsormais confirmĂŠe. Jensen Huang, le fondateur et PDG de Nvidia accompagnera bien Donald Trump lors de sa visite dĂtat en Chine. Ce dernier devrait en profâŚ [+3487 chars]",,fr,'Donald Trump'
https://www.20minutes.fr/societe/4223315-20260513-uniforme-ecole-outil-magique-apres-effets-limites-experience-va-etre-abandonnee,https://www.20minutes.fr/societe/4223315-20260513-uniforme-ecole-outil-magique-apres-effets-limites-experience-va-etre-abandonnee,0,www.20minutes.fr,"Uniforme Ă  lâĂŠcoleÂ : ÂŤÂ Pas lâoutil magiqueâŚÂ Âť AprĂ¨s des effets limitĂŠs, lâexpĂŠrience va-t-elle ĂŞtre abandonnĂŠeÂ ?",Cette mesure promue enÂ 2023 par Gabriel Attal a eu des effets inĂŠgaux et globalement limitĂŠs,https://img.20mn.fr/iqtOkfbrQOO-Vl_2dLNk6ik/1444x920_le-ministre-francais-de-l-education-edouard-geffray-part-apres-la-reunion-hebdomadaire-du-cabinet-au-palais-presidentiel-de-l-elysee-a-paris-le-6-mai-2026-01accorsinijeanne-cdm-0025-credit-jeanne-accorsini-sipa-2605061256,2026-05-13T07:59:31Z,http://web.archive.org/web/20260513201603/https://www.20minutes.fr/societe/4223315-20260513-uniforme-ecole-outil-magique-apres-effets-limites-experience-va-etre-abandonnee,"Quelles conclusions pour lexpĂŠrimentation de luniformeÂ Ă  l'ĂŠcole ? Cette mesure, promue enÂ 2023 par Gabriel Attal lors de son passage Ă  lEducation nationale comme un moyen datteindre ÂŤÂ lĂŠgalitĂŠ sociaâŚ [+4131 chars]",,fr,'Gabriel Attal'
https://www.dhnet.be/actu/monde/2026/05/13/malgre-des-demissions-en-cascade-dans-son-propre-parti-et-des-appels-a-ce-quil-parte-le-premier-ministre-anglais-stramer-saccroche-a-tout-prix-FV6UDUXGLVH3TJHZOF4F7SWJPA/,https://www.dhnet.be/actu/monde/2026/05/13/malgre-des-demissions-en-cascade-dans-son-propre-parti-et-des-appels-a-ce-quil-parte-le-premier-ministre-anglais-stramer-saccroche-a-tout-prix-FV6UDUXGLVH3TJHZOF4F7SWJPA/,0,www.dhnet.be,"MalgrĂŠ des dĂŠmissions en cascade dans son propre parti et des appels Ă  ce qu'il parte, le premier ministre anglais Stramer s'accroche Ă  tout prix","Bien qu'il soit de plus en plus fragilisĂŠ, le Premier ministre britannique Keir Starmer a dit mardi vouloir ""continuer Ă  gouverner"", suscitant de profondes divisions au sein du Labour. Le nom de l'ancienne vice-PremiĂ¨re ministre Angela Rayner, 46 ans, est ausâŚ",https://www.dhnet.be/resizer/v2/EBPJ2BDDIVHZTN6UN7YMTCI2DQ.jpg?auth=ac96d6eebc9a9e3c5fc9f91ab8107b290e3340f85b29f037dea7a0d290d676cb&width=1200&height=630&quality=85&focal=1837%2C1225,2026-05-13T09:13:11Z,,"Qui veut le dĂŠpart de Starmer ?
La pression sur le dirigeant n'a fait que s'accroĂŽtre depuis son discours de lundi, censĂŠ relancer son mandat aprĂ¨s des ĂŠlections locales dĂŠsastreuses pour le Labour âŚ [+4323 chars]",,fr,'Keir Starmer'
https://www.courrierinternational.com/article/justice-elon-musk-contre-sam-altman-leur-proces-changera-t-il-l-avenir-de-l-ia_243919,https://www.courrierinternational.com/article/justice-elon-musk-contre-sam-altman-leur-proces-changera-t-il-l-avenir-de-l-ia_243919,0,www.courrierinternational.com,Elon Musk contre Sam AltmanÂ : leur procĂ¨s changera-t-il lâavenir de lâIAÂ ?,"Sam Altman, le patron dâOpenAI, a tĂŠmoignĂŠ, le mardi 12Â mai, dans le cadre du procĂ¨s que lui a intentĂŠ Elon Musk, qui avait fondĂŠ avec lui lâentreprise dâintelligence artificielle en 2015. Lâaffaire soulĂ¨ve des questions irrĂŠsolues autour des dangers de lâintâŚ",https://focus.courrierinternational.com/2026/04/29/0/0/1920/1280/1200/630/60/0/90884f0_ftp-1-a4yblbd3z3e6-2026-04-29t174052z-1503926160-rc21zka40miz-rtrmadp-3-musk-openai-court.JPG,2026-05-13T10:22:22Z,,"Les milliardaires Sam Altman et Elon Musk, deux des figures les plus influentes du secteur de lintelligence artificielle (IA), saffrontent sur le terrain judiciaire. Les enjeux du procĂ¨s sont de tailâŚ [+1038 chars]",,fr,'Sam Altman'
https://www.lalibre.be/economie/conjoncture/2026/05/13/a-23-ans-le-prince-liegeois-de-linformatique-simplante-aux-etats-unis-et-au-japon-B7UEJJTF5VE6BCP5CW5VVNVHNM/,https://www.lalibre.be/economie/conjoncture/2026/05/13/a-23-ans-le-prince-liegeois-de-linformatique-simplante-aux-etats-unis-et-au-japon-B7UEJJTF5VE6BCP5CW5VVNVHNM/,0,www.lalibre.be,"Ă 23 ans, le prince liĂŠgeois de lâinformatique sâimplante aux Ătats-Unis et au Japon",Andrew Willems a fondĂŠ sa sociĂŠtĂŠ en 2022 et a connu une forte croissance depuis lors. ...,https://www.lalibre.be/resizer/v2/RSYEWRP3UFC35JPHLHPZOWWRIA.png?auth=c45a238d19ac278e28156692b200cb40262644cd6d97f10c102085355e2e2829&width=1200&height=630&quality=85&focal=825%2C543,2026-05-13T11:50:29Z,,"Programmeur Ă  17 ans
Ă 17 ans, il devient programmeur/analyste dans une boĂŽte informatique. ""Je me suis alors rendu compte que les systĂ¨mes informatiques des entreprises ĂŠtaient bancals, dĂŠclare-t-iâŚ [+3386 chars]",,fr,'prince Andrew'
https://www.lexpress.fr/monde/amerique/faire-du-venezuela-le-51e-etat-americain-la-nouvelle-lubie-de-donald-trump-3S5HXIUMCBGXFHCVOWSUNRFZEY/,https://www.lexpress.fr/monde/amerique/faire-du-venezuela-le-51e-etat-americain-la-nouvelle-lubie-de-donald-trump-3S5HXIUMCBGXFHCVOWSUNRFZEY/,0,www.lexpress.fr,"Faire du Venezuela le 51e Etat amĂŠricain, la nouvelle lubie de Donald Trump","Quatre mois aprĂ¨s l'enlĂ¨vement du prĂŠsident vĂŠnĂŠzuĂŠlien Nicolas Maduro par l'armĂŠe amĂŠricaine, le milliardaire a affirmĂŠ qu'il envisageait ""sĂŠrieusement"" de ""contrĂ´ler le pays"". La prĂŠsidente par intĂŠrim a rappelĂŠ que son pays n'ĂŠtait ""pas une colonie"".",https://www.lexpress.fr/resizer/v2/EIZBSKYO45BATBPLY752UL6TJE.JPG?auth=7cc68d97d7a4aaa37134ee168992a9dfe5c5576354e8e38a7ef4f9bcc34814e2&width=1200&height=630&quality=85&smart=true,2026-05-13T13:50:35Z,http://web.archive.org/web/20260513201700/https://www.lexpress.fr/monde/amerique/faire-du-venezuela-le-51e-etat-americain-la-nouvelle-lubie-de-donald-trump-3S5HXIUMCBGXFHCVOWSUNRFZEY/,"A priori, peu de choses lient le Venezuela au Canada et au Groenland. Mais dĂŠsormais, le pays d'AmĂŠrique latine a rejoint les deux autres territoires dans le groupe des pays menacĂŠs par Donald Trump.âŚ [+3880 chars]",,fr,'Nicolas Maduro'
https://www.20minutes.fr/diaporama/diaporama-4223356-images-ping-pong-coca-manche-chemise-best-of-rencontres-entre-presidents-americains-chinois,https://www.20minutes.fr/diaporama/diaporama-4223356-images-ping-pong-coca-manche-chemise-best-of-rencontres-entre-presidents-americains-chinois,0,www.20minutes.fr,"EN IMAGES Ping-pong, Coca et manche de chemiseâŚ Le best-of des rencontres entre prĂŠsidents amĂŠricains et chinois","Donald Trump se rend en Chine pour un sommet bilatĂŠral, le premier depuisÂ 2017. Entre PĂŠkin et Washington, les relations ont souvent ĂŠtĂŠ complexes",https://img.20mn.fr/5zFe23bET_27uvR5nCnyfSk/1444x920_tres-virulent-lors-de-la-campagne-electorale-contre-la-chine-qu-il-accusait-de-violer-l-economie-americaine-donald-trump-adoucit-le-ton-apres-sa-premiere-election-en-novembre-2017-il-est-recu-lors-d-une-visite-d-etat-a-pekin-en-janvier-2018-le-gouvernement-americain-augmente-les-tarifs-sur-une-serie-d-importations-chinoises-relancant-la-guerre-commerciale-entre-les-deux-pays,2026-05-13T14:07:35Z,,"Un bras de fer entre amis. Donald Trump entame une visite en Chine Ă  la rencontre de son homologue chinois Xi Jinping. Si le prĂŠsident amĂŠricain dit sattendre Ă  recevoir un ÂŤÂ gros cĂ˘linÂ Âť, de nombreuâŚ [+1004 chars]",,fr,'Barack Obama'
https://www.courrierinternational.com/article/diplomatie-la-detente-se-confirme-mais-les-relations-entre-paris-et-alger-restent-un-champ-de-mines_243986,https://www.courrierinternational.com/article/diplomatie-la-detente-se-confirme-mais-les-relations-entre-paris-et-alger-restent-un-champ-de-mines_243986,0,www.courrierinternational.com,"âLa dĂŠtente se confirmeâ, mais les relations entre Paris et Alger restent un âchamp de minesâ","Les relations entre la France et lâAlgĂŠrie semblent se dĂŠtendre ces derniĂ¨res semaines aprĂ¨s un discours dâapaisement du prĂŠsident Emmanuel Macron et des gestes diplomatiques dâAlger. Une dĂŠtente toutefois fragile, et la discorde entre les deux pays nâest sanâŚ",https://focus.courrierinternational.com/2026/05/09/0/0/3499/2333/1200/630/60/0/cb9cf4f_ftp-1-b3qyzi9ri9yr-afp-b2cv3kf.jpg,2026-05-13T14:48:09Z,,"Les signes dune reprise du dialogue entre Paris et Alger se multiplient aprĂ¨s les longs mois de tensions qui ont suivi la reconnaissance par la France de la marocanitĂŠ du Sahara occidental, en juilleâŚ [+1078 chars]",,fr,'Emmanuel Macron'
https://www.telerama.fr/cinema/a-cannes-peter-jackson-annonce-preparer-un-nouveau-tintin-on-est-en-train-de-travailler-sur-le-script-7031057.php,https://www.telerama.fr/cinema/a-cannes-peter-jackson-annonce-preparer-un-nouveau-tintin-on-est-en-train-de-travailler-sur-le-script-7031057.php,0,www.telerama.fr,"Ă Cannes, Peter Jackson annonce prĂŠparer un nouveau âTintinâ : âOn est en train de travailler sur le scriptâ","Lors dâune rencontre en public ce mercredi 13Â mai, le rĂŠalisateur nĂŠo-zĂŠlandais a rĂŠvĂŠlĂŠ quâil prendrait la suite de Steven Spielberg pour un deuxiĂ¨me volet des âAventures de Tintinâ. Il est ĂŠgalement revenu sur ses souvenirs de tournage. Morceaux choisis.",https://focus.telerama.fr/2026/05/13/740/475/3028/2019/1200/800/60/0/a049191_upload-1-rrlsp6adsa6t-020-2275979744-2.jpg,2026-05-13T15:16:36Z,,"Lors dune rencontre en public ce mercredi 13Â mai, le rĂŠalisateur nĂŠo-zĂŠlandais a rĂŠvĂŠlĂŠ quil prendrait la suite de Steven Spielberg pour un deuxiĂ¨me volet des Aventures de Tintin. Il est ĂŠgalement reâŚ [+8590 chars]",,fr,'Steven Spielberg'
https://www.lesnumeriques.com/serie/stuart-fails-to-save-the-universe-une-bande-annonce-etonnante-pour-le-spinoff-de-the-big-bang-theory-n255912.html,https://www.lesnumeriques.com/serie/stuart-fails-to-save-the-universe-une-bande-annonce-etonnante-pour-le-spinoff-de-the-big-bang-theory-n255912.html,0,www.lesnumeriques.com,ActualitĂŠ : Stuart Fails to Save the Universe : une bande-annonce ĂŠtonnante pour le spinoff de The Big Bang Theory,"HBO Max vient de dĂŠvoiler la premiĂ¨re bande-annonce et la date de sortie de Stuart Fails to Save the Universe, la premiĂ¨re sĂŠrie dĂŠrivĂŠe faĂ§on science-fiction de la sitcom The Big Bang Theory.",https://cdn.lesnumeriques.com/optim/news/25/255912/c659545e-stuart-fails-to-save-the-universe-une-bande-annonce-etonnante-pour-le-spinoff-de-the-big-bang-theory__1200_678__68-0-2064-1048.jpg,2026-05-13T15:59:00Z,http://web.archive.org/web/20260514123256/https://www.lesnumeriques.com/serie/stuart-fails-to-save-the-universe-une-bande-annonce-etonnante-pour-le-spinoff-de-the-big-bang-theory-n255912.html,"AprĂ¨s 12 saisons sur autant d'annĂŠes de diffusion, en 2019 la sitcom Ă  succĂ¨s The Big Bang Theory tirera sa rĂŠvĂŠrence. En dehors de Young Sheldon qui s'arrĂŞtera elle en 2024 (et du show spinoff du spâŚ [+1937 chars]",,fr,'nan nan'
