index,url,valid,domain,title,description,image,published,archive,content,quote,language,keyword
https://www.franceinfo.fr/monde/afrique/algerie/la-france-et-l-algerie-actent-une-reprise-concrete-de-leur-cooperation-judiciaire-operationnelle_8011763.html,https://www.franceinfo.fr/monde/afrique/algerie/la-france-et-l-algerie-actent-une-reprise-concrete-de-leur-cooperation-judiciaire-operationnelle_8011763.html,0,www.franceinfo.fr,"La France et l'AlgĂŠrie actent une ""reprise concrĂ¨te"" de leur ""coopĂŠration judiciaire opĂŠrationnelle""","En visite en AlgĂŠrie, le ministre de la Justice, GĂŠrald Darmanin, a actĂŠ cette reprise, lundi, avec son homologue algĂŠrien, aprĂ¨s deux annĂŠes d'interruption totale.",https://www.franceinfo.fr/pictures/ykx5qj9MAbwfJeIP6IiIpDVbVgA/0x0:1024x576/1500x843/2026/05/18/6a0b0af62ed0a479001213.jpg,2026-05-18T12:50:08Z,http://web.archive.org/web/20260519111541/https://www.franceinfo.fr/monde/afrique/algerie/la-france-et-l-algerie-actent-une-reprise-concrete-de-leur-cooperation-judiciaire-operationnelle_8011763.html,"Des relations rĂŠchauffĂŠes aprĂ¨s ""deux annĂŠes dinterruption totale"". La France et l'AlgĂŠrie ont actĂŠ, lundi 18 mai, une ""reprise concrĂ¨te"" de leur ""coopĂŠration judiciaire opĂŠrationnelle"", a annoncĂŠ auâŚ [+1146 chars]",,fr,'GĂŠrald Darmanin'
https://www.telerama.fr/cinema/tribune-anti-bollore-pourquoi-la-liste-noire-de-canal-secoue-le-cinema-francais-7031165.php,https://www.telerama.fr/cinema/tribune-anti-bollore-pourquoi-la-liste-noire-de-canal-secoue-le-cinema-francais-7031165.php,0,www.telerama.fr,Tribune anti-BollorĂŠÂ : pourquoi la liste noire de Canal+ secoue le cinĂŠma franĂ§ais,"Maxime Saada, le patron de la chaĂŽne cryptĂŠe, a affirmĂŠ que les signataires dâune tribune dĂŠnonĂ§ant âlâemprise de BollorĂŠâ sur le cinĂŠma ne travailleraient plus avec Canal+, principal financeur du septiĂ¨me art. Ă Cannes, les tensions se multiplient.",https://focus.telerama.fr/2026/05/18/770/665/3965/2643/1200/800/60/0/530515a_upload-1-91p3jlzcbrse-opaleplus-allde240315a-21.jpg,2026-05-18T13:29:46Z,,"Maxime Saada, le patron de la chaĂŽne cryptĂŠe, a affirmĂŠ que les signataires dune tribune dĂŠnonĂ§ant lemprise de BollorĂŠ sur le cinĂŠma ne travailleraient plus avec Canal+, principal financeur du septiĂ¨âŚ [+6604 chars]",,fr,'nan nan'
https://www.dhnet.be/medias/cinema/2026/05/18/javier-bardem-tacle-trump-poutine-et-netanyahu-a-cannes-ma-bte-est-plus-grosse-que-la-tienne-et-je-vais-te-bombarder-la-gueule-Z77O4LX67JHRHJGFR6YSJWWQS4/,https://www.dhnet.be/medias/cinema/2026/05/18/javier-bardem-tacle-trump-poutine-et-netanyahu-a-cannes-ma-bte-est-plus-grosse-que-la-tienne-et-je-vais-te-bombarder-la-gueule-Z77O4LX67JHRHJGFR6YSJWWQS4/,0,www.dhnet.be,"Javier Bardem tacle Trump, Poutine et Netanyahu Ă  CannesÂ : âMa b*te est plus grosse que la tienne et je vais te bombarder la gueuleâ","La star espagnole, en compĂŠtition au Festival de Cannes, a estimĂŠ que la âmasculinitĂŠ toxiqueâ des PrĂŠsidents amĂŠricain, russe et israĂŠlien ĂŠtait responsable de âmilliers de mortsâ. âUn gĂŠnocide est en cours, câest un faitâ ...",https://www.dhnet.be/resizer/v2/ONWSZWDNAZF3VDAEOXE3YLRO7Q.jpg?auth=3d8021e59695fb2162dbc3427d6f9a27d3b94b224daae6c605261a66940e0f3d&width=1200&height=630&quality=85&focal=2617%2C1745,2026-05-18T13:53:37Z,,"Grand dĂŠfenseur de la cause palestinienne, Javier Bardem (No Country for Old Men, Vicky Cristina Barcelona, Biutiful) a par ailleurs affirmĂŠ qu'un ""gĂŠnocide"" ĂŠtait ""toujours en cours"" Ă  Gaza. LĂ  oĂš pâŚ [+797 chars]",,fr,'Poutine'
https://www.bfmtv.com/politique/modem/il-aurait-tort-de-s-en-priver-pourquoi-francois-bayrou-man-uvre-en-vue-de-la-presidentielle_AN-202605180636.html,https://www.bfmtv.com/politique/modem/il-aurait-tort-de-s-en-priver-pourquoi-francois-bayrou-man-uvre-en-vue-de-la-presidentielle_AN-202605180636.html,0,www.bfmtv.com,"""Il aurait tort de s'en priver"": pourquoi FranĂ§ois Bayrou manĹuvre en vue de la prĂŠsidentielle","L'ancien Premier ministre a beau ne plus dĂŠtenir aucun mandat ĂŠlectoral, il se croit toujours en mesure de peser pour 2027. FranĂ§ois Bayrou tente de rassembler autour d'une seule banniĂ¨re plusieurs partis du centre qui se rĂŠuniraient autour du Modem. De quoi âŚ",https://images.bfmtv.com/nsDsYt1NdrCyK9GNkaXejyDqGgg=/0x0:2048x1152/2048x0/images/Francois-Bayrou-le-15-mars-2026-a-Pau-2287789.jpg,2026-05-18T14:43:29Z,,"L'ancien Premier ministre a beau ne plus dĂŠtenir aucun mandat ĂŠlectoral, il se croit toujours en mesure de peser pour 2027. FranĂ§ois Bayrou tente de rassembler autour d'une seule banniĂ¨re plusieurs pâŚ [+5758 chars]",,fr,'Premier ministre'
https://www.courrierinternational.com/article/economie-le-g7-finances-parviendra-t-il-a-l-unite-a-paris-face-au-blocage-du-detroit-d-ormuz_244117,https://www.courrierinternational.com/article/economie-le-g7-finances-parviendra-t-il-a-l-unite-a-paris-face-au-blocage-du-detroit-d-ormuz_244117,0,www.courrierinternational.com,Le G7Â Finances parviendra-t-il Ă  lâunitĂŠ Ă  Paris face au blocage du dĂŠtroit dâOrmuzÂ ?,"Avant mĂŞme lâouverture, lundi 18Â mai, de la rencontre des ministres des Finances du groupe des sept pays membres dans la capitale franĂ§aise, Scott Bessent, secrĂŠtaire du TrĂŠsor des Ătats-Unis, a appelĂŠ ses homologues Ă  appliquer des sanctions contre lâIran. CâŚ",https://focus.courrierinternational.com/2026/05/18/0/0/6192/4128/1200/630/60/0/a634de5_ftp-1-sypwnvidjmrv-afp-b36z4k2.jpg,2026-05-18T15:22:15Z,,"Les ministres des Finances et les directeurs des banques centrales des pays membres du G7Â se rĂŠunissent Ă  Paris, cesÂ 18Â et 19Â mai, pour deux jours dĂŠchanges sur les dĂŠsĂŠquilibres macroĂŠconomiques et âŚ [+2217 chars]",,fr,'nan nan'
https://www.begeek.fr/pourquoi-dustin-hoffman-a-refuse-le-role-principal-dans-un-chef-doeuvre-de-martin-scorsese-432320,https://www.begeek.fr/pourquoi-dustin-hoffman-a-refuse-le-role-principal-dans-un-chef-doeuvre-de-martin-scorsese-432320,0,www.begeek.fr,Pourquoi Dustin Hoffman a refusĂŠ le rĂ´le principal dans un chef-dâĹuvre de Martin Scorsese,Dustin Hoffman a refusĂŠ dâincarner le personnage principal dans lâun des films les plus cĂŠlĂ¨bres de Martin Scorsese. Ce choix marquant a influencĂŠ la trajectoire du projet et offre un ĂŠclairage inĂŠdit sur la carriĂ¨re de lâacteur.,https://www.begeek.fr/app/uploads/2026/05/Taxi-Driver.jpg,2026-05-18T17:00:46Z,,Dustin Hoffman a refusĂŠ dincarner le personnage principal dans lun des films les plus cĂŠlĂ¨bres de Martin Scorsese. Ce choix marquant a influencĂŠ la trajectoire du projet et offre un ĂŠclairage inĂŠdit âŚ [+3289 chars],,fr,'David Letterman'
https://www.bfmtv.com/politique/gouvernement/en-deplacement-en-algerie-gerald-darmanin-evoque-le-travail-a-faire-pour-renouer-la-confiance-entre-les-deux-pays_AN-202605180815.html,https://www.bfmtv.com/politique/gouvernement/en-deplacement-en-algerie-gerald-darmanin-evoque-le-travail-a-faire-pour-renouer-la-confiance-entre-les-deux-pays_AN-202605180815.html,0,www.bfmtv.com,"En dĂŠplacement en AlgĂŠrie, GĂŠrald Darmanin ĂŠvoque le travail Ă  faire ""pour renouer la confiance"" entre les deux pays","Le garde des Sceaux GĂŠrald Darmanin s'est rendu ce lundi Ă  Alger avec plusieurs magistrats pour discuter de la coopĂŠration judiciaire franco-algĂŠrienne ainsi que de certains dossiers entre les deux pays dans le but de ""renouer la confiance"".",https://images.bfmtv.com/obfqWItS8e2CCO1OSCavtr6OIAU=/0x106:2048x1258/2048x0/images/Le-ministre-algerien-de-la-Justice-Lotfi-Boudjemaa-recoit-le-ministre-francais-de-la-Justice-Gerald-Darmanin-au-centre-a-droite-lors-d-une-rencontre-bilaterale-au-siege-du-ministere-a-Alger-le-18-mai-2026-2287909.jpg,2026-05-18T17:39:54Z,http://web.archive.org/web/20260519095227/https://www.bfmtv.com/politique/gouvernement/en-deplacement-en-algerie-gerald-darmanin-evoque-le-travail-a-faire-pour-renouer-la-confiance-entre-les-deux-pays_AN-202605180815.html,Le garde des Sceaux GĂŠrald Darmanin s'est rendu ce lundi Ă  Alger avec plusieurs magistrats pour discuter de la coopĂŠration judiciaire franco-algĂŠrienne ainsi que de certains dossiers entre les deux pâŚ [+1571 chars],,fr,'Christophe Gleizes'
https://www.franceinfo.fr/replay-radio/les-informes-de-france-info/periscolaire-a-paris-la-polemique-canal-gerald-darmanin-en-algerie-les-informes-de-franceinfo-du-lundi-18-mai-2026_7981805.html,https://www.franceinfo.fr/replay-radio/les-informes-de-france-info/periscolaire-a-paris-la-polemique-canal-gerald-darmanin-en-algerie-les-informes-de-franceinfo-du-lundi-18-mai-2026_7981805.html,0,www.franceinfo.fr,"PĂŠriscolaire Ă  Paris, la polĂŠmique Canal+, GĂŠrald Darmanin en AlgĂŠrie... Les informĂŠs de franceinfo du lundi 18 mai 2026",Les informĂŠs dĂŠbattent de l'actualitĂŠ autour de Brigitte Boucher.,https://www.franceinfo.fr/pictures/1pa1-hEZGJQc3EfSb01a3doS9I0/0x0:640x360/1500x843/2026/05/18/6a0b636c0c8ad799155719.png,2026-05-18T19:20:35Z,http://web.archive.org/web/20260519112613/https://www.franceinfo.fr/replay-radio/les-informes-de-france-info/periscolaire-a-paris-la-polemique-canal-gerald-darmanin-en-algerie-les-informes-de-franceinfo-du-lundi-18-mai-2026_7981805.html,"Les informĂŠs dĂŠbattent de l'actualitĂŠ autour de Brigitte Boucher.
Les thĂ¨mes
Violences dans le pĂŠriscolaire Ă  ParisÂ : Une convention citoyenne s'est ouverte aujourd'hui, consacrĂŠe Ă  la protection dâŚ [+1205 chars]",,fr,'Christophe Gleizes'
https://www.courrierinternational.com/article/californie-elon-musk-perd-son-bras-de-fer-judiciaire-contre-openai_244140,https://www.courrierinternational.com/article/californie-elon-musk-perd-son-bras-de-fer-judiciaire-contre-openai_244140,0,www.courrierinternational.com,Elon Musk perd son bras de fer judiciaire contre OpenAI,"Le PDG de Tesla, qui avait ĂŠtĂŠ lâun âdes cofondateurs originaux dâOpenAI, accusait son patron Sam Altman dâavoir trahi la mission âinitiale de la sociĂŠtĂŠ â en crĂŠant âune entitĂŠ Ă  but lucratif. Mais un jury californien a estimĂŠ lundi quâElon Musk âavait intentâŚ",https://focus.courrierinternational.com/2026/05/15/2/0/3254/2169/1200/630/60/0/bb8cbd6_ftp-1-6feaow5qodnt-2026-05-15t103542z-1355699746-rc24zka8y6me-rtrmadp-3-britain-ofcom-x.JPG,2026-05-19T04:07:14Z,,"Cest une victoire franche pour OpenAI, rĂŠsume The Washington Post. Elon Musk a perdu lundi 18Â mai son retentissant procĂ¨s en Californie contre les crĂŠateurs de ChatGPT, quil accusait davoir dĂŠtournĂŠ âŚ [+3017 chars]",,fr,'Sam Altman'
https://www.bfmtv.com/international/moyen-orient/direct-guerre-au-moyen-orient-donald-trump-evoque-de-tres-bonnes-chances-de-parvenir-a-un-accord-avec-l-iran_LN-202605190088.html,https://www.bfmtv.com/international/moyen-orient/direct-guerre-au-moyen-orient-donald-trump-evoque-de-tres-bonnes-chances-de-parvenir-a-un-accord-avec-l-iran_LN-202605190088.html,0,www.bfmtv.com,"DIRECT. Guerre au Moyen-Orient: Donald Trump ĂŠvoque de ""trĂ¨s bonnes chances"" de parvenir Ă  un accord avec l'Iran","Le 81e jour du conflit en Iran et dans la rĂŠgion s'ouvre, ce mardi 19 mai, alors que les Ătats-Unis ont annoncĂŠ avoir avortĂŠ in extremis une attaque dans la journĂŠe prĂŠvue lundi. Donald Trump a estimĂŠ lundi qu'il existait de ""trĂ¨s bonnes chances"" de parvenir âŚ",https://images.bfmtv.com/83olaSm9MNrBccAVsYAwDBJ0Tig=/0x188:2048x1340/2048x0/images/Donald-Trump-lors-d-un-echange-avec-la-presse-le-9-mai-2026-2283846.jpg,2026-05-19T04:30:10Z,,"L'Australie a obtenu de la Chine de se faire livrer 600.000 barils de kĂŠrosĂ¨ne, a annoncĂŠ aujourd'hui le Premier ministre Anthony Albanese, en pleine hausse des prix du carburant.
Le pays insulaire âŚ [+785 chars]",,fr,'Donald Trump'
https://www.zdnet.fr/actualites/openai-gagne-son-proces-contre-musk-quel-impact-sur-la-roadmap-et-les-api-495200.htm,https://www.zdnet.fr/actualites/openai-gagne-son-proces-contre-musk-quel-impact-sur-la-roadmap-et-les-api-495200.htm,0,www.zdnet.fr,OpenAI gagne son procĂ¨s contre Musk : Quel impact sur la roadmap et les API ?,Le verdict est tombĂŠ aprĂ¨s trois semaines dâun procĂ¨s ultra-mĂŠdiatisĂŠ : la justice a dĂŠboutĂŠ Elon Musk de ses poursuites contre OpenAI et son dirigeant Sam Altman. Cette dĂŠcision ĂŠcarte un risque structurel majeur sur lâĂŠcosystĂ¨me de lâIA.,https://www.zdnet.fr/wp-content/uploads/zdnet/2025/10/openai.jpg,2026-05-19T04:50:10Z,http://web.archive.org/web/20260519120027/https://www.zdnet.fr/actualites/openai-gagne-son-proces-contre-musk-quel-impact-sur-la-roadmap-et-les-api-495200.htm,"Il aura fallu moins de deux heures de dĂŠlibĂŠration au jury populaire pour trancher. Les neuf citoyens amĂŠricains ont estimĂŠ que les accusations d'Elon Musk, reprochant Ă  OpenAI d'avoir dĂŠtournĂŠ ses dâŚ [+2340 chars]",,fr,'Sam Altman'
https://rmcsport.bfmtv.com/football/nous-avons-ete-tres-rassures-gerald-darmanin-evoque-les-conditions-de-detention-de-christophe-gleize-apres-son-voyage-en-algerie_AD-202605190241.html,https://rmcsport.bfmtv.com/football/nous-avons-ete-tres-rassures-gerald-darmanin-evoque-les-conditions-de-detention-de-christophe-gleize-apres-son-voyage-en-algerie_AD-202605190241.html,0,rmcsport.bfmtv.com,"""Nous avons ĂŠtĂŠ trĂ¨s rassurĂŠs"": GĂŠrald Darmanin ĂŠvoque les conditions de dĂŠtention de Christophe Gleizes aprĂ¨s son voyage en AlgĂŠrie",Le ministre de la Justice ĂŠtait en visite en AlgĂŠrie ce lundi 18 mai. La question des conditions de dĂŠtention du journaliste franĂ§ais Christophe Gleizes ĂŠtait au cĹur de ce dĂŠplacement.,https://images.bfmtv.com/Df1h8zHCaCW_FRtlun1nV49rNFc=/0x99:1280x819/images/Christophe-Gleizes-2106910.jpg,2026-05-19T06:35:56Z,http://web.archive.org/web/20260520064023/https://rmcsport.bfmtv.com/football/nous-avons-ete-tres-rassures-gerald-darmanin-evoque-les-conditions-de-detention-de-christophe-gleize-apres-son-voyage-en-algerie_AD-202605190241.html,"Le ministre de la Justice ĂŠtait en visite en AlgĂŠrie ce lundi 18 mai. La question des conditions de dĂŠtention du journaliste franĂ§ais Christophe Gleizes ĂŠtait au cur de ce dĂŠplacement.
De retour d'AâŚ [+214 chars]",,fr,'Christophe Gleizes'
https://www.franceinfo.fr/culture/livres/emprisonnement-du-journaliste-christophe-gleizes-en-algerie/nous-avons-ete-tres-rassures-par-la-facon-dont-christophe-gleizes-est-traite-declare-gerald-darmanin_8013611.html,https://www.franceinfo.fr/culture/livres/emprisonnement-du-journaliste-christophe-gleizes-en-algerie/nous-avons-ete-tres-rassures-par-la-facon-dont-christophe-gleizes-est-traite-declare-gerald-darmanin_8013611.html,0,www.franceinfo.fr,"""Nous avons ĂŠtĂŠ trĂ¨s rassurĂŠs par la faĂ§on dont Christophe Gleizes est traitĂŠ"", dĂŠclare GĂŠrald Darmanin","C'est ce qu'a dĂŠclarĂŠ le ministre de la Justice, mardi, sur CNews, au lendemain de son voyage en AlgĂŠrie.",https://www.franceinfo.fr/pictures/a6amdhZ0aWw-S0rcQTGo1no_dGo/0x0:1024x576/1500x843/2026/05/19/6a0c078d787ad733669060.jpg,2026-05-19T06:48:29Z,http://web.archive.org/web/20260519105417/https://www.franceinfo.fr/culture/livres/emprisonnement-du-journaliste-christophe-gleizes-en-algerie/nous-avons-ete-tres-rassures-par-la-facon-dont-christophe-gleizes-est-traite-declare-gerald-darmanin_8013611.html,"De retour d'AlgĂŠrie, GĂŠrald Darmanin donne des signaux positifs sur le sort du journaliste franĂ§ais Christophe Gleizes oĂš il est incarcĂŠrĂŠ. ""Nous avons ĂŠtĂŠ trĂ¨s rassurĂŠs par la faĂ§on dont Christophe âŚ [+854 chars]",,fr,'Christophe Gleizes'
https://www.20minutes.fr/monde/4224196-20260519-algerie-darmanin-dit-tres-rassure-facon-dont-christophe-gleizes-traite,https://www.20minutes.fr/monde/4224196-20260519-algerie-darmanin-dit-tres-rassure-facon-dont-christophe-gleizes-traite,0,www.20minutes.fr,AlgĂŠrieÂ : Darmanin se dit ÂŤÂ trĂ¨s rassurĂŠÂ Âť par la faĂ§on dont Christophe Gleizes est traitĂŠ,"AprĂ¨s sa visite en AlgĂŠrie, le ministre de la Justice GĂŠrald Darmanin sâest dit ÂŤÂ trĂ¨s rassurĂŠÂ Âť par la faĂ§on dont est traitĂŠ le journaliste sportif Christophe Gleizes, dĂŠtenu dans le pays depuis un an",https://img.20mn.fr/haBDJ779RBSHvzcQacWmLCk/1444x920_photo-illustrations-free-christophe-gleizes-journaliste-sportif-francais-condamne-en-algerie-greuezfrancois-greuez2153-credit-francois-greuez-sipa-2605061506,2026-05-19T06:56:01Z,http://web.archive.org/web/20260519162845/https://www.20minutes.fr/monde/4224196-20260519-algerie-darmanin-dit-tres-rassure-facon-dont-christophe-gleizes-traite,"Le ministre de la Justice GĂŠrald Darmanin, de retour dune visite Ă  Alger, sest dit mardi ÂŤÂ trĂ¨s rassurĂŠÂ Âť par la faĂ§on dont le journaliste sportif Christophe Gleizes, dĂŠtenu dans ce pays, ÂŤÂ est traitâŚ [+1562 chars]",,fr,'GĂŠrald Darmanin'
https://www.ledauphine.com/faits-divers-justice/2026/05/19/de-retour-d-alger-darmanin-se-dit-tres-rassure-par-la-facon-dont-christophe-gleizes-est-traite,https://www.ledauphine.com/faits-divers-justice/2026/05/19/de-retour-d-alger-darmanin-se-dit-tres-rassure-par-la-facon-dont-christophe-gleizes-est-traite,0,www.ledauphine.com,"Diplomatie. De retour d'Alger, Darmanin se dit ÂŤ trĂ¨s rassurĂŠ par la faĂ§on dont Christophe Gleizes est traitĂŠ Âť","Au lendemain d'une visite Ă  Alger, le ministre de la Justice GĂŠrald Darmanin a rassurĂŠ sur la dĂŠtention du journaliste sportif Christophe Gleizes, en prison en AlgĂŠrie depuis prĂ¨s d'un an.",https://cdn-s-www.ledauphine.com/images/C8E19BA6-A6EF-4AB6-9894-1552AC2559D4/FB1200/photo-1779175730.jpg,2026-05-19T07:29:00Z,http://web.archive.org/web/20260520022702/https://www.ledauphine.com/faits-divers-justice/2026/05/19/de-retour-d-alger-darmanin-se-dit-tres-rassure-par-la-facon-dont-christophe-gleizes-est-traite,"Le ministre de la Justice, GĂŠrald Darmanin, s'est dit mardi ÂŤ trĂ¨s rassurĂŠ Âť par la faĂ§on dont le journaliste sportif Christophe Gleizes ÂŤ est traitĂŠ Âť par l'AlgĂŠrie oĂš il est dĂŠtenu, au lendemain d'âŚ [+1428 chars]",,fr,'Christophe Gleizes'
https://www.franceinfo.fr/monde/afrique/algerie/le-vice-president-du-rn-reaffirme-la-necessite-d-un-dialogue-de-fermete-avec-l-algerie-notamment-sur-le-sort-de-christophe-gleizes-et-les-oqtf_8013725.html,https://www.franceinfo.fr/monde/afrique/algerie/le-vice-president-du-rn-reaffirme-la-necessite-d-un-dialogue-de-fermete-avec-l-algerie-notamment-sur-le-sort-de-christophe-gleizes-et-les-oqtf_8013725.html,0,www.franceinfo.fr,"Le vice-prĂŠsident du RN rĂŠaffirme la nĂŠcessitĂŠ dâun ""dialogue de fermetĂŠ"" avec lâAlgĂŠrie, notamment sur le sort de Christophe Gleizes et les OQTF","""On peut vider l'ocĂŠan avec une cuillĂ¨re Ă  cafĂŠ, (...) on ne verra pas les rĂŠsultats"", ironise le dĂŠputĂŠ du Nord, SĂŠbastien Chenu, aprĂ¨s la visite GĂŠrald Darmanin en AlgĂŠrie.",https://www.franceinfo.fr/pictures/3fBZA4_QZhRtgEZUC2QzjZ0UGms/0x0:1280x720/1500x843/2026/05/19/6a0c05b95d13d532950752.jpg,2026-05-19T08:36:19Z,,"Le vice-prĂŠsident du Rassemblement national et dĂŠputĂŠ du Nord SĂŠbastien Chenu plaide mardi 19 mai sur franceinfo pour ""un dialogue de fermetĂŠ avec l'Ătat algĂŠrien"", ĂŠvoquant notamment le cas du journâŚ [+2641 chars]",,fr,'Christophe Gleizes'
https://www.lalibre.be/international/europe/2026/05/19/espagne-lex-premier-socialiste-zapatero-vise-par-une-enquete-pour-trafic-dinfluence-LO57PJSVMRE7PIJFYSIXPGZYUU/,https://www.lalibre.be/international/europe/2026/05/19/espagne-lex-premier-socialiste-zapatero-vise-par-une-enquete-pour-trafic-dinfluence-LO57PJSVMRE7PIJFYSIXPGZYUU/,0,www.lalibre.be,Espagne: l'ex-Premier socialiste Zapatero visĂŠ par une enquĂŞte pour trafic d'influence,"L'ancien Premier ministre socialiste espagnol JosĂŠ Luis Rodriguez Zapatero est visĂŠ par une enquĂŞte pour trafic d'influence dans l'affaire du sauvetage public de la compagnie aĂŠrienne Plus Ultra, liĂŠe au Venezuela, pendant la pandĂŠmie de Covid-19, a annoncĂŠ mâŚ",https://www.lalibre.be/resizer/v2/CR7B4UAUONAMTGQ3AFNFNYBXTQ.jpg?auth=ac5fa17e933102c351371f09f2e34c0c2ea562213f25fd701e2261cf5ce5d048&width=1200&height=630&quality=85&focal=455%2C227,2026-05-19T08:42:58Z,,"Plus Ultra, poids plume du ciel espagnol, ne desservait en 2021 que l'Equateur, le PĂŠrou et le Venezuela, avec quatre Airbus A-340.
La compagnie avait pourtant bĂŠnĂŠficiĂŠ de ce prĂŞt d'urgence accordĂŠâŚ [+1306 chars]",,fr,'Premier ministre'
https://www.bfmtv.com/politique/gouvernement/elles-sont-reparties-laurent-nunez-affirme-que-les-relations-sont-desormais-bonnes-entre-la-france-et-l-algerie_AV-202605190414.html,https://www.bfmtv.com/politique/gouvernement/elles-sont-reparties-laurent-nunez-affirme-que-les-relations-sont-desormais-bonnes-entre-la-france-et-l-algerie_AV-202605190414.html,0,www.bfmtv.com,"""Elles sont reparties"": Laurent NuĂąez affirme que les relations sont dĂŠsormais ""bonnes"" entre la France et l'AlgĂŠrie","Le ministre de l'IntĂŠrieur assure sur BFMTV-RMC ce mardi 19 mai que les relations entre la France et l'AlgĂŠrie ""sont bonnes"" aprĂ¨s une crise acrimonieuse de presque deux ans.",https://images.bfmtv.com/dG7ROE8XOyI5w4YvwhG-1b3SpYA=/0x0:1920x1080/1920x0/images/Le-ministre-de-l-Interieur-Laurent-Nunez-le-19-mai-2026-2288192.jpg,2026-05-19T09:21:28Z,http://web.archive.org/web/20260520071953/https://www.bfmtv.com/politique/gouvernement/elles-sont-reparties-laurent-nunez-affirme-que-les-relations-sont-desormais-bonnes-entre-la-france-et-l-algerie_AV-202605190414.html,"Le ministre de l'IntĂŠrieur assure sur BFMTV-RMC ce mardi 19 mai que les relations entre la France et l'AlgĂŠrie ""sont bonnes"" aprĂ¨s une crise acrimonieuse de presque deux ans.
Un apaisement des relatâŚ [+2569 chars]",,fr,'Christophe Gleizes'
https://www.lavenir.net/fil-info/2026/05/19/inquietante-augmentation-de-fugues-de-mineurs-en-belgique-derriere-chaque-disparition-il-y-a-un-enfant-en-detresse-75BRGD5NYNC65FJZSAUC27MW3U/,https://www.lavenir.net/fil-info/2026/05/19/inquietante-augmentation-de-fugues-de-mineurs-en-belgique-derriere-chaque-disparition-il-y-a-un-enfant-en-detresse-75BRGD5NYNC65FJZSAUC27MW3U/,0,www.lavenir.net,"InquiĂŠtante augmentation de fugues de mineurs en BelgiqueÂ : âDerriĂ¨re chaque disparition, il y a un enfant en dĂŠtresseâ","En 2025, Child Focus a ouvert 2.147 dossiers de fugue concernant des mineurs en Belgique, soit une hausse de 19Â % en un an, ressort-il du rapport annuel de la Fondation pour enfants disparus et sexuellement exploitĂŠs sorti ce mardi 19 mai 2026. De plus en pluâŚ",https://www.lavenir.net/resizer/v2/7D35HPCJNRDVNLOBSXMB2FQG3Q.jpg?auth=49292cc8a1491b86c764405afbe3f9999047d71a0c13061e775ee4aa0d11e1c2&width=1200&height=630&quality=85&focal=550%2C364,2026-05-19T10:00:36Z,http://web.archive.org/web/20260520024142/https://www.lavenir.net/fil-info/2026/05/19/inquietante-augmentation-de-fugues-de-mineurs-en-belgique-derriere-chaque-disparition-il-y-a-un-enfant-en-detresse-75BRGD5NYNC65FJZSAUC27MW3U/,"Chantage Ă  la photo ou Ă  la vidĂŠo intime : l'inquiĂŠtant phĂŠnomĂ¨ne d'extorsion qui touche les garĂ§ons belges de 14 ans !""Fuguer est rarement un caprice. Pour beaucoup d'enfants, la fugue est un appel âŚ [+2400 chars]",,fr,'nan nan'
https://next.ink/236770/elon-musk-vs-openai-tout-ce-quil-faut-savoir-du-proces-qui-secoue-la-silicon-valley/,https://next.ink/236770/elon-musk-vs-openai-tout-ce-quil-faut-savoir-du-proces-qui-secoue-la-silicon-valley/,0,next.ink,ÂŤÂ ProcĂ¨s du siĂ¨cleÂ Âť de la Silicon ValleyÂ : Elon Musk est dĂŠboutĂŠ de ses poursuites contre OpenAI,Câest le procĂ¨s du siĂ¨cle (mĂŞme si le siĂ¨cle est encore jeune) : Elon Musk et OpenAI sâaffrontent depuis trois semaines devant le jury dâun tribunalâŚ,https://next.ink/wp-content/uploads/2026/05/War-of-the-monsters-1024x495.webp,2026-05-19T10:46:56Z,http://web.archive.org/web/20260520183650/https://next.ink/236770/elon-musk-vs-openai-tout-ce-quil-faut-savoir-du-proces-qui-secoue-la-silicon-valley/,"DerniĂ¨re mise Ă  jour, mardi 19 mai, 00h45Â : au terme de trois semaines de procĂ¨s, le jury du tribunal dâOakland a finalement rejetĂŠ les diffĂŠrents griefs de la plainte formulĂŠe par Elon Musk, qui se âŚ [+31659 chars]",,fr,'Barack Obama'
