index,url,valid,domain,title,description,image,published,archive,content,quote,language,keyword
https://www.20minutes.fr/monde/israel/4203995-20260302-iran-dubai-qatar-combien-francais-installes-moyen-orient,https://www.20minutes.fr/monde/israel/4203995-20260302-iran-dubai-qatar-combien-francais-installes-moyen-orient,0,www.20minutes.fr,"Iran, Dubaï, Qatar… Combien de Français sont installés au Moyen-Orient ?","Emmanuel Macron a affirmé dimanche que la « priorité absolue » était la sécurité des « ressortissants » français, après les attaques des États-Unis et Israël en Iran, qui a répliqué, laissant craindre un embrasement régional",https://img.20mn.fr/ag0ZDKT0QPi5dSfyi5MaVik/1444x920_le-president-francais-emmanuel-macron-prend-la-parole-lors-d-une-reunion-du-conseil-de-defense-nationale-au-palais-de-l-elysee-le-dimanche-1er-mars-2026-a-paris-en-france-ap-photo-aurelien-morissard-piscine-amo203-26060679772242-photo-de-piscine-2603012006,2026-03-02T11:13:38Z,http://web.archive.org/web/20260302165234/https://www.20minutes.fr/monde/israel/4203995-20260302-iran-dubai-qatar-combien-francais-installes-moyen-orient,"«La priorité absolue est la sécurité de nos ressortissants dans tous les pays frappés », a affirmé dimanche Emmanuel Macron lors dun Conseil de défense. Le président de la République a organisé ce po… [+3061 chars]",,fr,'Emmanuel Macron'
https://www.20minutes.fr/societe/4204134-20260302-nucleaire-quoi-base-ultrasecrete-ile-longue-rend-emmanuel-macron,https://www.20minutes.fr/societe/4204134-20260302-nucleaire-quoi-base-ultrasecrete-ile-longue-rend-emmanuel-macron,0,www.20minutes.fr,Nucléaire : C’est quoi cette base ultrasecrète de l’Île Longue où se rend Emmanuel Macron ?,"Emmanuel Macron doit prononcer ce lundi après-midi un discours très attendu sur la question de la dissuasion nucléaire depuis la base de l’Île Longue (Finistère), qui abrite les quatre sous-marins nucléaires lanceurs d’engins français",https://img.20mn.fr/HSsPFp_8RRSNiFN2rVvyhSk/1444x920_un-sous-marin-de-la-marine-francaise-est-photographie-le-2-fevrier-2017-a-ile-longue-la-base-du-snle-les-sous-marins-lance-missiles-francais-basee-sur-une-peninsule-de-la-rade-de-brest-dans-l-ouest-de-la-france-photo-de-fred-tanneau-afp,2026-03-02T11:25:12Z,,"Si vous essayez de la chercher sur Google Earth, vous ne verrez quune zone floutée. La navigation et la pêche sont également interdites dans cette zone de même que son survol même si cinq drones y on… [+2623 chars]",,fr,'Emmanuel Macron'
https://www.mediapart.fr/journal/politique/020326/deux-semaines-apres-la-mort-de-quentin-deranque-le-desarroi-des-gauches,https://www.mediapart.fr/journal/politique/020326/deux-semaines-apres-la-mort-de-quentin-deranque-le-desarroi-des-gauches,0,www.mediapart.fr,"Deux semaines après la mort de Quentin Deranque, le désarroi des gauches","Couper les ponts avec La France insoumise ou faire front commun, même quand la stratégie du mouvement mélenchoniste exaspère ? Deux semaines après la mort de Quentin Deranque, et en pleine campagne des municipales, le reste de la gauche nage en pleine confusi…",https://static.mediapart.fr/etmagine/og/journal/files/2026/02/26/260226-img-apres-lyon-le-grand-malaise-gauche-1.jpg,2026-03-02T12:32:08Z,http://web.archive.org/web/20260302202740/https://www.mediapart.fr/journal/politique/020326/deux-semaines-apres-la-mort-de-quentin-deranque-le-desarroi-des-gauches,"Les cookies et technologies similaires que nous utilisons sur Mediapart sont de différentes natures et nous permettent de poursuivre différentes finalités. 
Certains sont nécessaires au fonctionneme… [+3291 chars]",,fr,'Quentin Deranque'
https://www.mediapart.fr/journal/politique/020326/dans-la-tourmente-l-antifascisme-fait-l-union-sacree,https://www.mediapart.fr/journal/politique/020326/dans-la-tourmente-l-antifascisme-fait-l-union-sacree,0,www.mediapart.fr,"Dans la tourmente, l’antifascisme fait l’union sacrée","Les interprétations sur la « radicalisation » de la Jeune Garde se multiplient depuis la mort du militant néofasciste Quentin Deranque. La sphère antifasciste est plurielle, mais face à l’offensive réactionnaire, elle a mis ses divergences en sourdine pour fa…",https://static.mediapart.fr/etmagine/og/journal/files/2026/02/26/260226-img-dans-la-tourmente-l-antifascisme-fait-l-union-sacree-1.jpg,2026-03-02T12:34:43Z,,"Les cookies et technologies similaires que nous utilisons sur Mediapart sont de différentes natures et nous permettent de poursuivre différentes finalités. 
Certains sont nécessaires au fonctionneme… [+3291 chars]",,fr,'Quentin Deranque'
https://atlantico.fr/article/podcast/affaire-quentin-deranque-revelatrice-domination-ideologique-qui-fracture-la-democratie-olivier-vial,https://atlantico.fr/article/podcast/affaire-quentin-deranque-revelatrice-domination-ideologique-qui-fracture-la-democratie-olivier-vial,0,atlantico.fr,"L’affaire Quentin Deranque, révélatrice d’une domination idéologique qui fracture la démocratie","L’affaire Quentin Deranque dépasse le drame humain : elle expose la puissance d’un récit « antifasciste » imposé par la gauche radicale depuis 1945. Dans notre dernier podcast, Hors Circuit, Olivier Vial (du Centre d’Etudes et de Recherches Universitaire) déc…",https://atlantico.codexcdn.net/assets/as1RXR91fn21fkHBB.jpg?width=700&height=500&quality=75,2026-03-02T15:01:00Z,http://web.archive.org/web/20260302231900/https://atlantico.fr/article/podcast/affaire-quentin-deranque-revelatrice-domination-ideologique-qui-fracture-la-democratie-olivier-vial,"Laffaire Quentin Deranque dépasse le drame humain : elle expose la puissance dun récit « antifasciste » imposé par la gauche radicale depuis 1945. Dans notre dernier podcast, Hors Circuit, Olivier Vi… [+283 chars]",,fr,'Quentin Deranque'
https://www.monde-diplomatique.fr/2026/03/HALIMI/69366,https://www.monde-diplomatique.fr/2026/03/HALIMI/69366,0,www.monde-diplomatique.fr,"Jeffrey Epstein, agent du Mossad ?","Monsieur Alan Dershowitz est sans doute l'un des avocats les plus connus aux États-Unis. Défenseur passionné d'Israël, il fut également l'avocat de Jeffrey Epstein. Lors d'un débat l'opposant le 13 février dernier à un comédien d'origine égyptienne, Bassem Yo…",https://www.monde-diplomatique.fr/IMG/jpg/compositionrusse600.jpg,2026-03-02T16:27:30Z,http://web.archive.org/web/20260302210950/https://www.monde-diplomatique.fr/2026/03/HALIMI/69366,"Monsieur Alan Dershowitz est sans doute lun des avocats les plus connus aux États-Unis. Défenseur passionné dIsraël, il fut également lavocat de Jeffrey Epstein. Lors dun débat lopposant le 13 févrie… [+3295 chars]",,fr,'Jeffrey Epstein'
https://www.lemonde.fr/international/article/2026/03/02/discours-d-emmanuel-macron-sur-le-nucleaire-ce-qu-il-faut-retenir-des-annonces-du-chef-de-l-etat_6669282_3210.html,https://www.lemonde.fr/international/article/2026/03/02/discours-d-emmanuel-macron-sur-le-nucleaire-ce-qu-il-faut-retenir-des-annonces-du-chef-de-l-etat_6669282_3210.html,0,www.lemonde.fr,Ce qu’il faut retenir des annonces d’Emmanuel Macron sur la nouvelle doctrine de dissuasion nucléaire de la France,"Mise en place d’une « dissuasion nucléaire avancée » avec participation de huit pays alliés à des exercices, augmentation du nombre de têtes nucléaires, construction d’un nouveau sous-marin nucléaire... Retour sur les annonces majeures du chef de l’Etat.",https://img.lemde.fr/2026/03/02/214/0/1600/1066/1440/960/60/0/c23b30b_upload-1-4713aladyc1e-whatsapp-image-2026-03-02-at-17-32-05.jpeg,2026-03-02T18:15:39Z,,"Emmanuel Macron, à la base navale de sous-marins nucléaires de lîle Longue, dans la presquîle de Crozon, le 2 mars 2026. KAMIL ZIHNIOGLU POUR « LE MONDE »
Une « évolution majeure » de la doctrine nu… [+6235 chars]",,fr,'Emmanuel Macron'
https://www.presse-citron.net/en-plus-daugmenter-le-nombre-de-bombes-nucleaires-la-france-va-plonger-dans-le-silence-un-changement-de-strategie-que-lon-vous-explique/,https://www.presse-citron.net/en-plus-daugmenter-le-nombre-de-bombes-nucleaires-la-france-va-plonger-dans-le-silence-un-changement-de-strategie-que-lon-vous-explique/,0,www.presse-citron.net,"En plus d’augmenter le nombre de bombes nucléaires, la France va plonger dans le silence : un changement de stratégie que l’on vous explique",Emmanuel Macron en a dit plus sur le futur de la dissuasion nucléaire française.,https://www.presse-citron.net/app/uploads/2026/03/france-arme-nucleaire-1600x900.jpg,2026-03-03T08:55:39Z,,"Cest un discours qui était attendu par les spécialistes du dossier. Ce lundi 2 mars, Emmanuel Macron a pris la parole sur la base sous-marine de l’île Longue dans le Finistère pour évoquer le futur d… [+2455 chars]",,fr,'Emmanuel Macron'
https://www.mediapart.fr/journal/international/030326/dissuasion-nucleaire-emmanuel-macron-amorce-une-nouvelle-etape,https://www.mediapart.fr/journal/international/030326/dissuasion-nucleaire-emmanuel-macron-amorce-une-nouvelle-etape,0,www.mediapart.fr,Dissuasion nucléaire: Emmanuel Macron amorce une nouvelle étape,"Lundi 2 mars, le président de la République a annoncé une augmentation de l’arsenal nucléaire français et un « travail commun » avec huit États européens en matière de dissuasion. Les oppositions s’affirment rassurées par l’absence d’une perspective de « part…",https://static.mediapart.fr/etmagine/og/journal/files/2026/03/03/260303-img-nucleaire-macron-theorise-une-dissuasion-durcie-et-avancee.jpg,2026-03-03T18:34:55Z,,"Les cookies et technologies similaires que nous utilisons sur Mediapart sont de différentes natures et nous permettent de poursuivre différentes finalités. 
Certains sont nécessaires au fonctionneme… [+3291 chars]",,fr,'Emmanuel Macron'
https://www.presse-citron.net/guerre-en-iran-la-france-va-deployer-le-porte-avions-charles-de-gaulle-annonce-emmanuel-macron/,https://www.presse-citron.net/guerre-en-iran-la-france-va-deployer-le-porte-avions-charles-de-gaulle-annonce-emmanuel-macron/,0,www.presse-citron.net,"Guerre en Iran : la France va déployer le porte-avions Charles-de-Gaulle, annonce Emmanuel Macron","Le président de la République française Emmanuel Macron a tenu à s’exprimer ce mardi 3 mars à 20 heures sur la situation en Iran et la place de la France. À la fin de sa prise de parole, il a confirmé qu’en tant que chef des Armées, il avait demandé au porte-…",https://www.presse-citron.net/app/uploads/2026/03/macron-porte-avions-charles-de-gaulle-iran-1600x900.jpg,2026-03-03T20:03:19Z,,"La France part en direction de la guerre en Iran. Après avoir déployé des Rafales dans le ciel du Golfe, il est temps pour le porte-avions Charles de Gaulle de faire route vers la Méditerranée. Le na… [+3473 chars]",,fr,'Emmanuel Macron'
https://www.mediapart.fr/journal/international/030326/guerre-au-moyen-orient-macron-envoie-des-renforts-et-pointe-la-responsabilite-premiere-de-l-iran,https://www.mediapart.fr/journal/international/030326/guerre-au-moyen-orient-macron-envoie-des-renforts-et-pointe-la-responsabilite-premiere-de-l-iran,0,www.mediapart.fr,Guerre au Moyen-Orient: Macron envoie des renforts et pointe la «responsabilité première» de l’Iran,Emmanuel Macron a pris la parole mardi 3 mars au soir au sujet du conflit en cours au Moyen-Orient.,https://www.mediapart.fr/assets/front/images/social/og_image/journal.png,2026-03-03T21:18:52Z,,"Les cookies et technologies similaires que nous utilisons sur Mediapart sont de différentes natures et nous permettent de poursuivre différentes finalités. 
Certains sont nécessaires au fonctionneme… [+3291 chars]",,fr,'Emmanuel Macron'
https://www.lemonde.fr/international/live/2026/03/03/en-direct-iran-emmanuel-macron-annonce-l-envoi-a-chypre-de-moyens-de-defense-antiaerienne-supplementaires_6668663_3210.html,https://www.lemonde.fr/international/live/2026/03/03/en-direct-iran-emmanuel-macron-annonce-l-envoi-a-chypre-de-moyens-de-defense-antiaerienne-supplementaires_6668663_3210.html,0,www.lemonde.fr,"EN DIRECT, Iran : Emmanuel Macron annonce l’envoi à Chypre de « moyens de défense antiaérienne » supplémentaires","Le président français a aussi annoncé l’envoi à Chypre de la frégate « Languedoc » et a donné l’ordre d’envoyer le porte-avions « Charles-de-Gaulle » en Méditerranée. Par ailleurs, M. Macron a déclaré que deux vols évacuant des Français du Moyen-Orient arrive…",https://img.lemde.fr/2026/03/03/265/0/8088/4044/1440/720/60/0/69b21f3_ftp-1-fladdsobhsin-5356240-01-06.jpg,2026-03-03T21:25:48Z,,"Le président français a également appelé Israël à cesser ses frappes au Liban : « Ce serait une escalade dangereuse et une erreur stratégique. »« Depuis ces dernières heures, la guerre sétend au Liba… [+753 chars]",,fr,'Emmanuel Macron'
https://www.20minutes.fr/politique/4204412-20260304-apres-allocution-macron-moyens-militaires-francais-deployes,https://www.20minutes.fr/politique/4204412-20260304-apres-allocution-macron-moyens-militaires-francais-deployes,0,www.20minutes.fr,"Après l’allocution de Macron, quels sont les moyens militaires français déployés ?","La France renforce son dispositif militaire au Moyen-Orient. Emmanuel Macron a annoncé, mardi, le déploiement de moyens militaires supplémentaires pour soutenir les alliés de Paris et sécuriser les routes maritimes stratégiques",https://img.20mn.fr/YsaCP36BRaCsi49GE5MKtSk/1444x920_dossiers-cette-photographie-montre-les-couleurs-du-drapeau-tricolore-illuminant-la-tour-avec-le-pont-du-porte-avions-francais-charles-de-gaulle-r91-lors-d-une-visite-mediatique-alors-qu-il-etait-amarre-au-quai-du-port-nord-de-malmo-en-suede-le-25-fevrier-2026-emmanuel-macron-a-annonce-le-3-mars-2026-des-renforts-militaires-supplementaires-au-moyen-orient-dechire-par-la-guerre-notamment-le-porte-avions-charles-de-gaulle-et-son-escorte-de-fregates-qui-mettront-le-cap-vers-la-mediterranee-photo-de-johan-nilsson-tt-news-agency-afp-sweden-out-sweden-out,2026-03-04T01:50:28Z,http://web.archive.org/web/20260304032115/https://www.20minutes.fr/politique/4204412-20260304-apres-allocution-macron-moyens-militaires-francais-deployes,"Face à lextension de la guerre au Moyen-Orient après les frappes des Etats-Unis et dIsraël sur lIran, la France accélère son déploiement militaire. Emmanuel Macron a annoncé, mardi soir lors dune all… [+2803 chars]",,fr,'Emmanuel Macron'
https://www.20minutes.fr/monde/etats-unis/4204329-20260304-dissuasion-pourquoi-grandes-puissances-nucleaires-autant-stocks-missiles,https://www.20minutes.fr/monde/etats-unis/4204329-20260304-dissuasion-pourquoi-grandes-puissances-nucleaires-autant-stocks-missiles,0,www.20minutes.fr,Dissuasion : Pourquoi les grandes puissances nucléaires ont autant de stocks de missiles ?,"Lors de son discours sur la dissuasion lundi, Emmanuel Macron a rappelé quelques grands principes de la doctrine française. Elle est radicalement différente de celles des Etats-Unis ou de la Russie, qui possèdent beaucoup plus de têtes nucléaires",https://img.20mn.fr/rghIWcgjQrWd7nodRHQjEik/1444x920_des-membres-de-la-marine-francaise-se-tiennent-sur-le-dessus-d-un-sous-marin-avant-la-visite-du-president-francais-a-la-base-navale-de-sous-marins-nucleaires-d-ile-longue-a-crozon-dans-le-nord-ouest-de-la-france-le-2-mars-2026-des-attentes-elevees-peu-de-certitudes-le-2-mars-2026-emmanuel-macron-expliquera-comment-la-dissuasion-nucleaire-francaise-peut-contribuer-a-renforcer-la-securite-en-europe-face-a-un-monde-de-plus-en-plus-brutal-et-a-un-allie-americain-de-plus-en-plus-incertain-cette-question-a-ete-mise-en-lumiere-par-l-offensive-israelo-americaine-en-iran-ce-week-end-sur-fond-de-crise-nucleaire-iranienne-qui-secoue-l-ensemble-du-moyen-orient-et-par-extension-la-communaute-internationale-photo-de-yoan-valat-pool-afp,2026-03-04T05:07:37Z,http://web.archive.org/web/20260304055117/https://www.20minutes.fr/monde/etats-unis/4204329-20260304-dissuasion-pourquoi-grandes-puissances-nucleaires-autant-stocks-missiles,«Le demi-siècle qui vient sera un âge darmes nucléaires. La France y tiendra tout son rôle. » Dans un discours grave prononcé depuis la base de sous-marins nucléaires lanceurs dengins (SNLE) de lÎle … [+6269 chars],,fr,'Emmanuel Macron'
https://www.lemonde.fr/international/live/2026/03/04/en-direct-iran-les-premiers-francais-rapatries-du-moyen-orient-ont-atterri-a-paris-israel-annonce-avoir-lance-une-nouvelle-large-vague-de-frappes-sur-l-iran_6668663_3210.html,https://www.lemonde.fr/international/live/2026/03/04/en-direct-iran-les-premiers-francais-rapatries-du-moyen-orient-ont-atterri-a-paris-israel-annonce-avoir-lance-une-nouvelle-large-vague-de-frappes-sur-l-iran_6668663_3210.html,0,www.lemonde.fr,"EN DIRECT, Iran : les premiers Français rapatriés du Moyen-Orient ont atterri à Paris ; Israël annonce avoir lancé une nouvelle « large vague » de frappes sur l’Iran","L’avion affrété par Air France est arrivé dans la nuit, mercredi, en provenance d’Oman. Une centaine de places avaient été réservées et il s’agissait d’un vol transportant aussi bien des clients et du personnel de la compagnie que « beaucoup de familles, de j…",https://img.lemde.fr/2026/03/03/163/0/3983/1991/1440/720/60/0/96f417e_ftp-1-l8g7wmurnozz-5357358-01-06.jpg,2026-03-04T05:19:01Z,,"Un premier vol de ressortissants français du Moyen-Orient est arrivé tôt mercredi matin à laéroport Paris-Charles-de-Gaulle en provenance dOman, a constaté lAgence France-Presse (AFP).
Lavion affrét… [+1671 chars]",,fr,'Emmanuel Macron'
https://www.20minutes.fr/justice/4204444-20260304-mort-quentin-deranque-deux-suspects-supplementaires-arretes-pres-lyon,https://www.20minutes.fr/justice/4204444-20260304-mort-quentin-deranque-deux-suspects-supplementaires-arretes-pres-lyon,0,www.20minutes.fr,Mort de Quentin Deranque : Deux suspects supplémentaires arrêtés près de Lyon,"Avec ces deux arrestations, la police pense avoir interpellé tous les participants à la rixe qui a conduit à la mort du militant d’ultradroite",https://img.20mn.fr/Iyv8q6TmQEG9Xl_thu8KtSk/1444x920_des-personnes-defilent-avec-des-drapeaux-en-hommage-au-militant-d-extreme-droite-quentin-deranque-a-lyon-en-france-le-21-fevrier-2026-le-militant-d-extreme-droite-quentin-deranque-est-decede-le-14-fevrier-des-suites-de-blessures-subies-lors-d-un-affrontement-entre-des-partisans-d-extreme-droite-et-d-extreme-gauche-devant-sciences-po-lyon-middle-east-images-mei-fra-as-lmfqd-20260221-033-credit-abolfazl-salmanzadeh-mei-sipa-2602231255,2026-03-04T08:24:42Z,,"«On pense désormais avoir tous ceux qui ont participé directement aux coups portés à Quentin Deranque », indique une source policière. Ce mercredi matin, deux hommes soupçonnés davoir participé aux v… [+1358 chars]",,fr,'Quentin Deranque'
https://www.20minutes.fr/politique/4204735-20260305-guerre-iran-cote-confiance-macron-grimpe-fleche-reste-bien-bas,https://www.20minutes.fr/politique/4204735-20260305-guerre-iran-cote-confiance-macron-grimpe-fleche-reste-bien-bas,0,www.20minutes.fr,Guerre en Iran : La cote de confiance de Macron grimpe en flèche (mais reste bien bas),"Emmanuel Macron voit sa cote de confiance progresser de six points à 25 % après le lancement de l’offensive israélo-américaine en Iran et son discours sur la dissuasion nucléaire, selon le baromètre Elabe pour Les Echos publié ce jeudi",https://img.20mn.fr/nkGbNwYzSCSRSgUn2NuY1ik/1444x920_discours-d-emmanuel-macron-president-de-la-republique-francaise-a-20h00-a-la-television-sur-tf1-le-president-prend-la-parole-pour-evoquer-la-situation-au-moyen-orient-alors-que-les-frappes-americaines-et-israeliennes-et-les-actions-de-represailles-iraniennes-se-poursuivent-mardi-3-mars-2026-paris-france-allocution-d-emmanuel-macron-president-de-la-republique-francaise-a-20-heures-a-la-television-sur-tf1-le-president-sexprime-pour-evoquer-la-situation-au-moyen-orient-alors-que-les-frappes-americaines-et-israeliennes-ainsi-que-les-ripostes-iraniennes-se-poursuivent-mardi-3-mars-2026-paris-france-01accorsini-jeanne-mac-rontv-003-credit-jeanne-accorsini-sipa-260303-2013,2026-03-05T15:33:09Z,,"Emmanuel Macron voit sa cote de confiance progresser de six points à 25 % après le lancement de loffensive israélo-américaine en Iran et son discours sur la dissuasion nucléaire, selon le baromètre E… [+1824 chars]",,fr,'Emmanuel Macron'
https://www.bfmtv.com/international/moyen-orient/liban/le-president-du-liban-demande-a-emmanuel-macron-d-intervenir-aupres-d-israel-afin-d-empecher-que-la-banlieue-sud-de-beyrouth-ne-soit-ciblee_AD-202603050733.html,https://www.bfmtv.com/international/moyen-orient/liban/le-president-du-liban-demande-a-emmanuel-macron-d-intervenir-aupres-d-israel-afin-d-empecher-que-la-banlieue-sud-de-beyrouth-ne-soit-ciblee_AD-202603050733.html,0,www.bfmtv.com,"Le président du Liban demande à Emmanuel Macron ""d'intervenir auprès d'Israël afin d'empêcher que la banlieue sud de Beyrouth ne soit ciblée""","Le président du Liban Joseph Aoun a demandé ce jeudi au locataire de l'Élysée d'apporter son aide ""pour parvenir à un cessez-le-feu dans les plus brefs délais"", alors qu'Israël a appelé les habitants de toute la banlieue sud de Beyrouth à évacuer ""immédiateme…",https://images.bfmtv.com/hconZF7PHHJ2QC9eLWRQCQHGm4w=/0x49:2048x1201/2048x0/images/Le-president-Emmanuel-Macron-et-son-homologue-libanais-Joseph-Aoun-le-17-janvier-2025-au-Liban-2057029.jpg,2026-03-05T16:59:55Z,,"Le président du Liban Joseph Aoun a demandé ce jeudi au locataire de l'Élysée d'apporter son aide ""pour parvenir à un cessez-le-feu dans les plus brefs délais"", alors qu'Israël a appelé les habitants… [+2318 chars]",,fr,'Emmanuel Macron'
https://www.bfmtv.com/politique/elysee/emmanuel-macron-annonce-l-envoi-immediat-d-une-aide-humanitaire-pour-les-civils-qui-fuient-le-sud-du-liban_AN-202603050793.html,https://www.bfmtv.com/politique/elysee/emmanuel-macron-annonce-l-envoi-immediat-d-une-aide-humanitaire-pour-les-civils-qui-fuient-le-sud-du-liban_AN-202603050793.html,0,www.bfmtv.com,"Emmanuel Macron annonce ""l'envoi immédiat d'une aide humanitaire"" pour les civils qui fuient le sud du Liban","Liban est entraîné dans la guerre depuis lundi après une première attaque contre Israël du mouvement pro-iranien, qui affirmait vouloir ""venger"" la mort du guide suprême iranien, l'ayatollah Ali Khamenei.",https://images.bfmtv.com/nko8bkyRxL4078l0Vo4kHPqGmkU=/0x106:2048x1258/2048x0/images/x-2245566.jpg,2026-03-05T17:51:54Z,,"Le président français Emmanuel Macron prononce un discours lors de sa visite à la base navale de sous-marins nucléaires lanceurs d'engins de l'Île Longue à Crozon, dans le nord-ouest de la France, le… [+31 chars]",,fr,'Emmanuel Macron'
https://www.lemonde.fr/international/live/2026/03/05/en-direct-guerre-en-iran-emmanuel-macron-veut-etablir-un-plan-pour-mettre-un-terme-aux-operations-militaires-du-hezbollah-et-d-israel_6668663_3210.html,https://www.lemonde.fr/international/live/2026/03/05/en-direct-guerre-en-iran-emmanuel-macron-veut-etablir-un-plan-pour-mettre-un-terme-aux-operations-militaires-du-hezbollah-et-d-israel_6668663_3210.html,0,www.lemonde.fr,"EN DIRECT, guerre en Iran : Emmanuel Macron veut « établir un plan » pour « mettre un terme aux opérations militaires » du Hezbollah et d’Israël",Le président libanais avait demandé au chef de l’Etat français d’intervenir auprès d’Israël afin d’empêcher le bombardement de la banlieue sud de Beyrouth après que l’armée israélienne a appelé les habitants à évacuer « immédiatement » pour leur survie.,https://img.lemde.fr/2026/03/05/584/0/5500/2750/1440/720/60/0/d94294a_ftp-1-sgkweoqwlhg4-2026-03-05t164859z-734591714-rc2eyja7ywa8-rtrmadp-3-iran-crisis-lebanon.JPG,2026-03-05T17:58:43Z,,"« La vocation du gouvernement belge nest pas de se substituer à une agence de voyage, mais de pouvoir sauver des vies en mettant les gens dans un endroit sûr », a déclaré jeudi le ministre des affair… [+1313 chars]",,fr,'Emmanuel Macron'
https://www.bfmtv.com/international/europe/guerre-au-moyen-orient-france-italie-et-grece-vont-coordonner-l-envoi-de-moyens-militaires-en-mediterranee_AD-202603050810.html,https://www.bfmtv.com/international/europe/guerre-au-moyen-orient-france-italie-et-grece-vont-coordonner-l-envoi-de-moyens-militaires-en-mediterranee_AD-202603050810.html,0,www.bfmtv.com,"Guerre au Moyen-Orient: France, Italie et Grèce vont ""coordonner"" l'envoi de moyens militaires en Méditerranée","Athènes a envoyé lundi deux frégates et des avions F16 à Chypre. Emmanuel Macron a annoncé mardi le déploiement du porte-avions Charles de Gaulle, la frégate multimissions Languedoc et de moyens anti-aériens, le ministre de la Défense italien va déployer des …",https://images.bfmtv.com/wyc8BjGsXBjm92ue_w5wRJ4qDqI=/0x25:2048x1177/2048x0/images/Le-porte-avions-francais-Charles-de-Gaulle-au-port-de-Malmoe-en-Suede-vendredi-27-fevrier-2244196.jpg,2026-03-05T18:07:30Z,,"Athènes a envoyé lundi deux frégates et des avions F16 à Chypre. Emmanuel Macron a annoncé mardi le déploiement du porte-avions Charles de Gaulle, la frégate multimissions Languedoc et de moyens anti… [+1494 chars]",,fr,'Emmanuel Macron'
