index,url,valid,domain,title,description,image,published,archive,content,quote,language,keyword
https://www.huffingtonpost.fr/international/video/marco-rubio-a-ete-assailli-de-questions-par-les-journalistes-de-la-maison-blanche-au-grand-dam-de-jd-vance_263457.html,https://www.huffingtonpost.fr/international/video/marco-rubio-a-ete-assailli-de-questions-par-les-journalistes-de-la-maison-blanche-au-grand-dam-de-jd-vance_263457.html,0,www.huffingtonpost.fr,"Marco Rubio a été assailli de questions par les journalistes de la Maison Blanche, au grand dam de JD Vance",Le secrétaire d’État a remplacé la porte-parole de l’administration Trump au premier jour de son congé maternité.,https://focus.huffingtonpost.fr/2026/05/06/521/0/5000/2812/1820/1023/75/0/73c420b_upload-1-jrcfqm51xjcj-afp-20260506-leyden-rubiosfi260505-npxcg-v1-highres-whitehousepressbriefinghost.jpg,2026-05-06T14:40:14Z,,"La lecture de ce contenu est susceptible dentraîner un dépôt de cookies de la part de lopérateur tiers qui lhéberge. Compte-tenu des choix que vous avez exprimés en matière de dépôt de cookies, nous … [+3109 chars]",,fr,'Marco Rubio'
https://www.20minutes.fr/monde/ukraine/4222323-20260506-guerre-ukraine-poutine-viole-treve-zelensky-tente-rendre-monnaie-piece,https://www.20minutes.fr/monde/ukraine/4222323-20260506-guerre-ukraine-poutine-viole-treve-zelensky-tente-rendre-monnaie-piece,0,www.20minutes.fr,"Guerre en Ukraine : Poutine viole la trêve, Zelensky tenté de lui rendre la monnaie de sa pièce","« 20 Minutes » fait le point pour vous tous les soirs sur le conflit en Ukraine. Ce mercredi, alors que Kiev avait annoncé une trêve, la Russie a continué ses frappes mortelles",https://img.20mn.fr/JL80k8b-SX-mtza_Qp1Inyk/1444x920_combo-cette-combinaison-de-photos-creee-le-12-mai-2025-montre-une-photo-de-piscine-diffusee-par-l-agence-d-etat-russe-spoutnik-representant-le-president-russe-vladimir-poutine-lors-d-une-interview-accordee-a-l-agence-de-presse-ria-novosti-au-kremlin-de-moscou-le-12-mars-2024-et-une-photo-du-president-ukrainien-volodymyr-zelensky-lors-du-21e-sommet-du-shangri-la-dialogue-a-l-hotel-shangri-la-de-singapour-le-2-juin-2024-a-la-suite-de-la-visite-de-certains-dirigeants-europeens-a-kiev-ou-ils-ont-appele-la-russie-a-accepter-un-cessez-le-feu-inconditionnel-de-30-jours-afin-de-permettre-des-pourparlers-de-paix-poutine-a-propose-des-negociations-directes-avec-l-ukraine-a-istanbul-le-15-mai-mais-n-a-pas-repondu-a-l-appel-europeen-en-faveur-d-un-cessez-le-feu-de-30-jours-zelensky-a-declare-qu-il-serait-pret-a-rencontrer-poutine-en-turquie-mais-n-a-pas-precise-s-il-y-assisterait-toujours-si-la-russie-refusait-la-proposition-europeenne-photo-de-gavriil-grigorov-et-nhac-nguyen-sources-diverses-afp,2026-05-06T17:57:33Z,,"Vous avez raté les derniers événements sur la guerre en Ukraine ? 20 Minutes fait le point pour vous tous les soirs. Voici lessentiel de ce mercredi 6 mai 2026, au 1.533e jour du conflit.
Linfo du j… [+2311 chars]",,fr,'Vladimir Poutine'
https://www.franceinfo.fr/replay-magazine/franceinfo/l-invite-politique/l-invite-politique-du-jeudi-07-mai-2026_7944872.html,https://www.franceinfo.fr/replay-magazine/franceinfo/l-invite-politique/l-invite-politique-du-jeudi-07-mai-2026_7944872.html,0,www.franceinfo.fr,"Aides carburants : ""Le Premier ministre cherche à gagner du temps pour ne rien délivrer aux Français"", juge Sébastien Chenu, vice-président RN de l'Assemblée nationale","Voir ou revoir l'émission Aides carburants : ""Le Premier ministre cherche à gagner du temps pour ne rien délivrer aux Français"", juge Sébastien Chenu, vice-président RN de l'Assemblée nationale. Invité politique de franceinfo ce jeudi 7 mai, l'élu Rassembleme…",https://www.franceinfo.fr/pictures/QDhXE8y4jMRD4KZszWwZPJMufmI/18x0:1386x769/1500x843/2026/05/07/69fc708b1b492540035660.jpg,2026-05-07T10:09:40Z,,"Invité politique de franceinfo ce jeudi 7 mai, l'élu Rassemblement national du Nord déplore que les aides du gouvernement pour répondre à la crise des carburants ne soient ""ni calibrées, ni au niveau… [+7649 chars]",,fr,'Premier ministre'
https://www.challenges.fr/monde/lavidite-de-poutine-va-bien-au-dela-du-territoire-ukrainien-sommes-nous-reellement-prets-face-a-la-menace-russe_643239,https://www.challenges.fr/monde/lavidite-de-poutine-va-bien-au-dela-du-territoire-ukrainien-sommes-nous-reellement-prets-face-a-la-menace-russe_643239,0,www.challenges.fr,L’avidité de Poutine va bien au-delà du territoire ukrainien : sommes-nous réellement prêts face à la menace russe ?,La Russie est entrée dans la cinquième année d’une guerre sans fin. Un conflit qui a été l’occasion d’une modernisation d’ampleur de l’armée russe. Le dernier essai de Céline Marrangé replace cette offensive dans une histoire longue et rappelle que le régime …,https://www.challenges.fr/_ipx/f_jpg&enlarge_true&s_1200x630/cha/static/2026-05/54825.HR_0.jpg%3FVersionId=O9_CNedGzwOGZ4g1mcsgAIrz4FtyEOw4,2026-05-07T10:45:00Z,,"Signe de temps plus difficiles pour Vladimir Poutine, la parade qui célèbre chaque année le 9 mai sur la place Rouge à Moscou la victoire sur lAllemagne nazie se fera a minima, sans exhibition de cha… [+732 chars]",,fr,'Poutine'
https://www.courrierinternational.com/article/vu-d-ukraine-moscou-vivra-un-defile-du-9-mai-sous-la-menace-des-drones_243787,https://www.courrierinternational.com/article/vu-d-ukraine-moscou-vivra-un-defile-du-9-mai-sous-la-menace-des-drones_243787,0,www.courrierinternational.com,Moscou vivra un défilé du 9 Mai sous la menace des drones,"Après l’annonce unilatérale par Vladimir Poutine d’une trêve les 8 et 9 mai, à l’occasion des commémorations de la victoire sur l’Allemagne nazie, Volodymyr Zelensky avait proposé un cessez-le-feu à partir du 6. Mais celui-ci n’a pas été respecté par les Russ…",https://focus.courrierinternational.com/2026/05/07/71/0/4064/2709/1200/630/60/0/ad3f18b_ftp-1-9uf2zrvdhhe3-2026-05-07t091241z-59522669-rc274lavlgt9-rtrmadp-3-russia-security.JPG,2026-05-07T14:16:13Z,,"Moscou, puis Kiev : lundi 4 mai, les deux belligérants du conflit en Ukraine ont tous deux annoncé des trêves, mais pour des dates différentes. Celle décrétée par le président russe Vladimir Poutine … [+3486 chars]",,fr,'Vladimir Poutine'
https://www.courrierinternational.com/article/russie-autour-de-poutine-le-pouvoir-se-fissure-et-la-peur-gagne-le-sommet_243772,https://www.courrierinternational.com/article/russie-autour-de-poutine-le-pouvoir-se-fissure-et-la-peur-gagne-le-sommet_243772,0,www.courrierinternational.com,"Autour de Poutine, le pouvoir se fissure et la peur gagne le sommet","Défiance, rivalités internes et usure vis-à-vis de l’invasion de l’Ukraine : ces jours-ci, la presse internationale dépeint, à grand renfort de révélations et d’analyses, un Kremlin en crise. Sans annoncer de chute imminente, ces signaux disent beaucoup de l’…",https://focus.courrierinternational.com/2026/04/28/71/0/7744/5162/1200/630/60/0/8c64b71_ftp-1-x5ghuprgo0hc-2026-04-28t181203z-1074112026-rc2hyka4ojjo-rtrmadp-3-ukraine-crisis-putin-tuapse.JPG,2026-05-07T16:14:52Z,,"Ce nest pas encore une rébellion, mais plutôt un changement de ton. Dans The Economist, un ancien haut responsable russe signe un texte au titre alarmiste : Vladimir Poutine perd son emprise sur la R… [+5445 chars]",,fr,'Vladimir Poutine'
https://www.lalibre.be/international/europe/guerre-ukraine-russie/2026/05/07/la-mise-en-garde-de-zelensky-aux-dirigeants-allies-a-la-russie-une-etrange-envie-par-les-temps-qui-courent-nous-ne-le-recommandons-pas-CGH5E2LU45BORP4SCSBALSIWXQ/,https://www.lalibre.be/international/europe/guerre-ukraine-russie/2026/05/07/la-mise-en-garde-de-zelensky-aux-dirigeants-allies-a-la-russie-une-etrange-envie-par-les-temps-qui-courent-nous-ne-le-recommandons-pas-CGH5E2LU45BORP4SCSBALSIWXQ/,0,www.lalibre.be,"La mise en garde de Zelensky aux dirigeants alliés à la Russie: ""Une étrange envie par les temps qui courent, nous ne le recommandons pas""",Volodymyr Zelensky a déconseillé jeudi aux représentants des pays alliés à la Russie de se rendre aux célébrations du 9 mai à Moscou. ...,https://www.lalibre.be/resizer/v2/ZNNS74UJCZDB5ALAY2TDOR475M.jpg?auth=2b6199ea47a9240d9d4f676cd70a37b47b7dcc3108c5dfbe8f45c216ec264d57&width=1200&height=630&quality=85&focal=1296%2C864,2026-05-07T17:21:07Z,,"La Russie a de son côté exhorté les habitants de Kiev à quitter la ville face à la menace d'une frappe le 9 mai.
L'Europe redoute une ""fenêtre d'opportunité"" pour Vladimir Poutine : ""Quelque chose p… [+736 chars]",,fr,'Vladimir Poutine'
https://www.lexpress.fr/monde/russie-un-ancien-avocat-pro-kremlin-desormais-en-croisade-contre-poutine-SMVSF7QJ2JBW3FEIQ42WHWQX4Y/,https://www.lexpress.fr/monde/russie-un-ancien-avocat-pro-kremlin-desormais-en-croisade-contre-poutine-SMVSF7QJ2JBW3FEIQ42WHWQX4Y/,0,www.lexpress.fr,Russie : un ancien avocat pro-Kremlin désormais en croisade contre Poutine,"Longtemps associé au camp pro-Kremlin et surtout connu pour ses attaques contre Alexeï Navalny, Ilya Remeslo a été admis dans un hôpital psychiatrique après avoir critiqué Vladimir Poutine.",https://www.lexpress.fr/resizer/v2/BSUD6HKXCRCEPNMZAMJD6HVUYY.JPG?auth=4ecf9712f23f9e79c8908dfe9c0349d1177d4aab6ff5d405d6bd3b8519d65286&width=1200&height=630&quality=85&smart=true,2026-05-07T17:22:54Z,,"En l'espace de quelques semaines, ses positions politiques se sont radicalement transformées. Au point de le conduire en hôpital psychiatrique. À 42 ans, Ilya Remeslo, connu en Russie pour être un av… [+4538 chars]",,fr,'Poutine'
https://www.franceinfo.fr/monde/russie/vladimir-poutine/vladimir-poutine-redouterait-une-tentative-d-assassinat_7990112.html,https://www.franceinfo.fr/monde/russie/vladimir-poutine/vladimir-poutine-redouterait-une-tentative-d-assassinat_7990112.html,0,www.franceinfo.fr,"Déplacements limités, bunker sécurisé... Vladimir Poutine redouterait une tentative d'assassinat","Vladimir Poutine limiterait ses déplacements par crainte pour sa vie, selon un rapport de renseignement européen. Le président russe redouterait une tentative d'assassinat ou un coup d'État, se retranchant désormais dans un bunker sécurisé.",https://www.franceinfo.fr/pictures/HblD1O8XIGMuZiC_gH16EyqpzI0/0x9:1402x798/1500x843/2026/05/07/69fcf33663890142965598.jpg,2026-05-07T20:26:57Z,,"Vladimir Poutine limiterait ses déplacements par crainte pour sa vie, selon un rapport de renseignement européen. Le président russe redouterait une tentative d'assassinat ou un coup d'État, se retra… [+2243 chars]",,fr,'Vladimir Poutine'
https://www.lalibre.be/international/europe/guerre-ukraine-russie/2026/05/08/des-drones-abattus-en-russie-en-pleine-treve-unilaterale-pour-les-commerations-du-9-mai-J3PIOBOB2FC43C2CIPW3BVUK7Q/,https://www.lalibre.be/international/europe/guerre-ukraine-russie/2026/05/08/des-drones-abattus-en-russie-en-pleine-treve-unilaterale-pour-les-commerations-du-9-mai-J3PIOBOB2FC43C2CIPW3BVUK7Q/,0,www.lalibre.be,Des drones abattus en Russie en pleine trêve unilatérale pour les commérations du 9-Mai,"La Russie a annoncé vendredi matin avoir détruit plus de 250 drones ukrainiens depuis l'entrée en vigueur à minuit de sa trêve unilatérale de deux jours pour les commémorations du 9-Mai, auxquelles le président ukrainien Volodymyr Zelensky dissuade les alliés…",https://www.lalibre.be/resizer/v2/N2EI6DIFXJGNLNCXOKWJHIXGZA.jpg?auth=5c5b84da81b4ba2f4dfc4ed83a5ec73e34776794ec82b959017a985a450f2957&width=1200&height=630&quality=85&focal=2952%2C1962,2026-05-08T05:00:47Z,,"Les engins ont été abattus dans une dizaine de régions, dont celle de la capitale russe, de même source.
L'entrée en vigueur de la trêve unilatérale russe avait commencé à 00H00 heure de Moscou.
La… [+4082 chars]",,fr,'Vladimir Poutine'
https://www.lalibre.be/international/europe/guerre-ukraine-russie/2026/05/08/la-situation-nest-pas-terrible-pour-poutine-et-la-russie-qui-perdent-du-terrain-en-ukraine-trois-elements-expliquent-ce-revers-ICFVQOOIUVBMTMC7VLX43GIKUE/,https://www.lalibre.be/international/europe/guerre-ukraine-russie/2026/05/08/la-situation-nest-pas-terrible-pour-poutine-et-la-russie-qui-perdent-du-terrain-en-ukraine-trois-elements-expliquent-ce-revers-ICFVQOOIUVBMTMC7VLX43GIKUE/,0,www.lalibre.be,La situation n’est pas terrible pour Poutine et la Russie qui perdent du terrain en Ukraine: trois éléments expliquent ce revers,"Pour la première fois depuis près de deux ans, les troupes russes ont perdu une surface nette sur le front ukrainien, le mois dernier. ...",https://www.lalibre.be/resizer/v2/BPS4JOD72NFM3DIZWWBFKIYWNE.jpg?auth=fd5b73e2cf9a3af3025caa66797f51a4d236369a691511a99c24948757659df5&width=1200&height=630&quality=85&focal=4320%2C2880,2026-05-08T10:55:43Z,http://web.archive.org/web/20260509013222/https://www.lalibre.be/international/europe/guerre-ukraine-russie/2026/05/08/la-situation-nest-pas-terrible-pour-poutine-et-la-russie-qui-perdent-du-terrain-en-ukraine-trois-elements-expliquent-ce-revers-ICFVQOOIUVBMTMC7VLX43GIKUE/,"En Russie, Vladimir Poutine entre pression et paranoïa: ""Sous la stabilité de surface se trouve un système politique fracturé""Trois éléments expliquent ce revers selon les analystes de l'ISW : les co… [+3815 chars]",,fr,'Vladimir Poutine'
https://www.presse-citron.net/apple-nvidia-boeing-quels-sont-les-rares-patrons-invites-par-trump-a-pekin/,https://www.presse-citron.net/apple-nvidia-boeing-quels-sont-les-rares-patrons-invites-par-trump-a-pekin/,0,www.presse-citron.net,"Apple, Nvidia, Boeing : quels sont les rares patrons invités par Trump à Pékin ?","Le président américain retourne en Chine rencontrer Xi Jinping, 9 ans après sa dernière visite en 2017. Comparé à des délégations comme celle du Premier ministre canadien ou du chancelier allemand, Donald Trump a fait une sélection très restreinte. Le signe d…",https://www.presse-citron.net/app/uploads/2026/05/donald-trump-nvidia-jensen-huang-1600x900.jpg,2026-05-08T15:00:04Z,,"Donald Trump retourne en Chine les 15 et 16 mai prochains, après plusieurs mois de retard sur le calendrier initial. 9 ans après sa visite en novembre 2017, le président américain fera sa première re… [+2959 chars]",,fr,'Donald Trump'
https://www.nouvelobs.com/monde/20260508.OBS114783/en-ukraine-poutine-n-avance-toujours-pas-voire-recule-incapable-de-profiter-de-la-guerre-au-moyen-orient.html,https://www.nouvelobs.com/monde/20260508.OBS114783/en-ukraine-poutine-n-avance-toujours-pas-voire-recule-incapable-de-profiter-de-la-guerre-au-moyen-orient.html,0,www.nouvelobs.com,"En Ukraine, Poutine n’avance toujours pas… voire recule, incapable de profiter de la guerre au Moyen-Orient","Déjouant encore les attentes, l’armée de Kiev a repris l’initiative sur certains secteurs de la ligne de front, tandis que l’impatience gagne le premier cercle du pouvoir russe. Ce samedi 9 mai, la parade militaire à Moscou s’annonce bien terne.",https://focus.nouvelobs.com/2026/05/07/46/0/2575/1717/1200/800/0/0/e76bd28_upload-1-qowy30h5uf4s-000-a9gq2g3.jpg,2026-05-08T16:00:03Z,http://web.archive.org/web/20260508160243/https://www.nouvelobs.com/monde/20260508.OBS114783/en-ukraine-poutine-n-avance-toujours-pas-voire-recule-incapable-de-profiter-de-la-guerre-au-moyen-orient.html,"Le président russe Vladimir Poutine à Moscou, le 30 avril 2026. VIACHESLAV PROKOFIEV/AFP
Commenter Lire plus tard 
Google Actualités
Partager Sabonner pour lire 
Tous les astres semblaient pourta… [+1199 chars]",,fr,'Vladimir Poutine'
https://www.huffingtonpost.fr/international/video/en-russie-le-9-mai-de-vladimir-poutine-s-annonce-morose-entre-defile-reduit-impopularite-et-difficultes-en-ukraine-clx1_263371.html,https://www.huffingtonpost.fr/international/video/en-russie-le-9-mai-de-vladimir-poutine-s-annonce-morose-entre-defile-reduit-impopularite-et-difficultes-en-ukraine-clx1_263371.html,0,www.huffingtonpost.fr,"En Russie, le 9 mai de Vladimir Poutine s’annonce morose entre défilé réduit, impopularité et difficultés en Ukraine","Contrairement aux années précédentes, la place Rouge ne sera pas envahie par les chars d’assaut, missiles balistiques et autres équipements militaires.",https://focus.huffingtonpost.fr/2026/05/05/0/0/1920/1080/1820/1023/75/0/3fea64e_upload-1-l8s7hgg9ziee-montage-1080p-00-06-16-15-still004.jpg,2026-05-08T17:29:41Z,,"La lecture de ce contenu est susceptible dentraîner un dépôt de cookies de la part de lopérateur tiers qui lhéberge. Compte-tenu des choix que vous avez exprimés en matière de dépôt de cookies, nous … [+2002 chars]",,fr,'Vladimir Poutine'
https://www.ledauphine.com/defense-guerre-conflit/2026/05/08/guerre-en-ukraine-vladimir-poutine-joue-sa-survie-dans-la-continuation-du-conflit,https://www.ledauphine.com/defense-guerre-conflit/2026/05/08/guerre-en-ukraine-vladimir-poutine-joue-sa-survie-dans-la-continuation-du-conflit,0,www.ledauphine.com,Interview. Guerre en Ukraine : Vladimir Poutine « joue sa survie dans la continuation » du conflit,Marie Mendras est professeure à l’École des Affaires Internationales de Sciences Po. L'auteure de La guerre permanente : l’ultime stratégie du Kremlin (Éd. Calmann-Lévy) estime que nous sommes à « un tournant » du conflit.,https://cdn-s-www.ledauphine.com/images/E5CA9A11-647A-4AF3-B58A-8298D6140CC6/FB1200/photo-1778250354.jpg,2026-05-08T17:30:00Z,,"Marie Mendras est membre de la revue Esprit. Photo DR
La Russie et l'Ukraine ont continué vendredi leurs attaques mutuelles de drones, malgré l'entrée en vigueur à minuit d'une trêve russe. Elle a é… [+5899 chars]",,fr,'Poutine'
https://www.franceinfo.fr/monde/europe/manifestations-en-ukraine/guerre-en-ukraine-donald-trump-annonce-un-cessez-le-feu-de-trois-jours-entre-kiev-et-moscou-a-partir-de-samedi_7992212.html,https://www.franceinfo.fr/monde/europe/manifestations-en-ukraine/guerre-en-ukraine-donald-trump-annonce-un-cessez-le-feu-de-trois-jours-entre-kiev-et-moscou-a-partir-de-samedi_7992212.html,0,www.franceinfo.fr,Guerre en Ukraine : Donald Trump annonce un cessez-le-feu de trois jours entre Kiev et Moscou à partir de samedi,"Le président américain a précisé le cadre de ce court cessez-le-feu sur son compte Truth Social, avec ""un échange de 1 000 prisonniers"" de chaque pays.",https://www.franceinfo.fr/pictures/sUgy-jFaFd6xoSxY3_1FaqEagrY/0x404:4089x2704/1500x843/2026/05/08/69fe279937bf1154591811.jpg,2026-05-08T18:20:10Z,,"Donald Trump, le président américain, a annoncé vendredi 8 mai qu'un cessez-le-feu de trois jours entre l'Ukraine et la Russie prendrait effet samedi, dimanche et lundi, alors que Moscou avait déjà d… [+715 chars]",,fr,'Vladimir Poutine'
https://www.huffingtonpost.fr/international/article/guerre-en-ukraine-donald-trump-annonce-un-cessez-le-feu-de-trois-jours-entre-kiev-et-moscou_263536.html,https://www.huffingtonpost.fr/international/article/guerre-en-ukraine-donald-trump-annonce-un-cessez-le-feu-de-trois-jours-entre-kiev-et-moscou_263536.html,0,www.huffingtonpost.fr,Guerre en Ukraine : Donald Trump annonce un cessez-le-feu de trois jours entre Kiev et Moscou,Le président américain a indiqué dans un message sur Truth Social que « toute activité militaire » serait suspendue de samedi à lundi inclus. Un « échange » de prisonniers est aussi annoncé.,https://focus.huffingtonpost.fr/2025/09/24/10/0/1280/720/1820/1023/75/0/64b74af_upload-1-umrxuotyj9ql-afp-20250923-aa-24092025-2437583-v1-highres-zelenskyytrumpmeetingattheunheadqua.jpg,2026-05-08T18:40:02Z,,A voir aussi sur Le HuffPost La lecture de ce contenu est susceptible dentraîner un dépôt de cookies de la part de lopérateur tiers qui lhéberge. Compte-tenu des choix que vous avez exprimés en matiè… [+2591 chars],,fr,'Donald Trump'
https://www.20minutes.fr/monde/ukraine/4222634-20260508-guerre-ukraine-trump-annonce-cessez-feu-trois-jours-entre-moscou-kiev,https://www.20minutes.fr/monde/ukraine/4222634-20260508-guerre-ukraine-trump-annonce-cessez-feu-trois-jours-entre-moscou-kiev,0,www.20minutes.fr,Guerre en Ukraine : Trump annonce un cessez-le-feu de trois jours entre Moscou et Kiev,"Donald Trump a annoncé vendredi 8 mai un cessez-le-feu de trois jours entre l’Ukraine et la Russie, malgré la poursuite des frappes de drones entre Kiev et Moscou",https://img.20mn.fr/n8ErAcp-QvSecnlcd9mPkyk/1444x920_credit-obligatoire-photo-d-aaron-schwartz-pool-via-cnp-shutterstock-16866510ba-le-president-americain-donald-j-trump-prononce-une-allocution-lors-d-un-dejeuner-pour-les-meres-gold-star-et-les-meres-anges-a-l-occasion-de-la-fete-des-meres-dans-la-roseraie-de-la-maison-blanche-a-washington-dc-etats-unis-dejeuner-trump-a-l-occasion-de-la-fete-des-meres-2026-washington-district-de-columbia-etats-unis-08-mai-2026-shutterstock-editorial-trump-luncheon-honoring-mothe-16866510ba-2605082057,2026-05-08T20:32:28Z,http://web.archive.org/web/20260509020742/https://www.20minutes.fr/monde/ukraine/4222634-20260508-guerre-ukraine-trump-annonce-cessez-feu-trois-jours-entre-moscou-kiev,"Le président américain Donald Trump a annoncé vendredi 8 mai linstauration dun cessez-le-feu de trois jours entre lUkraine et la Russie, prévu du 9 au 11 mai. Cette annonce intervient alors que Mosco… [+2255 chars]",,fr,'Vladimir Poutine'
https://www.courrierinternational.com/article/treve-cessez-le-feu-entre-l-ukraine-et-la-russie-apres-une-intervention-diplomatique-surprise-de-donald-trump_243830,https://www.courrierinternational.com/article/treve-cessez-le-feu-entre-l-ukraine-et-la-russie-apres-une-intervention-diplomatique-surprise-de-donald-trump_243830,0,www.courrierinternational.com,Cessez-le-feu entre l’Ukraine et la Russie après “une intervention diplomatique surprise” de Donald Trump,"La trêve doit durer trois jours, du 9 au 11 mai, et s’accompagne d’un vaste échange de prisonniers. La Russie organise ce 9 mai un défilé militaire pour commémorer la fin de la Seconde guerre mondiale.",https://focus.courrierinternational.com/2026/05/09/0/0/4944/3296/1200/630/60/0/39b9d7f_ftp-1-lf7pknxhhrh1-2026-05-09t005459z-1974504185-rc2b5laj5cpq-rtrmadp-3-usa-trump.JPG,2026-05-09T03:55:20Z,,"Le Moscow Times évoqueintervention diplomatique surprise de Donald Trump tandis que Politico parle du dernier rebondissement en date dun long conflit. Vendredi, le président américain a annoncé sur s… [+3512 chars]",,fr,'Donald Trump'
https://www.bfmtv.com/international/asie/russie/crainte-d-une-attaque-ukrainienne-vladimir-poutine-inquiet-pour-sa-securite-le-defile-militaire-pour-la-victoire-du-9-mai-largement-reduit-et-sous-tension-a-moscou_AN-202605090041.html,https://www.bfmtv.com/international/asie/russie/crainte-d-une-attaque-ukrainienne-vladimir-poutine-inquiet-pour-sa-securite-le-defile-militaire-pour-la-victoire-du-9-mai-largement-reduit-et-sous-tension-a-moscou_AN-202605090041.html,0,www.bfmtv.com,"Crainte d'une attaque ukrainienne, Vladimir Poutine inquiet pour sa sécurité... Le défilé militaire pour la victoire du 9-Mai largement réduit et sous tension à Moscou","Chaque 9 mai, la Russie célèbre le Jour de la Victoire face à l'Allemagne nazie. Si cette journée est l'occasion de vanter les forces militaires du Kremlin à travers un défilé sur la Place Rouge de Moscou, les célébrations seront fortement réduites cette anné…",https://images.bfmtv.com/K8OL4k10jTItpRi2iJhNfaMtSYo=/0x58:768x490/768x0/images/Photo-diffusee-par-l-agence-d-Etat-russe-Sputnik-du-president-russe-Vladimir-Poutine-saluant-les-commandants-militaires-apres-le-defile-militaire-du-Jour-de-la-Victoire-sur-la-Place-Rouge-a-Moscou-le-9-mai-2025-2079094.jpg,2026-05-09T04:45:00Z,http://web.archive.org/web/20260509215810/https://www.bfmtv.com/international/asie/russie/crainte-d-une-attaque-ukrainienne-vladimir-poutine-inquiet-pour-sa-securite-le-defile-militaire-pour-la-victoire-du-9-mai-largement-reduit-et-sous-tension-a-moscou_AN-202605090041.html,"Chaque 9 mai, la Russie célèbre le Jour de la Victoire face à l'Allemagne nazie. Si cette journée est l'occasion de vanter les forces militaires du Kremlin à travers un défilé sur la Place Rouge de M… [+5784 chars]",,fr,'Vladimir Poutine'
https://www.ledauphine.com/defense-guerre-conflit/2026/05/09/internet-coupe-coup-d-etat-redoute-en-echec-sur-le-front-moscou-durcit-le-regime,https://www.ledauphine.com/defense-guerre-conflit/2026/05/09/internet-coupe-coup-d-etat-redoute-en-echec-sur-le-front-moscou-durcit-le-regime,0,www.ledauphine.com,"Guerre en Ukraine. Internet coupé, coup d'État redouté... En échec sur le front, Moscou durcit le régime",Moscou et Kiev continuent leurs attaques de drones malgré la trêve russe et un cessez-le-feu surprise annoncé par Donald Trump. La multiplication des frappes oblige le Kremlin à contrôler de plus en plus étroitement une population qui ressent désormais claire…,https://cdn-s-www.ledauphine.com/images/F7CF577C-9353-405D-97C1-EE67C66F055A/FB1200/photo-1778254494.jpg,2026-05-09T05:00:00Z,http://web.archive.org/web/20260510023415/https://www.ledauphine.com/defense-guerre-conflit/2026/05/09/internet-coupe-coup-d-etat-redoute-en-echec-sur-le-front-moscou-durcit-le-regime,Le ciel est lourd en Russie. Et pas uniquement à cause des nuages. Alors que Moscou et Kiev continuent leurs attaques de drones malgré la trêve russe et un cessez-le-feu surprise annoncé par Donald T… [+4658 chars],,fr,'Vladimir Poutine'
