index,url,valid,domain,title,description,image,published,archive,content,quote,language,keyword
https://www.lemonde.fr/international/article/2026/03/01/comment-voulez-vous-que-j-examine-mes-patients-dans-le-noir-a-cuba-la-penurie-de-carburant-commande-le-quotidien_6668747_3210.html,https://www.lemonde.fr/international/article/2026/03/01/comment-voulez-vous-que-j-examine-mes-patients-dans-le-noir-a-cuba-la-penurie-de-carburant-commande-le-quotidien_6668747_3210.html,0,www.lemonde.fr,"« Comment voulez-vous que j’examine mes patients dans le noir ? » A Cuba, la pénurie de carburant commande le quotidien","Soumise à un blocus pétrolier par les Etats-Unis et dépendante des importations d’énergie, l’île s’enfonce dans une crise qui touche désormais les services les plus élémentaires. Vendredi, Donald Trump a émis l’hypothèse d’une « prise de contrôle amicale de C…",https://img.lemde.fr/2026/02/27/380/0/5704/3802/1440/960/60/0/2cc9ae6_upload-1-dalyba0gtzhj-ll-cuba-la-havane-80.jpg,2026-03-01T04:45:11Z,,"Un habitant sarrête devant une « mipyme » (boutique privée) éclairée grâce à son générateur, lors dune coupure délectricité à La Havane, le 4 janvier 2026. LUCIEN LUNG/RIVA PRESS POUR « LE MONDE »
D… [+1228 chars]",,fr,'Donald Trump'
https://www.courrierinternational.com/article/moyen-orient-seisme-politique-en-iran-teheran-confirme-la-mort-d-ali-khamenei-dans-des-frappes-israelo-americaines_241161,https://www.courrierinternational.com/article/moyen-orient-seisme-politique-en-iran-teheran-confirme-la-mort-d-ali-khamenei-dans-des-frappes-israelo-americaines_241161,0,www.courrierinternational.com,“Séisme politique” en Iran : Téhéran confirme la mort d’Ali Khamenei dans des frappes israélo-américaines,"Les Gardiens de la Révolution ont promis dimanche “la plus féroce offensive de l’Histoire” contre les Etats-Unis et l’État hébreu, après le décès du guide suprême. Si sa disparition constitue un tournant historique pour le Moyen-Orient, elle ne signifie pas p…",https://focus.courrierinternational.com/2026/03/01/0/0/7936/5290/1200/630/60/0/ff11cbd_ftp-1-xgcf1qvth0nf-afp-99eb296.jpg,2026-03-01T04:49:57Z,,"Il était le visage de la République islamique pendant plus de trois décennies. Son architecte. Le père de lambiguïté nucléaire, des missiles, des milices et de la patience stratégique, soit tout ce q… [+3845 chars]",,fr,'nan Si'
https://www.bfmtv.com/international/moyen-orient/iran/l-iran-confirme-la-mort-du-guide-supreme-ali-khamenei-dans-l-operation-militaire-americano-israelienne_AV-202603010060.html,https://www.bfmtv.com/international/moyen-orient/iran/l-iran-confirme-la-mort-du-guide-supreme-ali-khamenei-dans-l-operation-militaire-americano-israelienne_AV-202603010060.html,0,www.bfmtv.com,L'Iran confirme la mort du guide suprême Ali Khamenei dans l'opération militaire américano-israélienne,"Après l’annonce faite samedi 28 février par Donald Trump, les médias iraniens ont confirmé ce dimanche 1er mars la mort d’Ali Khamenei dans les frappes américano-israéliennes.",https://images.bfmtv.com/3vK7mpT0HUrw0jx8ajuE00IOkFA=/0x212:2048x1364/2048x0/images/L-ayatollah-Khamenei-a-Teheran-le-19-mars-2024-1836446.jpg,2026-03-01T04:52:20Z,,"Après lannonce faite samedi 28 février par Donald Trump, les médias iraniens ont confirmé ce dimanche 1er mars la mort dAli Khamenei dans les frappes américano-israéliennes.
Les Gardiens de la révol… [+488 chars]",,fr,'Donald Trump'
https://www.bfmtv.com/international/moyen-orient/iran/direct-frappes-en-iran-les-gardiens-de-la-revolution-promettent-un-chatiment-severe-aux-meurtriers-du-guide-supreme_LN-202603010061.html,https://www.bfmtv.com/international/moyen-orient/iran/direct-frappes-en-iran-les-gardiens-de-la-revolution-promettent-un-chatiment-severe-aux-meurtriers-du-guide-supreme_LN-202603010061.html,0,www.bfmtv.com,"DIRECT. Frappes en Iran: les Gardiens de la révolution promettent un ""châtiment sévère"" aux ""meurtriers"" du guide suprême","Le guide suprême iranien Ali Khamenei a été tué, samedi 28 février, par des frappes menées dans le pays par les États-Unis et Israël. Téhéran a riposté par des tirs de missiles contre Israël et les États du Golfe. Donald Trump a assuré que les frappes continu…",https://images.bfmtv.com/XmFLKYKP2zJAXGk9aU0pqGZDJrU=/0x106:2048x1258/2048x0/images/Le-guide-supreme-iranien-l-ayatollah-Ali-Khamenei-a-Teheran-le-4-juin-2025-2098626.jpg,2026-03-01T04:59:30Z,,"La transition sera assurée par un triumvirat composé du président iranien, Masoud Pezeshkian, du chef du pouvoir judiciaire en Iran, Gholamhossein Mohseni Ejeï, ainsi que d'un membre du Conseil des g… [+281 chars]",,fr,'Donald Trump'
https://www.20minutes.fr/monde/etats-unis/4203917-20260301-frappes-iran-make-iran-great-again-diaspora-iranienne-los-angeles-fete-mort-khamenei,https://www.20minutes.fr/monde/etats-unis/4203917-20260301-frappes-iran-make-iran-great-again-diaspora-iranienne-los-angeles-fete-mort-khamenei,0,www.20minutes.fr,Frappes en Iran : « Make Iran Great Again »… La diaspora iranienne à Los Angeles fête la mort de Khamenei,Le guide suprême Ali Khamenei est mort dans les frappes menées par Israël et les Etats-Unis de Donald Trump en Iran,https://img.20mn.fr/E9btPEwjRdSAlvxbrwg6iSk/1444x920_los-angeles-february-28-signs-denouncing-iranian-leader-ayatollah-ali-khamenei-are-held-up-as-embers-of-the-iranian-community-and-supporters-celebrate-on-february-28-2026-in-los-angeles-california-president-donald-trump-announced-that-the-united-states-and-israel-had-launched-an-attack-on-iran-saturday-morning-mario-tama-getty-images-afp-photo-by-mario-tama-getty-images-north-america-getty-images-via-afp,2026-03-01T05:16:11Z,http://web.archive.org/web/20260301092509/https://www.20minutes.fr/monde/etats-unis/4203917-20260301-frappes-iran-make-iran-great-again-diaspora-iranienne-los-angeles-fete-mort-khamenei,"Sans surprise, une partie de la diaspora iranienne présente aux Etats-Unis a salué samedi la mort du guide suprême Ali Khamenei. Des danses de joie ont ainsi eu lieu à Los Angeles. Cette mégapole amé… [+2783 chars]",,fr,'Donald Trump'
https://www.bfmtv.com/international/amerique-nord/etats-unis/donald-trump-menace-l-iran-d-une-riposte-militaire-sans-precedent-en-cas-de-represailles-apres-l-attaque-americano-israelienne_AN-202603010078.html,https://www.bfmtv.com/international/amerique-nord/etats-unis/donald-trump-menace-l-iran-d-une-riposte-militaire-sans-precedent-en-cas-de-represailles-apres-l-attaque-americano-israelienne_AN-202603010078.html,0,www.bfmtv.com,"Donald Trump menace l'Iran d'une riposte militaire ""sans précédent"" en cas de représailles après l'attaque américano-israélienne",Le président des États-Unis a prévenu l'Iran ce dimanche 1er mars en cas de riposte à l'attaque américano-israélienne menée samedi et dans laquelle est mort le guide suprême iranien.,https://images.bfmtv.com/7cns3pWSHEDH-09THJcmWovE2gk=/0x0:2048x1152/2048x0/images/Donald-Trump-lors-du-premier-Conseil-de-Paix-a-Washington-le-19-fevrier-2026-2238746.jpg,2026-03-01T05:50:51Z,http://web.archive.org/web/20260301185154/https://www.bfmtv.com/international/amerique-nord/etats-unis/donald-trump-menace-l-iran-d-une-riposte-militaire-sans-precedent-en-cas-de-represailles-apres-l-attaque-americano-israelienne_AN-202603010078.html,"Le président des États-Unis a prévenu l'Iran ce dimanche 1er mars en cas de riposte à l'attaque américano-israélienne menée samedi et dans laquelle est mort le guide suprême iranien.
Le président am… [+565 chars]",,fr,'Donald Trump'
https://www.franceinfo.fr/monde/iran/guerre-entre-les-etats-unis-israel-et-l-iran/nucleaire-missiles-balistiques-repression-sanglante-les-principales-raisons-qui-ont-pousse-les-etats-unis-et-israel-a-attaquer-de-nouveau-l-iran_7836977.html,https://www.franceinfo.fr/monde/iran/guerre-entre-les-etats-unis-israel-et-l-iran/nucleaire-missiles-balistiques-repression-sanglante-les-principales-raisons-qui-ont-pousse-les-etats-unis-et-israel-a-attaquer-de-nouveau-l-iran_7836977.html,0,www.franceinfo.fr,"Nucléaire, missiles balistiques, répression sanglante... Les principales raisons qui ont poussé les Etats-Unis et Israël à attaquer de nouveau l'Iran","""Nous allons détruire leurs missiles et anéantir leur industrie balistique (...) Nous allons anéantir leur marine"", a promis samedi Donald Trump, dévoilant l'objectif de cette opération conjointe avec Israël : ""Eliminer la menace existentielle que fait peser …",https://www.franceinfo.fr/pictures/ilameSYIRraEhyA9kXJj1_6ZHM4/0x758:7290x4857/1500x843/2026/02/28/000-999y46h-69a333684424b951139792.jpg,2026-03-01T06:14:09Z,,"""La paix est à portée de main."" A quelques heures du lancement de l'opération conjointe des Etats-Unis et d'Israël contre l'Iran, le ministre des Affaires étrangères omanais, Badr al-Busaidi, chargé … [+7367 chars]",,fr,'Donald Trump'
https://www.courrierinternational.com/article/idees-la-petromelancolie-ca-suffit-pourquoi-avons-nous-tant-de-mal-a-renoncer-a-l-or-noir_240046,https://www.courrierinternational.com/article/idees-la-petromelancolie-ca-suffit-pourquoi-avons-nous-tant-de-mal-a-renoncer-a-l-or-noir_240046,0,www.courrierinternational.com,"La “pétromélancolie”, ça suffit : pourquoi avons-nous tant de mal à renoncer à l’or noir ?","Avec le retour de Donald Trump à la Maison-Blanche, le pétrole est redevenu un enjeu géopolitique de premier plan. Mais si l’or noir fait de la résistance, c’est aussi parce que les partisans de la transition énergétique ont sous-estimé le poids de l’imaginai…",https://focus.courrierinternational.com/2026/02/13/0/0/2850/1900/1200/630/60/0/6fd1ca3_upload-1-dwsgv6d2qodt-bartkus-slowhand.jpg,2026-03-01T06:15:49Z,,"Quand il a commencé à sen prendre au Venezuela, il parlait encore de drogue [lenlèvement de Nicolás Maduro, dans la nuit du 2 au 3 janvier, a dabord été justifié au nom du narcoterrorisme]. Donald Tr… [+1078 chars]",,fr,'Donald Trump'
https://www.franceinfo.fr/monde/iran/direct-guerre-au-moyen-orient-apres-la-mort-du-guide-ali-khamenei-donald-trump-menace-l-iran-d-une-riposte-sans-precedent-en-cas-de-represailles_7838399.html,https://www.franceinfo.fr/monde/iran/direct-guerre-au-moyen-orient-apres-la-mort-du-guide-ali-khamenei-donald-trump-menace-l-iran-d-une-riposte-sans-precedent-en-cas-de-represailles_7838399.html,0,www.franceinfo.fr,"Guerre au Moyen-Orient : après la mort du guide Ali Khamenei, Donald Trump menace l'Iran d’une riposte ""sans précédent"" en cas de représailles","Le guide suprême iranien Ali Khamenei est mort samedi, a confirmé Téhéran. Mais le conflit dans la région fait toujours rage et des frappes continuent de tomber en Iran et dans la région.",https://www.franceinfo.fr/pictures/6xUDco62QhSAHa8gcByXC1puTq8/0x53:1024x629/1500x843/2026/03/01/000-99eb296-69a3deb5631a9449113735.jpg,2026-03-01T06:37:42Z,,"Au lendemain de la mort du guide suprême iranien Ali Khamenei, tué dans l'attaque israélo-américaine lancée samedi sur l'Iran, le Moyen-Orient continue de s'embraser. Le président américain Donald Tr… [+1160 chars]",,fr,'Donald Trump'
https://www.lemonde.fr/international/article/2026/03/01/les-etats-unis-et-israel-commettent-un-crime-d-agression-contre-l-iran-juge-matthew-duss-ancien-conseiller-de-bernie-sanders_6668800_3210.html,https://www.lemonde.fr/international/article/2026/03/01/les-etats-unis-et-israel-commettent-un-crime-d-agression-contre-l-iran-juge-matthew-duss-ancien-conseiller-de-bernie-sanders_6668800_3210.html,0,www.lemonde.fr,"Frappes en Iran : les Etats-Unis et Israël commettent « un crime d’agression », juge Matthew Duss, ancien conseiller de Bernie Sanders","Voix influente du camp progressiste, ancien conseiller du sénateur Bernie Sanders, Matthew Duss estime que la direction du Parti démocrate, en matière de politique étrangère, reste prisonnière de schémas anciens, hérités de l’après-guerre froide.",https://img.lemde.fr/2026/02/13/0/58/5380/3587/1440/960/60/0/430716b_ftp-1-forfelvus8sm-2026-02-13t163818z-1700405191-rc24ljazqesh-rtrmadp-3-security-munich.JPG,2026-03-01T07:03:29Z,http://web.archive.org/web/20260301102633/https://www.lemonde.fr/international/article/2026/03/01/les-etats-unis-et-israel-commettent-un-crime-d-agression-contre-l-iran-juge-matthew-duss-ancien-conseiller-de-bernie-sanders_6668800_3210.html,"Aux Etats-Unis, les démocrates sont focalisés sur les questions intérieures. Pourtant, la défaite électorale en 2024 et les embardées de Donald Trump dans le monde les obligent aussi à une réflexion … [+1753 chars]",,fr,'Donald Trump'
https://www.lexpress.fr/monde/proche-moyen-orient/attaque-en-iran-donald-trump-menace-de-frapper-teheran-avec-une-force-jamais-vue-WPG2RWIUOVC2FNRTQO6ONWP6XY/,https://www.lexpress.fr/monde/proche-moyen-orient/attaque-en-iran-donald-trump-menace-de-frapper-teheran-avec-une-force-jamais-vue-WPG2RWIUOVC2FNRTQO6ONWP6XY/,0,www.lexpress.fr,"EN DIRECT. Attaque en Iran : Donald Trump menace de frapper Téhéran ""avec une force jamais vue""","Après la mort du guide suprême Ali Khamenei samedi 28 février, le régime iranien a annoncé que le chef d’état-major de l’armée avait aussi été tué par les frappes israélo-américaines.",https://www.lexpress.fr/resizer/v2/JCPTCMYCE5BHTBTRT6UZBF45DI.JPG?auth=680f78440be96d4f6debde6c7b36c53020ed536be3499c8373dccd0c1744d239&width=1200&height=630&quality=85&focal=3027%2C1543,2026-03-01T07:06:07Z,http://web.archive.org/web/20260301110609/https://www.lexpress.fr/monde/proche-moyen-orient/attaque-en-iran-donald-trump-menace-de-frapper-teheran-avec-une-force-jamais-vue-WPG2RWIUOVC2FNRTQO6ONWP6XY/,"Les médias officiels iraniens ont confirmé ce dimanche 1er mars que l'ayatollah Ali Khamenei avait été tué dans les frappes menées par Israël et les Etats-Unis, tandis que l'armée israélienne a décla… [+2214 chars]",,fr,'Donald Trump'
https://www.bfmtv.com/politique/elections/municipales/nous-ne-partageons-pas-la-vision-de-lfi-sur-le-vivre-ensemble-sur-la-republique-sur-la-laicite-carole-delga-estime-que-toute-alliance-avec-lfi-aux-municipales-serait-un-deshonneur-pour-le-ps_AD-202603010134.html,https://www.bfmtv.com/politique/elections/municipales/nous-ne-partageons-pas-la-vision-de-lfi-sur-le-vivre-ensemble-sur-la-republique-sur-la-laicite-carole-delga-estime-que-toute-alliance-avec-lfi-aux-municipales-serait-un-deshonneur-pour-le-ps_AD-202603010134.html,0,www.bfmtv.com,"""Nous ne partageons pas leur vision sur le vivre-ensemble, sur la République, sur la laïcité..."": Carole Delga estime que toute alliance avec LFI aux municipales serait un ""déshonneur"" pour le PS","La présidente de la région Occitanie tacle le parti de Jean-Luc Mélenchon en assurant ""qu'il faut réparer les injustices en rassemblant, pas en déclamant ou en antagonisant davantage la société"".",https://images.bfmtv.com/3WIJguo7JM_bqz8gTqer7J-vkio=/0x106:2048x1258/2048x0/images/Carole-Delga-president-de-la-region-Occitanie-le-19-janvier-2026-2244028.jpg,2026-03-01T07:59:00Z,http://web.archive.org/web/20260302024604/https://www.bfmtv.com/politique/elections/municipales/nous-ne-partageons-pas-la-vision-de-lfi-sur-le-vivre-ensemble-sur-la-republique-sur-la-laicite-carole-delga-estime-que-toute-alliance-avec-lfi-aux-municipales-serait-un-deshonneur-pour-le-ps_AD-202603010134.html,"La présidente de la région Occitanie tacle le parti de Jean-Luc Mélenchon en assurant ""qu'il faut réparer les injustices en rassemblant, pas en déclamant ou en antagonisant davantage la société"".
La… [+2493 chars]",,fr,'Quentin Deranque'
https://www.lemonde.fr/international/live/2026/03/01/en-direct-guerre-en-ukraine-la-russie-a-lance-plus-de-34-000-projectiles-sur-le-territoire-ukrainien-au-cours-des-trois-mois-d-hiver-affirme-volodymyr-zelensky_6668763_3210.html,https://www.lemonde.fr/international/live/2026/03/01/en-direct-guerre-en-ukraine-la-russie-a-lance-plus-de-34-000-projectiles-sur-le-territoire-ukrainien-au-cours-des-trois-mois-d-hiver-affirme-volodymyr-zelensky_6668763_3210.html,0,www.lemonde.fr,"EN DIRECT, guerre en Ukraine : la Russie a lancé plus de 34 000 projectiles sur le territoire ukrainien au cours des trois mois d’hiver, affirme Volodymyr Zelensky","Selon le président ukrainien, sur cette période, les forces russes ont tiré plus de 14 670 bombes guidées, 738 missiles et près de 19 000 drones d’attaque, en majorité des appareils de type Shahed de conception russo-iranienne, a-t-il précisé.",https://img.lemde.fr/2026/02/23/1029/0/8028/4014/1440/720/60/0/c763d6c_ftp-1-1eshhwj91x8m-5276781-01-06.jpg,2026-03-01T10:19:11Z,,"Les forces armées belges, avec le soutien de militaires français, ont pris le contrôle de lEthera un pétrolier appartenant à la flotte fantôme russe, a annoncé Theo Francken, le ministre de la défens… [+2336 chars]",,fr,'Volodymyr Zelensky'
https://www.lemonde.fr/international/live/2026/03/01/en-direct-au-moins-six-personnes-sont-mortes-en-israel-apres-une-frappe-iranienne-emmanuel-macron-convoque-un-nouveau-conseil-de-defense_6668663_3210.html,https://www.lemonde.fr/international/live/2026/03/01/en-direct-au-moins-six-personnes-sont-mortes-en-israel-apres-une-frappe-iranienne-emmanuel-macron-convoque-un-nouveau-conseil-de-defense_6668663_3210.html,0,www.lemonde.fr,EN DIRECT : au moins six personnes sont mortes en Israël après une frappe iranienne ; Emmanuel Macron convoque un nouveau conseil de défense,"Après la mort du Guide suprême iranien, Ali Khamene, dans les frappes survenues samedi, la transition politique se met en place en Iran. L’ayatollah Alireza Arafi, directeur des séminaires islamiques d’Iran, a été nommé au sein du triumvirat assurant la trans…",https://img.lemde.fr/2026/03/01/641/0/5500/2750/1440/720/60/0/90b9ce9_ftp-1-ultn942rwdd7-2026-03-01t130053z-490056157-rc2ovjam1zh3-rtrmadp-3-iran-crisis-israel.JPG,2026-03-01T13:03:57Z,,"La mort, samedi, du Guide suprême iranien, layatollah Ali Khamenei, après près de trente-sept ans au pouvoir, ouvre une période dincertitude majeure en Iran et enclenche un mécanisme de succession, r… [+2322 chars]",,fr,'Emmanuel Macron'
https://www.lemonde.fr/international/live/2026/03/01/en-direct-guerre-en-ukraine-selon-volodymyr-zelensky-la-russie-a-tire-plus-de-34-000-projectiles-sur-le-territoire-ukrainien-au-cours-des-trois-mois-d-hiver_6668763_3210.html,https://www.lemonde.fr/international/live/2026/03/01/en-direct-guerre-en-ukraine-selon-volodymyr-zelensky-la-russie-a-tire-plus-de-34-000-projectiles-sur-le-territoire-ukrainien-au-cours-des-trois-mois-d-hiver_6668763_3210.html,0,www.lemonde.fr,"EN DIRECT, guerre en Ukraine : selon Volodymyr Zelensky, la Russie a tiré plus de 34 000 projectiles sur le territoire ukrainien au cours des trois mois d’hiver","Les forces russes ont lancé plus de 14 670 bombes guidées, 738 missiles et près de 19 000 drones d’attaque, en majorité des appareils de type Shahed de conception russo-iranienne, a précisé le président ukrainien, soulignant que ces drones sont désormais util…",https://img.lemde.fr/2026/02/14/406/0/5249/2624/1440/720/60/0/4c1bd86_ftp-1-lppkxqlgdiko-9830013f91ea4fe29d2c91ee4e900aab-0-933f9ec62c22454193c48f13277fd349.jpg,2026-03-01T14:35:31Z,,"Les forces armées belges, avec le soutien de militaires français, ont pris le contrôle de lEthera un pétrolier appartenant à la flotte fantôme russe, a annoncé Theo Francken, le ministre de la défens… [+2336 chars]",,fr,'Emmanuel Macron'
https://www.ledauphine.com/politique/2026/03/01/polemique-sur-la-prononciation-d-epstein-jean-luc-melenchon-se-defend-d-etre-antisemite,https://www.ledauphine.com/politique/2026/03/01/polemique-sur-la-prononciation-d-epstein-jean-luc-melenchon-se-defend-d-etre-antisemite,0,www.ledauphine.com,Politique. Polémique sur la prononciation d'Epstein : Jean-Luc Mélenchon se défend d'être « antisémite »,"Jean-Luc Mélenchon est revenu ce dimanche à Perpignan sur la polémique née de sa prononciation du nom du pédocriminel Jeffrey Epstein, affirmant que « cet homme-là n'avait aucune religion ».",https://cdn-s-www.ledauphine.com/images/7C3BAB95-BF54-41A4-9931-B80A3736739E/FB1200/photo-1772386713.jpg,2026-03-01T17:44:00Z,,"En meeting à Perpignan (Pyrénées-Orientales) ce dimanche, Jean-Luc Mélenchon est revenu sur la polémique née de sa prononciation du nom du pédocriminel Jeffrey Epstein. « Ce n'est pas moi qui ait fai… [+3626 chars]",,fr,'nan nan'
https://www.20minutes.fr/monde/israel/4203942-20260301-frappes-iran-france-va-rehausser-posture-militaire-golfe-annonce-emmanuel-macron,https://www.20minutes.fr/monde/israel/4203942-20260301-frappes-iran-france-va-rehausser-posture-militaire-golfe-annonce-emmanuel-macron,0,www.20minutes.fr,"Frappes en Iran : La France va rehausser sa « posture » militaire dans le Golfe, annonce Emmanuel Macron","Après les frappes américaines et israéliennes contre l’Iran et les représailles iraniennes contre les pays du Golfe, Emmanuel Macron a évoqué ce dimanche une possible augmentation des moyens militaires français déployés dans la région",https://img.20mn.fr/PaAMWzGUSneR9O5ziJPFyCk/1444x920_le-president-francais-emmanuel-macron-au-centre-et-le-premier-ministre-sebastien-lecornu-a-gauche-assistent-a-un-discours-lors-d-une-reunion-du-conseil-de-defense-nationale-au-palais-presidentiel-de-l-elysee-a-paris-le-samedi-28-fevrier-2026-anna-kurth-photo-de-piscine-via-ap-xpag641-26059641461744-photo-de-piscine-2602281905,2026-03-01T19:41:02Z,http://web.archive.org/web/20260302002557/https://www.20minutes.fr/monde/israel/4203942-20260301-frappes-iran-france-va-rehausser-posture-militaire-golfe-annonce-emmanuel-macron,La France sur la défensive. Emmanuel Macron a annoncé ce dimanche soir « rehausser notre posture et notre accompagnement défensif pour être au côté de ceux avec lesquels nous avons des traités de déf… [+960 chars],,fr,'Emmanuel Macron'
https://www.lemonde.fr/politique/article/2026/03/01/jean-luc-melenchon-plaisante-sur-la-prononciation-du-nom-de-raphael-glucksmann-qui-le-compare-a-jean-marie-le-pen_6668956_823448.html,https://www.lemonde.fr/politique/article/2026/03/01/jean-luc-melenchon-plaisante-sur-la-prononciation-du-nom-de-raphael-glucksmann-qui-le-compare-a-jean-marie-le-pen_6668956_823448.html,0,www.lemonde.fr,"Jean-Luc Mélenchon plaisante sur la prononciation du nom de Raphaël Glucksmann, qui le compare à Jean-Marie Le Pen","Le leader « insoumis » a déjà été accusé d’antisémitisme ces derniers jours pour avoir ironisé sur le nom de Jeffrey Epstein, laissant sous-entendre l’existence d’un complot visant à cacher l’origine juive du pédocriminel américain.",https://img.lemde.fr/2026/03/01/197/0/2953/1968/1440/960/60/0/89adeb4_upload-1-zgojbzar68am-2026-03-01-heg-perpignan-0247.JPG,2026-03-01T22:57:09Z,,"Jean-Luc Mélenchon est venu soutenir Mickaël Idrac, tête de la liste « Perpignan changez dair ! » aux élections municipales. A Perpignan, le 1 mars 2026. GUILLAUME HERBAUT POUR « LE MONDE »
Le déput… [+3646 chars]",,fr,'Quentin Deranque'
https://madeinperpignan.com/meeting-bardella-melenchon-perpignan-municipale/,https://madeinperpignan.com/meeting-bardella-melenchon-perpignan-municipale/,0,madeinperpignan.com,Duel Bardella-Mélenchon à Perpignan : La guerre des chefs éclipse l'élection municipale,"À deux semaines du premier tour des élections municipales, Perpignan a passé un week-end au cœur des tensions nationales. Jordan Bardella et Jean-Luc Mélenchon se sont affrontés par meetings interposés. Le premier, venu le 28 février, vante le bilan de Louis …",https://madeinperpignan.com/wp-content/uploads/2026/03/Une-Bardella-Melenchon-combat-chefs.jpg,2026-03-02T08:09:29Z,,"Article mis à jour le 2 mars 2026 à 09:19
À deux semaines du premier tour des élections municipales, Perpignan a passé un week-end au cur des tensions nationales. Jordan Bardella et Jean-Luc Mélench… [+5996 chars]",,fr,'nan nan'
https://www.ledauphine.com/politique/2026/03/02/apres-la-prononciation-d-epstein-jean-luc-melenchon-se-moque-de-glucksmann,https://www.ledauphine.com/politique/2026/03/02/apres-la-prononciation-d-epstein-jean-luc-melenchon-se-moque-de-glucksmann,0,www.ledauphine.com,"Politique. Après la prononciation d'Epstein, Jean-Luc Mélenchon se moque de ''Glucksmann''","En plaisantant sur la prononciation du nom de Raphaël Glucksmann, Jean-Luc Mélenchon s'est attiré les foudres de l'intéressé, qui l'a qualifié de « Jean-Marie Le Pen de notre époque ».",https://cdn-s-www.ledauphine.com/images/937E4F0A-D72A-41E0-A681-3937F1072AB7/FB1200/photo-1772446223.jpg,2026-03-02T10:10:00Z,http://web.archive.org/web/20260302105043/https://www.ledauphine.com/politique/2026/03/02/apres-la-prononciation-d-epstein-jean-luc-melenchon-se-moque-de-glucksmann,"Jean-Luc Mélenchon a remis une pièce dans la machine en plaisantant sur la prononciation du nom de Raphaël Glucksmann, dimanche, lors d'un meeting à Perpignan.
Le leader de La France insoumise a dit… [+1800 chars]",,fr,'Quentin Deranque'
